{
  "prompt": {
    "guidelineId": "cg1134-postnatal-care-pdf",
    "fieldsProcessed": [
      "humanFriendlyName",
      "organisation",
      "yearProduced",
      "summary"
    ],
    "enhancedFields": 4,
    "contentLength": 2306
  },
  "response": "{\n  \"success\": true,\n  \"enhancedFields\": [\n    {\n      \"field\": \"humanFriendlyName\",\n      \"oldValue\": null,\n      \"newValue\": \"Postnatal Care Guidelines for Mothers and Newborns\",\n      \"action\": \"added\"\n    },\n    {\n      \"field\": \"organisation\",\n      \"oldValue\": null,\n      \"newValue\": \"NICE\",\n      \"action\": \"added\"\n    },\n    {\n      \"field\": \"yearProduced\",\n      \"oldValue\": null,\n      \"newValue\": \"I cannot find a publication year in the provided text. The guideline content is detailed, but it does not include a visible publication date. If you have another section or the document's header/footer that includes the year, please share it, and I can extract it for you\",\n      \"action\": \"added\"\n    },\n    {\n      \"field\": \"summary\",\n      \"oldValue\": null,\n      \"newValue\": \"**Summary:** The guideline outlines postnatal care for mothers/birthing parents and newborns, emphasizing assessments, monitoring, and education. Key recommendations include: - **Community visits:** Minimum visits post-discharge (next day, by day 5 for screenings, and final review). - **Baby care:** Recognize serious illness \\\"red flags,\\\" refer jaundice concerns, and use the Baby Check tool. Ensure feeding assessments and handover to health visitors. - **Inpatient care:** Complete assessments and Transfer of Care forms. - **Complex needs:** Assign a named health professional. - **Language support:** Provide interpreters. - **Follow-up:** Arrange appointments and review readmissions. - **Documentation:** Ensure all care discussions and handovers are recorded. Appendices cover discharge checklists and out-of-area transfer information\",\n      \"action\": \"added\"\n    }\n  ]\n}",
  "endpoint": "enhanceGuidelineMetadata",
  "timestamp": "2025-06-18T21-54-04",
  "textContent": "AI: DeepSeek (deepseek-chat)\n\nQ: {\n  \"guidelineId\": \"cg1134-postnatal-care-pdf\",\n  \"fieldsProcessed\": [\n    \"humanFriendlyName\",\n    \"organisation\",\n    \"yearProduced\",\n    \"summary\"\n  ],\n  \"enhancedFields\": 4,\n  \"contentLength\": 2306\n}\n\nA: {\n  \"success\": true,\n  \"enhancedFields\": [\n    {\n      \"field\": \"humanFriendlyName\",\n      \"oldValue\": null,\n      \"newValue\": \"Postnatal Care Guidelines for Mothers and Newborns\",\n      \"action\": \"added\"\n    },\n    {\n      \"field\": \"organisation\",\n      \"oldValue\": null,\n      \"newValue\": \"NICE\",\n      \"action\": \"added\"\n    },\n    {\n      \"field\": \"yearProduced\",\n      \"oldValue\": null,\n      \"newValue\": \"I cannot find a publication year in the provided text. The guideline content is detailed, but it does not include a visible publication date. If you have another section or the document's header/footer that includes the year, please share it, and I can extract it for you\",\n      \"action\": \"added\"\n    },\n    {\n      \"field\": \"summary\",\n      \"oldValue\": null,\n      \"newValue\": \"**Summary:** The guideline outlines postnatal care for mothers/birthing parents and newborns, emphasizing assessments, monitoring, and education. Key recommendations include: - **Community visits:** Minimum visits post-discharge (next day, by day 5 for screenings, and final review). - **Baby care:** Recognize serious illness \\\"red flags,\\\" refer jaundice concerns, and use the Baby Check tool. Ensure feeding assessments and handover to health visitors. - **Inpatient care:** Complete assessments and Transfer of Care forms. - **Complex needs:** Assign a named health professional. - **Language support:** Provide interpreters. - **Follow-up:** Arrange appointments and review readmissions. - **Documentation:** Ensure all care discussions and handovers are recorded. Appendices cover discharge checklists and out-of-area transfer information\",\n      \"action\": \"added\"\n    }\n  ]\n}",
  "ai_provider": "DeepSeek",
  "ai_model": "deepseek-chat",
  "token_usage": null
}