{
  "prompt": {
    "guidelineId": "gynae-cepod-pathway-pdf",
    "fieldsProcessed": [
      "humanFriendlyName",
      "organisation",
      "yearProduced",
      "summary"
    ],
    "enhancedFields": 4,
    "contentLength": 1277
  },
  "response": "{\n  \"success\": true,\n  \"enhancedFields\": [\n    {\n      \"field\": \"humanFriendlyName\",\n      \"oldValue\": null,\n      \"newValue\": \"**Gynaecology CEPOD Pathway for Emergency Procedures**\",\n      \"action\": \"added\"\n    },\n    {\n      \"field\": \"organisation\",\n      \"oldValue\": null,\n      \"newValue\": \"RCOG\",\n      \"action\": \"added\"\n    },\n    {\n      \"field\": \"yearProduced\",\n      \"oldValue\": null,\n      \"newValue\": \"I cannot find a publication year in the provided text. The text appears to be a medical proforma or checklist rather than a published guideline with a clear publication date\",\n      \"action\": \"added\"\n    },\n    {\n      \"field\": \"summary\",\n      \"oldValue\": null,\n      \"newValue\": \"**Summary of Medical Guideline:** - **SIRS Assessment:** Admit to Level 11 if ≥2 of: temp <36°C or >38°C, HR >90 bpm, RR >20/min. - **Working Diagnosis:** Includes Bartholin’s cyst/abscess, vulva abscess/haematoma, retained products of conception, ectopic pregnancy, or other. - **Planned Procedures:** Marsupialisation, incision & drainage, ERPC, diagnostic laparoscopy, or other. - **Checklist:** Complete proforma, consent, cremation (if needed), and CEPOD booking form. Contact CEPOD Coordinator (bleep 8061) for availability (fast-track days: Tue/Wed/Fri PM). - **If not operated today:** Provide patient leaflet, inform GAU nurse (ext 4013/4022), arrange admission with Day Surgery Unit (ext 7242), and transfer notes. - **Discharge:** Confirm nurse-led discharge permission post-op\",\n      \"action\": \"added\"\n    }\n  ]\n}",
  "endpoint": "enhanceGuidelineMetadata",
  "timestamp": "2025-06-18T22-27-47",
  "textContent": "AI: DeepSeek (deepseek-chat)\n\nQ: {\n  \"guidelineId\": \"gynae-cepod-pathway-pdf\",\n  \"fieldsProcessed\": [\n    \"humanFriendlyName\",\n    \"organisation\",\n    \"yearProduced\",\n    \"summary\"\n  ],\n  \"enhancedFields\": 4,\n  \"contentLength\": 1277\n}\n\nA: {\n  \"success\": true,\n  \"enhancedFields\": [\n    {\n      \"field\": \"humanFriendlyName\",\n      \"oldValue\": null,\n      \"newValue\": \"**Gynaecology CEPOD Pathway for Emergency Procedures**\",\n      \"action\": \"added\"\n    },\n    {\n      \"field\": \"organisation\",\n      \"oldValue\": null,\n      \"newValue\": \"RCOG\",\n      \"action\": \"added\"\n    },\n    {\n      \"field\": \"yearProduced\",\n      \"oldValue\": null,\n      \"newValue\": \"I cannot find a publication year in the provided text. The text appears to be a medical proforma or checklist rather than a published guideline with a clear publication date\",\n      \"action\": \"added\"\n    },\n    {\n      \"field\": \"summary\",\n      \"oldValue\": null,\n      \"newValue\": \"**Summary of Medical Guideline:** - **SIRS Assessment:** Admit to Level 11 if ≥2 of: temp <36°C or >38°C, HR >90 bpm, RR >20/min. - **Working Diagnosis:** Includes Bartholin’s cyst/abscess, vulva abscess/haematoma, retained products of conception, ectopic pregnancy, or other. - **Planned Procedures:** Marsupialisation, incision & drainage, ERPC, diagnostic laparoscopy, or other. - **Checklist:** Complete proforma, consent, cremation (if needed), and CEPOD booking form. Contact CEPOD Coordinator (bleep 8061) for availability (fast-track days: Tue/Wed/Fri PM). - **If not operated today:** Provide patient leaflet, inform GAU nurse (ext 4013/4022), arrange admission with Day Surgery Unit (ext 7242), and transfer notes. - **Discharge:** Confirm nurse-led discharge permission post-op\",\n      \"action\": \"added\"\n    }\n  ]\n}",
  "ai_provider": "DeepSeek",
  "ai_model": "deepseek-chat",
  "token_usage": null
}