{
  "prompt": {
    "guidelineId": "mp027-female-genital-mutilation-fgm-pdf",
    "fieldsProcessed": [
      "humanFriendlyName",
      "organisation",
      "yearProduced",
      "summary"
    ],
    "enhancedFields": 4,
    "contentLength": 2728
  },
  "response": "{\n  \"success\": true,\n  \"enhancedFields\": [\n    {\n      \"field\": \"humanFriendlyName\",\n      \"oldValue\": null,\n      \"newValue\": \"FGM Maternity Care Protocol\",\n      \"action\": \"added\"\n    },\n    {\n      \"field\": \"organisation\",\n      \"oldValue\": null,\n      \"newValue\": \"BSUH\",\n      \"action\": \"added\"\n    },\n    {\n      \"field\": \"yearProduced\",\n      \"oldValue\": null,\n      \"newValue\": \"2022\",\n      \"action\": \"added\"\n    },\n    {\n      \"field\": \"summary\",\n      \"oldValue\": null,\n      \"newValue\": \"**Summary of FGM Maternity Protocol (MP027):** - **Scope:** Applies to women/persons with FGM; must align with BSUH FGM policy. - **Responsibilities:** Midwives/obstetricians must follow guidance; management ensures protocol accessibility and review. - **Key Points:** FGM is illegal in the UK, a public health and safeguarding issue. Four WHO-classified types exist. - **Antenatal Care:** Identify FGM early; mandatory reporting for under-18s. Offer antenatal defibulation when indicated. - **Intrapartum Care:** Prioritize privacy/dignity. Hospital birth recommended; home birth possible if defibulated. Individualized birth plans, female attendants on request. Inform registrar, document care plan. Epidural advised for potential defibulation. Perform defibulation under epidural in labor using aseptic technique; suturing by trained clinician. - **Postnatal Care:** Check perineum, encourage mobilization. Safeguard female infants. Include FGM in discharge summary. Document discussions/referrals. Tailor community visits; inform health visitors. (Word count: 150)\",\n      \"action\": \"added\"\n    }\n  ]\n}",
  "endpoint": "enhanceGuidelineMetadata",
  "timestamp": "2025-06-18T22-40-10",
  "textContent": "AI: DeepSeek (deepseek-chat)\n\nQ: {\n  \"guidelineId\": \"mp027-female-genital-mutilation-fgm-pdf\",\n  \"fieldsProcessed\": [\n    \"humanFriendlyName\",\n    \"organisation\",\n    \"yearProduced\",\n    \"summary\"\n  ],\n  \"enhancedFields\": 4,\n  \"contentLength\": 2728\n}\n\nA: {\n  \"success\": true,\n  \"enhancedFields\": [\n    {\n      \"field\": \"humanFriendlyName\",\n      \"oldValue\": null,\n      \"newValue\": \"FGM Maternity Care Protocol\",\n      \"action\": \"added\"\n    },\n    {\n      \"field\": \"organisation\",\n      \"oldValue\": null,\n      \"newValue\": \"BSUH\",\n      \"action\": \"added\"\n    },\n    {\n      \"field\": \"yearProduced\",\n      \"oldValue\": null,\n      \"newValue\": \"2022\",\n      \"action\": \"added\"\n    },\n    {\n      \"field\": \"summary\",\n      \"oldValue\": null,\n      \"newValue\": \"**Summary of FGM Maternity Protocol (MP027):** - **Scope:** Applies to women/persons with FGM; must align with BSUH FGM policy. - **Responsibilities:** Midwives/obstetricians must follow guidance; management ensures protocol accessibility and review. - **Key Points:** FGM is illegal in the UK, a public health and safeguarding issue. Four WHO-classified types exist. - **Antenatal Care:** Identify FGM early; mandatory reporting for under-18s. Offer antenatal defibulation when indicated. - **Intrapartum Care:** Prioritize privacy/dignity. Hospital birth recommended; home birth possible if defibulated. Individualized birth plans, female attendants on request. Inform registrar, document care plan. Epidural advised for potential defibulation. Perform defibulation under epidural in labor using aseptic technique; suturing by trained clinician. - **Postnatal Care:** Check perineum, encourage mobilization. Safeguard female infants. Include FGM in discharge summary. Document discussions/referrals. Tailor community visits; inform health visitors. (Word count: 150)\",\n      \"action\": \"added\"\n    }\n  ]\n}",
  "ai_provider": "DeepSeek",
  "ai_model": "deepseek-chat",
  "token_usage": null
}