{
  "prompt": {
    "guidelineId": "sp21003-process-for-checking-daily-safety-standards-sop-pdf",
    "fieldsProcessed": [
      "humanFriendlyName",
      "organisation",
      "yearProduced",
      "summary"
    ],
    "enhancedFields": 4,
    "contentLength": 1687
  },
  "response": "{\n  \"success\": true,\n  \"enhancedFields\": [\n    {\n      \"field\": \"humanFriendlyName\",\n      \"oldValue\": null,\n      \"newValue\": \"Daily Safety Checks for Maternity Units SOP\",\n      \"action\": \"added\"\n    },\n    {\n      \"field\": \"organisation\",\n      \"oldValue\": null,\n      \"newValue\": \"UH Sussex West\",\n      \"action\": \"added\"\n    },\n    {\n      \"field\": \"yearProduced\",\n      \"oldValue\": null,\n      \"newValue\": \"The provided text does not contain a publication year. If you have another guideline text that includes the year, please share it, and I can extract the 4-digit year for you\",\n      \"action\": \"added\"\n    },\n    {\n      \"field\": \"summary\",\n      \"oldValue\": null,\n      \"newValue\": \"**Summary of Medical Guideline:** This SOP ensures daily safety checks in maternity units at UH Sussex West, covering staff responsibilities, safety standards, and actions for non-compliance. **Key Points:** - **Applies to:** Maternity assistants, midwives, and managers. - **Responsibilities:** Midwives must follow the SOP; management ensures reviews and accessibility. - **Safety Standards:** Daily checks include equipment, fire safety, cleaning, drug/treatment rooms, and other areas, documented via laminates or electronic boards. - **Non-Compliance:** Lapses must be rectified sustainably, escalated to the matron if unresolved, with initial concerns addressed by the midwife in charge. (Word count: 100)\",\n      \"action\": \"added\"\n    }\n  ]\n}",
  "endpoint": "enhanceGuidelineMetadata",
  "timestamp": "2025-06-18T23-03-13",
  "textContent": "AI: DeepSeek (deepseek-chat)\n\nQ: {\n  \"guidelineId\": \"sp21003-process-for-checking-daily-safety-standards-sop-pdf\",\n  \"fieldsProcessed\": [\n    \"humanFriendlyName\",\n    \"organisation\",\n    \"yearProduced\",\n    \"summary\"\n  ],\n  \"enhancedFields\": 4,\n  \"contentLength\": 1687\n}\n\nA: {\n  \"success\": true,\n  \"enhancedFields\": [\n    {\n      \"field\": \"humanFriendlyName\",\n      \"oldValue\": null,\n      \"newValue\": \"Daily Safety Checks for Maternity Units SOP\",\n      \"action\": \"added\"\n    },\n    {\n      \"field\": \"organisation\",\n      \"oldValue\": null,\n      \"newValue\": \"UH Sussex West\",\n      \"action\": \"added\"\n    },\n    {\n      \"field\": \"yearProduced\",\n      \"oldValue\": null,\n      \"newValue\": \"The provided text does not contain a publication year. If you have another guideline text that includes the year, please share it, and I can extract the 4-digit year for you\",\n      \"action\": \"added\"\n    },\n    {\n      \"field\": \"summary\",\n      \"oldValue\": null,\n      \"newValue\": \"**Summary of Medical Guideline:** This SOP ensures daily safety checks in maternity units at UH Sussex West, covering staff responsibilities, safety standards, and actions for non-compliance. **Key Points:** - **Applies to:** Maternity assistants, midwives, and managers. - **Responsibilities:** Midwives must follow the SOP; management ensures reviews and accessibility. - **Safety Standards:** Daily checks include equipment, fire safety, cleaning, drug/treatment rooms, and other areas, documented via laminates or electronic boards. - **Non-Compliance:** Lapses must be rectified sustainably, escalated to the matron if unresolved, with initial concerns addressed by the midwife in charge. (Word count: 100)\",\n      \"action\": \"added\"\n    }\n  ]\n}",
  "ai_provider": "DeepSeek",
  "ai_model": "deepseek-chat",
  "token_usage": null
}