{
  "prompt": {
    "guidelineId": "cg18006-nipe-sop-pdf",
    "fieldsProcessed": [
      "humanFriendlyName",
      "organisation",
      "yearProduced",
      "summary"
    ],
    "enhancedFields": 4,
    "contentLength": 5792
  },
  "response": "{\n  \"success\": true,\n  \"enhancedFields\": [\n    {\n      \"field\": \"humanFriendlyName\",\n      \"oldValue\": null,\n      \"newValue\": \"Newborn and Infant Physical Examination (NIPE) Screening Guidelines\",\n      \"action\": \"added\"\n    },\n    {\n      \"field\": \"organisation\",\n      \"oldValue\": null,\n      \"newValue\": \"NHS\",\n      \"action\": \"added\"\n    },\n    {\n      \"field\": \"yearProduced\",\n      \"oldValue\": null,\n      \"newValue\": \"The text provided does not contain a specific publication year. If you can provide the publication year within the text, I can extract it for you. Otherwise, I am unable to determine the year from the current content\",\n      \"action\": \"added\"\n    },\n    {\n      \"field\": \"summary\",\n      \"oldValue\": null,\n      \"newValue\": \"**Summary of NHS Newborn and Infant Physical Examination (NIPE) Screening SOP:** The NIPE programme screens babies within 72 hours of birth for congenital abnormalities (heart, hips, eyes, testes) to reduce morbidity/mortality. Eligible babies are those born at UH Sussex NHS Trust. **Key Recommendations:** - **Timing:** Screen by 72 hours; refer abnormalities promptly. - **Missed Screens:** Report if due to pathway failure; document parental declines or medical unsuitability. - **Training:** Practitioners (doctors/midwives) must complete accredited training and annual updates. - **Hip Screening:** Refer abnormal exams or high-risk babies (breech, family history) for ultrasound at 4-6 weeks. - **Documentation:** Record declines, deaths, or incomplete screenings; escalate near breaches. - **Failures:** Track missed appointments; adjust timelines for preterm babies (<34 weeks). - **Incidents:** Report serious incidents; ensure follow-up for abnormal results. **Pathways:** - Community midwives or GPs complete post-discharge screens. - Hip clinic referrals: abnormal exams → ultrasound at 4 weeks; risk factors → scan at 4-6 weeks. **Data & Reporting:** Submit quarterly KPI data; discuss performance mitigations. **Contacts:** Referral/queries to designated NHS emails. *Glossary terms defined (e.g., NICU, NIPE, PHE).* *(For full details, refer to Staffnet document.)*\",\n      \"action\": \"added\"\n    }\n  ]\n}",
  "endpoint": "enhanceGuidelineMetadata",
  "timestamp": "2025-06-18T22-12-13",
  "textContent": "AI: DeepSeek (deepseek-chat)\n\nQ: {\n  \"guidelineId\": \"cg18006-nipe-sop-pdf\",\n  \"fieldsProcessed\": [\n    \"humanFriendlyName\",\n    \"organisation\",\n    \"yearProduced\",\n    \"summary\"\n  ],\n  \"enhancedFields\": 4,\n  \"contentLength\": 5792\n}\n\nA: {\n  \"success\": true,\n  \"enhancedFields\": [\n    {\n      \"field\": \"humanFriendlyName\",\n      \"oldValue\": null,\n      \"newValue\": \"Newborn and Infant Physical Examination (NIPE) Screening Guidelines\",\n      \"action\": \"added\"\n    },\n    {\n      \"field\": \"organisation\",\n      \"oldValue\": null,\n      \"newValue\": \"NHS\",\n      \"action\": \"added\"\n    },\n    {\n      \"field\": \"yearProduced\",\n      \"oldValue\": null,\n      \"newValue\": \"The text provided does not contain a specific publication year. If you can provide the publication year within the text, I can extract it for you. Otherwise, I am unable to determine the year from the current content\",\n      \"action\": \"added\"\n    },\n    {\n      \"field\": \"summary\",\n      \"oldValue\": null,\n      \"newValue\": \"**Summary of NHS Newborn and Infant Physical Examination (NIPE) Screening SOP:** The NIPE programme screens babies within 72 hours of birth for congenital abnormalities (heart, hips, eyes, testes) to reduce morbidity/mortality. Eligible babies are those born at UH Sussex NHS Trust. **Key Recommendations:** - **Timing:** Screen by 72 hours; refer abnormalities promptly. - **Missed Screens:** Report if due to pathway failure; document parental declines or medical unsuitability. - **Training:** Practitioners (doctors/midwives) must complete accredited training and annual updates. - **Hip Screening:** Refer abnormal exams or high-risk babies (breech, family history) for ultrasound at 4-6 weeks. - **Documentation:** Record declines, deaths, or incomplete screenings; escalate near breaches. - **Failures:** Track missed appointments; adjust timelines for preterm babies (<34 weeks). - **Incidents:** Report serious incidents; ensure follow-up for abnormal results. **Pathways:** - Community midwives or GPs complete post-discharge screens. - Hip clinic referrals: abnormal exams → ultrasound at 4 weeks; risk factors → scan at 4-6 weeks. **Data & Reporting:** Submit quarterly KPI data; discuss performance mitigations. **Contacts:** Referral/queries to designated NHS emails. *Glossary terms defined (e.g., NICU, NIPE, PHE).* *(For full details, refer to Staffnet document.)*\",\n      \"action\": \"added\"\n    }\n  ]\n}",
  "ai_provider": "DeepSeek",
  "ai_model": "deepseek-chat",
  "token_usage": null
}