{
  "prompt": {
    "guidelineId": "uhsx-midwifery-preceptorship-protocol-pdf",
    "fieldsProcessed": [
      "humanFriendlyName",
      "organisation",
      "yearProduced",
      "summary"
    ],
    "enhancedFields": 4,
    "contentLength": 6909
  },
  "response": "{\n  \"success\": true,\n  \"enhancedFields\": [\n    {\n      \"field\": \"humanFriendlyName\",\n      \"oldValue\": null,\n      \"newValue\": \"Midwifery Preceptorship Program Guidelines\",\n      \"action\": \"added\"\n    },\n    {\n      \"field\": \"organisation\",\n      \"oldValue\": null,\n      \"newValue\": \"UHSussex\",\n      \"action\": \"added\"\n    },\n    {\n      \"field\": \"yearProduced\",\n      \"oldValue\": null,\n      \"newValue\": \"The text provided does not contain a publication year. If you have another guideline text that includes the publication year, please share it, and I can extract the 4-digit year for you\",\n      \"action\": \"added\"\n    },\n    {\n      \"field\": \"summary\",\n      \"oldValue\": null,\n      \"newValue\": \"**Summary of Medical Guideline: Midwifery Preceptorship Program** - **Roles & Responsibilities**: - **Preceptors** guide preceptees, communicate progress, and act as role models. - **Professional Midwifery Advocates (PMAs)** support via the A-EQUIP model, offering restorative supervision (at least twice during preceptorship). - **Line managers** ensure policy implementation, supernumerary periods, and progression to Band 6. - **Chief nurse/director of midwifery** oversee program delivery. - **Program Structure**: - Preceptees receive **4+ weeks supernumerary status**, no caseload allocation. - Protected time for **induction, study days, mandatory training, and infant feeding training**. - Regular **progress meetings (3, 6, 9, 12 months)** documented in an ePortfolio. - **Competency & Completion**: - Final sign-off confirms competency for Band 6 progression. Unmet requirements trigger performance guidance. - Annual program evaluation with feedback from stakeholders. - **Support & Escalation**: - Reflective practice encouraged; concerns addressed via structured escalation (PMA, line manager, or HELP service). - Preceptees commit to training, meetings, and self-directed learning; preceptors provide feedback and mentorship. - **Documentation**: - Standardized forms for progress logs, NMC reflective accounts, and competency tracking\",\n      \"action\": \"added\"\n    }\n  ]\n}",
  "endpoint": "enhanceGuidelineMetadata",
  "timestamp": "2025-06-18T23-12-22",
  "textContent": "AI: DeepSeek (deepseek-chat)\n\nQ: {\n  \"guidelineId\": \"uhsx-midwifery-preceptorship-protocol-pdf\",\n  \"fieldsProcessed\": [\n    \"humanFriendlyName\",\n    \"organisation\",\n    \"yearProduced\",\n    \"summary\"\n  ],\n  \"enhancedFields\": 4,\n  \"contentLength\": 6909\n}\n\nA: {\n  \"success\": true,\n  \"enhancedFields\": [\n    {\n      \"field\": \"humanFriendlyName\",\n      \"oldValue\": null,\n      \"newValue\": \"Midwifery Preceptorship Program Guidelines\",\n      \"action\": \"added\"\n    },\n    {\n      \"field\": \"organisation\",\n      \"oldValue\": null,\n      \"newValue\": \"UHSussex\",\n      \"action\": \"added\"\n    },\n    {\n      \"field\": \"yearProduced\",\n      \"oldValue\": null,\n      \"newValue\": \"The text provided does not contain a publication year. If you have another guideline text that includes the publication year, please share it, and I can extract the 4-digit year for you\",\n      \"action\": \"added\"\n    },\n    {\n      \"field\": \"summary\",\n      \"oldValue\": null,\n      \"newValue\": \"**Summary of Medical Guideline: Midwifery Preceptorship Program** - **Roles & Responsibilities**: - **Preceptors** guide preceptees, communicate progress, and act as role models. - **Professional Midwifery Advocates (PMAs)** support via the A-EQUIP model, offering restorative supervision (at least twice during preceptorship). - **Line managers** ensure policy implementation, supernumerary periods, and progression to Band 6. - **Chief nurse/director of midwifery** oversee program delivery. - **Program Structure**: - Preceptees receive **4+ weeks supernumerary status**, no caseload allocation. - Protected time for **induction, study days, mandatory training, and infant feeding training**. - Regular **progress meetings (3, 6, 9, 12 months)** documented in an ePortfolio. - **Competency & Completion**: - Final sign-off confirms competency for Band 6 progression. Unmet requirements trigger performance guidance. - Annual program evaluation with feedback from stakeholders. - **Support & Escalation**: - Reflective practice encouraged; concerns addressed via structured escalation (PMA, line manager, or HELP service). - Preceptees commit to training, meetings, and self-directed learning; preceptors provide feedback and mentorship. - **Documentation**: - Standardized forms for progress logs, NMC reflective accounts, and competency tracking\",\n      \"action\": \"added\"\n    }\n  ]\n}",
  "ai_provider": "DeepSeek",
  "ai_model": "deepseek-chat",
  "token_usage": null
}