{
  "prompt": {
    "guidelineId": "mp042-epidurals-in-labour-pdf",
    "fieldsProcessed": [
      "humanFriendlyName",
      "organisation",
      "yearProduced",
      "summary"
    ],
    "enhancedFields": 4,
    "contentLength": 3073
  },
  "response": "{\n  \"success\": true,\n  \"enhancedFields\": [\n    {\n      \"field\": \"humanFriendlyName\",\n      \"oldValue\": null,\n      \"newValue\": \"Epidural Analgesia Guidelines for Labour\",\n      \"action\": \"added\"\n    },\n    {\n      \"field\": \"organisation\",\n      \"oldValue\": null,\n      \"newValue\": \"RCOG\",\n      \"action\": \"added\"\n    },\n    {\n      \"field\": \"yearProduced\",\n      \"oldValue\": null,\n      \"newValue\": \"The text provided does not contain a publication year. If you have another guideline text that includes the year, please share it, and I can extract the 4-digit year for you\",\n      \"action\": \"added\"\n    },\n    {\n      \"field\": \"summary\",\n      \"oldValue\": null,\n      \"newValue\": \"**Summary of Epidurals in Labour MP042 Guidelines** **Scope**: Applies to women/people receiving epidurals during labour and managing complications. **Responsibilities**: - **Midwives**: Provide unbiased information, check platelets, ensure equipment, request anaesthetist review. - **Anaesthetists**: Explain procedure, obtain consent, establish analgesia, prescribe drugs. **Indications**: Maternal request, obstetric/fetal needs, or medical conditions benefiting from reduced stress. **Contraindications**: Sepsis, clotting disorders, hypovolemia, allergy to amide local anaesthetics. **Equipment**: IV access, epidural pump, oxygen, resuscitation trolley. **Eating/Drinking**: Clear fluids and light carbs allowed; restrictions in high-risk cases. **Ongoing Management**: - Patient-controlled epidural analgesia (PCEA) preferred; bolus top-up if pain persists. - Monitor maternal vitals, block distribution, fetal heart rate, and contractions. - Catheterize if unable to void; consider re-catheterization post-delivery for 6 hours. **Complications & Management**: - **Hypotension/bradycardia**: Oxygen, IV fluids, stop epidural. - **High block**: Stop infusion, urgent anaesthetic review. - **Local anaesthetic toxicity**: Metallic taste, confusion—treat emergently. - **Dural puncture**: Re-site epidural or intrathecal dose; blood patch for headache. **Postnatal Care**: - Communicate dural puncture to GP. - Review headache details; contact hospital if issues persist. - Discharge summary provided by obstetricians\",\n      \"action\": \"added\"\n    }\n  ]\n}",
  "endpoint": "enhanceGuidelineMetadata",
  "timestamp": "2025-06-18T22-46-37",
  "textContent": "AI: DeepSeek (deepseek-chat)\n\nQ: {\n  \"guidelineId\": \"mp042-epidurals-in-labour-pdf\",\n  \"fieldsProcessed\": [\n    \"humanFriendlyName\",\n    \"organisation\",\n    \"yearProduced\",\n    \"summary\"\n  ],\n  \"enhancedFields\": 4,\n  \"contentLength\": 3073\n}\n\nA: {\n  \"success\": true,\n  \"enhancedFields\": [\n    {\n      \"field\": \"humanFriendlyName\",\n      \"oldValue\": null,\n      \"newValue\": \"Epidural Analgesia Guidelines for Labour\",\n      \"action\": \"added\"\n    },\n    {\n      \"field\": \"organisation\",\n      \"oldValue\": null,\n      \"newValue\": \"RCOG\",\n      \"action\": \"added\"\n    },\n    {\n      \"field\": \"yearProduced\",\n      \"oldValue\": null,\n      \"newValue\": \"The text provided does not contain a publication year. If you have another guideline text that includes the year, please share it, and I can extract the 4-digit year for you\",\n      \"action\": \"added\"\n    },\n    {\n      \"field\": \"summary\",\n      \"oldValue\": null,\n      \"newValue\": \"**Summary of Epidurals in Labour MP042 Guidelines** **Scope**: Applies to women/people receiving epidurals during labour and managing complications. **Responsibilities**: - **Midwives**: Provide unbiased information, check platelets, ensure equipment, request anaesthetist review. - **Anaesthetists**: Explain procedure, obtain consent, establish analgesia, prescribe drugs. **Indications**: Maternal request, obstetric/fetal needs, or medical conditions benefiting from reduced stress. **Contraindications**: Sepsis, clotting disorders, hypovolemia, allergy to amide local anaesthetics. **Equipment**: IV access, epidural pump, oxygen, resuscitation trolley. **Eating/Drinking**: Clear fluids and light carbs allowed; restrictions in high-risk cases. **Ongoing Management**: - Patient-controlled epidural analgesia (PCEA) preferred; bolus top-up if pain persists. - Monitor maternal vitals, block distribution, fetal heart rate, and contractions. - Catheterize if unable to void; consider re-catheterization post-delivery for 6 hours. **Complications & Management**: - **Hypotension/bradycardia**: Oxygen, IV fluids, stop epidural. - **High block**: Stop infusion, urgent anaesthetic review. - **Local anaesthetic toxicity**: Metallic taste, confusion—treat emergently. - **Dural puncture**: Re-site epidural or intrathecal dose; blood patch for headache. **Postnatal Care**: - Communicate dural puncture to GP. - Review headache details; contact hospital if issues persist. - Discharge summary provided by obstetricians\",\n      \"action\": \"added\"\n    }\n  ]\n}",
  "ai_provider": "DeepSeek",
  "ai_model": "deepseek-chat",
  "token_usage": null
}