{
  "prompt": {
    "guidelineId": "cg1118-neonatal-hypothermia-pdf",
    "fieldsProcessed": [
      "humanFriendlyName",
      "organisation",
      "yearProduced",
      "summary"
    ],
    "enhancedFields": 4,
    "contentLength": 1134
  },
  "response": "{\n  \"success\": true,\n  \"enhancedFields\": [\n    {\n      \"field\": \"humanFriendlyName\",\n      \"oldValue\": null,\n      \"newValue\": \"Neonatal Hypothermia Detection and Management Guide\",\n      \"action\": \"added\"\n    },\n    {\n      \"field\": \"organisation\",\n      \"oldValue\": null,\n      \"newValue\": \"The text provided does not explicitly mention a specific publishing organization or institution such as NHS, NICE, WHO, RCOG, etc. Therefore, I cannot identify the organization name from the given guideline text. If you have any additional context or another guideline text where the organization is mentioned, please share it, and I'd be happy to assist!\",\n      \"action\": \"added\"\n    },\n    {\n      \"field\": \"yearProduced\",\n      \"oldValue\": null,\n      \"newValue\": \"The text provided does not contain a publication year. If you have another guideline text that includes the year, please share it, and I can extract the 4-digit year for you\",\n      \"action\": \"added\"\n    },\n    {\n      \"field\": \"summary\",\n      \"oldValue\": null,\n      \"newValue\": \"**Summary of Neonatal Hypothermia Guideline:** - **Aim:** Guide staff on detecting and managing neonatal hypothermia. - **Scope:** Applies to all staff caring for newborns. - **Responsibilities:** Midwives, healthcare assistants, and pediatricians must follow guidelines and use clinical judgment. - **Key Actions:** Anticipate hypothermia in at-risk infants, perform observations, and intervene appropriately. - **Midwife Duties:** Recognize risk factors, maintain warmth, promote skin-to-skin contact. - **At Birth:** Dry baby, initiate skin-to-skin contact, encourage feeding. - **Low Temp Management:** Use skin-to-skin, monitor, and employ a hot cot if needed. - **Skin-to-Skin Benefits:** Stabilizes heart rate, temperature, and supports feeding. - **Hot Cot Use:** Keep on, monitor temperature, gradually reduce heat. - **Ongoing Care:** Stop monitoring if temperature stabilizes; prioritize feeding. - **Parent Communication:** Explain monitoring and care. - **Audit:** Follow Maternity Audit Document for compliance tracking\",\n      \"action\": \"added\"\n    }\n  ]\n}",
  "endpoint": "enhanceGuidelineMetadata",
  "timestamp": "2025-06-18T21-44-27",
  "textContent": "AI: DeepSeek (deepseek-chat)\n\nQ: {\n  \"guidelineId\": \"cg1118-neonatal-hypothermia-pdf\",\n  \"fieldsProcessed\": [\n    \"humanFriendlyName\",\n    \"organisation\",\n    \"yearProduced\",\n    \"summary\"\n  ],\n  \"enhancedFields\": 4,\n  \"contentLength\": 1134\n}\n\nA: {\n  \"success\": true,\n  \"enhancedFields\": [\n    {\n      \"field\": \"humanFriendlyName\",\n      \"oldValue\": null,\n      \"newValue\": \"Neonatal Hypothermia Detection and Management Guide\",\n      \"action\": \"added\"\n    },\n    {\n      \"field\": \"organisation\",\n      \"oldValue\": null,\n      \"newValue\": \"The text provided does not explicitly mention a specific publishing organization or institution such as NHS, NICE, WHO, RCOG, etc. Therefore, I cannot identify the organization name from the given guideline text. If you have any additional context or another guideline text where the organization is mentioned, please share it, and I'd be happy to assist!\",\n      \"action\": \"added\"\n    },\n    {\n      \"field\": \"yearProduced\",\n      \"oldValue\": null,\n      \"newValue\": \"The text provided does not contain a publication year. If you have another guideline text that includes the year, please share it, and I can extract the 4-digit year for you\",\n      \"action\": \"added\"\n    },\n    {\n      \"field\": \"summary\",\n      \"oldValue\": null,\n      \"newValue\": \"**Summary of Neonatal Hypothermia Guideline:** - **Aim:** Guide staff on detecting and managing neonatal hypothermia. - **Scope:** Applies to all staff caring for newborns. - **Responsibilities:** Midwives, healthcare assistants, and pediatricians must follow guidelines and use clinical judgment. - **Key Actions:** Anticipate hypothermia in at-risk infants, perform observations, and intervene appropriately. - **Midwife Duties:** Recognize risk factors, maintain warmth, promote skin-to-skin contact. - **At Birth:** Dry baby, initiate skin-to-skin contact, encourage feeding. - **Low Temp Management:** Use skin-to-skin, monitor, and employ a hot cot if needed. - **Skin-to-Skin Benefits:** Stabilizes heart rate, temperature, and supports feeding. - **Hot Cot Use:** Keep on, monitor temperature, gradually reduce heat. - **Ongoing Care:** Stop monitoring if temperature stabilizes; prioritize feeding. - **Parent Communication:** Explain monitoring and care. - **Audit:** Follow Maternity Audit Document for compliance tracking\",\n      \"action\": \"added\"\n    }\n  ]\n}",
  "ai_provider": "DeepSeek",
  "ai_model": "deepseek-chat",
  "token_usage": null
}