{
  "prompt": {
    "guidelineId": "cg1118-neonatal-hypothermia-pdf",
    "fieldsProcessed": [
      "humanFriendlyName",
      "organisation",
      "yearProduced",
      "summary"
    ],
    "enhancedFields": 4,
    "contentLength": 1134
  },
  "response": "{\n  \"success\": true,\n  \"enhancedFields\": [\n    {\n      \"field\": \"humanFriendlyName\",\n      \"oldValue\": null,\n      \"newValue\": \"Neonatal Hypothermia Detection and Management Guide\",\n      \"action\": \"added\"\n    },\n    {\n      \"field\": \"organisation\",\n      \"oldValue\": null,\n      \"newValue\": \"The text provided does not explicitly mention a specific publishing organization or institution such as NHS, NICE, WHO, RCOG, etc. Therefore, I cannot identify the organization name from the given guideline text. If you have additional context or a source link where this guideline is published, please share it, and I can help identify the organization\",\n      \"action\": \"added\"\n    },\n    {\n      \"field\": \"yearProduced\",\n      \"oldValue\": null,\n      \"newValue\": \"I'm sorry, but the provided text does not contain a publication year. If you have another guideline text that includes the year, I'd be happy to extract it for you\",\n      \"action\": \"added\"\n    },\n    {\n      \"field\": \"summary\",\n      \"oldValue\": null,\n      \"newValue\": \"**Summary of Neonatal Hypothermia Guideline:** This guideline provides staff with recommendations for preventing, detecting, and managing neonatal hypothermia. It applies to all caregivers of newborns, emphasizing midwives, healthcare assistants, and pediatricians. Key actions include anticipating hypothermia in at-risk infants, maintaining a warm environment, and promoting skin-to-skin contact. After birth, dry the baby, initiate skin-to-skin contact, and encourage feeding. If hypothermia occurs, use skin-to-skin contact, monitoring, and a hot cot (pre-warmed, with gradual temperature reduction). Skin-to-skin contact stabilizes heart rate, temperature, and supports feeding. Ongoing care includes discontinuing monitoring once temperature stabilizes and ensuring adequate feeding. Parents should be informed about monitoring and management. Audit processes are detailed in the Maternity Audit Document\",\n      \"action\": \"added\"\n    }\n  ]\n}",
  "endpoint": "enhanceGuidelineMetadata",
  "timestamp": "2025-06-18T21-44-28",
  "textContent": "AI: DeepSeek (deepseek-chat)\n\nQ: {\n  \"guidelineId\": \"cg1118-neonatal-hypothermia-pdf\",\n  \"fieldsProcessed\": [\n    \"humanFriendlyName\",\n    \"organisation\",\n    \"yearProduced\",\n    \"summary\"\n  ],\n  \"enhancedFields\": 4,\n  \"contentLength\": 1134\n}\n\nA: {\n  \"success\": true,\n  \"enhancedFields\": [\n    {\n      \"field\": \"humanFriendlyName\",\n      \"oldValue\": null,\n      \"newValue\": \"Neonatal Hypothermia Detection and Management Guide\",\n      \"action\": \"added\"\n    },\n    {\n      \"field\": \"organisation\",\n      \"oldValue\": null,\n      \"newValue\": \"The text provided does not explicitly mention a specific publishing organization or institution such as NHS, NICE, WHO, RCOG, etc. Therefore, I cannot identify the organization name from the given guideline text. If you have additional context or a source link where this guideline is published, please share it, and I can help identify the organization\",\n      \"action\": \"added\"\n    },\n    {\n      \"field\": \"yearProduced\",\n      \"oldValue\": null,\n      \"newValue\": \"I'm sorry, but the provided text does not contain a publication year. If you have another guideline text that includes the year, I'd be happy to extract it for you\",\n      \"action\": \"added\"\n    },\n    {\n      \"field\": \"summary\",\n      \"oldValue\": null,\n      \"newValue\": \"**Summary of Neonatal Hypothermia Guideline:** This guideline provides staff with recommendations for preventing, detecting, and managing neonatal hypothermia. It applies to all caregivers of newborns, emphasizing midwives, healthcare assistants, and pediatricians. Key actions include anticipating hypothermia in at-risk infants, maintaining a warm environment, and promoting skin-to-skin contact. After birth, dry the baby, initiate skin-to-skin contact, and encourage feeding. If hypothermia occurs, use skin-to-skin contact, monitoring, and a hot cot (pre-warmed, with gradual temperature reduction). Skin-to-skin contact stabilizes heart rate, temperature, and supports feeding. Ongoing care includes discontinuing monitoring once temperature stabilizes and ensuring adequate feeding. Parents should be informed about monitoring and management. Audit processes are detailed in the Maternity Audit Document\",\n      \"action\": \"added\"\n    }\n  ]\n}",
  "ai_provider": "DeepSeek",
  "ai_model": "deepseek-chat",
  "token_usage": null
}