{
  "prompt": {
    "guidelineId": "cg1130-assisted-vaginal-birth-guideline-pdf",
    "fieldsProcessed": [
      "humanFriendlyName",
      "organisation",
      "yearProduced",
      "summary"
    ],
    "enhancedFields": 4,
    "contentLength": 2258
  },
  "response": "{\n  \"success\": true,\n  \"enhancedFields\": [\n    {\n      \"field\": \"humanFriendlyName\",\n      \"oldValue\": null,\n      \"newValue\": \"Assisted Vaginal Birth: Forceps and Vacuum Extraction Guidelines\",\n      \"action\": \"added\"\n    },\n    {\n      \"field\": \"organisation\",\n      \"oldValue\": null,\n      \"newValue\": \"RCOG\",\n      \"action\": \"added\"\n    },\n    {\n      \"field\": \"yearProduced\",\n      \"oldValue\": null,\n      \"newValue\": \"I'm sorry, but the provided text does not contain a publication year. If you have another guideline text that includes the year, I'd be happy to extract it for you\",\n      \"action\": \"added\"\n    },\n    {\n      \"field\": \"summary\",\n      \"oldValue\": null,\n      \"newValue\": \"**Summary of Assisted Vaginal Birth Guideline:** - **Instrument choice**: Operators should select the most appropriate instrument (forceps or vacuum) for the first attempt. Vacuum extraction has a higher failure rate but less maternal trauma, while forceps are more effective but risk maternal injury. Vacuum is linked to neonatal cephalohematoma and retinal hemorrhage but not cesarean birth or low Apgar scores. - **Risk factors for failure**: Mid-cavity/rotational birth, maternal obesity, fetal weight >4000g, occipito-posterior position, short maternal stature, and large fetal head circumference. - **Pre-procedure**: Ultrasound assessment is recommended if fetal head position is uncertain. - **Post-birth care**: Administer antibiotics to reduce infection risk. Monitor for complications, ensure bladder care, thromboprophylaxis, and analgesia. Document and discuss postnatal plans. - **Psychological support**: Offer referral to a midwife counselor for traumatic births; avoid single-session, trauma-focused interventions. Ensure supportive frameworks for adverse events and adhere to duty of candour. - **Audit & reporting**: Complete incident reports as needed and monitor compliance with RCOG standards\",\n      \"action\": \"added\"\n    }\n  ]\n}",
  "endpoint": "enhanceGuidelineMetadata",
  "timestamp": "2025-06-18T21-49-49",
  "textContent": "AI: DeepSeek (deepseek-chat)\n\nQ: {\n  \"guidelineId\": \"cg1130-assisted-vaginal-birth-guideline-pdf\",\n  \"fieldsProcessed\": [\n    \"humanFriendlyName\",\n    \"organisation\",\n    \"yearProduced\",\n    \"summary\"\n  ],\n  \"enhancedFields\": 4,\n  \"contentLength\": 2258\n}\n\nA: {\n  \"success\": true,\n  \"enhancedFields\": [\n    {\n      \"field\": \"humanFriendlyName\",\n      \"oldValue\": null,\n      \"newValue\": \"Assisted Vaginal Birth: Forceps and Vacuum Extraction Guidelines\",\n      \"action\": \"added\"\n    },\n    {\n      \"field\": \"organisation\",\n      \"oldValue\": null,\n      \"newValue\": \"RCOG\",\n      \"action\": \"added\"\n    },\n    {\n      \"field\": \"yearProduced\",\n      \"oldValue\": null,\n      \"newValue\": \"I'm sorry, but the provided text does not contain a publication year. If you have another guideline text that includes the year, I'd be happy to extract it for you\",\n      \"action\": \"added\"\n    },\n    {\n      \"field\": \"summary\",\n      \"oldValue\": null,\n      \"newValue\": \"**Summary of Assisted Vaginal Birth Guideline:** - **Instrument choice**: Operators should select the most appropriate instrument (forceps or vacuum) for the first attempt. Vacuum extraction has a higher failure rate but less maternal trauma, while forceps are more effective but risk maternal injury. Vacuum is linked to neonatal cephalohematoma and retinal hemorrhage but not cesarean birth or low Apgar scores. - **Risk factors for failure**: Mid-cavity/rotational birth, maternal obesity, fetal weight >4000g, occipito-posterior position, short maternal stature, and large fetal head circumference. - **Pre-procedure**: Ultrasound assessment is recommended if fetal head position is uncertain. - **Post-birth care**: Administer antibiotics to reduce infection risk. Monitor for complications, ensure bladder care, thromboprophylaxis, and analgesia. Document and discuss postnatal plans. - **Psychological support**: Offer referral to a midwife counselor for traumatic births; avoid single-session, trauma-focused interventions. Ensure supportive frameworks for adverse events and adhere to duty of candour. - **Audit & reporting**: Complete incident reports as needed and monitor compliance with RCOG standards\",\n      \"action\": \"added\"\n    }\n  ]\n}",
  "ai_provider": "DeepSeek",
  "ai_model": "deepseek-chat",
  "token_usage": null
}