{
  "prompt": {
    "guidelineId": "cg1116-fetal-heart-monitoring-sampling-pdf",
    "fieldsProcessed": [
      "humanFriendlyName",
      "organisation",
      "yearProduced",
      "summary"
    ],
    "enhancedFields": 4,
    "contentLength": 7813
  },
  "response": "{\n  \"success\": true,\n  \"enhancedFields\": [\n    {\n      \"field\": \"humanFriendlyName\",\n      \"oldValue\": null,\n      \"newValue\": \"Fetal Heart Monitoring Guidelines for Antenatal and Intrapartum Care\",\n      \"action\": \"added\"\n    },\n    {\n      \"field\": \"organisation\",\n      \"oldValue\": null,\n      \"newValue\": \"RCOG\",\n      \"action\": \"added\"\n    },\n    {\n      \"field\": \"yearProduced\",\n      \"oldValue\": null,\n      \"newValue\": \"The provided text does not contain a publication year. If you have another guideline text that includes the publication year, please share it, and I can extract the 4-digit year for you\",\n      \"action\": \"added\"\n    },\n    {\n      \"field\": \"summary\",\n      \"oldValue\": null,\n      \"newValue\": \"**Summary of Fetal Heart Monitoring Guidelines:** - **Monitoring Methods:** Intermittent auscultation (low-risk pregnancies) and continuous electronic fetal monitoring (CEFM) for high-risk cases (e.g., hypertension, breech presentation). - **Antenatal Monitoring:** Dawes-Redman Criteria apply from 26 weeks; discontinue after 10 minutes if met; obstetric review needed if not met by 60 minutes. - **Intrapartum CTG:** Regular review, documentation, and TREND analysis for classification. Escalate concerns promptly. - **Poor CTG Quality:** Reposition transducers, use fetal scalp electrode (FSE), or switch machines if issues persist. - **Fetal Blood Sampling (FBS):** Consider for pathological CTG if no contraindications (e.g., acute fetal compromise, sepsis, bleeding disorders, prematurity <34 weeks). Avoid if expediting birth is needed. - **Cord Blood Sampling:** Paired samples required for concerning labors, SGA/FGR cases, or after FBS. Analyze promptly; document results. - **Care Analysis (FM800E):** Use antenatally only; requires 10 minutes of quality data. Results update every 2 minutes (max 60 mins). Not diagnostic—clinical judgment essential. - **Key Principles:** Prioritize maternal preferences, multidisciplinary communication, and holistic clinical assessment. Store CTG traces for 25 years\",\n      \"action\": \"added\"\n    }\n  ]\n}",
  "endpoint": "enhanceGuidelineMetadata",
  "timestamp": "2025-06-18T21-42-51",
  "textContent": "AI: DeepSeek (deepseek-chat)\n\nQ: {\n  \"guidelineId\": \"cg1116-fetal-heart-monitoring-sampling-pdf\",\n  \"fieldsProcessed\": [\n    \"humanFriendlyName\",\n    \"organisation\",\n    \"yearProduced\",\n    \"summary\"\n  ],\n  \"enhancedFields\": 4,\n  \"contentLength\": 7813\n}\n\nA: {\n  \"success\": true,\n  \"enhancedFields\": [\n    {\n      \"field\": \"humanFriendlyName\",\n      \"oldValue\": null,\n      \"newValue\": \"Fetal Heart Monitoring Guidelines for Antenatal and Intrapartum Care\",\n      \"action\": \"added\"\n    },\n    {\n      \"field\": \"organisation\",\n      \"oldValue\": null,\n      \"newValue\": \"RCOG\",\n      \"action\": \"added\"\n    },\n    {\n      \"field\": \"yearProduced\",\n      \"oldValue\": null,\n      \"newValue\": \"The provided text does not contain a publication year. If you have another guideline text that includes the publication year, please share it, and I can extract the 4-digit year for you\",\n      \"action\": \"added\"\n    },\n    {\n      \"field\": \"summary\",\n      \"oldValue\": null,\n      \"newValue\": \"**Summary of Fetal Heart Monitoring Guidelines:** - **Monitoring Methods:** Intermittent auscultation (low-risk pregnancies) and continuous electronic fetal monitoring (CEFM) for high-risk cases (e.g., hypertension, breech presentation). - **Antenatal Monitoring:** Dawes-Redman Criteria apply from 26 weeks; discontinue after 10 minutes if met; obstetric review needed if not met by 60 minutes. - **Intrapartum CTG:** Regular review, documentation, and TREND analysis for classification. Escalate concerns promptly. - **Poor CTG Quality:** Reposition transducers, use fetal scalp electrode (FSE), or switch machines if issues persist. - **Fetal Blood Sampling (FBS):** Consider for pathological CTG if no contraindications (e.g., acute fetal compromise, sepsis, bleeding disorders, prematurity <34 weeks). Avoid if expediting birth is needed. - **Cord Blood Sampling:** Paired samples required for concerning labors, SGA/FGR cases, or after FBS. Analyze promptly; document results. - **Care Analysis (FM800E):** Use antenatally only; requires 10 minutes of quality data. Results update every 2 minutes (max 60 mins). Not diagnostic—clinical judgment essential. - **Key Principles:** Prioritize maternal preferences, multidisciplinary communication, and holistic clinical assessment. Store CTG traces for 25 years\",\n      \"action\": \"added\"\n    }\n  ]\n}",
  "ai_provider": "DeepSeek",
  "ai_model": "deepseek-chat",
  "token_usage": null
}