{
  "prompt": {
    "guidelineId": "cg1147-maternal-sepsis-pdf",
    "fieldsProcessed": [
      "humanFriendlyName",
      "organisation",
      "yearProduced",
      "summary"
    ],
    "enhancedFields": 4,
    "contentLength": 5196
  },
  "response": "{\n  \"success\": true,\n  \"enhancedFields\": [\n    {\n      \"field\": \"humanFriendlyName\",\n      \"oldValue\": null,\n      \"newValue\": \"Maternal Sepsis in Pregnancy and Postpartum: Clinical Guideline\",\n      \"action\": \"added\"\n    },\n    {\n      \"field\": \"organisation\",\n      \"oldValue\": null,\n      \"newValue\": \"RCOG\",\n      \"action\": \"added\"\n    },\n    {\n      \"field\": \"yearProduced\",\n      \"oldValue\": null,\n      \"newValue\": \"2016\",\n      \"action\": \"added\"\n    },\n    {\n      \"field\": \"summary\",\n      \"oldValue\": null,\n      \"newValue\": \"**Summary of Clinical Guideline for Maternal or Birthing Person Sepsis in Pregnancy and the Puerperium** Sepsis in pregnancy is life-threatening and requires prompt recognition and treatment to reduce mortality. High-risk groups include minority ethnic backgrounds and deprived areas. **Key Recommendations:** - **Diagnosis:** Maintain high suspicion; symptoms (e.g., fever, rigors, abdominal pain) may be non-specific. Use translator services for language barriers. - **Risk Factors:** Obesity, diabetes, prolonged SROM, cesarean delivery, retained products, or Group B streptococcal infection. - **Management:** - **High-risk sepsis:** Immediate oxygen, IV antibiotics/fluids, blood cultures, lactate monitoring, and critical care referral if hypotension or elevated lactate persists. - **Moderate-risk sepsis:** Hourly assessments, senior review within 3 hours, and antibiotics if criteria met. - **Influenza:** Pregnant individuals are high-risk; treat respiratory symptoms promptly with antivirals. - **Neonatal Care:** Refer babies with jaundice or feeding concerns. **Tools:** Use MEOWS for early warning scores and involve multidisciplinary teams. Ensure equitable care and timely expert consultation. *Sources: Sepsis-3 (2016), Surviving Sepsis Campaign (2012), UK Sepsis Trust, WHO.*\",\n      \"action\": \"added\"\n    }\n  ]\n}",
  "endpoint": "enhanceGuidelineMetadata",
  "timestamp": "2025-06-18T22-00-31",
  "textContent": "AI: DeepSeek (deepseek-chat)\n\nQ: {\n  \"guidelineId\": \"cg1147-maternal-sepsis-pdf\",\n  \"fieldsProcessed\": [\n    \"humanFriendlyName\",\n    \"organisation\",\n    \"yearProduced\",\n    \"summary\"\n  ],\n  \"enhancedFields\": 4,\n  \"contentLength\": 5196\n}\n\nA: {\n  \"success\": true,\n  \"enhancedFields\": [\n    {\n      \"field\": \"humanFriendlyName\",\n      \"oldValue\": null,\n      \"newValue\": \"Maternal Sepsis in Pregnancy and Postpartum: Clinical Guideline\",\n      \"action\": \"added\"\n    },\n    {\n      \"field\": \"organisation\",\n      \"oldValue\": null,\n      \"newValue\": \"RCOG\",\n      \"action\": \"added\"\n    },\n    {\n      \"field\": \"yearProduced\",\n      \"oldValue\": null,\n      \"newValue\": \"2016\",\n      \"action\": \"added\"\n    },\n    {\n      \"field\": \"summary\",\n      \"oldValue\": null,\n      \"newValue\": \"**Summary of Clinical Guideline for Maternal or Birthing Person Sepsis in Pregnancy and the Puerperium** Sepsis in pregnancy is life-threatening and requires prompt recognition and treatment to reduce mortality. High-risk groups include minority ethnic backgrounds and deprived areas. **Key Recommendations:** - **Diagnosis:** Maintain high suspicion; symptoms (e.g., fever, rigors, abdominal pain) may be non-specific. Use translator services for language barriers. - **Risk Factors:** Obesity, diabetes, prolonged SROM, cesarean delivery, retained products, or Group B streptococcal infection. - **Management:** - **High-risk sepsis:** Immediate oxygen, IV antibiotics/fluids, blood cultures, lactate monitoring, and critical care referral if hypotension or elevated lactate persists. - **Moderate-risk sepsis:** Hourly assessments, senior review within 3 hours, and antibiotics if criteria met. - **Influenza:** Pregnant individuals are high-risk; treat respiratory symptoms promptly with antivirals. - **Neonatal Care:** Refer babies with jaundice or feeding concerns. **Tools:** Use MEOWS for early warning scores and involve multidisciplinary teams. Ensure equitable care and timely expert consultation. *Sources: Sepsis-3 (2016), Surviving Sepsis Campaign (2012), UK Sepsis Trust, WHO.*\",\n      \"action\": \"added\"\n    }\n  ]\n}",
  "ai_provider": "DeepSeek",
  "ai_model": "deepseek-chat",
  "token_usage": null
}