{
  "prompt": {
    "guidelineId": "cg1109-diabetes-in-pregnancy-guideline-pdf",
    "fieldsProcessed": [
      "humanFriendlyName",
      "organisation",
      "yearProduced",
      "summary"
    ],
    "enhancedFields": 4,
    "contentLength": 3289
  },
  "response": "{\n  \"success\": true,\n  \"enhancedFields\": [\n    {\n      \"field\": \"humanFriendlyName\",\n      \"oldValue\": null,\n      \"newValue\": \"Diabetes in Pregnancy Care Guidelines\",\n      \"action\": \"added\"\n    },\n    {\n      \"field\": \"organisation\",\n      \"oldValue\": null,\n      \"newValue\": \"RCOG\",\n      \"action\": \"added\"\n    },\n    {\n      \"field\": \"yearProduced\",\n      \"oldValue\": null,\n      \"newValue\": \"I'm unable to find a publication year in the provided text. Could you please check if the year is mentioned elsewhere in the document? If not, I cannot extract it from this excerpt\",\n      \"action\": \"added\"\n    },\n    {\n      \"field\": \"summary\",\n      \"oldValue\": null,\n      \"newValue\": \"**Summary of Diabetes in Pregnancy Guideline:** - **Pre-pregnancy counseling** for those with pre-existing diabetes: discuss risks, optimize glucose control, review medications, and screen for complications. - **Screening for GDM**: Follow diagnostic criteria; refer to Diabetes Pregnancy Team if diagnosed. - **Late pregnancy (after 34 weeks)**: Routine GTT or glucose monitoring is unnecessary unless new concerns arise. Random glucose ≥7mmol/L warrants discussion. - **GDM diagnosis without GTT**: Fasting glucose ≥5.6mmol/L or any glucose >11.0mmol/L requires urgent referral. - **Management**: For fasting glucose <7mmol/L, trial diet/exercise changes first. - **Corticosteroid use**: Monitor glucose closely; adjust insulin, consider hospitalization if unstable. - **Labor & delivery**: Continue insulin; may require VRIII. Postpartum, adjust insulin and monitor glucose. - **Breastfeeding**: Frequent glucose monitoring advised. - **Diabetic emergencies**: Immediate medical attention required. - **Monitoring**: 20-week ultrasound, fetal heart exam, self-monitoring of glucose. - **Vaccination**: Offer COVID-19 and other recommended vaccines per guidelines. - **Audit**: Regular audits to ensure adherence to care standards\",\n      \"action\": \"added\"\n    }\n  ]\n}",
  "endpoint": "enhanceGuidelineMetadata",
  "timestamp": "2025-06-18T18-41-54",
  "textContent": "AI: DeepSeek (deepseek-chat)\n\nQ: {\n  \"guidelineId\": \"cg1109-diabetes-in-pregnancy-guideline-pdf\",\n  \"fieldsProcessed\": [\n    \"humanFriendlyName\",\n    \"organisation\",\n    \"yearProduced\",\n    \"summary\"\n  ],\n  \"enhancedFields\": 4,\n  \"contentLength\": 3289\n}\n\nA: {\n  \"success\": true,\n  \"enhancedFields\": [\n    {\n      \"field\": \"humanFriendlyName\",\n      \"oldValue\": null,\n      \"newValue\": \"Diabetes in Pregnancy Care Guidelines\",\n      \"action\": \"added\"\n    },\n    {\n      \"field\": \"organisation\",\n      \"oldValue\": null,\n      \"newValue\": \"RCOG\",\n      \"action\": \"added\"\n    },\n    {\n      \"field\": \"yearProduced\",\n      \"oldValue\": null,\n      \"newValue\": \"I'm unable to find a publication year in the provided text. Could you please check if the year is mentioned elsewhere in the document? If not, I cannot extract it from this excerpt\",\n      \"action\": \"added\"\n    },\n    {\n      \"field\": \"summary\",\n      \"oldValue\": null,\n      \"newValue\": \"**Summary of Diabetes in Pregnancy Guideline:** - **Pre-pregnancy counseling** for those with pre-existing diabetes: discuss risks, optimize glucose control, review medications, and screen for complications. - **Screening for GDM**: Follow diagnostic criteria; refer to Diabetes Pregnancy Team if diagnosed. - **Late pregnancy (after 34 weeks)**: Routine GTT or glucose monitoring is unnecessary unless new concerns arise. Random glucose ≥7mmol/L warrants discussion. - **GDM diagnosis without GTT**: Fasting glucose ≥5.6mmol/L or any glucose >11.0mmol/L requires urgent referral. - **Management**: For fasting glucose <7mmol/L, trial diet/exercise changes first. - **Corticosteroid use**: Monitor glucose closely; adjust insulin, consider hospitalization if unstable. - **Labor & delivery**: Continue insulin; may require VRIII. Postpartum, adjust insulin and monitor glucose. - **Breastfeeding**: Frequent glucose monitoring advised. - **Diabetic emergencies**: Immediate medical attention required. - **Monitoring**: 20-week ultrasound, fetal heart exam, self-monitoring of glucose. - **Vaccination**: Offer COVID-19 and other recommended vaccines per guidelines. - **Audit**: Regular audits to ensure adherence to care standards\",\n      \"action\": \"added\"\n    }\n  ]\n}",
  "ai_provider": "DeepSeek",
  "ai_model": "deepseek-chat",
  "token_usage": null
}