{
  "prompt": {
    "guidelineId": "appendix-7-pcea-labour-chart-v2-july-2020-final-pdf",
    "fieldsProcessed": [
      "humanFriendlyName",
      "organisation",
      "yearProduced",
      "summary"
    ],
    "enhancedFields": 4,
    "contentLength": 3372
  },
  "response": "{\n  \"success\": true,\n  \"enhancedFields\": [\n    {\n      \"field\": \"humanFriendlyName\",\n      \"oldValue\": null,\n      \"newValue\": \"Labour Epidural Analgesia PCEA Guidelines\",\n      \"action\": \"added\"\n    },\n    {\n      \"field\": \"organisation\",\n      \"oldValue\": null,\n      \"newValue\": \"WSHT\",\n      \"action\": \"added\"\n    },\n    {\n      \"field\": \"yearProduced\",\n      \"oldValue\": null,\n      \"newValue\": \"I'm sorry, but I cannot find a publication year in the provided medical guideline text. The text appears to be a clinical form or template for epidural procedures, but it does not include a publication date. If you have another document or can provide more context, I'd be happy to help extract the year for you\",\n      \"action\": \"added\"\n    },\n    {\n      \"field\": \"summary\",\n      \"oldValue\": null,\n      \"newValue\": \"**Summary of Labour PCEA Epidural Guideline:** - **Consent:** Risks discussed (e.g., hypotension, headache, neurological damage—temporary 1/1000, permanent 1/13,000). - **Prescription:** - **Solution:** 0.1% levobupivacaine with fentanyl (2 µg/mL). - **PCEA Settings:** 8 mL bolus, 15-minute lockout, optional background infusion (0–2 mL/h). - **Insertion:** - Position: Lateral/sitting; Tuohy needle (18g/16g); loss of resistance (saline/air). - Catheter depth recorded; aspiration checked for blood/CSF. - **Monitoring:** - BP every 5 minutes for 20 minutes post-initiation/bolus (>10 mL 0.1% or 5 mL 0.25% levobupivacaine). - Assess block level (cold sensation at xiphisternum, leg raise) and pain relief (good/moderate/poor). - **Post-Insertion:** - **Observations:** Every 30 minutes (15 minutes post-top-up). - **Safety:** Epidural cassette checked/signed; IV Hartmann’s recommended. - **Mobility/Hydration:** Regular position changes, pressure area assessments, and hydration encouraged. - **Documentation:** Boluses delivered/demanded, block effectiveness, and complications recorded hourly. *Note:* Do not leave cassette unattended; label catheter/infusion line\",\n      \"action\": \"added\"\n    }\n  ]\n}",
  "endpoint": "enhanceGuidelineMetadata",
  "timestamp": "2025-06-18T18-39-57",
  "textContent": "AI: DeepSeek (deepseek-chat)\n\nQ: {\n  \"guidelineId\": \"appendix-7-pcea-labour-chart-v2-july-2020-final-pdf\",\n  \"fieldsProcessed\": [\n    \"humanFriendlyName\",\n    \"organisation\",\n    \"yearProduced\",\n    \"summary\"\n  ],\n  \"enhancedFields\": 4,\n  \"contentLength\": 3372\n}\n\nA: {\n  \"success\": true,\n  \"enhancedFields\": [\n    {\n      \"field\": \"humanFriendlyName\",\n      \"oldValue\": null,\n      \"newValue\": \"Labour Epidural Analgesia PCEA Guidelines\",\n      \"action\": \"added\"\n    },\n    {\n      \"field\": \"organisation\",\n      \"oldValue\": null,\n      \"newValue\": \"WSHT\",\n      \"action\": \"added\"\n    },\n    {\n      \"field\": \"yearProduced\",\n      \"oldValue\": null,\n      \"newValue\": \"I'm sorry, but I cannot find a publication year in the provided medical guideline text. The text appears to be a clinical form or template for epidural procedures, but it does not include a publication date. If you have another document or can provide more context, I'd be happy to help extract the year for you\",\n      \"action\": \"added\"\n    },\n    {\n      \"field\": \"summary\",\n      \"oldValue\": null,\n      \"newValue\": \"**Summary of Labour PCEA Epidural Guideline:** - **Consent:** Risks discussed (e.g., hypotension, headache, neurological damage—temporary 1/1000, permanent 1/13,000). - **Prescription:** - **Solution:** 0.1% levobupivacaine with fentanyl (2 µg/mL). - **PCEA Settings:** 8 mL bolus, 15-minute lockout, optional background infusion (0–2 mL/h). - **Insertion:** - Position: Lateral/sitting; Tuohy needle (18g/16g); loss of resistance (saline/air). - Catheter depth recorded; aspiration checked for blood/CSF. - **Monitoring:** - BP every 5 minutes for 20 minutes post-initiation/bolus (>10 mL 0.1% or 5 mL 0.25% levobupivacaine). - Assess block level (cold sensation at xiphisternum, leg raise) and pain relief (good/moderate/poor). - **Post-Insertion:** - **Observations:** Every 30 minutes (15 minutes post-top-up). - **Safety:** Epidural cassette checked/signed; IV Hartmann’s recommended. - **Mobility/Hydration:** Regular position changes, pressure area assessments, and hydration encouraged. - **Documentation:** Boluses delivered/demanded, block effectiveness, and complications recorded hourly. *Note:* Do not leave cassette unattended; label catheter/infusion line\",\n      \"action\": \"added\"\n    }\n  ]\n}",
  "ai_provider": "DeepSeek",
  "ai_model": "deepseek-chat",
  "token_usage": null
}