{
  "prompt": {
    "guidelineId": "cg1109-diabetes-in-pregnancy-guideline-pdf",
    "fieldsProcessed": [
      "humanFriendlyName",
      "organisation",
      "yearProduced",
      "summary"
    ],
    "enhancedFields": 4,
    "contentLength": 3289
  },
  "response": "{\n  \"success\": true,\n  \"enhancedFields\": [\n    {\n      \"field\": \"humanFriendlyName\",\n      \"oldValue\": null,\n      \"newValue\": \"Diabetes in Pregnancy Care Guidelines\",\n      \"action\": \"added\"\n    },\n    {\n      \"field\": \"organisation\",\n      \"oldValue\": null,\n      \"newValue\": \"RCOG\",\n      \"action\": \"added\"\n    },\n    {\n      \"field\": \"yearProduced\",\n      \"oldValue\": null,\n      \"newValue\": \"I'm sorry, but the provided text does not contain a publication year. If you have another guideline text that includes the year, I'd be happy to extract it for you\",\n      \"action\": \"added\"\n    },\n    {\n      \"field\": \"summary\",\n      \"oldValue\": null,\n      \"newValue\": \"**Summary of Diabetes in Pregnancy Guideline** - **Pre-pregnancy counseling**: Discuss risks, optimize glucose monitoring, review medications, and screen for complications in women with pre-existing diabetes. - **GDM screening**: Follow diagnostic criteria; refer to Diabetes Pregnancy Team if diagnosed. After 34 weeks, GTT is rarely useful unless new concerns arise (random glucose ≥7mmol/L warrants discussion). - **Diagnosis without GTT**: Glucose >11.0mmol/L or fasting ≥5.6mmol/L requires urgent referral. - **Management**: For GDM with fasting glucose <7mmol/L, trial diet/exercise first. Corticosteroid use may require hospitalization for glucose monitoring and insulin adjustment. - **Labor/delivery**: Continue insulin; consider VRIII. Postpartum, adjust insulin and monitor glucose. - **Breastfeeding**: Frequent glucose monitoring advised. - **Monitoring**: Ultrasound and fetal heart exam at 20 weeks; self-monitor glucose. - **Vaccination**: Offer COVID-19 vaccination per JCVI guidelines, prioritizing GDM patients. - **Audit**: Regular audits to ensure compliance and quality care\",\n      \"action\": \"added\"\n    }\n  ]\n}",
  "endpoint": "enhanceGuidelineMetadata",
  "timestamp": "2025-06-18T18-41-54",
  "textContent": "AI: DeepSeek (deepseek-chat)\n\nQ: {\n  \"guidelineId\": \"cg1109-diabetes-in-pregnancy-guideline-pdf\",\n  \"fieldsProcessed\": [\n    \"humanFriendlyName\",\n    \"organisation\",\n    \"yearProduced\",\n    \"summary\"\n  ],\n  \"enhancedFields\": 4,\n  \"contentLength\": 3289\n}\n\nA: {\n  \"success\": true,\n  \"enhancedFields\": [\n    {\n      \"field\": \"humanFriendlyName\",\n      \"oldValue\": null,\n      \"newValue\": \"Diabetes in Pregnancy Care Guidelines\",\n      \"action\": \"added\"\n    },\n    {\n      \"field\": \"organisation\",\n      \"oldValue\": null,\n      \"newValue\": \"RCOG\",\n      \"action\": \"added\"\n    },\n    {\n      \"field\": \"yearProduced\",\n      \"oldValue\": null,\n      \"newValue\": \"I'm sorry, but the provided text does not contain a publication year. If you have another guideline text that includes the year, I'd be happy to extract it for you\",\n      \"action\": \"added\"\n    },\n    {\n      \"field\": \"summary\",\n      \"oldValue\": null,\n      \"newValue\": \"**Summary of Diabetes in Pregnancy Guideline** - **Pre-pregnancy counseling**: Discuss risks, optimize glucose monitoring, review medications, and screen for complications in women with pre-existing diabetes. - **GDM screening**: Follow diagnostic criteria; refer to Diabetes Pregnancy Team if diagnosed. After 34 weeks, GTT is rarely useful unless new concerns arise (random glucose ≥7mmol/L warrants discussion). - **Diagnosis without GTT**: Glucose >11.0mmol/L or fasting ≥5.6mmol/L requires urgent referral. - **Management**: For GDM with fasting glucose <7mmol/L, trial diet/exercise first. Corticosteroid use may require hospitalization for glucose monitoring and insulin adjustment. - **Labor/delivery**: Continue insulin; consider VRIII. Postpartum, adjust insulin and monitor glucose. - **Breastfeeding**: Frequent glucose monitoring advised. - **Monitoring**: Ultrasound and fetal heart exam at 20 weeks; self-monitor glucose. - **Vaccination**: Offer COVID-19 vaccination per JCVI guidelines, prioritizing GDM patients. - **Audit**: Regular audits to ensure compliance and quality care\",\n      \"action\": \"added\"\n    }\n  ]\n}",
  "ai_provider": "DeepSeek",
  "ai_model": "deepseek-chat",
  "token_usage": null
}