{
  "prompt": {
    "guidelineId": "mp005-perinatal-care-for-transgender-non-binary-people-pdf",
    "fieldsProcessed": [
      "humanFriendlyName",
      "organisation",
      "yearProduced",
      "summary"
    ],
    "enhancedFields": 4,
    "contentLength": 5976
  },
  "response": "{\n  \"success\": true,\n  \"enhancedFields\": [\n    {\n      \"field\": \"humanFriendlyName\",\n      \"oldValue\": null,\n      \"newValue\": \"Perinatal Care for Trans and Non-Binary People\",\n      \"action\": \"added\"\n    },\n    {\n      \"field\": \"organisation\",\n      \"oldValue\": null,\n      \"newValue\": \"Brighton & Sussex University Hospitals NHS Trust\",\n      \"action\": \"added\"\n    },\n    {\n      \"field\": \"yearProduced\",\n      \"oldValue\": null,\n      \"newValue\": \"2020\",\n      \"action\": \"added\"\n    },\n    {\n      \"field\": \"summary\",\n      \"oldValue\": null,\n      \"newValue\": \"**Summary of Perinatal Care for Trans and Non-Binary People (RSCH PRH only) MP005** **Key Principles:** - Use preferred names/pronouns and maintain privacy/dignity. Provide trauma-informed care and support for gender dysphoria. **Clinical Recommendations:** 1. **Pre-conception & Antenatal Care:** Discuss hormone therapy, surgeries, and conception support. 2. **Intrapartum Care:** - For catheterization, confirm urethral location post-lower surgery. Use standard-length catheters if needed. - Follow aseptic technique; stabilize tissues during insertion. 3. **Postnatal Care:** - Offer choice between side-room or shared ward accommodation. - Monitor chest health (e.g., mastitis risk post-top surgery). - Discuss postnatal depression (higher risk if previously on testosterone). - Support infant feeding (breast/chestfeeding possible if nipples remain). - Address contraception and testosterone resumption post-birth. - Note: UK birth registration records gestational parent as \\\"Mother.\\\" **Communication:** Use patient-preferred anatomical terms (e.g., \\\"chestfeeding\\\"). Follow NMC/NICE guidelines for respectful, individualized care. **Definitions:** Clarifies terms like gender identity, lower surgery, and transition. **Appendix:** Includes \\\"My Language Preferences\\\" form for documenting pronouns and anatomical terms. (Word count: 200)\",\n      \"action\": \"added\"\n    }\n  ]\n}",
  "endpoint": "enhanceGuidelineMetadata",
  "timestamp": "2025-06-18T22-32-40",
  "textContent": "AI: DeepSeek (deepseek-chat)\n\nQ: {\n  \"guidelineId\": \"mp005-perinatal-care-for-transgender-non-binary-people-pdf\",\n  \"fieldsProcessed\": [\n    \"humanFriendlyName\",\n    \"organisation\",\n    \"yearProduced\",\n    \"summary\"\n  ],\n  \"enhancedFields\": 4,\n  \"contentLength\": 5976\n}\n\nA: {\n  \"success\": true,\n  \"enhancedFields\": [\n    {\n      \"field\": \"humanFriendlyName\",\n      \"oldValue\": null,\n      \"newValue\": \"Perinatal Care for Trans and Non-Binary People\",\n      \"action\": \"added\"\n    },\n    {\n      \"field\": \"organisation\",\n      \"oldValue\": null,\n      \"newValue\": \"Brighton & Sussex University Hospitals NHS Trust\",\n      \"action\": \"added\"\n    },\n    {\n      \"field\": \"yearProduced\",\n      \"oldValue\": null,\n      \"newValue\": \"2020\",\n      \"action\": \"added\"\n    },\n    {\n      \"field\": \"summary\",\n      \"oldValue\": null,\n      \"newValue\": \"**Summary of Perinatal Care for Trans and Non-Binary People (RSCH PRH only) MP005** **Key Principles:** - Use preferred names/pronouns and maintain privacy/dignity. Provide trauma-informed care and support for gender dysphoria. **Clinical Recommendations:** 1. **Pre-conception & Antenatal Care:** Discuss hormone therapy, surgeries, and conception support. 2. **Intrapartum Care:** - For catheterization, confirm urethral location post-lower surgery. Use standard-length catheters if needed. - Follow aseptic technique; stabilize tissues during insertion. 3. **Postnatal Care:** - Offer choice between side-room or shared ward accommodation. - Monitor chest health (e.g., mastitis risk post-top surgery). - Discuss postnatal depression (higher risk if previously on testosterone). - Support infant feeding (breast/chestfeeding possible if nipples remain). - Address contraception and testosterone resumption post-birth. - Note: UK birth registration records gestational parent as \\\"Mother.\\\" **Communication:** Use patient-preferred anatomical terms (e.g., \\\"chestfeeding\\\"). Follow NMC/NICE guidelines for respectful, individualized care. **Definitions:** Clarifies terms like gender identity, lower surgery, and transition. **Appendix:** Includes \\\"My Language Preferences\\\" form for documenting pronouns and anatomical terms. (Word count: 200)\",\n      \"action\": \"added\"\n    }\n  ]\n}",
  "ai_provider": "DeepSeek",
  "ai_model": "deepseek-chat",
  "token_usage": null
}