{
  "prompt": {
    "guidelineId": "cg1128-neonatal-resuscitation-pdf",
    "fieldsProcessed": [
      "humanFriendlyName",
      "organisation",
      "yearProduced",
      "summary"
    ],
    "enhancedFields": 4,
    "contentLength": 3034
  },
  "response": "{\n  \"success\": true,\n  \"enhancedFields\": [\n    {\n      \"field\": \"humanFriendlyName\",\n      \"oldValue\": null,\n      \"newValue\": \"Neonatal Resuscitation Guidelines and Equipment Checklist\",\n      \"action\": \"added\"\n    },\n    {\n      \"field\": \"organisation\",\n      \"oldValue\": null,\n      \"newValue\": \"RCOG\",\n      \"action\": \"added\"\n    },\n    {\n      \"field\": \"yearProduced\",\n      \"oldValue\": null,\n      \"newValue\": \"2023\",\n      \"action\": \"added\"\n    },\n    {\n      \"field\": \"summary\",\n      \"oldValue\": null,\n      \"newValue\": \"**Summary of Neonatal Resuscitation Guideline (CG1128 V6, Jan 2023):** - **Personnel & Equipment**: Ensure trained staff and resuscitation equipment (e.g., laryngoscopes, endotracheal tubes [ETTs], suction devices) are available. The resuscitaire must be checked pre-delivery (heater, oxygen, suction, masks, ETTs). - **Drug Dosing**: Weight-based adrenaline (0.2 ml/kg IV/IO), bicarbonate (2–4 ml/kg of 4.2%), glucose 10% (2.5 ml/kg), and 0.9% sodium chloride (10 ml/kg). ETT sizes/lengths vary by weight/gestation (e.g., 2.5/5.5 cm for 0.5–0.75 kg). - **Extreme Preterm (<26 weeks)**: Individualized decision-making with parental involvement; options include resuscitation, comfort care, or survival-focused care based on gestational age. - **Flowchart**: Follow Resuscitation Council UK’s Newborn Life Support (NLS 2021) algorithm. - **Key Checks**: Verify oxygen supply, suction pressure (10 kPa), and equipment functionality (blades, masks, airways). Single-use items (e.g., suction catheters) must not be reused. *Tables detail equipment lists, drug doses, and preterm management pathways.*\",\n      \"action\": \"added\"\n    }\n  ]\n}",
  "endpoint": "enhanceGuidelineMetadata",
  "timestamp": "2025-06-18T21-49-05",
  "textContent": "AI: DeepSeek (deepseek-chat)\n\nQ: {\n  \"guidelineId\": \"cg1128-neonatal-resuscitation-pdf\",\n  \"fieldsProcessed\": [\n    \"humanFriendlyName\",\n    \"organisation\",\n    \"yearProduced\",\n    \"summary\"\n  ],\n  \"enhancedFields\": 4,\n  \"contentLength\": 3034\n}\n\nA: {\n  \"success\": true,\n  \"enhancedFields\": [\n    {\n      \"field\": \"humanFriendlyName\",\n      \"oldValue\": null,\n      \"newValue\": \"Neonatal Resuscitation Guidelines and Equipment Checklist\",\n      \"action\": \"added\"\n    },\n    {\n      \"field\": \"organisation\",\n      \"oldValue\": null,\n      \"newValue\": \"RCOG\",\n      \"action\": \"added\"\n    },\n    {\n      \"field\": \"yearProduced\",\n      \"oldValue\": null,\n      \"newValue\": \"2023\",\n      \"action\": \"added\"\n    },\n    {\n      \"field\": \"summary\",\n      \"oldValue\": null,\n      \"newValue\": \"**Summary of Neonatal Resuscitation Guideline (CG1128 V6, Jan 2023):** - **Personnel & Equipment**: Ensure trained staff and resuscitation equipment (e.g., laryngoscopes, endotracheal tubes [ETTs], suction devices) are available. The resuscitaire must be checked pre-delivery (heater, oxygen, suction, masks, ETTs). - **Drug Dosing**: Weight-based adrenaline (0.2 ml/kg IV/IO), bicarbonate (2–4 ml/kg of 4.2%), glucose 10% (2.5 ml/kg), and 0.9% sodium chloride (10 ml/kg). ETT sizes/lengths vary by weight/gestation (e.g., 2.5/5.5 cm for 0.5–0.75 kg). - **Extreme Preterm (<26 weeks)**: Individualized decision-making with parental involvement; options include resuscitation, comfort care, or survival-focused care based on gestational age. - **Flowchart**: Follow Resuscitation Council UK’s Newborn Life Support (NLS 2021) algorithm. - **Key Checks**: Verify oxygen supply, suction pressure (10 kPa), and equipment functionality (blades, masks, airways). Single-use items (e.g., suction catheters) must not be reused. *Tables detail equipment lists, drug doses, and preterm management pathways.*\",\n      \"action\": \"added\"\n    }\n  ]\n}",
  "ai_provider": "DeepSeek",
  "ai_model": "deepseek-chat",
  "token_usage": null
}