{
  "prompt": {
    "guidelineId": "appendix-7-pcea-labour-chart-v2-july-2020-final-pdf",
    "fieldsProcessed": [
      "humanFriendlyName",
      "organisation",
      "yearProduced",
      "summary"
    ],
    "enhancedFields": 4,
    "contentLength": 3372
  },
  "response": "{\n  \"success\": true,\n  \"enhancedFields\": [\n    {\n      \"field\": \"humanFriendlyName\",\n      \"oldValue\": null,\n      \"newValue\": \"Labour Epidural Analgesia PCEA Guidelines\",\n      \"action\": \"added\"\n    },\n    {\n      \"field\": \"organisation\",\n      \"oldValue\": null,\n      \"newValue\": \"WSHT\",\n      \"action\": \"added\"\n    },\n    {\n      \"field\": \"yearProduced\",\n      \"oldValue\": null,\n      \"newValue\": \"I'm sorry, but the provided text does not contain any information about the publication year of the medical guideline. If you have another document or section that includes the publication date, please share it, and I'll be happy to extract the year for you\",\n      \"action\": \"added\"\n    },\n    {\n      \"field\": \"summary\",\n      \"oldValue\": null,\n      \"newValue\": \"**Summary of Labour PCEA Epidural Guidelines:** - **Consent:** Risks discussed (e.g., hypotension, headache, neurological damage—temporary 1/1000, permanent 1/13,000). - **Prescription:** - **Solution:** 0.1% levobupivacaine + fentanyl (2 µg/mL). - **PCEA Settings:** Bolus 8 mL, lockout 15 min, optional background infusion (0–2 mL/h). - **Insertion:** - Position: Lateral/sitting; Tuohy needle (18g/16g); loss of resistance (saline/air). - Catheter depth recorded; aspiration checked for blood/CSF. - **Monitoring:** - BP every 5 min for 20 min post-initiation/bolus (>10 mL 0.1% or 5 mL 0.25% levobupivacaine). - Assess block (cold sensation at xiphisternum, leg raise), pain relief (good/moderate/poor). - **PCEA Observations:** - Record every 30 min (or every 5 min for 15 min after midwifery/anaesthetist top-ups). - Track boluses delivered/demanded, total volume, and complications. - **Safety:** - IV Hartmann’s recommended; epidural cassette checked/signed. - Pressure area assessments every 2h; encourage mobility/hydration. - **Documentation:** Anaesthetist(s), parity, cervical dilation, BMI, obstetric/medical history, and insertion details recorded. *Key Points:* Focus on vigilant monitoring, block assessment, and maternal safety\",\n      \"action\": \"added\"\n    }\n  ]\n}",
  "endpoint": "enhanceGuidelineMetadata",
  "timestamp": "2025-06-18T18-39-57",
  "textContent": "AI: DeepSeek (deepseek-chat)\n\nQ: {\n  \"guidelineId\": \"appendix-7-pcea-labour-chart-v2-july-2020-final-pdf\",\n  \"fieldsProcessed\": [\n    \"humanFriendlyName\",\n    \"organisation\",\n    \"yearProduced\",\n    \"summary\"\n  ],\n  \"enhancedFields\": 4,\n  \"contentLength\": 3372\n}\n\nA: {\n  \"success\": true,\n  \"enhancedFields\": [\n    {\n      \"field\": \"humanFriendlyName\",\n      \"oldValue\": null,\n      \"newValue\": \"Labour Epidural Analgesia PCEA Guidelines\",\n      \"action\": \"added\"\n    },\n    {\n      \"field\": \"organisation\",\n      \"oldValue\": null,\n      \"newValue\": \"WSHT\",\n      \"action\": \"added\"\n    },\n    {\n      \"field\": \"yearProduced\",\n      \"oldValue\": null,\n      \"newValue\": \"I'm sorry, but the provided text does not contain any information about the publication year of the medical guideline. If you have another document or section that includes the publication date, please share it, and I'll be happy to extract the year for you\",\n      \"action\": \"added\"\n    },\n    {\n      \"field\": \"summary\",\n      \"oldValue\": null,\n      \"newValue\": \"**Summary of Labour PCEA Epidural Guidelines:** - **Consent:** Risks discussed (e.g., hypotension, headache, neurological damage—temporary 1/1000, permanent 1/13,000). - **Prescription:** - **Solution:** 0.1% levobupivacaine + fentanyl (2 µg/mL). - **PCEA Settings:** Bolus 8 mL, lockout 15 min, optional background infusion (0–2 mL/h). - **Insertion:** - Position: Lateral/sitting; Tuohy needle (18g/16g); loss of resistance (saline/air). - Catheter depth recorded; aspiration checked for blood/CSF. - **Monitoring:** - BP every 5 min for 20 min post-initiation/bolus (>10 mL 0.1% or 5 mL 0.25% levobupivacaine). - Assess block (cold sensation at xiphisternum, leg raise), pain relief (good/moderate/poor). - **PCEA Observations:** - Record every 30 min (or every 5 min for 15 min after midwifery/anaesthetist top-ups). - Track boluses delivered/demanded, total volume, and complications. - **Safety:** - IV Hartmann’s recommended; epidural cassette checked/signed. - Pressure area assessments every 2h; encourage mobility/hydration. - **Documentation:** Anaesthetist(s), parity, cervical dilation, BMI, obstetric/medical history, and insertion details recorded. *Key Points:* Focus on vigilant monitoring, block assessment, and maternal safety\",\n      \"action\": \"added\"\n    }\n  ]\n}",
  "ai_provider": "DeepSeek",
  "ai_model": "deepseek-chat",
  "token_usage": null
}