{
  "prompt": {
    "guidelineId": "releasing-placentas-to-parents-form-pdf",
    "fieldsProcessed": [
      "humanFriendlyName",
      "organisation",
      "yearProduced",
      "summary"
    ],
    "enhancedFields": 4,
    "contentLength": 795
  },
  "response": "{\n  \"success\": true,\n  \"enhancedFields\": [\n    {\n      \"field\": \"humanFriendlyName\",\n      \"oldValue\": null,\n      \"newValue\": \"Guidelines for Handling and Disposing of Placenta\",\n      \"action\": \"added\"\n    },\n    {\n      \"field\": \"organisation\",\n      \"oldValue\": null,\n      \"newValue\": \"RCOG\",\n      \"action\": \"added\"\n    },\n    {\n      \"field\": \"yearProduced\",\n      \"oldValue\": null,\n      \"newValue\": \"The provided text does not contain a publication year. If you have another guideline text that includes the year, please share it, and I can extract the 4-digit year for you\",\n      \"action\": \"added\"\n    },\n    {\n      \"field\": \"summary\",\n      \"oldValue\": null,\n      \"newValue\": \"**Summary of Guidelines for Releasing Placentas to Parents:** - Seal placenta in 2 bags and store in a leak-proof container for transport. - Refrigerate (without food) for 48–72 hours before disposal. - Follow hygiene precautions to minimize infection risk; avoid contact with broken skin. - For burial: dig at least 1 meter deep, avoid water sources, and remove plastic cord clamps/non-biodegradable materials. - Do not dispose of placenta in domestic waste—return to hospital if needed. - Comply with local regulations for burial or disposal\",\n      \"action\": \"added\"\n    }\n  ]\n}",
  "endpoint": "enhanceGuidelineMetadata",
  "timestamp": "2025-06-18T23-00-42",
  "textContent": "AI: DeepSeek (deepseek-chat)\n\nQ: {\n  \"guidelineId\": \"releasing-placentas-to-parents-form-pdf\",\n  \"fieldsProcessed\": [\n    \"humanFriendlyName\",\n    \"organisation\",\n    \"yearProduced\",\n    \"summary\"\n  ],\n  \"enhancedFields\": 4,\n  \"contentLength\": 795\n}\n\nA: {\n  \"success\": true,\n  \"enhancedFields\": [\n    {\n      \"field\": \"humanFriendlyName\",\n      \"oldValue\": null,\n      \"newValue\": \"Guidelines for Handling and Disposing of Placenta\",\n      \"action\": \"added\"\n    },\n    {\n      \"field\": \"organisation\",\n      \"oldValue\": null,\n      \"newValue\": \"RCOG\",\n      \"action\": \"added\"\n    },\n    {\n      \"field\": \"yearProduced\",\n      \"oldValue\": null,\n      \"newValue\": \"The provided text does not contain a publication year. If you have another guideline text that includes the year, please share it, and I can extract the 4-digit year for you\",\n      \"action\": \"added\"\n    },\n    {\n      \"field\": \"summary\",\n      \"oldValue\": null,\n      \"newValue\": \"**Summary of Guidelines for Releasing Placentas to Parents:** - Seal placenta in 2 bags and store in a leak-proof container for transport. - Refrigerate (without food) for 48–72 hours before disposal. - Follow hygiene precautions to minimize infection risk; avoid contact with broken skin. - For burial: dig at least 1 meter deep, avoid water sources, and remove plastic cord clamps/non-biodegradable materials. - Do not dispose of placenta in domestic waste—return to hospital if needed. - Comply with local regulations for burial or disposal\",\n      \"action\": \"added\"\n    }\n  ]\n}",
  "ai_provider": "DeepSeek",
  "ai_model": "deepseek-chat",
  "token_usage": null
}