{
  "prompt": {
    "guidelineId": "mp032-pre-labour-rupture-of-membranes-term-pre-term-pdf",
    "fieldsProcessed": [
      "humanFriendlyName",
      "organisation",
      "yearProduced",
      "summary"
    ],
    "enhancedFields": 4,
    "contentLength": 3123
  },
  "response": "{\n  \"success\": true,\n  \"enhancedFields\": [\n    {\n      \"field\": \"humanFriendlyName\",\n      \"oldValue\": null,\n      \"newValue\": \"Term and Pre-Term Rupture of Membranes Management\",\n      \"action\": \"added\"\n    },\n    {\n      \"field\": \"organisation\",\n      \"oldValue\": null,\n      \"newValue\": \"RCOG\",\n      \"action\": \"added\"\n    },\n    {\n      \"field\": \"yearProduced\",\n      \"oldValue\": null,\n      \"newValue\": \"I couldn't find a publication year in the provided medical guideline text. The text references NICE guidelines and RCOG Green Top Guideline but does not specify a publication year for this particular protocol\",\n      \"action\": \"added\"\n    },\n    {\n      \"field\": \"summary\",\n      \"oldValue\": null,\n      \"newValue\": \"**Summary of Maternity Protocol MP032:** **Term PROM (≥37 weeks):** - Defined as membrane rupture before labor onset. - Telephone risk assessment by midwife/obstetrician. - Clinical assessment includes history, exam, and testing. - Management options: induction of labor (IOL) or conservative care. - IOL timing based on Bishop score; follow NICE/RCOG guidelines. **Preterm PROM (<37 weeks):** - Urgent assessment for suspected PPROM. - Midwife completes BSOTS MP026 assessment, checks baseline obs, and starts CTG if >26 weeks. - Obstetric review, sterile speculum exam, and Amnisure® test if no fluid seen. - Offer antibiotics, corticosteroids (23-34+6 weeks), and MgSO4 if delivery expected within 24 hours. - Dynamic management based on fetal wellbeing, liquor volume, and MDT input. - For <22 weeks: prioritize maternal wellbeing; discuss poor outcomes openly. - Serial scans: 4-weekly until 32 weeks, 2-weekly from 34 weeks. - Neonatal team involvement for delivery planning, especially at 22-24+6 weeks. - Intrapartum monitoring/resuscitation plans based on gestation and MDT consensus\",\n      \"action\": \"added\"\n    }\n  ]\n}",
  "endpoint": "enhanceGuidelineMetadata",
  "timestamp": "2025-06-18T22-42-04",
  "textContent": "AI: DeepSeek (deepseek-chat)\n\nQ: {\n  \"guidelineId\": \"mp032-pre-labour-rupture-of-membranes-term-pre-term-pdf\",\n  \"fieldsProcessed\": [\n    \"humanFriendlyName\",\n    \"organisation\",\n    \"yearProduced\",\n    \"summary\"\n  ],\n  \"enhancedFields\": 4,\n  \"contentLength\": 3123\n}\n\nA: {\n  \"success\": true,\n  \"enhancedFields\": [\n    {\n      \"field\": \"humanFriendlyName\",\n      \"oldValue\": null,\n      \"newValue\": \"Term and Pre-Term Rupture of Membranes Management\",\n      \"action\": \"added\"\n    },\n    {\n      \"field\": \"organisation\",\n      \"oldValue\": null,\n      \"newValue\": \"RCOG\",\n      \"action\": \"added\"\n    },\n    {\n      \"field\": \"yearProduced\",\n      \"oldValue\": null,\n      \"newValue\": \"I couldn't find a publication year in the provided medical guideline text. The text references NICE guidelines and RCOG Green Top Guideline but does not specify a publication year for this particular protocol\",\n      \"action\": \"added\"\n    },\n    {\n      \"field\": \"summary\",\n      \"oldValue\": null,\n      \"newValue\": \"**Summary of Maternity Protocol MP032:** **Term PROM (≥37 weeks):** - Defined as membrane rupture before labor onset. - Telephone risk assessment by midwife/obstetrician. - Clinical assessment includes history, exam, and testing. - Management options: induction of labor (IOL) or conservative care. - IOL timing based on Bishop score; follow NICE/RCOG guidelines. **Preterm PROM (<37 weeks):** - Urgent assessment for suspected PPROM. - Midwife completes BSOTS MP026 assessment, checks baseline obs, and starts CTG if >26 weeks. - Obstetric review, sterile speculum exam, and Amnisure® test if no fluid seen. - Offer antibiotics, corticosteroids (23-34+6 weeks), and MgSO4 if delivery expected within 24 hours. - Dynamic management based on fetal wellbeing, liquor volume, and MDT input. - For <22 weeks: prioritize maternal wellbeing; discuss poor outcomes openly. - Serial scans: 4-weekly until 32 weeks, 2-weekly from 34 weeks. - Neonatal team involvement for delivery planning, especially at 22-24+6 weeks. - Intrapartum monitoring/resuscitation plans based on gestation and MDT consensus\",\n      \"action\": \"added\"\n    }\n  ]\n}",
  "ai_provider": "DeepSeek",
  "ai_model": "deepseek-chat",
  "token_usage": null
}