{
  "prompt": {
    "guidelineId": "gp005-emergency-gynaecology-admissions-gau-ready-pdf",
    "fieldsProcessed": [
      "humanFriendlyName",
      "organisation",
      "yearProduced",
      "summary"
    ],
    "enhancedFields": 4,
    "contentLength": 3325
  },
  "response": "{\n  \"success\": true,\n  \"enhancedFields\": [\n    {\n      \"field\": \"humanFriendlyName\",\n      \"oldValue\": null,\n      \"newValue\": \"Emergency Gynaecology Care and GAU Admission Protocol\",\n      \"action\": \"added\"\n    },\n    {\n      \"field\": \"organisation\",\n      \"oldValue\": null,\n      \"newValue\": \"RCOG\",\n      \"action\": \"added\"\n    },\n    {\n      \"field\": \"yearProduced\",\n      \"oldValue\": null,\n      \"newValue\": \"2020\",\n      \"action\": \"added\"\n    },\n    {\n      \"field\": \"summary\",\n      \"oldValue\": null,\n      \"newValue\": \"**Summary of Emergency Gynaecology Admissions & GAU Protocol GP005, May 2020** - **Key Principles**: Guidelines support but do not replace clinical judgement; senior input is advised. - **Scope**: Applies to all Women’s Directorate staff, including ED clinicians and management. - **Responsibilities**: Staff must follow protocols while using professional judgement; management ensures accessibility and review. - **General Approach**: Prompt assessment (history, observations) for acute gynaecological conditions (e.g., pelvic pain, abnormal bleeding, hyperemesis). Refer to registrar if needed. - **Early Pregnancy (<14 weeks)**: Structured assessment/referral; ectopic pregnancy requires urgent management. - **Clinical Management**: - Ovarian torsion demands surgery within 6 hours. - Stable patients referred to Gynaecology Assessment Unit (GAU); unstable/surgical cases go to CEPOD/emergency pathways. - **Hospital-Specific Protocols**: - **RSCH**: GAU accepts stable patients; emergency surgery via CEPOD. - **PRH**: Transfer unstable/surgical patients to RSCH after stabilization. - **GAU Details**: - 24/7 service with ultrasound and specialist access. - Excludes unstable/immediate surgical cases. - **Other Departments**: Gynaecology patients admitted elsewhere must be reviewed daily and logged on the whiteboard. - **Referral Pathways**: Clear routes for ED/GP referrals; contact details for obstetric/gynaecology teams provided. - **After-Hours Care**: SHO/SPR cover; EPU bookings via GAU after hours. (Word count: 200)\",\n      \"action\": \"added\"\n    }\n  ]\n}",
  "endpoint": "enhanceGuidelineMetadata",
  "timestamp": "2025-06-18T22-21-17",
  "textContent": "AI: DeepSeek (deepseek-chat)\n\nQ: {\n  \"guidelineId\": \"gp005-emergency-gynaecology-admissions-gau-ready-pdf\",\n  \"fieldsProcessed\": [\n    \"humanFriendlyName\",\n    \"organisation\",\n    \"yearProduced\",\n    \"summary\"\n  ],\n  \"enhancedFields\": 4,\n  \"contentLength\": 3325\n}\n\nA: {\n  \"success\": true,\n  \"enhancedFields\": [\n    {\n      \"field\": \"humanFriendlyName\",\n      \"oldValue\": null,\n      \"newValue\": \"Emergency Gynaecology Care and GAU Admission Protocol\",\n      \"action\": \"added\"\n    },\n    {\n      \"field\": \"organisation\",\n      \"oldValue\": null,\n      \"newValue\": \"RCOG\",\n      \"action\": \"added\"\n    },\n    {\n      \"field\": \"yearProduced\",\n      \"oldValue\": null,\n      \"newValue\": \"2020\",\n      \"action\": \"added\"\n    },\n    {\n      \"field\": \"summary\",\n      \"oldValue\": null,\n      \"newValue\": \"**Summary of Emergency Gynaecology Admissions & GAU Protocol GP005, May 2020** - **Key Principles**: Guidelines support but do not replace clinical judgement; senior input is advised. - **Scope**: Applies to all Women’s Directorate staff, including ED clinicians and management. - **Responsibilities**: Staff must follow protocols while using professional judgement; management ensures accessibility and review. - **General Approach**: Prompt assessment (history, observations) for acute gynaecological conditions (e.g., pelvic pain, abnormal bleeding, hyperemesis). Refer to registrar if needed. - **Early Pregnancy (<14 weeks)**: Structured assessment/referral; ectopic pregnancy requires urgent management. - **Clinical Management**: - Ovarian torsion demands surgery within 6 hours. - Stable patients referred to Gynaecology Assessment Unit (GAU); unstable/surgical cases go to CEPOD/emergency pathways. - **Hospital-Specific Protocols**: - **RSCH**: GAU accepts stable patients; emergency surgery via CEPOD. - **PRH**: Transfer unstable/surgical patients to RSCH after stabilization. - **GAU Details**: - 24/7 service with ultrasound and specialist access. - Excludes unstable/immediate surgical cases. - **Other Departments**: Gynaecology patients admitted elsewhere must be reviewed daily and logged on the whiteboard. - **Referral Pathways**: Clear routes for ED/GP referrals; contact details for obstetric/gynaecology teams provided. - **After-Hours Care**: SHO/SPR cover; EPU bookings via GAU after hours. (Word count: 200)\",\n      \"action\": \"added\"\n    }\n  ]\n}",
  "ai_provider": "DeepSeek",
  "ai_model": "deepseek-chat",
  "token_usage": null
}