{
  "prompt": {
    "guidelineId": "cg1109-diabetes-in-pregnancy-guideline-pdf",
    "fieldsProcessed": [
      "humanFriendlyName",
      "organisation",
      "yearProduced",
      "summary"
    ],
    "enhancedFields": 4,
    "contentLength": 3289
  },
  "response": "{\n  \"success\": true,\n  \"enhancedFields\": [\n    {\n      \"field\": \"humanFriendlyName\",\n      \"oldValue\": null,\n      \"newValue\": \"Diabetes in Pregnancy Care Guidelines\",\n      \"action\": \"added\"\n    },\n    {\n      \"field\": \"organisation\",\n      \"oldValue\": null,\n      \"newValue\": \"RCOG\",\n      \"action\": \"added\"\n    },\n    {\n      \"field\": \"yearProduced\",\n      \"oldValue\": null,\n      \"newValue\": \"I cannot find a publication year in the provided text. The guideline does not explicitly mention a 4-digit year. If you have another document or can provide the year within the text, I'd be happy to extract it for you\",\n      \"action\": \"added\"\n    },\n    {\n      \"field\": \"summary\",\n      \"oldValue\": null,\n      \"newValue\": \"**Summary of Diabetes in Pregnancy Guideline:** - **Pre-pregnancy counseling:** Discuss risks, optimize glucose monitoring, review medications, and screen for complications in women with pre-existing diabetes. - **Screening for GDM:** Follow diagnostic criteria; refer to Diabetes Pregnancy Team if diagnosed. After 34 weeks, GTT is rarely useful unless new concerns arise (random glucose ≥7mmol/L warrants discussion). - **Diagnosis without GTT:** Urgent referral if glucose >11.0mmol/L (any time) or fasting ≥5.6mmol/L. - **Management:** For GDM with fasting glucose <7mmol/L, trial diet/exercise first. Insulin adjustment and close monitoring are needed for those on corticosteroids or with hyperemesis. - **Labor/delivery:** Continue insulin; consider VRIII. Postpartum, adjust insulin and monitor glucose. Breastfeeding requires frequent glucose checks. - **Monitoring:** 20-week ultrasound and fetal heart exam; self-monitor blood glucose. - **Emergencies:** Immediate medical attention for diabetic emergencies. - **Vaccination:** Offer COVID-19 vaccination per JCVI guidelines, prioritizing GDM patients. - **Audit:** Regular audits to ensure guideline adherence\",\n      \"action\": \"added\"\n    }\n  ]\n}",
  "endpoint": "enhanceGuidelineMetadata",
  "timestamp": "2025-06-18T18-41-52",
  "textContent": "AI: DeepSeek (deepseek-chat)\n\nQ: {\n  \"guidelineId\": \"cg1109-diabetes-in-pregnancy-guideline-pdf\",\n  \"fieldsProcessed\": [\n    \"humanFriendlyName\",\n    \"organisation\",\n    \"yearProduced\",\n    \"summary\"\n  ],\n  \"enhancedFields\": 4,\n  \"contentLength\": 3289\n}\n\nA: {\n  \"success\": true,\n  \"enhancedFields\": [\n    {\n      \"field\": \"humanFriendlyName\",\n      \"oldValue\": null,\n      \"newValue\": \"Diabetes in Pregnancy Care Guidelines\",\n      \"action\": \"added\"\n    },\n    {\n      \"field\": \"organisation\",\n      \"oldValue\": null,\n      \"newValue\": \"RCOG\",\n      \"action\": \"added\"\n    },\n    {\n      \"field\": \"yearProduced\",\n      \"oldValue\": null,\n      \"newValue\": \"I cannot find a publication year in the provided text. The guideline does not explicitly mention a 4-digit year. If you have another document or can provide the year within the text, I'd be happy to extract it for you\",\n      \"action\": \"added\"\n    },\n    {\n      \"field\": \"summary\",\n      \"oldValue\": null,\n      \"newValue\": \"**Summary of Diabetes in Pregnancy Guideline:** - **Pre-pregnancy counseling:** Discuss risks, optimize glucose monitoring, review medications, and screen for complications in women with pre-existing diabetes. - **Screening for GDM:** Follow diagnostic criteria; refer to Diabetes Pregnancy Team if diagnosed. After 34 weeks, GTT is rarely useful unless new concerns arise (random glucose ≥7mmol/L warrants discussion). - **Diagnosis without GTT:** Urgent referral if glucose >11.0mmol/L (any time) or fasting ≥5.6mmol/L. - **Management:** For GDM with fasting glucose <7mmol/L, trial diet/exercise first. Insulin adjustment and close monitoring are needed for those on corticosteroids or with hyperemesis. - **Labor/delivery:** Continue insulin; consider VRIII. Postpartum, adjust insulin and monitor glucose. Breastfeeding requires frequent glucose checks. - **Monitoring:** 20-week ultrasound and fetal heart exam; self-monitor blood glucose. - **Emergencies:** Immediate medical attention for diabetic emergencies. - **Vaccination:** Offer COVID-19 vaccination per JCVI guidelines, prioritizing GDM patients. - **Audit:** Regular audits to ensure guideline adherence\",\n      \"action\": \"added\"\n    }\n  ]\n}",
  "ai_provider": "DeepSeek",
  "ai_model": "deepseek-chat",
  "token_usage": null
}