{
  "prompt": {
    "guidelineId": "gau-proforma-july-19-pdf",
    "fieldsProcessed": [
      "humanFriendlyName",
      "organisation",
      "yearProduced",
      "summary"
    ],
    "enhancedFields": 4,
    "contentLength": 3806
  },
  "response": "{\n  \"success\": true,\n  \"enhancedFields\": [\n    {\n      \"field\": \"humanFriendlyName\",\n      \"oldValue\": null,\n      \"newValue\": \"Acute Gynaecological Assessment Proforma\",\n      \"action\": \"added\"\n    },\n    {\n      \"field\": \"organisation\",\n      \"oldValue\": null,\n      \"newValue\": \"RCOG\",\n      \"action\": \"added\"\n    },\n    {\n      \"field\": \"yearProduced\",\n      \"oldValue\": null,\n      \"newValue\": \"The provided text does not contain a publication year. If you have another guideline text that includes the publication year, please share it, and I can extract the 4-digit year for you\",\n      \"action\": \"added\"\n    },\n    {\n      \"field\": \"summary\",\n      \"oldValue\": null,\n      \"newValue\": \"**Summary of Acute Gynaecological Proforma Guidelines** **Key Clinical Recommendations:** 1. **History & Examination:** - Document menstrual cycle details, bleeding patterns, sexual history, and pregnancy status. - Assess pain severity, bleeding volume, and ectopic pregnancy risk factors. - Record vital signs, NEWS score, and modified McCormack Score. 2. **Investigations:** - Essential tests: FBC, serum hCG, pelvic ultrasound, urinalysis, and STI swabs (HVS/NAAT). - Additional tests as needed: U&E, LFTs, clotting, CRP, ECG, or CT imaging. 3. **PID Management:** - **Outpatient:** Doxycycline + metronidazole + ceftriaxone (IM stat). Penicillin-allergic: doxycycline + metronidazole. - **Inpatient:** IV ceftriaxone + doxycycline/metronidazole; switch to oral after 48 hours if improving. - **Pregnant patients:** Clarithromycin + metronidazole + ceftriaxone. 4. **Anti-D Prophylaxis:** - Administer if indicated (e.g., bleeding in Rh-negative pregnant patients). Document consent and dose. 5. **Follow-Up & Documentation:** - Provide patient information leaflets. - Record drug administration, fluid prescriptions, and nursing reviews. **Note:** For penicillin allergies or gonorrhoea risk, consult specialist guidelines\",\n      \"action\": \"added\"\n    }\n  ]\n}",
  "endpoint": "enhanceGuidelineMetadata",
  "timestamp": "2025-06-18T22-18-40",
  "textContent": "AI: DeepSeek (deepseek-chat)\n\nQ: {\n  \"guidelineId\": \"gau-proforma-july-19-pdf\",\n  \"fieldsProcessed\": [\n    \"humanFriendlyName\",\n    \"organisation\",\n    \"yearProduced\",\n    \"summary\"\n  ],\n  \"enhancedFields\": 4,\n  \"contentLength\": 3806\n}\n\nA: {\n  \"success\": true,\n  \"enhancedFields\": [\n    {\n      \"field\": \"humanFriendlyName\",\n      \"oldValue\": null,\n      \"newValue\": \"Acute Gynaecological Assessment Proforma\",\n      \"action\": \"added\"\n    },\n    {\n      \"field\": \"organisation\",\n      \"oldValue\": null,\n      \"newValue\": \"RCOG\",\n      \"action\": \"added\"\n    },\n    {\n      \"field\": \"yearProduced\",\n      \"oldValue\": null,\n      \"newValue\": \"The provided text does not contain a publication year. If you have another guideline text that includes the publication year, please share it, and I can extract the 4-digit year for you\",\n      \"action\": \"added\"\n    },\n    {\n      \"field\": \"summary\",\n      \"oldValue\": null,\n      \"newValue\": \"**Summary of Acute Gynaecological Proforma Guidelines** **Key Clinical Recommendations:** 1. **History & Examination:** - Document menstrual cycle details, bleeding patterns, sexual history, and pregnancy status. - Assess pain severity, bleeding volume, and ectopic pregnancy risk factors. - Record vital signs, NEWS score, and modified McCormack Score. 2. **Investigations:** - Essential tests: FBC, serum hCG, pelvic ultrasound, urinalysis, and STI swabs (HVS/NAAT). - Additional tests as needed: U&E, LFTs, clotting, CRP, ECG, or CT imaging. 3. **PID Management:** - **Outpatient:** Doxycycline + metronidazole + ceftriaxone (IM stat). Penicillin-allergic: doxycycline + metronidazole. - **Inpatient:** IV ceftriaxone + doxycycline/metronidazole; switch to oral after 48 hours if improving. - **Pregnant patients:** Clarithromycin + metronidazole + ceftriaxone. 4. **Anti-D Prophylaxis:** - Administer if indicated (e.g., bleeding in Rh-negative pregnant patients). Document consent and dose. 5. **Follow-Up & Documentation:** - Provide patient information leaflets. - Record drug administration, fluid prescriptions, and nursing reviews. **Note:** For penicillin allergies or gonorrhoea risk, consult specialist guidelines\",\n      \"action\": \"added\"\n    }\n  ]\n}",
  "ai_provider": "DeepSeek",
  "ai_model": "deepseek-chat",
  "token_usage": null
}