{
  "prompt": {
    "guidelineId": "mp043-prevention-of-acid-aspiration-pdf",
    "fieldsProcessed": [
      "humanFriendlyName",
      "organisation",
      "yearProduced",
      "summary"
    ],
    "enhancedFields": 4,
    "contentLength": 600
  },
  "response": "{\n  \"success\": true,\n  \"enhancedFields\": [\n    {\n      \"field\": \"humanFriendlyName\",\n      \"oldValue\": null,\n      \"newValue\": \"Preventing Acid Aspiration During Labor and Delivery\",\n      \"action\": \"added\"\n    },\n    {\n      \"field\": \"organisation\",\n      \"oldValue\": null,\n      \"newValue\": \"RSCH\",\n      \"action\": \"added\"\n    },\n    {\n      \"field\": \"yearProduced\",\n      \"oldValue\": null,\n      \"newValue\": \"I don't see a publication year in the provided text. Could you check if it's included in another part of the guideline?\",\n      \"action\": \"added\"\n    },\n    {\n      \"field\": \"summary\",\n      \"oldValue\": null,\n      \"newValue\": \"**Summary of Prevention of Acid Aspiration Syndrome (RSCH PRH only):** - **Risk Factors:** Late pregnancy and labor increase acid aspiration risk. Neuraxial anesthesia is preferred for peri-partum procedures. - **High-Risk Groups:** Specific interventions are advised for high-risk laboring women, elective cesarean sections (CS), and emergency CS. - **Risk Stratification:** Low-risk and high-risk factors for aspiration are defined to guide management. - **Prophylaxis:** Antacid prophylaxis (e.g., sodium citrate) is recommended. - **Oral Medications:** H2-receptor antagonists or proton pump inhibitors may be used. - **Dietary Restrictions:** Clear fluid intake is permitted; solid foods should be avoided in labor. - **Fluid Guidelines:** Maintain hydration with oral fluids or IV therapy as needed. Key focus is on risk assessment, antacid use, and dietary management to reduce aspiration risk during delivery\",\n      \"action\": \"added\"\n    }\n  ]\n}",
  "endpoint": "enhanceGuidelineMetadata",
  "timestamp": "2025-06-18T22-47-01",
  "textContent": "AI: DeepSeek (deepseek-chat)\n\nQ: {\n  \"guidelineId\": \"mp043-prevention-of-acid-aspiration-pdf\",\n  \"fieldsProcessed\": [\n    \"humanFriendlyName\",\n    \"organisation\",\n    \"yearProduced\",\n    \"summary\"\n  ],\n  \"enhancedFields\": 4,\n  \"contentLength\": 600\n}\n\nA: {\n  \"success\": true,\n  \"enhancedFields\": [\n    {\n      \"field\": \"humanFriendlyName\",\n      \"oldValue\": null,\n      \"newValue\": \"Preventing Acid Aspiration During Labor and Delivery\",\n      \"action\": \"added\"\n    },\n    {\n      \"field\": \"organisation\",\n      \"oldValue\": null,\n      \"newValue\": \"RSCH\",\n      \"action\": \"added\"\n    },\n    {\n      \"field\": \"yearProduced\",\n      \"oldValue\": null,\n      \"newValue\": \"I don't see a publication year in the provided text. Could you check if it's included in another part of the guideline?\",\n      \"action\": \"added\"\n    },\n    {\n      \"field\": \"summary\",\n      \"oldValue\": null,\n      \"newValue\": \"**Summary of Prevention of Acid Aspiration Syndrome (RSCH PRH only):** - **Risk Factors:** Late pregnancy and labor increase acid aspiration risk. Neuraxial anesthesia is preferred for peri-partum procedures. - **High-Risk Groups:** Specific interventions are advised for high-risk laboring women, elective cesarean sections (CS), and emergency CS. - **Risk Stratification:** Low-risk and high-risk factors for aspiration are defined to guide management. - **Prophylaxis:** Antacid prophylaxis (e.g., sodium citrate) is recommended. - **Oral Medications:** H2-receptor antagonists or proton pump inhibitors may be used. - **Dietary Restrictions:** Clear fluid intake is permitted; solid foods should be avoided in labor. - **Fluid Guidelines:** Maintain hydration with oral fluids or IV therapy as needed. Key focus is on risk assessment, antacid use, and dietary management to reduce aspiration risk during delivery\",\n      \"action\": \"added\"\n    }\n  ]\n}",
  "ai_provider": "DeepSeek",
  "ai_model": "deepseek-chat",
  "token_usage": null
}