{
  "prompt": {
    "guidelineId": "cg1118-neonatal-hypothermia-pdf",
    "fieldsProcessed": [
      "humanFriendlyName",
      "organisation",
      "yearProduced",
      "summary"
    ],
    "enhancedFields": 4,
    "contentLength": 1134
  },
  "response": "{\n  \"success\": true,\n  \"enhancedFields\": [\n    {\n      \"field\": \"humanFriendlyName\",\n      \"oldValue\": null,\n      \"newValue\": \"Neonatal Hypothermia Detection and Management Guide\",\n      \"action\": \"added\"\n    },\n    {\n      \"field\": \"organisation\",\n      \"oldValue\": null,\n      \"newValue\": \"The text provided does not explicitly mention a specific publishing organization or institution such as NHS, NICE, WHO, RCOG, etc. Therefore, I cannot identify the organization name from the given guideline text. If you have any additional context or another guideline text where the organization is mentioned, please share it, and I'd be happy to assist!\",\n      \"action\": \"added\"\n    },\n    {\n      \"field\": \"yearProduced\",\n      \"oldValue\": null,\n      \"newValue\": \"I cannot determine the publication year from the provided text as it does not contain any explicit date or year information. The guideline text outlines procedures and responsibilities but does not include a publication or revision year. You may need to check the original source or document metadata for the year. Let me know if you have additional details!\",\n      \"action\": \"added\"\n    },\n    {\n      \"field\": \"summary\",\n      \"oldValue\": null,\n      \"newValue\": \"**Summary of Neonatal Hypothermia Guideline:** This guideline provides staff with protocols for detecting and managing neonatal hypothermia. It applies to all caregivers of newborns, emphasizing prevention, monitoring, and timely intervention. **Key Recommendations:** - **Prevention:** Anticipate hypothermia in at-risk infants; maintain a warm environment and encourage skin-to-skin contact. - **At Birth:** Dry the baby immediately, promote skin-to-skin contact, and encourage feeding. - **Low Temperature Management:** Use skin-to-skin contact, continuous monitoring, and a hot cot if needed. - **Hot Cot Use:** Keep it switched on, monitor temperature closely, and gradually reduce heat once stable. - **Ongoing Care:** Discontinue monitoring if temperature stabilizes; prioritize feeding. - **Parental Communication:** Explain procedures and management to parents. - **Audit:** Compliance and outcomes are monitored per the Maternity Audit Document. Staff must follow these steps while applying professional judgment\",\n      \"action\": \"added\"\n    }\n  ]\n}",
  "endpoint": "enhanceGuidelineMetadata",
  "timestamp": "2025-06-18T21-44-31",
  "textContent": "AI: DeepSeek (deepseek-chat)\n\nQ: {\n  \"guidelineId\": \"cg1118-neonatal-hypothermia-pdf\",\n  \"fieldsProcessed\": [\n    \"humanFriendlyName\",\n    \"organisation\",\n    \"yearProduced\",\n    \"summary\"\n  ],\n  \"enhancedFields\": 4,\n  \"contentLength\": 1134\n}\n\nA: {\n  \"success\": true,\n  \"enhancedFields\": [\n    {\n      \"field\": \"humanFriendlyName\",\n      \"oldValue\": null,\n      \"newValue\": \"Neonatal Hypothermia Detection and Management Guide\",\n      \"action\": \"added\"\n    },\n    {\n      \"field\": \"organisation\",\n      \"oldValue\": null,\n      \"newValue\": \"The text provided does not explicitly mention a specific publishing organization or institution such as NHS, NICE, WHO, RCOG, etc. Therefore, I cannot identify the organization name from the given guideline text. If you have any additional context or another guideline text where the organization is mentioned, please share it, and I'd be happy to assist!\",\n      \"action\": \"added\"\n    },\n    {\n      \"field\": \"yearProduced\",\n      \"oldValue\": null,\n      \"newValue\": \"I cannot determine the publication year from the provided text as it does not contain any explicit date or year information. The guideline text outlines procedures and responsibilities but does not include a publication or revision year. You may need to check the original source or document metadata for the year. Let me know if you have additional details!\",\n      \"action\": \"added\"\n    },\n    {\n      \"field\": \"summary\",\n      \"oldValue\": null,\n      \"newValue\": \"**Summary of Neonatal Hypothermia Guideline:** This guideline provides staff with protocols for detecting and managing neonatal hypothermia. It applies to all caregivers of newborns, emphasizing prevention, monitoring, and timely intervention. **Key Recommendations:** - **Prevention:** Anticipate hypothermia in at-risk infants; maintain a warm environment and encourage skin-to-skin contact. - **At Birth:** Dry the baby immediately, promote skin-to-skin contact, and encourage feeding. - **Low Temperature Management:** Use skin-to-skin contact, continuous monitoring, and a hot cot if needed. - **Hot Cot Use:** Keep it switched on, monitor temperature closely, and gradually reduce heat once stable. - **Ongoing Care:** Discontinue monitoring if temperature stabilizes; prioritize feeding. - **Parental Communication:** Explain procedures and management to parents. - **Audit:** Compliance and outcomes are monitored per the Maternity Audit Document. Staff must follow these steps while applying professional judgment\",\n      \"action\": \"added\"\n    }\n  ]\n}",
  "ai_provider": "DeepSeek",
  "ai_model": "deepseek-chat",
  "token_usage": null
}