{
  "prompt": {
    "guidelineId": "appendix-12-assking-sticker-pdf",
    "fieldsProcessed": [
      "humanFriendlyName",
      "organisation",
      "yearProduced",
      "summary"
    ],
    "enhancedFields": 4,
    "contentLength": 862
  },
  "response": "{\n  \"success\": true,\n  \"enhancedFields\": [\n    {\n      \"field\": \"humanFriendlyName\",\n      \"oldValue\": null,\n      \"newValue\": \"Pressure Ulcer Prevention Care Bundle\",\n      \"action\": \"added\"\n    },\n    {\n      \"field\": \"organisation\",\n      \"oldValue\": null,\n      \"newValue\": \"NICE\",\n      \"action\": \"added\"\n    },\n    {\n      \"field\": \"yearProduced\",\n      \"oldValue\": null,\n      \"newValue\": \"I cannot find a publication year in the provided text. The text appears to be a care bundle guideline but does not include a date or year. Could you provide additional context or check if the year is mentioned elsewhere in the document?\",\n      \"action\": \"added\"\n    },\n    {\n      \"field\": \"summary\",\n      \"oldValue\": null,\n      \"newValue\": \"**Summary of aSSKINg CARE BUNDLE Guidelines:** - **Assess Risk:** Use a Purpose T Care Plan (RED) for risk assessment. - **Skin:** Inspect pressure areas/vulnerable skin every 12 hours. - **Surface:** Use static foam or alternating pressure mattresses, pressure redistribution cushions, heel offloading (pillow/Heel Pro Boot), and protective pads. - **Keep Moving:** Reposition every 1-2 hours; use slide sheets for assistance. - **Incontinence:** Cleanse with Senset foam; apply Medi-Honey or Proshield barrier cream. - **Nutrition:** Calculate MUST score, monitor nutrition, refer to dietitians, and provide prevention leaflets. *(Word count: 80)*\",\n      \"action\": \"added\"\n    }\n  ]\n}",
  "endpoint": "enhanceGuidelineMetadata",
  "timestamp": "2025-06-18T18-39-50",
  "textContent": "AI: DeepSeek (deepseek-chat)\n\nQ: {\n  \"guidelineId\": \"appendix-12-assking-sticker-pdf\",\n  \"fieldsProcessed\": [\n    \"humanFriendlyName\",\n    \"organisation\",\n    \"yearProduced\",\n    \"summary\"\n  ],\n  \"enhancedFields\": 4,\n  \"contentLength\": 862\n}\n\nA: {\n  \"success\": true,\n  \"enhancedFields\": [\n    {\n      \"field\": \"humanFriendlyName\",\n      \"oldValue\": null,\n      \"newValue\": \"Pressure Ulcer Prevention Care Bundle\",\n      \"action\": \"added\"\n    },\n    {\n      \"field\": \"organisation\",\n      \"oldValue\": null,\n      \"newValue\": \"NICE\",\n      \"action\": \"added\"\n    },\n    {\n      \"field\": \"yearProduced\",\n      \"oldValue\": null,\n      \"newValue\": \"I cannot find a publication year in the provided text. The text appears to be a care bundle guideline but does not include a date or year. Could you provide additional context or check if the year is mentioned elsewhere in the document?\",\n      \"action\": \"added\"\n    },\n    {\n      \"field\": \"summary\",\n      \"oldValue\": null,\n      \"newValue\": \"**Summary of aSSKINg CARE BUNDLE Guidelines:** - **Assess Risk:** Use a Purpose T Care Plan (RED) for risk assessment. - **Skin:** Inspect pressure areas/vulnerable skin every 12 hours. - **Surface:** Use static foam or alternating pressure mattresses, pressure redistribution cushions, heel offloading (pillow/Heel Pro Boot), and protective pads. - **Keep Moving:** Reposition every 1-2 hours; use slide sheets for assistance. - **Incontinence:** Cleanse with Senset foam; apply Medi-Honey or Proshield barrier cream. - **Nutrition:** Calculate MUST score, monitor nutrition, refer to dietitians, and provide prevention leaflets. *(Word count: 80)*\",\n      \"action\": \"added\"\n    }\n  ]\n}",
  "ai_provider": "DeepSeek",
  "ai_model": "deepseek-chat",
  "token_usage": null
}