{
  "prompt": {
    "prompt": "Original Transcript:\nSITUATION: 28-year-old G1P0 at 26+2 weeks gestation with newly diagnosed gestational diabetes mellitus requiring management plan\n\nBACKGROUND: Miss Chen presented for routine 26-week antenatal appointment. She had been feeling well with no specific symptoms but mentioned increased thirst and frequent urination over the past 3 weeks, which she attributed to normal pregnancy changes. OGTT was performed due to risk factors including BMI 32 at booking, family history of type 2 diabetes (both parents), and South Asian ethnicity. She works in an office, has a sedentary lifestyle, and admits to poor dietary habits with frequent takeaways. Previous pregnancy history nil. No known drug allergies. Taking folic acid 5mg daily and pregnancy multivitamins.\n\nASSESSMENT: OGTT results: fasting glucose 5.9 mmol/L (normal <5.6), 2-hour post-load 10.1 mmol/L (normal <7.8). Patient appears well, vital signs stable. Fundal height measures 27cm (appropriate for dates). Blood pressure 128/78 mmHg. Urinalysis shows 1+ glucose, no protein, no nitrites. Recent anomaly scan at 20 weeks was normal. Home glucose monitoring initiated showing morning readings 5.8-6.4 mmol/L, post-meal readings 8.2-9.8 mmol/L over past week.\n\nRECOMMENDATION: Urgent diabetes team referral arranged for next week. Comprehensive dietary counselling provided with written information. Self-monitoring blood glucose recommended QDS (pre-meals and 2 hours post-meals). Growth and liquor scans arranged for every 4 weeks. Target glucose levels discussed: fasting <5.3 mmol/L, 2-hour post-meal <6.4 mmol/L. If dietary control inadequate after 2 weeks trial, metformin +/- insulin will be considered. Antenatal care intensified with 2-weekly visits. Delivery planning discussed - aim for vaginal delivery at 38-40 weeks if well controlled.\n\nGuideline Analysis:\n### CG1109 Diabetes in Pregnancy guideline\n\nSince the guideline content is not available (as indicated by \"No content available\"), I cannot provide specific recommendations tied to guideline references. However, based on standard clinical practice for gestational diabetes mellitus (GDM) management, I can suggest general improvements to the clinical note:\n\n### Very Important Recommendations\n1. [Additional information needed] - Document detailed dietary assessment including current carbohydrate intake and typical meal patterns\nReason: Essential for tailoring dietary advice and identifying specific areas for improvement in nutritional management\n\n2. [Different management plan] - Consider immediate referral to diabetes education program rather than waiting for diabetes team referral next week\nReason: Early intensive education improves glycemic control outcomes in GDM\n\n### Somewhat Important Recommendations\n1. [Additional information needed] - Include assessment for symptoms of hyperglycemia (polyuria, polydipsia) severity and impact on daily life\nReason: Helps evaluate degree of glycemic control needed and patient awareness\n\n2. [Improved patient advice] - Provide specific written instructions on recognizing and managing hypoglycemia\nReason: Important safety information if pharmacological therapy is initiated later\n\n### Less Important Recommendations\n1. [Additional information needed] - Document discussion about fetal movement monitoring\nReason: Although not urgent, important for ongoing fetal wellbeing assessment\n\n2. [Improved patient advice] - Include information about postpartum diabetes screening\nReason: Early education about long-term implications improves follow-up rates\n\n### Unimportant Recommendations\n1. [Improved patient advice] - Consider providing sample meal plans\nReason: While helpful, this can be addressed during dietary counseling sessions\n\nWithout access to the specific guideline content (cg1109-diabetes-in-pregnancy-guideline-pdf), I cannot directly reference guideline sections or confirm if these recommendations align precisely with their protocol. The note appears generally comprehensive but could benefit from these additions to optimize care.\n\nTo provide more targeted recommendations, I would need:\n1. The actual content of guideline cg1109\n2. Specific sections of the guideline you want the note evaluated against\n3. Any particular aspects of care you want focused on (e.g., monitoring, pharmacotherapy thresholds, delivery timing)\n\n\n## Summary\n\nAnalyzed against the most relevant guideline successfully.\n\n*Note: Found 142 relevant guidelines total, analyzed against the most relevant one.*\n\n\nGuideline: CG1109 Diabetes in Pregnancy guideline\n\n\n\nPlease extract actionable suggestions from this analysis and format them as specified. For each suggestion, include detailed context with relevant quoted text from the guideline to help the user understand the reasoning behind the recommendation.",
    "system_prompt": "You are a medical AI assistant that converts clinical guideline analysis into structured, actionable suggestions. \n\nYour task is to analyze the provided guideline analysis and extract specific, actionable suggestions that can be presented to the user for acceptance, rejection, or modification.\n\nCRITICAL CLINICAL REASONING REQUIREMENTS:\n- You must first understand the specific clinical scenario and current diagnosis from the transcript\n- Carefully assess whether each potential recommendation is APPROPRIATE and INDICATED for this specific case\n- Apply the fundamental principle: \"Will this investigation or intervention change management or improve patient care in this specific scenario?\"\n- Consider the clinical context: is this an acute emergency, established diagnosis, or uncertain diagnostic situation?\n- Distinguish between situations where additional testing is needed vs. where diagnosis is already established\n- Only recommend interventions that would genuinely improve patient care in THIS specific scenario\n\nGENERAL CLINICAL APPROPRIATENESS PRINCIPLES:\n- Do NOT suggest diagnostic investigations when the diagnosis is already established through adequate clinical and/or imaging findings\n- Do NOT recommend interventions that conflict with the current evidence-based management plan\n- Do NOT suggest serial monitoring of biomarkers when the clinical picture and imaging provide sufficient diagnostic certainty\n- Consider whether additional investigations would actually change the management approach\n- Evaluate the timing: is this the appropriate point in the clinical course for this intervention?\n- Apply cost-benefit analysis: does the potential benefit justify the intervention in this specific case?\n\nFor each suggestion you identify, return ONLY a valid JSON object with the following structure:\n{\n  \"suggestions\": [\n    {\n      \"id\": \"1\",\n      \"originalText\": \"text from transcript that needs changing OR description of missing element\",\n      \"suggestedText\": \"proposed replacement text\",\n      \"context\": \"detailed explanation of why this change is suggested, including relevant quoted text from the guideline in quotation marks, and confirmation that this recommendation is appropriate for the specific clinical scenario\",\n      \"category\": \"addition|modification|deletion|formatting\",\n      \"priority\": \"high|medium|low\",\n      \"guidelineReference\": \"specific guideline section or rule\"\n    }\n  ]\n}\n\nCRITICAL FORMATTING REQUIREMENTS:\n- Return ONLY the JSON object - no markdown code blocks, no explanatory text\n- Do not wrap the JSON in ```json or ``` blocks\n- Start your response directly with { and end with }\n- Use sequential numeric IDs starting from \"1\"\n- Ensure all JSON is properly formatted and valid\n\nImportant guidelines for originalText field:\n- For MODIFICATIONS: Use the exact text from the transcript that needs to be changed\n- For ADDITIONS (missing elements): Use descriptive text like \"Missing: cervical length screening documentation\" or \"Gap: no discussion of antenatal corticosteroids\"\n- DO NOT use phrases like \"no additional cervical length screening ordered\" unless those exact words appear in the transcript\n- For missing elements, be clear that you're identifying an absence, not quoting existing text\n\nImportant guidelines for context field:\n- Provide detailed explanations including WHY the change is needed AND why it's appropriate for this specific case\n- Include specific quoted text from the guideline using quotation marks (e.g., \"According to the guideline: 'All women should receive screening for...'\")\n- Reference specific guideline recommendations or requirements\n- Explain the clinical rationale behind the suggestion\n- EXPLICITLY state why this recommendation is indicated in this particular clinical scenario\n- Make the context informative and educational\n\nOther important guidelines:\n- Only suggest changes that are explicitly supported by the guideline analysis AND clinically appropriate for the specific scenario\n- Make suggestions specific and actionable\n- For modifications, ensure original text selections are precise and findable in the transcript\n- Prioritize suggestions based on clinical importance and appropriateness\n- If no clinically appropriate suggestions can be made, return {\"suggestions\": []}\n- When in doubt about appropriateness, err on the side of NOT making the suggestion",
    "transcript_length": 1801,
    "analysis_length": 2646,
    "guideline_id": "cg1109-diabetes-in-pregnancy-guideline-pdf",
    "guideline_title": "CG1109 Diabetes in Pregnancy guideline"
  },
  "response": "{\n  \"suggestions\": [\n    {\n      \"id\": \"1\",\n      \"originalText\": \"Missing: detailed dietary assessment including current carbohydrate intake and typical meal patterns\",\n      \"suggestedText\": \"Document detailed dietary assessment including current carbohydrate intake, typical meal patterns, and specific areas needing improvement\",\n      \"context\": \"Essential for tailoring dietary advice in GDM management. While the guideline content isn't available, standard practice requires detailed nutritional assessment to personalize dietary interventions. This is particularly important given the patient's reported poor dietary habits and sedentary lifestyle.\",\n      \"category\": \"addition\",\n      \"priority\": \"high\",\n      \"guidelineReference\": \"Standard GDM management practice\"\n    },\n    {\n      \"id\": \"2\",\n      \"originalText\": \"Urgent diabetes team referral arranged for next week\",\n      \"suggestedText\": \"Immediate referral to diabetes education program in addition to diabetes team referral\",\n      \"context\": \"Early intensive education improves glycemic control outcomes in GDM. Given the patient's elevated glucose levels (fasting 5.9, post-load 10.1) and home monitoring results showing consistent hyperglycemia, prompt education is warranted to achieve targets faster.\",\n      \"category\": \"modification\",\n      \"priority\": \"high\",\n      \"guidelineReference\": \"Standard GDM management practice\"\n    },\n    {\n      \"id\": \"3\",\n      \"originalText\": \"Missing: assessment for symptoms of hyperglycemia severity and impact\",\n      \"suggestedText\": \"Document detailed assessment of hyperglycemia symptoms including severity, duration, and impact on daily activities\",\n      \"context\": \"Important to evaluate the clinical significance of the patient's reported increased thirst and frequent urination. This helps determine the urgency of intervention and provides baseline for monitoring treatment response.\",\n      \"category\": \"addition\",\n      \"priority\": \"medium\",\n      \"guidelineReference\": \"Standard diabetes assessment practice\"\n    },\n    {\n      \"id\": \"4\",\n      \"originalText\": \"Missing: written instructions on hypoglycemia recognition and management\",\n      \"suggestedText\": \"Provide specific written instructions on recognizing and managing hypoglycemia, especially if pharmacological therapy is initiated\",\n      \"context\": \"Critical safety information given the potential need for metformin/insulin. The patient's current glucose monitoring shows values close to treatment thresholds, making this education timely.\",\n      \"category\": \"addition\",\n      \"priority\": \"medium\",\n      \"guidelineReference\": \"Standard diabetes education protocol\"\n    },\n    {\n      \"id\": \"5\",\n      \"originalText\": \"Missing: discussion about fetal movement monitoring\",\n      \"suggestedText\": \"Document discussion and instructions about fetal movement monitoring\",\n      \"context\": \"Important for ongoing fetal wellbeing assessment in GDM, though not urgent given normal recent anomaly scan and appropriate fundal height. Should be included in comprehensive GDM education.\",\n      \"category\": \"addition\",\n      \"priority\": \"low\",\n      \"guidelineReference\": \"Standard antenatal care practice\"\n    },\n    {\n      \"id\": \"6\",\n      \"originalText\": \"Missing: information about postpartum diabetes screening\",\n      \"suggestedText\": \"Include education about postpartum diabetes screening and long-term diabetes risk\",\n      \"context\": \"Early education improves follow-up rates for critical postpartum glucose testing. Particularly relevant given the patient's multiple risk factors (BMI, family history, ethnicity).\",\n      \"category\": \"addition\",\n      \"priority\": \"low\",\n      \"guidelineReference\": \"Standard GDM follow-up practice\"\n    }\n  ]\n}",
  "endpoint": "dynamicAdvice",
  "timestamp": "2025-06-16T07-26-01",
  "textContent": "AI: DeepSeek (deepseek-chat)\n\nQ: {\n  \"prompt\": \"Original Transcript:\\nSITUATION: 28-year-old G1P0 at 26+2 weeks gestation with newly diagnosed gestational diabetes mellitus requiring management plan\\n\\nBACKGROUND: Miss Chen presented for routine 26-week antenatal appointment. She had been feeling well with no specific symptoms but mentioned increased thirst and frequent urination over the past 3 weeks, which she attributed to normal pregnancy changes. OGTT was performed due to risk factors including BMI 32 at booking, family history of type 2 diabetes (both parents), and South Asian ethnicity. She works in an office, has a sedentary lifestyle, and admits to poor dietary habits with frequent takeaways. Previous pregnancy history nil. No known drug allergies. Taking folic acid 5mg daily and pregnancy multivitamins.\\n\\nASSESSMENT: OGTT results: fasting glucose 5.9 mmol/L (normal <5.6), 2-hour post-load 10.1 mmol/L (normal <7.8). Patient appears well, vital signs stable. Fundal height measures 27cm (appropriate for dates). Blood pressure 128/78 mmHg. Urinalysis shows 1+ glucose, no protein, no nitrites. Recent anomaly scan at 20 weeks was normal. Home glucose monitoring initiated showing morning readings 5.8-6.4 mmol/L, post-meal readings 8.2-9.8 mmol/L over past week.\\n\\nRECOMMENDATION: Urgent diabetes team referral arranged for next week. Comprehensive dietary counselling provided with written information. Self-monitoring blood glucose recommended QDS (pre-meals and 2 hours post-meals). Growth and liquor scans arranged for every 4 weeks. Target glucose levels discussed: fasting <5.3 mmol/L, 2-hour post-meal <6.4 mmol/L. If dietary control inadequate after 2 weeks trial, metformin +/- insulin will be considered. Antenatal care intensified with 2-weekly visits. Delivery planning discussed - aim for vaginal delivery at 38-40 weeks if well controlled.\\n\\nGuideline Analysis:\\n### CG1109 Diabetes in Pregnancy guideline\\n\\nSince the guideline content is not available (as indicated by \\\"No content available\\\"), I cannot provide specific recommendations tied to guideline references. However, based on standard clinical practice for gestational diabetes mellitus (GDM) management, I can suggest general improvements to the clinical note:\\n\\n### Very Important Recommendations\\n1. [Additional information needed] - Document detailed dietary assessment including current carbohydrate intake and typical meal patterns\\nReason: Essential for tailoring dietary advice and identifying specific areas for improvement in nutritional management\\n\\n2. [Different management plan] - Consider immediate referral to diabetes education program rather than waiting for diabetes team referral next week\\nReason: Early intensive education improves glycemic control outcomes in GDM\\n\\n### Somewhat Important Recommendations\\n1. [Additional information needed] - Include assessment for symptoms of hyperglycemia (polyuria, polydipsia) severity and impact on daily life\\nReason: Helps evaluate degree of glycemic control needed and patient awareness\\n\\n2. [Improved patient advice] - Provide specific written instructions on recognizing and managing hypoglycemia\\nReason: Important safety information if pharmacological therapy is initiated later\\n\\n### Less Important Recommendations\\n1. [Additional information needed] - Document discussion about fetal movement monitoring\\nReason: Although not urgent, important for ongoing fetal wellbeing assessment\\n\\n2. [Improved patient advice] - Include information about postpartum diabetes screening\\nReason: Early education about long-term implications improves follow-up rates\\n\\n### Unimportant Recommendations\\n1. [Improved patient advice] - Consider providing sample meal plans\\nReason: While helpful, this can be addressed during dietary counseling sessions\\n\\nWithout access to the specific guideline content (cg1109-diabetes-in-pregnancy-guideline-pdf), I cannot directly reference guideline sections or confirm if these recommendations align precisely with their protocol. The note appears generally comprehensive but could benefit from these additions to optimize care.\\n\\nTo provide more targeted recommendations, I would need:\\n1. The actual content of guideline cg1109\\n2. Specific sections of the guideline you want the note evaluated against\\n3. Any particular aspects of care you want focused on (e.g., monitoring, pharmacotherapy thresholds, delivery timing)\\n\\n\\n## Summary\\n\\nAnalyzed against the most relevant guideline successfully.\\n\\n*Note: Found 142 relevant guidelines total, analyzed against the most relevant one.*\\n\\n\\nGuideline: CG1109 Diabetes in Pregnancy guideline\\n\\n\\n\\nPlease extract actionable suggestions from this analysis and format them as specified. For each suggestion, include detailed context with relevant quoted text from the guideline to help the user understand the reasoning behind the recommendation.\",\n  \"system_prompt\": \"You are a medical AI assistant that converts clinical guideline analysis into structured, actionable suggestions. \\n\\nYour task is to analyze the provided guideline analysis and extract specific, actionable suggestions that can be presented to the user for acceptance, rejection, or modification.\\n\\nCRITICAL CLINICAL REASONING REQUIREMENTS:\\n- You must first understand the specific clinical scenario and current diagnosis from the transcript\\n- Carefully assess whether each potential recommendation is APPROPRIATE and INDICATED for this specific case\\n- Apply the fundamental principle: \\\"Will this investigation or intervention change management or improve patient care in this specific scenario?\\\"\\n- Consider the clinical context: is this an acute emergency, established diagnosis, or uncertain diagnostic situation?\\n- Distinguish between situations where additional testing is needed vs. where diagnosis is already established\\n- Only recommend interventions that would genuinely improve patient care in THIS specific scenario\\n\\nGENERAL CLINICAL APPROPRIATENESS PRINCIPLES:\\n- Do NOT suggest diagnostic investigations when the diagnosis is already established through adequate clinical and/or imaging findings\\n- Do NOT recommend interventions that conflict with the current evidence-based management plan\\n- Do NOT suggest serial monitoring of biomarkers when the clinical picture and imaging provide sufficient diagnostic certainty\\n- Consider whether additional investigations would actually change the management approach\\n- Evaluate the timing: is this the appropriate point in the clinical course for this intervention?\\n- Apply cost-benefit analysis: does the potential benefit justify the intervention in this specific case?\\n\\nFor each suggestion you identify, return ONLY a valid JSON object with the following structure:\\n{\\n  \\\"suggestions\\\": [\\n    {\\n      \\\"id\\\": \\\"1\\\",\\n      \\\"originalText\\\": \\\"text from transcript that needs changing OR description of missing element\\\",\\n      \\\"suggestedText\\\": \\\"proposed replacement text\\\",\\n      \\\"context\\\": \\\"detailed explanation of why this change is suggested, including relevant quoted text from the guideline in quotation marks, and confirmation that this recommendation is appropriate for the specific clinical scenario\\\",\\n      \\\"category\\\": \\\"addition|modification|deletion|formatting\\\",\\n      \\\"priority\\\": \\\"high|medium|low\\\",\\n      \\\"guidelineReference\\\": \\\"specific guideline section or rule\\\"\\n    }\\n  ]\\n}\\n\\nCRITICAL FORMATTING REQUIREMENTS:\\n- Return ONLY the JSON object - no markdown code blocks, no explanatory text\\n- Do not wrap the JSON in ```json or ``` blocks\\n- Start your response directly with { and end with }\\n- Use sequential numeric IDs starting from \\\"1\\\"\\n- Ensure all JSON is properly formatted and valid\\n\\nImportant guidelines for originalText field:\\n- For MODIFICATIONS: Use the exact text from the transcript that needs to be changed\\n- For ADDITIONS (missing elements): Use descriptive text like \\\"Missing: cervical length screening documentation\\\" or \\\"Gap: no discussion of antenatal corticosteroids\\\"\\n- DO NOT use phrases like \\\"no additional cervical length screening ordered\\\" unless those exact words appear in the transcript\\n- For missing elements, be clear that you're identifying an absence, not quoting existing text\\n\\nImportant guidelines for context field:\\n- Provide detailed explanations including WHY the change is needed AND why it's appropriate for this specific case\\n- Include specific quoted text from the guideline using quotation marks (e.g., \\\"According to the guideline: 'All women should receive screening for...'\\\")\\n- Reference specific guideline recommendations or requirements\\n- Explain the clinical rationale behind the suggestion\\n- EXPLICITLY state why this recommendation is indicated in this particular clinical scenario\\n- Make the context informative and educational\\n\\nOther important guidelines:\\n- Only suggest changes that are explicitly supported by the guideline analysis AND clinically appropriate for the specific scenario\\n- Make suggestions specific and actionable\\n- For modifications, ensure original text selections are precise and findable in the transcript\\n- Prioritize suggestions based on clinical importance and appropriateness\\n- If no clinically appropriate suggestions can be made, return {\\\"suggestions\\\": []}\\n- When in doubt about appropriateness, err on the side of NOT making the suggestion\",\n  \"transcript_length\": 1801,\n  \"analysis_length\": 2646,\n  \"guideline_id\": \"cg1109-diabetes-in-pregnancy-guideline-pdf\",\n  \"guideline_title\": \"CG1109 Diabetes in Pregnancy guideline\"\n}\n\nA: {\n  \"suggestions\": [\n    {\n      \"id\": \"1\",\n      \"originalText\": \"Missing: detailed dietary assessment including current carbohydrate intake and typical meal patterns\",\n      \"suggestedText\": \"Document detailed dietary assessment including current carbohydrate intake, typical meal patterns, and specific areas needing improvement\",\n      \"context\": \"Essential for tailoring dietary advice in GDM management. While the guideline content isn't available, standard practice requires detailed nutritional assessment to personalize dietary interventions. This is particularly important given the patient's reported poor dietary habits and sedentary lifestyle.\",\n      \"category\": \"addition\",\n      \"priority\": \"high\",\n      \"guidelineReference\": \"Standard GDM management practice\"\n    },\n    {\n      \"id\": \"2\",\n      \"originalText\": \"Urgent diabetes team referral arranged for next week\",\n      \"suggestedText\": \"Immediate referral to diabetes education program in addition to diabetes team referral\",\n      \"context\": \"Early intensive education improves glycemic control outcomes in GDM. Given the patient's elevated glucose levels (fasting 5.9, post-load 10.1) and home monitoring results showing consistent hyperglycemia, prompt education is warranted to achieve targets faster.\",\n      \"category\": \"modification\",\n      \"priority\": \"high\",\n      \"guidelineReference\": \"Standard GDM management practice\"\n    },\n    {\n      \"id\": \"3\",\n      \"originalText\": \"Missing: assessment for symptoms of hyperglycemia severity and impact\",\n      \"suggestedText\": \"Document detailed assessment of hyperglycemia symptoms including severity, duration, and impact on daily activities\",\n      \"context\": \"Important to evaluate the clinical significance of the patient's reported increased thirst and frequent urination. This helps determine the urgency of intervention and provides baseline for monitoring treatment response.\",\n      \"category\": \"addition\",\n      \"priority\": \"medium\",\n      \"guidelineReference\": \"Standard diabetes assessment practice\"\n    },\n    {\n      \"id\": \"4\",\n      \"originalText\": \"Missing: written instructions on hypoglycemia recognition and management\",\n      \"suggestedText\": \"Provide specific written instructions on recognizing and managing hypoglycemia, especially if pharmacological therapy is initiated\",\n      \"context\": \"Critical safety information given the potential need for metformin/insulin. The patient's current glucose monitoring shows values close to treatment thresholds, making this education timely.\",\n      \"category\": \"addition\",\n      \"priority\": \"medium\",\n      \"guidelineReference\": \"Standard diabetes education protocol\"\n    },\n    {\n      \"id\": \"5\",\n      \"originalText\": \"Missing: discussion about fetal movement monitoring\",\n      \"suggestedText\": \"Document discussion and instructions about fetal movement monitoring\",\n      \"context\": \"Important for ongoing fetal wellbeing assessment in GDM, though not urgent given normal recent anomaly scan and appropriate fundal height. Should be included in comprehensive GDM education.\",\n      \"category\": \"addition\",\n      \"priority\": \"low\",\n      \"guidelineReference\": \"Standard antenatal care practice\"\n    },\n    {\n      \"id\": \"6\",\n      \"originalText\": \"Missing: information about postpartum diabetes screening\",\n      \"suggestedText\": \"Include education about postpartum diabetes screening and long-term diabetes risk\",\n      \"context\": \"Early education improves follow-up rates for critical postpartum glucose testing. Particularly relevant given the patient's multiple risk factors (BMI, family history, ethnicity).\",\n      \"category\": \"addition\",\n      \"priority\": \"low\",\n      \"guidelineReference\": \"Standard GDM follow-up practice\"\n    }\n  ]\n}\n\n--- Token Usage Report ---\nPrompt tokens: 1737\nCompletion tokens: 738\nTotal tokens: 2475\nEstimated cost: $0.001238",
  "ai_provider": "DeepSeek",
  "ai_model": "deepseek-chat",
  "token_usage": {
    "prompt_tokens": 1737,
    "completion_tokens": 738,
    "total_tokens": 2475,
    "estimated_cost_usd": 0.0012375
  }
}