{
  "prompt": {
    "guidelineId": "cg1114-breech-guideline-pdf",
    "fieldsProcessed": [
      "humanFriendlyName",
      "organisation",
      "yearProduced",
      "summary"
    ],
    "enhancedFields": 4,
    "contentLength": 3458
  },
  "response": "{\n  \"success\": true,\n  \"enhancedFields\": [\n    {\n      \"field\": \"humanFriendlyName\",\n      \"oldValue\": null,\n      \"newValue\": \"Breech Management Guideline: ECV and Vaginal Birth\",\n      \"action\": \"added\"\n    },\n    {\n      \"field\": \"organisation\",\n      \"oldValue\": null,\n      \"newValue\": \"RCOG\",\n      \"action\": \"added\"\n    },\n    {\n      \"field\": \"yearProduced\",\n      \"oldValue\": null,\n      \"newValue\": \"2017\",\n      \"action\": \"added\"\n    },\n    {\n      \"field\": \"summary\",\n      \"oldValue\": null,\n      \"newValue\": \"**Summary of Breech Management Guideline v6.0** This guideline provides evidence-based recommendations for managing breech presentation, focusing on **external cephalic version (ECV)** and **vaginal breech birth**. - **ECV** should be offered to pregnant women with confirmed breech presentation after **36 weeks**, unless contraindicated (e.g., placenta previa, fetal compromise). Risks are rare, and prior cesarean is not a contraindication. - Perform ECV in a **labor ward** with facilities for emergency care. Administer **Anti-D** if rhesus negative, document the procedure, and arrange follow-up. - **Vaginal breech birth** is an option if no unfavorable factors (e.g., fetal distress, hyperextended head). Ensure **anterior fetal position** and monitor fetal heart rate. - During delivery, assist by grasping the fetal pelvis, allow the body to hang for head flexion, and use maneuvers if needed (e.g., nuchal arm). - **Complications** (e.g., cord prolapse) require prompt management. **Paired cord blood samples** should be taken post-delivery. - Staff must counsel women on risks, benefits, and alternatives for both ECV and vaginal breech birth. Follow RCOG Green-Top Guideline 20b (2017) standards\",\n      \"action\": \"added\"\n    }\n  ]\n}",
  "endpoint": "enhanceGuidelineMetadata",
  "timestamp": "2025-06-18T21-42-16",
  "textContent": "AI: DeepSeek (deepseek-chat)\n\nQ: {\n  \"guidelineId\": \"cg1114-breech-guideline-pdf\",\n  \"fieldsProcessed\": [\n    \"humanFriendlyName\",\n    \"organisation\",\n    \"yearProduced\",\n    \"summary\"\n  ],\n  \"enhancedFields\": 4,\n  \"contentLength\": 3458\n}\n\nA: {\n  \"success\": true,\n  \"enhancedFields\": [\n    {\n      \"field\": \"humanFriendlyName\",\n      \"oldValue\": null,\n      \"newValue\": \"Breech Management Guideline: ECV and Vaginal Birth\",\n      \"action\": \"added\"\n    },\n    {\n      \"field\": \"organisation\",\n      \"oldValue\": null,\n      \"newValue\": \"RCOG\",\n      \"action\": \"added\"\n    },\n    {\n      \"field\": \"yearProduced\",\n      \"oldValue\": null,\n      \"newValue\": \"2017\",\n      \"action\": \"added\"\n    },\n    {\n      \"field\": \"summary\",\n      \"oldValue\": null,\n      \"newValue\": \"**Summary of Breech Management Guideline v6.0** This guideline provides evidence-based recommendations for managing breech presentation, focusing on **external cephalic version (ECV)** and **vaginal breech birth**. - **ECV** should be offered to pregnant women with confirmed breech presentation after **36 weeks**, unless contraindicated (e.g., placenta previa, fetal compromise). Risks are rare, and prior cesarean is not a contraindication. - Perform ECV in a **labor ward** with facilities for emergency care. Administer **Anti-D** if rhesus negative, document the procedure, and arrange follow-up. - **Vaginal breech birth** is an option if no unfavorable factors (e.g., fetal distress, hyperextended head). Ensure **anterior fetal position** and monitor fetal heart rate. - During delivery, assist by grasping the fetal pelvis, allow the body to hang for head flexion, and use maneuvers if needed (e.g., nuchal arm). - **Complications** (e.g., cord prolapse) require prompt management. **Paired cord blood samples** should be taken post-delivery. - Staff must counsel women on risks, benefits, and alternatives for both ECV and vaginal breech birth. Follow RCOG Green-Top Guideline 20b (2017) standards\",\n      \"action\": \"added\"\n    }\n  ]\n}",
  "ai_provider": "DeepSeek",
  "ai_model": "deepseek-chat",
  "token_usage": null
}