{
  "prompt": {
    "guidelineId": "gp001-management-of-miscarriage-pdf",
    "fieldsProcessed": [
      "humanFriendlyName",
      "organisation",
      "yearProduced",
      "summary"
    ],
    "enhancedFields": 4,
    "contentLength": 4579
  },
  "response": "{\n  \"success\": true,\n  \"enhancedFields\": [\n    {\n      \"field\": \"humanFriendlyName\",\n      \"oldValue\": null,\n      \"newValue\": \"Guidelines for Managing Miscarriage\",\n      \"action\": \"added\"\n    },\n    {\n      \"field\": \"organisation\",\n      \"oldValue\": null,\n      \"newValue\": \"Brighton and Sussex University Hospitals NHS Trust\",\n      \"action\": \"added\"\n    },\n    {\n      \"field\": \"yearProduced\",\n      \"oldValue\": null,\n      \"newValue\": \"The text provided does not contain a publication year. If you have another guideline text that includes the year, please share it, and I can extract the 4-digit year for you\",\n      \"action\": \"added\"\n    },\n    {\n      \"field\": \"summary\",\n      \"oldValue\": null,\n      \"newValue\": \"**Summary of Management of Miscarriage Guidelines** - **Scope**: Applies to women with confirmed miscarriage (pregnancy loss before 22 weeks). - **Diagnosis**: Transvaginal ultrasound recommended to confirm pregnancy location and viability. - **Management Options**: - **Conservative**: First-line for early first-trimester miscarriage, with follow-up scans if needed. - **Medical**: Offered if conservative management is unsuitable, with clear patient instructions. - **Surgical**: Requires informed consent and counseling. - **Anti-D Prophylaxis**: Administer to rhesus-negative women undergoing surgical management. - **Follow-up**: Offer post-miscarriage support and appointments. - **Communication**: Use sensitive language when discussing pregnancy loss. - **Documentation**: Complete necessary forms, including handling of pregnancy tissue. - **Support Services**: Provide patient information leaflets, memorial services, and funeral arrangements (optional). Contact details for bereavement support and counseling are included. (Note: Excluded non-clinical details about memorial services and funeral logistics for brevity.)\",\n      \"action\": \"added\"\n    }\n  ]\n}",
  "endpoint": "enhanceGuidelineMetadata",
  "timestamp": "2025-06-18T22-19-30",
  "textContent": "AI: DeepSeek (deepseek-chat)\n\nQ: {\n  \"guidelineId\": \"gp001-management-of-miscarriage-pdf\",\n  \"fieldsProcessed\": [\n    \"humanFriendlyName\",\n    \"organisation\",\n    \"yearProduced\",\n    \"summary\"\n  ],\n  \"enhancedFields\": 4,\n  \"contentLength\": 4579\n}\n\nA: {\n  \"success\": true,\n  \"enhancedFields\": [\n    {\n      \"field\": \"humanFriendlyName\",\n      \"oldValue\": null,\n      \"newValue\": \"Guidelines for Managing Miscarriage\",\n      \"action\": \"added\"\n    },\n    {\n      \"field\": \"organisation\",\n      \"oldValue\": null,\n      \"newValue\": \"Brighton and Sussex University Hospitals NHS Trust\",\n      \"action\": \"added\"\n    },\n    {\n      \"field\": \"yearProduced\",\n      \"oldValue\": null,\n      \"newValue\": \"The text provided does not contain a publication year. If you have another guideline text that includes the year, please share it, and I can extract the 4-digit year for you\",\n      \"action\": \"added\"\n    },\n    {\n      \"field\": \"summary\",\n      \"oldValue\": null,\n      \"newValue\": \"**Summary of Management of Miscarriage Guidelines** - **Scope**: Applies to women with confirmed miscarriage (pregnancy loss before 22 weeks). - **Diagnosis**: Transvaginal ultrasound recommended to confirm pregnancy location and viability. - **Management Options**: - **Conservative**: First-line for early first-trimester miscarriage, with follow-up scans if needed. - **Medical**: Offered if conservative management is unsuitable, with clear patient instructions. - **Surgical**: Requires informed consent and counseling. - **Anti-D Prophylaxis**: Administer to rhesus-negative women undergoing surgical management. - **Follow-up**: Offer post-miscarriage support and appointments. - **Communication**: Use sensitive language when discussing pregnancy loss. - **Documentation**: Complete necessary forms, including handling of pregnancy tissue. - **Support Services**: Provide patient information leaflets, memorial services, and funeral arrangements (optional). Contact details for bereavement support and counseling are included. (Note: Excluded non-clinical details about memorial services and funeral logistics for brevity.)\",\n      \"action\": \"added\"\n    }\n  ]\n}",
  "ai_provider": "DeepSeek",
  "ai_model": "deepseek-chat",
  "token_usage": null
}