{
  "prompt": {
    "guidelineId": "mp022-emergency-maternity-admissions-pdf",
    "fieldsProcessed": [
      "humanFriendlyName",
      "organisation",
      "yearProduced",
      "summary"
    ],
    "enhancedFields": 4,
    "contentLength": 2863
  },
  "response": "{\n  \"success\": true,\n  \"enhancedFields\": [\n    {\n      \"field\": \"humanFriendlyName\",\n      \"oldValue\": null,\n      \"newValue\": \"Emergency Maternity Admission Protocol\",\n      \"action\": \"added\"\n    },\n    {\n      \"field\": \"organisation\",\n      \"oldValue\": null,\n      \"newValue\": \"The text does not explicitly mention a specific publishing organization or institution like NHS, NICE, WHO, RCOG, etc. Therefore, based on the provided information, I cannot identify a specific organization name\",\n      \"action\": \"added\"\n    },\n    {\n      \"field\": \"yearProduced\",\n      \"oldValue\": null,\n      \"newValue\": \"I cannot find a publication year in the provided text. The guideline does not explicitly mention a 4-digit year\",\n      \"action\": \"added\"\n    },\n    {\n      \"field\": \"summary\",\n      \"oldValue\": null,\n      \"newValue\": \"**Summary of Emergency Maternity Admissions Guideline:** - **Scope:** Applies to all pregnant or postnatal individuals. - **Responsibilities:** Midwives/obstetricians must follow the protocol; management ensures regular reviews. - **A&E Presentation:** Pregnant/postnatal women should be promptly assessed as high risk. Acutely ill cases require early emergency/maternity team involvement. - **Obstetric Problems:** - <14 weeks: A&E assessment + EPU referral. - ≥24 weeks: Urgent A&E review + obstetric registrar referral. - **Postnatal Problems:** Under midwife care → DAU/Triage; others → GAU/A&E. - **Ectopic Pregnancy:** Must be excluded in women of childbearing age with unexplained abdominal pain. - **Non-Obstetric Problems:** Stabilize first, then involve obstetric team. - **Perimortem Caesarean:** Part of resuscitation for arrests in late pregnancy. - **Ambulance Services:** Direct high-risk cases to labor ward. - **Other Admissions:** Medical admissions require obstetric team discussion. - **Compliance:** Monitored via Trust auditing processes. (Word count: 150)\",\n      \"action\": \"added\"\n    }\n  ]\n}",
  "endpoint": "enhanceGuidelineMetadata",
  "timestamp": "2025-06-18T22-38-19",
  "textContent": "AI: DeepSeek (deepseek-chat)\n\nQ: {\n  \"guidelineId\": \"mp022-emergency-maternity-admissions-pdf\",\n  \"fieldsProcessed\": [\n    \"humanFriendlyName\",\n    \"organisation\",\n    \"yearProduced\",\n    \"summary\"\n  ],\n  \"enhancedFields\": 4,\n  \"contentLength\": 2863\n}\n\nA: {\n  \"success\": true,\n  \"enhancedFields\": [\n    {\n      \"field\": \"humanFriendlyName\",\n      \"oldValue\": null,\n      \"newValue\": \"Emergency Maternity Admission Protocol\",\n      \"action\": \"added\"\n    },\n    {\n      \"field\": \"organisation\",\n      \"oldValue\": null,\n      \"newValue\": \"The text does not explicitly mention a specific publishing organization or institution like NHS, NICE, WHO, RCOG, etc. Therefore, based on the provided information, I cannot identify a specific organization name\",\n      \"action\": \"added\"\n    },\n    {\n      \"field\": \"yearProduced\",\n      \"oldValue\": null,\n      \"newValue\": \"I cannot find a publication year in the provided text. The guideline does not explicitly mention a 4-digit year\",\n      \"action\": \"added\"\n    },\n    {\n      \"field\": \"summary\",\n      \"oldValue\": null,\n      \"newValue\": \"**Summary of Emergency Maternity Admissions Guideline:** - **Scope:** Applies to all pregnant or postnatal individuals. - **Responsibilities:** Midwives/obstetricians must follow the protocol; management ensures regular reviews. - **A&E Presentation:** Pregnant/postnatal women should be promptly assessed as high risk. Acutely ill cases require early emergency/maternity team involvement. - **Obstetric Problems:** - <14 weeks: A&E assessment + EPU referral. - ≥24 weeks: Urgent A&E review + obstetric registrar referral. - **Postnatal Problems:** Under midwife care → DAU/Triage; others → GAU/A&E. - **Ectopic Pregnancy:** Must be excluded in women of childbearing age with unexplained abdominal pain. - **Non-Obstetric Problems:** Stabilize first, then involve obstetric team. - **Perimortem Caesarean:** Part of resuscitation for arrests in late pregnancy. - **Ambulance Services:** Direct high-risk cases to labor ward. - **Other Admissions:** Medical admissions require obstetric team discussion. - **Compliance:** Monitored via Trust auditing processes. (Word count: 150)\",\n      \"action\": \"added\"\n    }\n  ]\n}",
  "ai_provider": "DeepSeek",
  "ai_model": "deepseek-chat",
  "token_usage": null
}