{
  "prompt": {
    "guidelineId": "cg11103-recovery-post-regional-and-ga-anaesthesia-pdf",
    "fieldsProcessed": [
      "humanFriendlyName",
      "organisation",
      "yearProduced",
      "summary"
    ],
    "enhancedFields": 4,
    "contentLength": 2204
  },
  "response": "{\n  \"success\": true,\n  \"enhancedFields\": [\n    {\n      \"field\": \"humanFriendlyName\",\n      \"oldValue\": null,\n      \"newValue\": \"Recovery After Anaesthesia for Maternity Procedures\",\n      \"action\": \"added\"\n    },\n    {\n      \"field\": \"organisation\",\n      \"oldValue\": null,\n      \"newValue\": \"The text does not explicitly mention a publishing organization or institution like NHS, NICE, WHO, RCOG, etc. Therefore, I cannot identify a specific organization name from the provided guideline text\",\n      \"action\": \"added\"\n    },\n    {\n      \"field\": \"yearProduced\",\n      \"oldValue\": null,\n      \"newValue\": \"There is no publication year mentioned in the provided text. If you have the full guideline document, please check the title page, footer, or references section for the publication year\",\n      \"action\": \"added\"\n    },\n    {\n      \"field\": \"summary\",\n      \"oldValue\": null,\n      \"newValue\": \"**Summary of Recovery Following Regional and General Anaesthesia Guideline (Maternity)** This guideline provides evidence-based recommendations for post-anaesthetic care after caesarean sections and obstetric procedures. It applies to midwives, obstetricians, anaesthetists, and recovery staff. **Key Recommendations:** - **Equipment:** Ensure availability of BP monitor, SpO₂ monitor, thermometer, oxygen, suction, and infusion devices. - **Monitoring:** Continuous vital sign monitoring until the woman is stable and conscious, with specific protocols for general/regional anaesthesia. - **Ongoing Care:** Maintain IV patency, administer medications, and avoid leaving the woman unattended. - **Discharge Criteria:** Consciousness, clear airway, stable cardiovascular status, adequate analgesia, and removal of pressure dressings. - **Postnatal Care:** Monitor temperature, pulse, BP; support breastfeeding and baby care. Refer anaesthetic complications to an obstetric anaesthetist. - **Training/Audit:** Ensure staff training via Maternity Training Needs Analysis. Audit vital signs and MEOWS chart documentation. Care continues until handover to the midwife is complete\",\n      \"action\": \"added\"\n    }\n  ]\n}",
  "endpoint": "enhanceGuidelineMetadata",
  "timestamp": "2025-06-18T18-41-43",
  "textContent": "AI: DeepSeek (deepseek-chat)\n\nQ: {\n  \"guidelineId\": \"cg11103-recovery-post-regional-and-ga-anaesthesia-pdf\",\n  \"fieldsProcessed\": [\n    \"humanFriendlyName\",\n    \"organisation\",\n    \"yearProduced\",\n    \"summary\"\n  ],\n  \"enhancedFields\": 4,\n  \"contentLength\": 2204\n}\n\nA: {\n  \"success\": true,\n  \"enhancedFields\": [\n    {\n      \"field\": \"humanFriendlyName\",\n      \"oldValue\": null,\n      \"newValue\": \"Recovery After Anaesthesia for Maternity Procedures\",\n      \"action\": \"added\"\n    },\n    {\n      \"field\": \"organisation\",\n      \"oldValue\": null,\n      \"newValue\": \"The text does not explicitly mention a publishing organization or institution like NHS, NICE, WHO, RCOG, etc. Therefore, I cannot identify a specific organization name from the provided guideline text\",\n      \"action\": \"added\"\n    },\n    {\n      \"field\": \"yearProduced\",\n      \"oldValue\": null,\n      \"newValue\": \"There is no publication year mentioned in the provided text. If you have the full guideline document, please check the title page, footer, or references section for the publication year\",\n      \"action\": \"added\"\n    },\n    {\n      \"field\": \"summary\",\n      \"oldValue\": null,\n      \"newValue\": \"**Summary of Recovery Following Regional and General Anaesthesia Guideline (Maternity)** This guideline provides evidence-based recommendations for post-anaesthetic care after caesarean sections and obstetric procedures. It applies to midwives, obstetricians, anaesthetists, and recovery staff. **Key Recommendations:** - **Equipment:** Ensure availability of BP monitor, SpO₂ monitor, thermometer, oxygen, suction, and infusion devices. - **Monitoring:** Continuous vital sign monitoring until the woman is stable and conscious, with specific protocols for general/regional anaesthesia. - **Ongoing Care:** Maintain IV patency, administer medications, and avoid leaving the woman unattended. - **Discharge Criteria:** Consciousness, clear airway, stable cardiovascular status, adequate analgesia, and removal of pressure dressings. - **Postnatal Care:** Monitor temperature, pulse, BP; support breastfeeding and baby care. Refer anaesthetic complications to an obstetric anaesthetist. - **Training/Audit:** Ensure staff training via Maternity Training Needs Analysis. Audit vital signs and MEOWS chart documentation. Care continues until handover to the midwife is complete\",\n      \"action\": \"added\"\n    }\n  ]\n}",
  "ai_provider": "DeepSeek",
  "ai_model": "deepseek-chat",
  "token_usage": null
}