{
  "prompt": {
    "guidelineId": "sop001-consultant-ward-round-east-uhs-maternity-pdf",
    "fieldsProcessed": [
      "humanFriendlyName",
      "organisation",
      "yearProduced",
      "summary"
    ],
    "enhancedFields": 4,
    "contentLength": 1401
  },
  "response": "{\n  \"success\": true,\n  \"enhancedFields\": [\n    {\n      \"field\": \"humanFriendlyName\",\n      \"oldValue\": null,\n      \"newValue\": \"Consultant-Led Ward Rounds and Department Presence Guidelines\",\n      \"action\": \"added\"\n    },\n    {\n      \"field\": \"organisation\",\n      \"oldValue\": null,\n      \"newValue\": \"RCOG\",\n      \"action\": \"added\"\n    },\n    {\n      \"field\": \"yearProduced\",\n      \"oldValue\": null,\n      \"newValue\": \"I cannot find a publication year in the provided text. The guideline does not explicitly mention a 4-digit year\",\n      \"action\": \"added\"\n    },\n    {\n      \"field\": \"summary\",\n      \"oldValue\": null,\n      \"newValue\": \"**Summary:** This SOP outlines the role of consultants in obstetric and gynaecology ward rounds to ensure patient safety and quality care. Consultants must lead or support twice-daily ward rounds, adhering to set timings, and review acute obstetric admissions within 14 hours. Daily gynaecology ward rounds are mandatory. Consultants should maintain professional behavior and be present on the labor ward as specified, with clear escalation protocols for clinical scenarios. Responsibilities for compliance lie with the chief of service, obstetric lead, and clinical director. The SOP aligns with RCOG standards and Ockenden Immediate Essential Actions\",\n      \"action\": \"added\"\n    }\n  ]\n}",
  "endpoint": "enhanceGuidelineMetadata",
  "timestamp": "2025-06-18T23-02-51",
  "textContent": "AI: DeepSeek (deepseek-chat)\n\nQ: {\n  \"guidelineId\": \"sop001-consultant-ward-round-east-uhs-maternity-pdf\",\n  \"fieldsProcessed\": [\n    \"humanFriendlyName\",\n    \"organisation\",\n    \"yearProduced\",\n    \"summary\"\n  ],\n  \"enhancedFields\": 4,\n  \"contentLength\": 1401\n}\n\nA: {\n  \"success\": true,\n  \"enhancedFields\": [\n    {\n      \"field\": \"humanFriendlyName\",\n      \"oldValue\": null,\n      \"newValue\": \"Consultant-Led Ward Rounds and Department Presence Guidelines\",\n      \"action\": \"added\"\n    },\n    {\n      \"field\": \"organisation\",\n      \"oldValue\": null,\n      \"newValue\": \"RCOG\",\n      \"action\": \"added\"\n    },\n    {\n      \"field\": \"yearProduced\",\n      \"oldValue\": null,\n      \"newValue\": \"I cannot find a publication year in the provided text. The guideline does not explicitly mention a 4-digit year\",\n      \"action\": \"added\"\n    },\n    {\n      \"field\": \"summary\",\n      \"oldValue\": null,\n      \"newValue\": \"**Summary:** This SOP outlines the role of consultants in obstetric and gynaecology ward rounds to ensure patient safety and quality care. Consultants must lead or support twice-daily ward rounds, adhering to set timings, and review acute obstetric admissions within 14 hours. Daily gynaecology ward rounds are mandatory. Consultants should maintain professional behavior and be present on the labor ward as specified, with clear escalation protocols for clinical scenarios. Responsibilities for compliance lie with the chief of service, obstetric lead, and clinical director. The SOP aligns with RCOG standards and Ockenden Immediate Essential Actions\",\n      \"action\": \"added\"\n    }\n  ]\n}",
  "ai_provider": "DeepSeek",
  "ai_model": "deepseek-chat",
  "token_usage": null
}