{
  "prompt": {
    "guidelineId": "cg14021-birth-centre-guideline-pdf",
    "fieldsProcessed": [
      "humanFriendlyName",
      "organisation",
      "yearProduced",
      "summary"
    ],
    "enhancedFields": 4,
    "contentLength": 1603
  },
  "response": "{\n  \"success\": true,\n  \"enhancedFields\": [\n    {\n      \"field\": \"humanFriendlyName\",\n      \"oldValue\": null,\n      \"newValue\": \"Birth Centre Care Guidelines for Maternity Staff\",\n      \"action\": \"added\"\n    },\n    {\n      \"field\": \"organisation\",\n      \"oldValue\": null,\n      \"newValue\": \"RCOG\",\n      \"action\": \"added\"\n    },\n    {\n      \"field\": \"yearProduced\",\n      \"oldValue\": null,\n      \"newValue\": \"2023\",\n      \"action\": \"added\"\n    },\n    {\n      \"field\": \"summary\",\n      \"oldValue\": null,\n      \"newValue\": \"**Summary of Birth Centre Guideline** **Purpose**: Guides maternity staff in supporting women choosing the Birth Centre for delivery. **Admission Criteria**: - Low-risk women are eligible; high-risk factors (e.g., preterm birth, fetal growth restriction, abnormal fetal heart rate, reduced fetal movements, meconium, major fetal anomalies) require exclusion. - Previous uterine surgery (myomectomy, hysterotomy) or abnormalities may contraindicate Birth Centre use. **Indications for Transfer to Central Labour Suite**: - Obstetric emergencies (e.g., retained placenta requiring manual removal). - Fetal complications (e.g., abnormal Dopplers, anhydramnios, oligohydramnios, polyhydramnios). **Emergency Transfer Process**: Outlines immediate care and transfer steps if complications arise. **Postnatal Transfer**: Low-risk women may remain on the Birth Centre post-delivery. **Monitoring**: Follows NICE intrapartum care standards for audit. **Key Documents**: Linked to antenatal care, risk assessment, homebirth, and labour care guidelines. *(Approved: 19th July 2023)*\",\n      \"action\": \"added\"\n    }\n  ]\n}",
  "endpoint": "enhanceGuidelineMetadata",
  "timestamp": "2025-06-18T22-09-29",
  "textContent": "AI: DeepSeek (deepseek-chat)\n\nQ: {\n  \"guidelineId\": \"cg14021-birth-centre-guideline-pdf\",\n  \"fieldsProcessed\": [\n    \"humanFriendlyName\",\n    \"organisation\",\n    \"yearProduced\",\n    \"summary\"\n  ],\n  \"enhancedFields\": 4,\n  \"contentLength\": 1603\n}\n\nA: {\n  \"success\": true,\n  \"enhancedFields\": [\n    {\n      \"field\": \"humanFriendlyName\",\n      \"oldValue\": null,\n      \"newValue\": \"Birth Centre Care Guidelines for Maternity Staff\",\n      \"action\": \"added\"\n    },\n    {\n      \"field\": \"organisation\",\n      \"oldValue\": null,\n      \"newValue\": \"RCOG\",\n      \"action\": \"added\"\n    },\n    {\n      \"field\": \"yearProduced\",\n      \"oldValue\": null,\n      \"newValue\": \"2023\",\n      \"action\": \"added\"\n    },\n    {\n      \"field\": \"summary\",\n      \"oldValue\": null,\n      \"newValue\": \"**Summary of Birth Centre Guideline** **Purpose**: Guides maternity staff in supporting women choosing the Birth Centre for delivery. **Admission Criteria**: - Low-risk women are eligible; high-risk factors (e.g., preterm birth, fetal growth restriction, abnormal fetal heart rate, reduced fetal movements, meconium, major fetal anomalies) require exclusion. - Previous uterine surgery (myomectomy, hysterotomy) or abnormalities may contraindicate Birth Centre use. **Indications for Transfer to Central Labour Suite**: - Obstetric emergencies (e.g., retained placenta requiring manual removal). - Fetal complications (e.g., abnormal Dopplers, anhydramnios, oligohydramnios, polyhydramnios). **Emergency Transfer Process**: Outlines immediate care and transfer steps if complications arise. **Postnatal Transfer**: Low-risk women may remain on the Birth Centre post-delivery. **Monitoring**: Follows NICE intrapartum care standards for audit. **Key Documents**: Linked to antenatal care, risk assessment, homebirth, and labour care guidelines. *(Approved: 19th July 2023)*\",\n      \"action\": \"added\"\n    }\n  ]\n}",
  "ai_provider": "DeepSeek",
  "ai_model": "deepseek-chat",
  "token_usage": null
}