{
  "prompt": {
    "guidelineId": "mp011-obesity-in-pregnancy-pdf",
    "fieldsProcessed": [
      "humanFriendlyName",
      "organisation",
      "yearProduced",
      "summary"
    ],
    "enhancedFields": 4,
    "contentLength": 4732
  },
  "response": "{\n  \"success\": true,\n  \"enhancedFields\": [\n    {\n      \"field\": \"humanFriendlyName\",\n      \"oldValue\": null,\n      \"newValue\": \"Obesity in Pregnancy Management Protocol\",\n      \"action\": \"added\"\n    },\n    {\n      \"field\": \"organisation\",\n      \"oldValue\": null,\n      \"newValue\": \"RCOG\",\n      \"action\": \"added\"\n    },\n    {\n      \"field\": \"yearProduced\",\n      \"oldValue\": null,\n      \"newValue\": \"The text does not contain a publication year. If you have another document or can provide the year, I'd be happy to help extract it\",\n      \"action\": \"added\"\n    },\n    {\n      \"field\": \"summary\",\n      \"oldValue\": null,\n      \"newValue\": \"**Summary of Obesity in Pregnancy Maternity Protocol: MP011** This protocol provides guidance for managing obese pregnant women (BMI ≥30), emphasizing risk assessment, multidisciplinary care, and tailored interventions. **Key Recommendations:** - **BMI ≥30:** Counsel on risks, provide thromboprophylaxis, and ensure multidisciplinary care. - **BMI ≥35:** Refer to obstetric care, offer additional scans, and antenatal consultations. - **BMI ≥40:** Include anesthetic management plans, tissue viability assessments, and specialist equipment. - **BMI ≥50:** Refer to an anesthetist and high-risk clinic; consider specialist equipment. **Labor & Birth:** Recommend obstetric unit birth, continuous CTG monitoring, and careful suturing during cesarean. Home birth requires safety discussions and documentation. **Postnatal Care:** Assess VTE risk, support breastfeeding, and continue weight management. **Post-Bariatric Surgery Pregnancy:** - Delay pregnancy for ≥1 year post-surgery; use LARC for contraception. - Monitor nutrition (supplements: folic acid 5mg, B12, vitamin D). - Screen for GDM via blood glucose monitoring (OGTT contraindicated). - Watch for surgical complications (e.g., internal hernia, band slippage). - No evidence for early induction or cesarean preference; encourage breastfeeding. **Specialist Equipment:** Ensure appropriate beds, BP cuffs, and scales for accurate assessments\",\n      \"action\": \"added\"\n    }\n  ]\n}",
  "endpoint": "enhanceGuidelineMetadata",
  "timestamp": "2025-06-18T22-35-20",
  "textContent": "AI: DeepSeek (deepseek-chat)\n\nQ: {\n  \"guidelineId\": \"mp011-obesity-in-pregnancy-pdf\",\n  \"fieldsProcessed\": [\n    \"humanFriendlyName\",\n    \"organisation\",\n    \"yearProduced\",\n    \"summary\"\n  ],\n  \"enhancedFields\": 4,\n  \"contentLength\": 4732\n}\n\nA: {\n  \"success\": true,\n  \"enhancedFields\": [\n    {\n      \"field\": \"humanFriendlyName\",\n      \"oldValue\": null,\n      \"newValue\": \"Obesity in Pregnancy Management Protocol\",\n      \"action\": \"added\"\n    },\n    {\n      \"field\": \"organisation\",\n      \"oldValue\": null,\n      \"newValue\": \"RCOG\",\n      \"action\": \"added\"\n    },\n    {\n      \"field\": \"yearProduced\",\n      \"oldValue\": null,\n      \"newValue\": \"The text does not contain a publication year. If you have another document or can provide the year, I'd be happy to help extract it\",\n      \"action\": \"added\"\n    },\n    {\n      \"field\": \"summary\",\n      \"oldValue\": null,\n      \"newValue\": \"**Summary of Obesity in Pregnancy Maternity Protocol: MP011** This protocol provides guidance for managing obese pregnant women (BMI ≥30), emphasizing risk assessment, multidisciplinary care, and tailored interventions. **Key Recommendations:** - **BMI ≥30:** Counsel on risks, provide thromboprophylaxis, and ensure multidisciplinary care. - **BMI ≥35:** Refer to obstetric care, offer additional scans, and antenatal consultations. - **BMI ≥40:** Include anesthetic management plans, tissue viability assessments, and specialist equipment. - **BMI ≥50:** Refer to an anesthetist and high-risk clinic; consider specialist equipment. **Labor & Birth:** Recommend obstetric unit birth, continuous CTG monitoring, and careful suturing during cesarean. Home birth requires safety discussions and documentation. **Postnatal Care:** Assess VTE risk, support breastfeeding, and continue weight management. **Post-Bariatric Surgery Pregnancy:** - Delay pregnancy for ≥1 year post-surgery; use LARC for contraception. - Monitor nutrition (supplements: folic acid 5mg, B12, vitamin D). - Screen for GDM via blood glucose monitoring (OGTT contraindicated). - Watch for surgical complications (e.g., internal hernia, band slippage). - No evidence for early induction or cesarean preference; encourage breastfeeding. **Specialist Equipment:** Ensure appropriate beds, BP cuffs, and scales for accurate assessments\",\n      \"action\": \"added\"\n    }\n  ]\n}",
  "ai_provider": "DeepSeek",
  "ai_model": "deepseek-chat",
  "token_usage": null
}