{
  "prompt": {
    "guidelineId": "gp011-referral-criteria-for-outpatient-hysteroscopy-pdf",
    "fieldsProcessed": [
      "humanFriendlyName",
      "organisation",
      "yearProduced",
      "summary"
    ],
    "enhancedFields": 4,
    "contentLength": 1916
  },
  "response": "{\n  \"success\": true,\n  \"enhancedFields\": [\n    {\n      \"field\": \"humanFriendlyName\",\n      \"oldValue\": null,\n      \"newValue\": \"Referral Criteria for Outpatient Hysteroscopy (OPH)\",\n      \"action\": \"added\"\n    },\n    {\n      \"field\": \"organisation\",\n      \"oldValue\": null,\n      \"newValue\": \"RCOG\",\n      \"action\": \"added\"\n    },\n    {\n      \"field\": \"yearProduced\",\n      \"oldValue\": null,\n      \"newValue\": \"The provided text does not contain a publication year. If you have another guideline text that includes the year, please share it, and I can extract the 4-digit year for you\",\n      \"action\": \"added\"\n    },\n    {\n      \"field\": \"summary\",\n      \"oldValue\": null,\n      \"newValue\": \"**Summary of Referral Criteria for Outpatient Hysteroscopy (OPH):** - **Key Principles:** Protocols guide decision-making, but professional judgement applies. - **Responsibilities:** Clinical staff must follow guidelines; management ensures protocol accessibility and review. - **Service Provision:** OPH is offered at PRH with consultants and trained nurses. Written patient information and consent are required. - **Referral Criteria:** Includes abnormal uterine bleeding, endometrial pathology, postmenopausal bleeding, Tamoxifen-related bleeding, fertility issues, and recurrent pregnancy loss. - **Suitability:** All women meeting criteria should be eligible. - **Unsuitability:** Excludes those unwilling, unable to tolerate pelvic exam, pregnant, or with PID/pelvic pathology. - **Referral Process:** - GOPD referrals require consultant approval. - Direct GP/BICS referrals accepted after triage. - **USS Protocol:** Ultrasound results guide triage for further investigation. - **Analgesia:** Adequate pain relief provided during the procedure. - **Clinic & Follow-Up:** Time slots allocated; most patients discharged with a clear plan. - **Communication:** Results sent to referring consultant and GP; histology reports shared promptly\",\n      \"action\": \"added\"\n    }\n  ]\n}",
  "endpoint": "enhanceGuidelineMetadata",
  "timestamp": "2025-06-18T22-23-21",
  "textContent": "AI: DeepSeek (deepseek-chat)\n\nQ: {\n  \"guidelineId\": \"gp011-referral-criteria-for-outpatient-hysteroscopy-pdf\",\n  \"fieldsProcessed\": [\n    \"humanFriendlyName\",\n    \"organisation\",\n    \"yearProduced\",\n    \"summary\"\n  ],\n  \"enhancedFields\": 4,\n  \"contentLength\": 1916\n}\n\nA: {\n  \"success\": true,\n  \"enhancedFields\": [\n    {\n      \"field\": \"humanFriendlyName\",\n      \"oldValue\": null,\n      \"newValue\": \"Referral Criteria for Outpatient Hysteroscopy (OPH)\",\n      \"action\": \"added\"\n    },\n    {\n      \"field\": \"organisation\",\n      \"oldValue\": null,\n      \"newValue\": \"RCOG\",\n      \"action\": \"added\"\n    },\n    {\n      \"field\": \"yearProduced\",\n      \"oldValue\": null,\n      \"newValue\": \"The provided text does not contain a publication year. If you have another guideline text that includes the year, please share it, and I can extract the 4-digit year for you\",\n      \"action\": \"added\"\n    },\n    {\n      \"field\": \"summary\",\n      \"oldValue\": null,\n      \"newValue\": \"**Summary of Referral Criteria for Outpatient Hysteroscopy (OPH):** - **Key Principles:** Protocols guide decision-making, but professional judgement applies. - **Responsibilities:** Clinical staff must follow guidelines; management ensures protocol accessibility and review. - **Service Provision:** OPH is offered at PRH with consultants and trained nurses. Written patient information and consent are required. - **Referral Criteria:** Includes abnormal uterine bleeding, endometrial pathology, postmenopausal bleeding, Tamoxifen-related bleeding, fertility issues, and recurrent pregnancy loss. - **Suitability:** All women meeting criteria should be eligible. - **Unsuitability:** Excludes those unwilling, unable to tolerate pelvic exam, pregnant, or with PID/pelvic pathology. - **Referral Process:** - GOPD referrals require consultant approval. - Direct GP/BICS referrals accepted after triage. - **USS Protocol:** Ultrasound results guide triage for further investigation. - **Analgesia:** Adequate pain relief provided during the procedure. - **Clinic & Follow-Up:** Time slots allocated; most patients discharged with a clear plan. - **Communication:** Results sent to referring consultant and GP; histology reports shared promptly\",\n      \"action\": \"added\"\n    }\n  ]\n}",
  "ai_provider": "DeepSeek",
  "ai_model": "deepseek-chat",
  "token_usage": null
}