{
  "prompt": {
    "guidelineId": "cg1122-maternal-transfer-onsite-handover-of-care-pdf",
    "fieldsProcessed": [
      "humanFriendlyName",
      "organisation",
      "yearProduced",
      "summary"
    ],
    "enhancedFields": 4,
    "contentLength": 1792
  },
  "response": "{\n  \"success\": true,\n  \"enhancedFields\": [\n    {\n      \"field\": \"humanFriendlyName\",\n      \"oldValue\": null,\n      \"newValue\": \"Maternal Transfer and Onsite Handover of Care Guideline\",\n      \"action\": \"added\"\n    },\n    {\n      \"field\": \"organisation\",\n      \"oldValue\": null,\n      \"newValue\": \"NHS\",\n      \"action\": \"added\"\n    },\n    {\n      \"field\": \"yearProduced\",\n      \"oldValue\": null,\n      \"newValue\": \"The text provided does not contain a publication year. If you have another guideline text that includes the year, please share it, and I can extract the 4-digit year for you\",\n      \"action\": \"added\"\n    },\n    {\n      \"field\": \"summary\",\n      \"oldValue\": null,\n      \"newValue\": \"**Summary of Maternal Transfer and Onsite Handover of Care Guideline:** This guideline ensures safe maternal transfers during antenatal, intrapartum, and postnatal periods, covering intra-hospital, home-to-hospital, and inter-hospital transfers. Key recommendations include: - **Multidisciplinary coordination** with clear documentation and informed consent. - **Structured handovers** using SBAR for verbal and written communication. - **Defined roles** for midwives, obstetricians, and management. - **Specific transfer protocols** for in utero, ITU/HDU, postnatal, and neonatal readmissions. - **Health visitor handover** post-booking and delivery, including discharge forms and postnatal concerns. - **Mandatory completion** of the Maternity SBAR Transfer Form during shift changes and ward transitions. - **Audit processes** for hospital, community, and critical care transfers. - **Emergency contacts** provided for antenatal clinic, community midwives, labour ward, and safeguarding. Emphasis is placed on clear communication, consent, and timely documentation to ensure patient safety\",\n      \"action\": \"added\"\n    }\n  ]\n}",
  "endpoint": "enhanceGuidelineMetadata",
  "timestamp": "2025-06-18T21-47-26",
  "textContent": "AI: DeepSeek (deepseek-chat)\n\nQ: {\n  \"guidelineId\": \"cg1122-maternal-transfer-onsite-handover-of-care-pdf\",\n  \"fieldsProcessed\": [\n    \"humanFriendlyName\",\n    \"organisation\",\n    \"yearProduced\",\n    \"summary\"\n  ],\n  \"enhancedFields\": 4,\n  \"contentLength\": 1792\n}\n\nA: {\n  \"success\": true,\n  \"enhancedFields\": [\n    {\n      \"field\": \"humanFriendlyName\",\n      \"oldValue\": null,\n      \"newValue\": \"Maternal Transfer and Onsite Handover of Care Guideline\",\n      \"action\": \"added\"\n    },\n    {\n      \"field\": \"organisation\",\n      \"oldValue\": null,\n      \"newValue\": \"NHS\",\n      \"action\": \"added\"\n    },\n    {\n      \"field\": \"yearProduced\",\n      \"oldValue\": null,\n      \"newValue\": \"The text provided does not contain a publication year. If you have another guideline text that includes the year, please share it, and I can extract the 4-digit year for you\",\n      \"action\": \"added\"\n    },\n    {\n      \"field\": \"summary\",\n      \"oldValue\": null,\n      \"newValue\": \"**Summary of Maternal Transfer and Onsite Handover of Care Guideline:** This guideline ensures safe maternal transfers during antenatal, intrapartum, and postnatal periods, covering intra-hospital, home-to-hospital, and inter-hospital transfers. Key recommendations include: - **Multidisciplinary coordination** with clear documentation and informed consent. - **Structured handovers** using SBAR for verbal and written communication. - **Defined roles** for midwives, obstetricians, and management. - **Specific transfer protocols** for in utero, ITU/HDU, postnatal, and neonatal readmissions. - **Health visitor handover** post-booking and delivery, including discharge forms and postnatal concerns. - **Mandatory completion** of the Maternity SBAR Transfer Form during shift changes and ward transitions. - **Audit processes** for hospital, community, and critical care transfers. - **Emergency contacts** provided for antenatal clinic, community midwives, labour ward, and safeguarding. Emphasis is placed on clear communication, consent, and timely documentation to ensure patient safety\",\n      \"action\": \"added\"\n    }\n  ]\n}",
  "ai_provider": "DeepSeek",
  "ai_model": "deepseek-chat",
  "token_usage": null
}