{
  "prompt": {
    "guidelineId": "gp021-the-management-of-foreign-body-in-female-genital-tract-rsch-prh-pdf",
    "fieldsProcessed": [
      "humanFriendlyName",
      "organisation",
      "yearProduced",
      "summary"
    ],
    "enhancedFields": 4,
    "contentLength": 1510
  },
  "response": "{\n  \"success\": true,\n  \"enhancedFields\": [\n    {\n      \"field\": \"humanFriendlyName\",\n      \"oldValue\": null,\n      \"newValue\": \"Guideline for Managing Foreign Bodies in the Female Genital Tract\",\n      \"action\": \"added\"\n    },\n    {\n      \"field\": \"organisation\",\n      \"oldValue\": null,\n      \"newValue\": \"RCOG\",\n      \"action\": \"added\"\n    },\n    {\n      \"field\": \"yearProduced\",\n      \"oldValue\": null,\n      \"newValue\": \"The text provided does not contain a publication year. If you have another guideline text that includes the year, please share it, and I can extract the 4-digit year for you\",\n      \"action\": \"added\"\n    },\n    {\n      \"field\": \"summary\",\n      \"oldValue\": null,\n      \"newValue\": \"**Summary:** This guideline outlines the management of suspected foreign bodies in the female genital tract. Key recommendations include: - **Referral:** Urgent cases require immediate referral; less urgent cases can be assessed during daytime. - **Assessment:** Conduct a thorough history and examination to determine the foreign body’s nature and duration. Investigations may be needed for infection or complications. - **Treatment:** Prioritize urgent removal for sharp objects or severe bleeding. Tailor treatment to symptom severity. - **After Care:** Discharge same-day if appropriate; provide mental health support for habitual insertion cases. - **Causes:** Foreign bodies may result from accidents, self-insertion, sexual abuse, or mental health issues. - **Compliance:** Regular audits will ensure adherence to the protocol. Nurses and gynaecologists must follow this guidance, and management must ensure accessibility and regular reviews. Professional judgement applies in protocol implementation\",\n      \"action\": \"added\"\n    }\n  ]\n}",
  "endpoint": "enhanceGuidelineMetadata",
  "timestamp": "2025-06-18T22-27-21",
  "textContent": "AI: DeepSeek (deepseek-chat)\n\nQ: {\n  \"guidelineId\": \"gp021-the-management-of-foreign-body-in-female-genital-tract-rsch-prh-pdf\",\n  \"fieldsProcessed\": [\n    \"humanFriendlyName\",\n    \"organisation\",\n    \"yearProduced\",\n    \"summary\"\n  ],\n  \"enhancedFields\": 4,\n  \"contentLength\": 1510\n}\n\nA: {\n  \"success\": true,\n  \"enhancedFields\": [\n    {\n      \"field\": \"humanFriendlyName\",\n      \"oldValue\": null,\n      \"newValue\": \"Guideline for Managing Foreign Bodies in the Female Genital Tract\",\n      \"action\": \"added\"\n    },\n    {\n      \"field\": \"organisation\",\n      \"oldValue\": null,\n      \"newValue\": \"RCOG\",\n      \"action\": \"added\"\n    },\n    {\n      \"field\": \"yearProduced\",\n      \"oldValue\": null,\n      \"newValue\": \"The text provided does not contain a publication year. If you have another guideline text that includes the year, please share it, and I can extract the 4-digit year for you\",\n      \"action\": \"added\"\n    },\n    {\n      \"field\": \"summary\",\n      \"oldValue\": null,\n      \"newValue\": \"**Summary:** This guideline outlines the management of suspected foreign bodies in the female genital tract. Key recommendations include: - **Referral:** Urgent cases require immediate referral; less urgent cases can be assessed during daytime. - **Assessment:** Conduct a thorough history and examination to determine the foreign body’s nature and duration. Investigations may be needed for infection or complications. - **Treatment:** Prioritize urgent removal for sharp objects or severe bleeding. Tailor treatment to symptom severity. - **After Care:** Discharge same-day if appropriate; provide mental health support for habitual insertion cases. - **Causes:** Foreign bodies may result from accidents, self-insertion, sexual abuse, or mental health issues. - **Compliance:** Regular audits will ensure adherence to the protocol. Nurses and gynaecologists must follow this guidance, and management must ensure accessibility and regular reviews. Professional judgement applies in protocol implementation\",\n      \"action\": \"added\"\n    }\n  ]\n}",
  "ai_provider": "DeepSeek",
  "ai_model": "deepseek-chat",
  "token_usage": null
}