{
  "prompt": {
    "guidelineId": "uhsx-homebirth-freebirth-guideline-pdf",
    "fieldsProcessed": [
      "humanFriendlyName",
      "organisation",
      "yearProduced",
      "summary"
    ],
    "enhancedFields": 4,
    "contentLength": 8448
  },
  "response": "{\n  \"success\": true,\n  \"enhancedFields\": [\n    {\n      \"field\": \"humanFriendlyName\",\n      \"oldValue\": null,\n      \"newValue\": \"Guidelines for Homebirth and Freebirth Care\",\n      \"action\": \"added\"\n    },\n    {\n      \"field\": \"organisation\",\n      \"oldValue\": null,\n      \"newValue\": \"NMC\",\n      \"action\": \"added\"\n    },\n    {\n      \"field\": \"yearProduced\",\n      \"oldValue\": null,\n      \"newValue\": \"The text does not contain a publication year\",\n      \"action\": \"added\"\n    },\n    {\n      \"field\": \"summary\",\n      \"oldValue\": null,\n      \"newValue\": \"**Summary of Homebirth & Freebirth Clinical Guideline** - **Eligibility**: Homebirth is safe for healthy women with uncomplicated pregnancies. High-risk pregnancies (e.g., pre-existing conditions, previous complications) should deliver in an obstetric unit. - **Informed Choice**: Women opting for homebirth against medical advice must be respected and referred to a consultant midwife for discussion. - **Risk Assessment**: Midwives must conduct ongoing risk assessments, document recommendations, and discuss emergency transfer plans. - **Intrapartum Care**: Requires two midwives, adherence to guidelines, and prompt transfer if complications arise (e.g., fetal distress, hemorrhage, prolonged labor). - **Freebirth**: Respectful communication is essential; safeguarding concerns must be addressed, and referrals made if needed. - **Staffing**: Homebirth services require two midwives; suspension occurs if staffing is unsafe. Geographic and travel safety must be considered. - **Postnatal Care**: Midwives provide immediate postnatal care, arrange newborn checks, and ensure emergency contact availability. - **Documentation**: All interactions, decisions, and transfers must be thoroughly documented. - **Equity & Rights**: Guidelines comply with equality and human rights principles. *Key exclusions for homebirth*: fetal distress, abnormal presentation, meconium-stained liquor, chorioamnionitis, postpartum hemorrhage, or neonatal complications requiring resuscitation\",\n      \"action\": \"added\"\n    }\n  ]\n}",
  "endpoint": "enhanceGuidelineMetadata",
  "timestamp": "2025-06-18T23-09-10",
  "textContent": "AI: DeepSeek (deepseek-chat)\n\nQ: {\n  \"guidelineId\": \"uhsx-homebirth-freebirth-guideline-pdf\",\n  \"fieldsProcessed\": [\n    \"humanFriendlyName\",\n    \"organisation\",\n    \"yearProduced\",\n    \"summary\"\n  ],\n  \"enhancedFields\": 4,\n  \"contentLength\": 8448\n}\n\nA: {\n  \"success\": true,\n  \"enhancedFields\": [\n    {\n      \"field\": \"humanFriendlyName\",\n      \"oldValue\": null,\n      \"newValue\": \"Guidelines for Homebirth and Freebirth Care\",\n      \"action\": \"added\"\n    },\n    {\n      \"field\": \"organisation\",\n      \"oldValue\": null,\n      \"newValue\": \"NMC\",\n      \"action\": \"added\"\n    },\n    {\n      \"field\": \"yearProduced\",\n      \"oldValue\": null,\n      \"newValue\": \"The text does not contain a publication year\",\n      \"action\": \"added\"\n    },\n    {\n      \"field\": \"summary\",\n      \"oldValue\": null,\n      \"newValue\": \"**Summary of Homebirth & Freebirth Clinical Guideline** - **Eligibility**: Homebirth is safe for healthy women with uncomplicated pregnancies. High-risk pregnancies (e.g., pre-existing conditions, previous complications) should deliver in an obstetric unit. - **Informed Choice**: Women opting for homebirth against medical advice must be respected and referred to a consultant midwife for discussion. - **Risk Assessment**: Midwives must conduct ongoing risk assessments, document recommendations, and discuss emergency transfer plans. - **Intrapartum Care**: Requires two midwives, adherence to guidelines, and prompt transfer if complications arise (e.g., fetal distress, hemorrhage, prolonged labor). - **Freebirth**: Respectful communication is essential; safeguarding concerns must be addressed, and referrals made if needed. - **Staffing**: Homebirth services require two midwives; suspension occurs if staffing is unsafe. Geographic and travel safety must be considered. - **Postnatal Care**: Midwives provide immediate postnatal care, arrange newborn checks, and ensure emergency contact availability. - **Documentation**: All interactions, decisions, and transfers must be thoroughly documented. - **Equity & Rights**: Guidelines comply with equality and human rights principles. *Key exclusions for homebirth*: fetal distress, abnormal presentation, meconium-stained liquor, chorioamnionitis, postpartum hemorrhage, or neonatal complications requiring resuscitation\",\n      \"action\": \"added\"\n    }\n  ]\n}",
  "ai_provider": "DeepSeek",
  "ai_model": "deepseek-chat",
  "token_usage": null
}