{
  "prompt": {
    "guidelineId": "cg1151-uterine-rupture-pdf",
    "fieldsProcessed": [
      "humanFriendlyName",
      "organisation",
      "yearProduced",
      "summary"
    ],
    "enhancedFields": 4,
    "contentLength": 2484
  },
  "response": "{\n  \"success\": true,\n  \"enhancedFields\": [\n    {\n      \"field\": \"humanFriendlyName\",\n      \"oldValue\": null,\n      \"newValue\": \"Uterine Rupture: Diagnosis and Management Guidelines\",\n      \"action\": \"added\"\n    },\n    {\n      \"field\": \"organisation\",\n      \"oldValue\": null,\n      \"newValue\": \"RCOG\",\n      \"action\": \"added\"\n    },\n    {\n      \"field\": \"yearProduced\",\n      \"oldValue\": null,\n      \"newValue\": \"The text provided does not contain a publication year. If you have another guideline text that includes the year, please share it, and I can extract the 4-digit year for you\",\n      \"action\": \"added\"\n    },\n    {\n      \"field\": \"summary\",\n      \"oldValue\": null,\n      \"newValue\": \"**Summary of Uterine Rupture Guideline:** Uterine rupture is a rare (2/10,000 pregnancies), life-threatening event requiring urgent intervention. Key risk factors include prior cesarean birth, high parity, and pregnancy complications. **Clinical Signs:** - Prolonged, intense contractions with poor labor progress (<0.5 cm/hr). - Severe, constant abdominal/scar pain, maternal tachycardia, vomiting, or shock. - Sudden \\\"giving way\\\" sensation with cessation of contractions. - Fetal distress (abnormal CTG) or severe compromise. **Management:** 1. **Emergency response:** Call for help, alert theater, notify pediatric team, stabilize ABCs. 2. **Surgery:** Immediate laparotomy to deliver fetus, repair uterus, or perform hysterectomy if needed. 3. **Postoperative care:** Monitor in Recovery/Critical Care, check FBC, involve neonatal/chaplaincy support. **Future Pregnancies:** Advise elective cesarean for women with prior uterine rupture. **Quality Improvement:** Audit cases to improve outcomes. Vigilance, continuous fetal monitoring, and prompt intervention are critical\",\n      \"action\": \"added\"\n    }\n  ]\n}",
  "endpoint": "enhanceGuidelineMetadata",
  "timestamp": "2025-06-18T22-00-59",
  "textContent": "AI: DeepSeek (deepseek-chat)\n\nQ: {\n  \"guidelineId\": \"cg1151-uterine-rupture-pdf\",\n  \"fieldsProcessed\": [\n    \"humanFriendlyName\",\n    \"organisation\",\n    \"yearProduced\",\n    \"summary\"\n  ],\n  \"enhancedFields\": 4,\n  \"contentLength\": 2484\n}\n\nA: {\n  \"success\": true,\n  \"enhancedFields\": [\n    {\n      \"field\": \"humanFriendlyName\",\n      \"oldValue\": null,\n      \"newValue\": \"Uterine Rupture: Diagnosis and Management Guidelines\",\n      \"action\": \"added\"\n    },\n    {\n      \"field\": \"organisation\",\n      \"oldValue\": null,\n      \"newValue\": \"RCOG\",\n      \"action\": \"added\"\n    },\n    {\n      \"field\": \"yearProduced\",\n      \"oldValue\": null,\n      \"newValue\": \"The text provided does not contain a publication year. If you have another guideline text that includes the year, please share it, and I can extract the 4-digit year for you\",\n      \"action\": \"added\"\n    },\n    {\n      \"field\": \"summary\",\n      \"oldValue\": null,\n      \"newValue\": \"**Summary of Uterine Rupture Guideline:** Uterine rupture is a rare (2/10,000 pregnancies), life-threatening event requiring urgent intervention. Key risk factors include prior cesarean birth, high parity, and pregnancy complications. **Clinical Signs:** - Prolonged, intense contractions with poor labor progress (<0.5 cm/hr). - Severe, constant abdominal/scar pain, maternal tachycardia, vomiting, or shock. - Sudden \\\"giving way\\\" sensation with cessation of contractions. - Fetal distress (abnormal CTG) or severe compromise. **Management:** 1. **Emergency response:** Call for help, alert theater, notify pediatric team, stabilize ABCs. 2. **Surgery:** Immediate laparotomy to deliver fetus, repair uterus, or perform hysterectomy if needed. 3. **Postoperative care:** Monitor in Recovery/Critical Care, check FBC, involve neonatal/chaplaincy support. **Future Pregnancies:** Advise elective cesarean for women with prior uterine rupture. **Quality Improvement:** Audit cases to improve outcomes. Vigilance, continuous fetal monitoring, and prompt intervention are critical\",\n      \"action\": \"added\"\n    }\n  ]\n}",
  "ai_provider": "DeepSeek",
  "ai_model": "deepseek-chat",
  "token_usage": null
}