{
  "prompt": {
    "guidelineId": "gp020-urogynaecology-specialist-nurse-led-clinic-1-pdf",
    "fieldsProcessed": [
      "humanFriendlyName",
      "organisation",
      "yearProduced",
      "summary"
    ],
    "enhancedFields": 4,
    "contentLength": 4062
  },
  "response": "{\n  \"success\": true,\n  \"enhancedFields\": [\n    {\n      \"field\": \"humanFriendlyName\",\n      \"oldValue\": null,\n      \"newValue\": \"Urogynaecology Nurse-Led Clinics Protocol\",\n      \"action\": \"added\"\n    },\n    {\n      \"field\": \"organisation\",\n      \"oldValue\": null,\n      \"newValue\": \"RCOG\",\n      \"action\": \"added\"\n    },\n    {\n      \"field\": \"yearProduced\",\n      \"oldValue\": null,\n      \"newValue\": \"The text provided does not contain a publication year. If you have another section or part of the guideline that includes the year, please share it, and I can extract it for you\",\n      \"action\": \"added\"\n    },\n    {\n      \"field\": \"summary\",\n      \"oldValue\": null,\n      \"newValue\": \"**Summary of Urogynaecology Specialist Nurse-Led Clinics GP020:** This guideline outlines standards for Urogynaecology Specialist Nurse-Led Clinics, covering consent, documentation, and care quality. Key clinics include: - **Urinary Incontinence Triage Clinic:** Manages stress incontinence/overactive bladder with counseling and conservative measures. - **Free Flowmetry & Residual Volume Clinic:** Conducts tests to assess bladder function. - **Telephone Follow-Up:** Monitors patients on conservative treatments. - **Pessary Replacement Clinic:** Adjusts pessaries as needed, documenting symptoms. - **Post-Operative Follow-Up:** Assesses surgical outcomes and complications. - **Trial Without Catheter (TWOC):** Patients voiding >100mL with <100mL residual volume are discharged; others require individualized care. - **Refractory Overactive Bladder:** Urodynamic assessment confirms detrusor overactivity; options include Botox or PTNS. - **Painful Bladder Syndrome:** Intravesical instillations may be used. Unusual cases should be discussed with a consultant. Training, audits, and research are emphasized for safe, effective practice. Documentation and confidentiality are mandatory\",\n      \"action\": \"added\"\n    }\n  ]\n}",
  "endpoint": "enhanceGuidelineMetadata",
  "timestamp": "2025-06-18T22-26-55",
  "textContent": "AI: DeepSeek (deepseek-chat)\n\nQ: {\n  \"guidelineId\": \"gp020-urogynaecology-specialist-nurse-led-clinic-1-pdf\",\n  \"fieldsProcessed\": [\n    \"humanFriendlyName\",\n    \"organisation\",\n    \"yearProduced\",\n    \"summary\"\n  ],\n  \"enhancedFields\": 4,\n  \"contentLength\": 4062\n}\n\nA: {\n  \"success\": true,\n  \"enhancedFields\": [\n    {\n      \"field\": \"humanFriendlyName\",\n      \"oldValue\": null,\n      \"newValue\": \"Urogynaecology Nurse-Led Clinics Protocol\",\n      \"action\": \"added\"\n    },\n    {\n      \"field\": \"organisation\",\n      \"oldValue\": null,\n      \"newValue\": \"RCOG\",\n      \"action\": \"added\"\n    },\n    {\n      \"field\": \"yearProduced\",\n      \"oldValue\": null,\n      \"newValue\": \"The text provided does not contain a publication year. If you have another section or part of the guideline that includes the year, please share it, and I can extract it for you\",\n      \"action\": \"added\"\n    },\n    {\n      \"field\": \"summary\",\n      \"oldValue\": null,\n      \"newValue\": \"**Summary of Urogynaecology Specialist Nurse-Led Clinics GP020:** This guideline outlines standards for Urogynaecology Specialist Nurse-Led Clinics, covering consent, documentation, and care quality. Key clinics include: - **Urinary Incontinence Triage Clinic:** Manages stress incontinence/overactive bladder with counseling and conservative measures. - **Free Flowmetry & Residual Volume Clinic:** Conducts tests to assess bladder function. - **Telephone Follow-Up:** Monitors patients on conservative treatments. - **Pessary Replacement Clinic:** Adjusts pessaries as needed, documenting symptoms. - **Post-Operative Follow-Up:** Assesses surgical outcomes and complications. - **Trial Without Catheter (TWOC):** Patients voiding >100mL with <100mL residual volume are discharged; others require individualized care. - **Refractory Overactive Bladder:** Urodynamic assessment confirms detrusor overactivity; options include Botox or PTNS. - **Painful Bladder Syndrome:** Intravesical instillations may be used. Unusual cases should be discussed with a consultant. Training, audits, and research are emphasized for safe, effective practice. Documentation and confidentiality are mandatory\",\n      \"action\": \"added\"\n    }\n  ]\n}",
  "ai_provider": "DeepSeek",
  "ai_model": "deepseek-chat",
  "token_usage": null
}