{
  "prompt": {
    "guidelineId": "cg14009-pcea-epidural-in-labour-guideline-pdf",
    "fieldsProcessed": [
      "humanFriendlyName",
      "organisation",
      "yearProduced",
      "summary"
    ],
    "enhancedFields": 4,
    "contentLength": 3103
  },
  "response": "{\n  \"success\": true,\n  \"enhancedFields\": [\n    {\n      \"field\": \"humanFriendlyName\",\n      \"oldValue\": null,\n      \"newValue\": \"**Guidelines for PCEA Use in Labor: Care and Management**\",\n      \"action\": \"added\"\n    },\n    {\n      \"field\": \"organisation\",\n      \"oldValue\": null,\n      \"newValue\": \"RCOG\",\n      \"action\": \"added\"\n    },\n    {\n      \"field\": \"yearProduced\",\n      \"oldValue\": null,\n      \"newValue\": \"2024\",\n      \"action\": \"added\"\n    },\n    {\n      \"field\": \"summary\",\n      \"oldValue\": null,\n      \"newValue\": \"**Summary of PCEA Guideline for Labor:** - **PCEA Benefits:** Patient-controlled epidural analgesia (PCEA) reduces local anesthetic dose, minimizes motor block, and improves satisfaction. A mandatory hourly epidural bolus may enhance effectiveness. - **Medication:** Prefer dilute levobupivacaine and fentanyl for \\\"mobile epidurals.\\\" - **Care Requirements:** 1:1 midwife care is essential. Avoid supine positioning (use a wedge); mobility is encouraged with support due to potential sensory/motor impairment. - **Monitoring:** Regular maternal/fetal assessment and documentation are critical. Watch for pressure area damage. - **Interventions:** Peanut ball use may shorten labor and reduce cesarean risk. Delay pushing for ≥1 hour after full dilatation. - **Anaesthetist Alert:** Call for analgesia dissatisfaction, sensory loss, weakness, hypotension, severe headache/itching. - **Postpartum:** Remove epidural catheter; monitor for complications (e.g., headache, backache). Refer for postnatal review if symptoms arise. - **Updates (2024):** Added chlorhexidine skin prep, pressure area care, and postnatal surveillance. Yellow band marks last dose/leg raise status. *(Word count: 200)*\",\n      \"action\": \"added\"\n    }\n  ]\n}",
  "endpoint": "enhanceGuidelineMetadata",
  "timestamp": "2025-06-18T22-08-37",
  "textContent": "AI: DeepSeek (deepseek-chat)\n\nQ: {\n  \"guidelineId\": \"cg14009-pcea-epidural-in-labour-guideline-pdf\",\n  \"fieldsProcessed\": [\n    \"humanFriendlyName\",\n    \"organisation\",\n    \"yearProduced\",\n    \"summary\"\n  ],\n  \"enhancedFields\": 4,\n  \"contentLength\": 3103\n}\n\nA: {\n  \"success\": true,\n  \"enhancedFields\": [\n    {\n      \"field\": \"humanFriendlyName\",\n      \"oldValue\": null,\n      \"newValue\": \"**Guidelines for PCEA Use in Labor: Care and Management**\",\n      \"action\": \"added\"\n    },\n    {\n      \"field\": \"organisation\",\n      \"oldValue\": null,\n      \"newValue\": \"RCOG\",\n      \"action\": \"added\"\n    },\n    {\n      \"field\": \"yearProduced\",\n      \"oldValue\": null,\n      \"newValue\": \"2024\",\n      \"action\": \"added\"\n    },\n    {\n      \"field\": \"summary\",\n      \"oldValue\": null,\n      \"newValue\": \"**Summary of PCEA Guideline for Labor:** - **PCEA Benefits:** Patient-controlled epidural analgesia (PCEA) reduces local anesthetic dose, minimizes motor block, and improves satisfaction. A mandatory hourly epidural bolus may enhance effectiveness. - **Medication:** Prefer dilute levobupivacaine and fentanyl for \\\"mobile epidurals.\\\" - **Care Requirements:** 1:1 midwife care is essential. Avoid supine positioning (use a wedge); mobility is encouraged with support due to potential sensory/motor impairment. - **Monitoring:** Regular maternal/fetal assessment and documentation are critical. Watch for pressure area damage. - **Interventions:** Peanut ball use may shorten labor and reduce cesarean risk. Delay pushing for ≥1 hour after full dilatation. - **Anaesthetist Alert:** Call for analgesia dissatisfaction, sensory loss, weakness, hypotension, severe headache/itching. - **Postpartum:** Remove epidural catheter; monitor for complications (e.g., headache, backache). Refer for postnatal review if symptoms arise. - **Updates (2024):** Added chlorhexidine skin prep, pressure area care, and postnatal surveillance. Yellow band marks last dose/leg raise status. *(Word count: 200)*\",\n      \"action\": \"added\"\n    }\n  ]\n}",
  "ai_provider": "DeepSeek",
  "ai_model": "deepseek-chat",
  "token_usage": null
}