{
  "prompt": {
    "guidelineId": "cg1128-neonatal-resuscitation-pdf",
    "fieldsProcessed": [
      "humanFriendlyName",
      "organisation",
      "yearProduced",
      "summary"
    ],
    "enhancedFields": 4,
    "contentLength": 3034
  },
  "response": "{\n  \"success\": true,\n  \"enhancedFields\": [\n    {\n      \"field\": \"humanFriendlyName\",\n      \"oldValue\": null,\n      \"newValue\": \"Neonatal Resuscitation Guidelines and Equipment Standards\",\n      \"action\": \"added\"\n    },\n    {\n      \"field\": \"organisation\",\n      \"oldValue\": null,\n      \"newValue\": \"RCOG\",\n      \"action\": \"added\"\n    },\n    {\n      \"field\": \"yearProduced\",\n      \"oldValue\": null,\n      \"newValue\": \"2023\",\n      \"action\": \"added\"\n    },\n    {\n      \"field\": \"summary\",\n      \"oldValue\": null,\n      \"newValue\": \"**Summary of Neonatal Resuscitation Guideline (CG1128 V6, Jan 2023):** - **Equipment & Personnel**: Ensure trained staff and resuscitation equipment (e.g., laryngoscopes, endotracheal tubes, suction, oxygen) are available and checked pre-delivery. - **Drug Dosing**: Adrenaline (0.2 ml/kg IV/IO), bicarbonate (2–4 ml/kg of 4.2%), glucose 10% (2.5 ml/kg), and 0.9% sodium chloride (10 ml/kg) are recommended, with weight-specific dosing (see table). - **Preterm Infants (<26 weeks)**: Individualized decisions (resuscitate/comfort care) based on gestational age, viability, and parental discussion. - **Airway Management**: ETT size/length varies by weight (e.g., 2.5/5.5 cm for 0.5–0.75 kg). Use correct mask sizes (0–1) and suction (10Fr catheter). - **Resuscitaire Setup**: Verify heater, oxygen supply (>4000 kPa), suction (10 kPa), and equipment (blades, stylets, hats) pre-delivery. - **Flowchart**: Follow Resuscitation Council UK’s Newborn Life Support (NLS 2021) algorithm. *Appendices detail equipment lists, preterm outcomes, and resuscitation steps.*\",\n      \"action\": \"added\"\n    }\n  ]\n}",
  "endpoint": "enhanceGuidelineMetadata",
  "timestamp": "2025-06-18T21-48-54",
  "textContent": "AI: DeepSeek (deepseek-chat)\n\nQ: {\n  \"guidelineId\": \"cg1128-neonatal-resuscitation-pdf\",\n  \"fieldsProcessed\": [\n    \"humanFriendlyName\",\n    \"organisation\",\n    \"yearProduced\",\n    \"summary\"\n  ],\n  \"enhancedFields\": 4,\n  \"contentLength\": 3034\n}\n\nA: {\n  \"success\": true,\n  \"enhancedFields\": [\n    {\n      \"field\": \"humanFriendlyName\",\n      \"oldValue\": null,\n      \"newValue\": \"Neonatal Resuscitation Guidelines and Equipment Standards\",\n      \"action\": \"added\"\n    },\n    {\n      \"field\": \"organisation\",\n      \"oldValue\": null,\n      \"newValue\": \"RCOG\",\n      \"action\": \"added\"\n    },\n    {\n      \"field\": \"yearProduced\",\n      \"oldValue\": null,\n      \"newValue\": \"2023\",\n      \"action\": \"added\"\n    },\n    {\n      \"field\": \"summary\",\n      \"oldValue\": null,\n      \"newValue\": \"**Summary of Neonatal Resuscitation Guideline (CG1128 V6, Jan 2023):** - **Equipment & Personnel**: Ensure trained staff and resuscitation equipment (e.g., laryngoscopes, endotracheal tubes, suction, oxygen) are available and checked pre-delivery. - **Drug Dosing**: Adrenaline (0.2 ml/kg IV/IO), bicarbonate (2–4 ml/kg of 4.2%), glucose 10% (2.5 ml/kg), and 0.9% sodium chloride (10 ml/kg) are recommended, with weight-specific dosing (see table). - **Preterm Infants (<26 weeks)**: Individualized decisions (resuscitate/comfort care) based on gestational age, viability, and parental discussion. - **Airway Management**: ETT size/length varies by weight (e.g., 2.5/5.5 cm for 0.5–0.75 kg). Use correct mask sizes (0–1) and suction (10Fr catheter). - **Resuscitaire Setup**: Verify heater, oxygen supply (>4000 kPa), suction (10 kPa), and equipment (blades, stylets, hats) pre-delivery. - **Flowchart**: Follow Resuscitation Council UK’s Newborn Life Support (NLS 2021) algorithm. *Appendices detail equipment lists, preterm outcomes, and resuscitation steps.*\",\n      \"action\": \"added\"\n    }\n  ]\n}",
  "ai_provider": "DeepSeek",
  "ai_model": "deepseek-chat",
  "token_usage": null
}