{
  "prompt": {
    "guidelineId": "cg18007-newborn-screening-failsafes-pdf",
    "fieldsProcessed": [
      "humanFriendlyName",
      "organisation",
      "yearProduced",
      "summary"
    ],
    "enhancedFields": 4,
    "contentLength": 3182
  },
  "response": "{\n  \"success\": true,\n  \"enhancedFields\": [\n    {\n      \"field\": \"humanFriendlyName\",\n      \"oldValue\": null,\n      \"newValue\": \"Newborn Screening Failsafe Procedures and Guidelines\",\n      \"action\": \"added\"\n    },\n    {\n      \"field\": \"organisation\",\n      \"oldValue\": null,\n      \"newValue\": \"NHS\",\n      \"action\": \"added\"\n    },\n    {\n      \"field\": \"yearProduced\",\n      \"oldValue\": null,\n      \"newValue\": \"I cannot find a publication year in the provided text. The guideline does not explicitly state its publication date\",\n      \"action\": \"added\"\n    },\n    {\n      \"field\": \"summary\",\n      \"oldValue\": null,\n      \"newValue\": \"**Summary of Newborn Screening Failsafes Guideline:** The NHS Newborn Screening Programmes aim to identify serious conditions early in babies up to 6 weeks old. Eligible infants are tracked via NHS numbers or GP registration, with daily checks required for transfers, discharges, and screenings. **Key Failsafe Procedures:** - **NIPE Referral Export:** Run preset S4N searches twice weekly for referrals and update the follow-up spreadsheet. - **Red (Breached) Baby Spreadsheet:** Track NICU babies to ensure timely screening. - **S4H NICU Failsafe:** Investigate missed screens for well/community and NICU babies. - **NHSP Systmone Report:** Verify all babies have screening results; follow up if missing. **Documentation & Follow-Up:** - Record neonatal/child deaths and NICU transfers in databases. - Merge duplicate records and ensure all births are fully documented. - Verify screenings at day 1, 5, and 10 visits; follow up on incomplete tests. - Copy discharge emails to screening administrators and document home births. - Forward repeat bloodspot notifications to Community Team Leads. **Consent:** Parents are offered three screenings (NIPE, NBS, NHSP) with confidential data handling. Consent or declination must be documented. **QA & Contacts:** Perform QA checks and use provided contact details for discrepancies. Updates to guidelines are noted\",\n      \"action\": \"added\"\n    }\n  ]\n}",
  "endpoint": "enhanceGuidelineMetadata",
  "timestamp": "2025-06-18T22-12-40",
  "textContent": "AI: DeepSeek (deepseek-chat)\n\nQ: {\n  \"guidelineId\": \"cg18007-newborn-screening-failsafes-pdf\",\n  \"fieldsProcessed\": [\n    \"humanFriendlyName\",\n    \"organisation\",\n    \"yearProduced\",\n    \"summary\"\n  ],\n  \"enhancedFields\": 4,\n  \"contentLength\": 3182\n}\n\nA: {\n  \"success\": true,\n  \"enhancedFields\": [\n    {\n      \"field\": \"humanFriendlyName\",\n      \"oldValue\": null,\n      \"newValue\": \"Newborn Screening Failsafe Procedures and Guidelines\",\n      \"action\": \"added\"\n    },\n    {\n      \"field\": \"organisation\",\n      \"oldValue\": null,\n      \"newValue\": \"NHS\",\n      \"action\": \"added\"\n    },\n    {\n      \"field\": \"yearProduced\",\n      \"oldValue\": null,\n      \"newValue\": \"I cannot find a publication year in the provided text. The guideline does not explicitly state its publication date\",\n      \"action\": \"added\"\n    },\n    {\n      \"field\": \"summary\",\n      \"oldValue\": null,\n      \"newValue\": \"**Summary of Newborn Screening Failsafes Guideline:** The NHS Newborn Screening Programmes aim to identify serious conditions early in babies up to 6 weeks old. Eligible infants are tracked via NHS numbers or GP registration, with daily checks required for transfers, discharges, and screenings. **Key Failsafe Procedures:** - **NIPE Referral Export:** Run preset S4N searches twice weekly for referrals and update the follow-up spreadsheet. - **Red (Breached) Baby Spreadsheet:** Track NICU babies to ensure timely screening. - **S4H NICU Failsafe:** Investigate missed screens for well/community and NICU babies. - **NHSP Systmone Report:** Verify all babies have screening results; follow up if missing. **Documentation & Follow-Up:** - Record neonatal/child deaths and NICU transfers in databases. - Merge duplicate records and ensure all births are fully documented. - Verify screenings at day 1, 5, and 10 visits; follow up on incomplete tests. - Copy discharge emails to screening administrators and document home births. - Forward repeat bloodspot notifications to Community Team Leads. **Consent:** Parents are offered three screenings (NIPE, NBS, NHSP) with confidential data handling. Consent or declination must be documented. **QA & Contacts:** Perform QA checks and use provided contact details for discrepancies. Updates to guidelines are noted\",\n      \"action\": \"added\"\n    }\n  ]\n}",
  "ai_provider": "DeepSeek",
  "ai_model": "deepseek-chat",
  "token_usage": null
}