{
  "prompt": {
    "guidelineId": "cg1119-iol-augmentation-of-labour-use-of-oxytocin-pdf",
    "fieldsProcessed": [
      "humanFriendlyName",
      "organisation",
      "yearProduced",
      "summary"
    ],
    "enhancedFields": 4,
    "contentLength": 6788
  },
  "response": "{\n  \"success\": true,\n  \"enhancedFields\": [\n    {\n      \"field\": \"humanFriendlyName\",\n      \"oldValue\": null,\n      \"newValue\": \"Guidelines for Labor Induction and Augmentation with Oxytocin\",\n      \"action\": \"added\"\n    },\n    {\n      \"field\": \"organisation\",\n      \"oldValue\": null,\n      \"newValue\": \"NHS\",\n      \"action\": \"added\"\n    },\n    {\n      \"field\": \"yearProduced\",\n      \"oldValue\": null,\n      \"newValue\": \"The text provided does not contain a publication year. If you have another guideline text that includes the publication year, please share it, and I can extract the 4-digit year for you\",\n      \"action\": \"added\"\n    },\n    {\n      \"field\": \"summary\",\n      \"oldValue\": null,\n      \"newValue\": \"**Summary of Guideline on Labor Induction and Augmentation:** - **Indication for Induction:** Advised between 41+0 and 42+0 weeks to reduce stillbirth risk, particularly for Black/Asian women and those in deprived areas. - **Membrane Sweep:** Offer at 38 and 39 weeks to promote spontaneous labor. - **Methods of Induction:** Include membrane sweep, cervical balloon catheter, dinoprostone, artificial rupture of membranes (ARM), and oxytocin infusion. - **Contraindications:** Avoid routine induction in cases of precipitate labor, suspected macrosomia, or maternal request without risk factors. - **Pre-Induction Assessment:** Check maternal/fetal wellbeing, confirm gestation, and assess cervix using Bishop Score. - **Special Populations:** Women with BMI ≥30 should discuss induction by 40 weeks; GBS-positive individuals may require oxytocin infusion. - **Monitoring:** Continuous CTG during induction; watch for uterine hyperstimulation (manage with terbutaline if needed). - **Failed Induction:** Reassess within 24–48 hours; options include further attempts or cesarean. - **Pre-Labor Rupture of Membranes (PROM):** Offer induction after 24 hours of expectant management; monitor for infection. - **Oxytocin Use:** Titrate infusion to achieve adequate contractions; follow protocols for dilution and administration. - **Complications:** Suspect uterine rupture if hyperstimulation occurs; emergency cesarean may be needed. - **Documentation:** Record all procedures, consent, and fetal/maternal observations. *Key Points:* Individualize counseling on risks/benefits; prioritize maternal autonomy in decision-making\",\n      \"action\": \"added\"\n    }\n  ]\n}",
  "endpoint": "enhanceGuidelineMetadata",
  "timestamp": "2025-06-18T21-46-59",
  "textContent": "AI: DeepSeek (deepseek-chat)\n\nQ: {\n  \"guidelineId\": \"cg1119-iol-augmentation-of-labour-use-of-oxytocin-pdf\",\n  \"fieldsProcessed\": [\n    \"humanFriendlyName\",\n    \"organisation\",\n    \"yearProduced\",\n    \"summary\"\n  ],\n  \"enhancedFields\": 4,\n  \"contentLength\": 6788\n}\n\nA: {\n  \"success\": true,\n  \"enhancedFields\": [\n    {\n      \"field\": \"humanFriendlyName\",\n      \"oldValue\": null,\n      \"newValue\": \"Guidelines for Labor Induction and Augmentation with Oxytocin\",\n      \"action\": \"added\"\n    },\n    {\n      \"field\": \"organisation\",\n      \"oldValue\": null,\n      \"newValue\": \"NHS\",\n      \"action\": \"added\"\n    },\n    {\n      \"field\": \"yearProduced\",\n      \"oldValue\": null,\n      \"newValue\": \"The text provided does not contain a publication year. If you have another guideline text that includes the publication year, please share it, and I can extract the 4-digit year for you\",\n      \"action\": \"added\"\n    },\n    {\n      \"field\": \"summary\",\n      \"oldValue\": null,\n      \"newValue\": \"**Summary of Guideline on Labor Induction and Augmentation:** - **Indication for Induction:** Advised between 41+0 and 42+0 weeks to reduce stillbirth risk, particularly for Black/Asian women and those in deprived areas. - **Membrane Sweep:** Offer at 38 and 39 weeks to promote spontaneous labor. - **Methods of Induction:** Include membrane sweep, cervical balloon catheter, dinoprostone, artificial rupture of membranes (ARM), and oxytocin infusion. - **Contraindications:** Avoid routine induction in cases of precipitate labor, suspected macrosomia, or maternal request without risk factors. - **Pre-Induction Assessment:** Check maternal/fetal wellbeing, confirm gestation, and assess cervix using Bishop Score. - **Special Populations:** Women with BMI ≥30 should discuss induction by 40 weeks; GBS-positive individuals may require oxytocin infusion. - **Monitoring:** Continuous CTG during induction; watch for uterine hyperstimulation (manage with terbutaline if needed). - **Failed Induction:** Reassess within 24–48 hours; options include further attempts or cesarean. - **Pre-Labor Rupture of Membranes (PROM):** Offer induction after 24 hours of expectant management; monitor for infection. - **Oxytocin Use:** Titrate infusion to achieve adequate contractions; follow protocols for dilution and administration. - **Complications:** Suspect uterine rupture if hyperstimulation occurs; emergency cesarean may be needed. - **Documentation:** Record all procedures, consent, and fetal/maternal observations. *Key Points:* Individualize counseling on risks/benefits; prioritize maternal autonomy in decision-making\",\n      \"action\": \"added\"\n    }\n  ]\n}",
  "ai_provider": "DeepSeek",
  "ai_model": "deepseek-chat",
  "token_usage": null
}