{
  "prompt": {
    "guidelineId": "cg1118-neonatal-hypothermia-pdf",
    "fieldsProcessed": [
      "humanFriendlyName",
      "organisation",
      "yearProduced",
      "summary"
    ],
    "enhancedFields": 4,
    "contentLength": 1134
  },
  "response": "{\n  \"success\": true,\n  \"enhancedFields\": [\n    {\n      \"field\": \"humanFriendlyName\",\n      \"oldValue\": null,\n      \"newValue\": \"Neonatal Hypothermia Detection and Management Guide\",\n      \"action\": \"added\"\n    },\n    {\n      \"field\": \"organisation\",\n      \"oldValue\": null,\n      \"newValue\": \"The text provided does not explicitly mention a specific publishing organization or institution such as NHS, NICE, WHO, RCOG, etc. Therefore, I cannot identify the organization name from the given guideline text. If you have additional context or a specific section that mentions the publishing organization, please provide that, and I can assist further\",\n      \"action\": \"added\"\n    },\n    {\n      \"field\": \"yearProduced\",\n      \"oldValue\": null,\n      \"newValue\": \"I cannot determine the publication year from the provided text as it does not contain any explicit date information. If you have the full document or a citation, please share that part so I can extract the year for you\",\n      \"action\": \"added\"\n    },\n    {\n      \"field\": \"summary\",\n      \"oldValue\": null,\n      \"newValue\": \"**Summary of Neonatal Hypothermia Guideline:** This guideline provides staff with protocols for detecting and managing neonatal hypothermia. It applies to all caregivers of newborns, emphasizing prevention, monitoring, and timely intervention. **Key Recommendations:** - **Prevention:** Anticipate hypothermia in at-risk infants; maintain a warm environment and encourage skin-to-skin contact. - **At Birth:** Dry the baby immediately, promote skin-to-skin contact, and encourage feeding to stabilize temperature. - **Low Temperature Management:** Use skin-to-skin contact, continuous monitoring, and a hot cot if needed. - **Hot Cot Use:** Keep it on, monitor temperature closely, and gradually reduce heat once stable. - **Ongoing Care:** Discontinue monitoring if temperature normalizes; prioritize feeding. - **Parent Communication:** Explain procedures and management to parents. - **Audit:** Follow the Maternity Audit Document for compliance monitoring. Staff must use professional judgment while adhering to these guidelines\",\n      \"action\": \"added\"\n    }\n  ]\n}",
  "endpoint": "enhanceGuidelineMetadata",
  "timestamp": "2025-06-18T21-44-28",
  "textContent": "AI: DeepSeek (deepseek-chat)\n\nQ: {\n  \"guidelineId\": \"cg1118-neonatal-hypothermia-pdf\",\n  \"fieldsProcessed\": [\n    \"humanFriendlyName\",\n    \"organisation\",\n    \"yearProduced\",\n    \"summary\"\n  ],\n  \"enhancedFields\": 4,\n  \"contentLength\": 1134\n}\n\nA: {\n  \"success\": true,\n  \"enhancedFields\": [\n    {\n      \"field\": \"humanFriendlyName\",\n      \"oldValue\": null,\n      \"newValue\": \"Neonatal Hypothermia Detection and Management Guide\",\n      \"action\": \"added\"\n    },\n    {\n      \"field\": \"organisation\",\n      \"oldValue\": null,\n      \"newValue\": \"The text provided does not explicitly mention a specific publishing organization or institution such as NHS, NICE, WHO, RCOG, etc. Therefore, I cannot identify the organization name from the given guideline text. If you have additional context or a specific section that mentions the publishing organization, please provide that, and I can assist further\",\n      \"action\": \"added\"\n    },\n    {\n      \"field\": \"yearProduced\",\n      \"oldValue\": null,\n      \"newValue\": \"I cannot determine the publication year from the provided text as it does not contain any explicit date information. If you have the full document or a citation, please share that part so I can extract the year for you\",\n      \"action\": \"added\"\n    },\n    {\n      \"field\": \"summary\",\n      \"oldValue\": null,\n      \"newValue\": \"**Summary of Neonatal Hypothermia Guideline:** This guideline provides staff with protocols for detecting and managing neonatal hypothermia. It applies to all caregivers of newborns, emphasizing prevention, monitoring, and timely intervention. **Key Recommendations:** - **Prevention:** Anticipate hypothermia in at-risk infants; maintain a warm environment and encourage skin-to-skin contact. - **At Birth:** Dry the baby immediately, promote skin-to-skin contact, and encourage feeding to stabilize temperature. - **Low Temperature Management:** Use skin-to-skin contact, continuous monitoring, and a hot cot if needed. - **Hot Cot Use:** Keep it on, monitor temperature closely, and gradually reduce heat once stable. - **Ongoing Care:** Discontinue monitoring if temperature normalizes; prioritize feeding. - **Parent Communication:** Explain procedures and management to parents. - **Audit:** Follow the Maternity Audit Document for compliance monitoring. Staff must use professional judgment while adhering to these guidelines\",\n      \"action\": \"added\"\n    }\n  ]\n}",
  "ai_provider": "DeepSeek",
  "ai_model": "deepseek-chat",
  "token_usage": null
}