{
  "prompt": {
    "guidelineId": "consultant-midwife-sop-pdf",
    "fieldsProcessed": [
      "humanFriendlyName",
      "organisation",
      "yearProduced",
      "summary"
    ],
    "enhancedFields": 4,
    "contentLength": 3894
  },
  "response": "{\n  \"success\": true,\n  \"enhancedFields\": [\n    {\n      \"field\": \"humanFriendlyName\",\n      \"oldValue\": null,\n      \"newValue\": \"Guidelines for Maternity Care Referrals to Consultant Midwife\",\n      \"action\": \"added\"\n    },\n    {\n      \"field\": \"organisation\",\n      \"oldValue\": null,\n      \"newValue\": \"RCOG\",\n      \"action\": \"added\"\n    },\n    {\n      \"field\": \"yearProduced\",\n      \"oldValue\": null,\n      \"newValue\": \"The provided text does not contain a publication year. If you have another guideline text that includes the year, please share it, and I can extract the 4-digit year for you\",\n      \"action\": \"added\"\n    },\n    {\n      \"field\": \"summary\",\n      \"oldValue\": null,\n      \"newValue\": \"**Summary:** This guideline outlines care planning for pregnant individuals deviating from standard maternity guidance, emphasizing referrals to the Consultant Midwife Clinic for non-standard choices (e.g., VBAC, twin births) or complications. Routine referrals should occur before 36 weeks; urgent referrals (e.g., postdates declining induction, undiagnosed breech) require direct contact with the Consultant Midwife or labour ward lead if unavailable. Consultations involve shared decision-making, with care plans documented in electronic/handheld notes. \\\"Amber\\\" and \\\"Red\\\" risk cases require joint review by the Consultant Midwife and Obstetrician. Referrals are triaged within one week; urgent cases are handled via phone/email. Midwives must identify deviations from norms promptly, communicate with the MDT, and support personalized birth choices. If preferences conflict with recommendations or scope of practice is uncertain, refer to the Consultant Midwife/Obstetrician. Referral forms must include detailed reasoning; digital signatures authorize submissions. Risk assessments begin antenatally and continue through postnatal care\",\n      \"action\": \"added\"\n    }\n  ]\n}",
  "endpoint": "enhanceGuidelineMetadata",
  "timestamp": "2025-06-18T22-17-45",
  "textContent": "AI: DeepSeek (deepseek-chat)\n\nQ: {\n  \"guidelineId\": \"consultant-midwife-sop-pdf\",\n  \"fieldsProcessed\": [\n    \"humanFriendlyName\",\n    \"organisation\",\n    \"yearProduced\",\n    \"summary\"\n  ],\n  \"enhancedFields\": 4,\n  \"contentLength\": 3894\n}\n\nA: {\n  \"success\": true,\n  \"enhancedFields\": [\n    {\n      \"field\": \"humanFriendlyName\",\n      \"oldValue\": null,\n      \"newValue\": \"Guidelines for Maternity Care Referrals to Consultant Midwife\",\n      \"action\": \"added\"\n    },\n    {\n      \"field\": \"organisation\",\n      \"oldValue\": null,\n      \"newValue\": \"RCOG\",\n      \"action\": \"added\"\n    },\n    {\n      \"field\": \"yearProduced\",\n      \"oldValue\": null,\n      \"newValue\": \"The provided text does not contain a publication year. If you have another guideline text that includes the year, please share it, and I can extract the 4-digit year for you\",\n      \"action\": \"added\"\n    },\n    {\n      \"field\": \"summary\",\n      \"oldValue\": null,\n      \"newValue\": \"**Summary:** This guideline outlines care planning for pregnant individuals deviating from standard maternity guidance, emphasizing referrals to the Consultant Midwife Clinic for non-standard choices (e.g., VBAC, twin births) or complications. Routine referrals should occur before 36 weeks; urgent referrals (e.g., postdates declining induction, undiagnosed breech) require direct contact with the Consultant Midwife or labour ward lead if unavailable. Consultations involve shared decision-making, with care plans documented in electronic/handheld notes. \\\"Amber\\\" and \\\"Red\\\" risk cases require joint review by the Consultant Midwife and Obstetrician. Referrals are triaged within one week; urgent cases are handled via phone/email. Midwives must identify deviations from norms promptly, communicate with the MDT, and support personalized birth choices. If preferences conflict with recommendations or scope of practice is uncertain, refer to the Consultant Midwife/Obstetrician. Referral forms must include detailed reasoning; digital signatures authorize submissions. Risk assessments begin antenatally and continue through postnatal care\",\n      \"action\": \"added\"\n    }\n  ]\n}",
  "ai_provider": "DeepSeek",
  "ai_model": "deepseek-chat",
  "token_usage": null
}