{
  "prompt": {
    "guidelineId": "cg1109-diabetes-in-pregnancy-guideline-pdf",
    "fieldsProcessed": [
      "humanFriendlyName",
      "organisation",
      "yearProduced",
      "summary"
    ],
    "enhancedFields": 4,
    "contentLength": 3289
  },
  "response": "{\n  \"success\": true,\n  \"enhancedFields\": [\n    {\n      \"field\": \"humanFriendlyName\",\n      \"oldValue\": null,\n      \"newValue\": \"Diabetes in Pregnancy Care Guidelines\",\n      \"action\": \"added\"\n    },\n    {\n      \"field\": \"organisation\",\n      \"oldValue\": null,\n      \"newValue\": \"RCOG\",\n      \"action\": \"added\"\n    },\n    {\n      \"field\": \"yearProduced\",\n      \"oldValue\": null,\n      \"newValue\": \"I cannot find a publication year in the provided text. The guideline does not explicitly state its publication or revision year\",\n      \"action\": \"added\"\n    },\n    {\n      \"field\": \"summary\",\n      \"oldValue\": null,\n      \"newValue\": \"**Summary of Diabetes in Pregnancy Guideline** - **Pre-pregnancy counseling**: Discuss risks, optimize glucose monitoring, review medications, and screen for complications in women with pre-existing diabetes. - **Screening for GDM**: Follow diagnostic criteria; refer to the Diabetes Pregnancy Team if diagnosed. After 34 weeks, GTT is rarely useful unless new concerns arise. - **Diagnosis without GTT**: Urgently refer if glucose >11.0 mmol/L (anytime) or fasting glucose ≥5.6 mmol/L. - **Management**: For GDM with fasting glucose <7 mmol/L, trial diet/exercise first. Monitor closely if on corticosteroids or with hyperemesis. - **Labor & delivery**: Continue insulin; consider VRIII. Post-delivery, adjust insulin and monitor glucose. - **Breastfeeding**: Frequent glucose monitoring advised. - **Fetal monitoring**: Include 20-week ultrasound and fetal heart exam. - **Vaccination**: Offer COVID-19 vaccination per JCVI guidance, prioritizing those with GDM. - **Emergency care**: Diabetic emergencies require immediate attention. - **Audit**: Regular audits to ensure guideline adherence\",\n      \"action\": \"added\"\n    }\n  ]\n}",
  "endpoint": "enhanceGuidelineMetadata",
  "timestamp": "2025-06-18T18-41-37",
  "textContent": "AI: DeepSeek (deepseek-chat)\n\nQ: {\n  \"guidelineId\": \"cg1109-diabetes-in-pregnancy-guideline-pdf\",\n  \"fieldsProcessed\": [\n    \"humanFriendlyName\",\n    \"organisation\",\n    \"yearProduced\",\n    \"summary\"\n  ],\n  \"enhancedFields\": 4,\n  \"contentLength\": 3289\n}\n\nA: {\n  \"success\": true,\n  \"enhancedFields\": [\n    {\n      \"field\": \"humanFriendlyName\",\n      \"oldValue\": null,\n      \"newValue\": \"Diabetes in Pregnancy Care Guidelines\",\n      \"action\": \"added\"\n    },\n    {\n      \"field\": \"organisation\",\n      \"oldValue\": null,\n      \"newValue\": \"RCOG\",\n      \"action\": \"added\"\n    },\n    {\n      \"field\": \"yearProduced\",\n      \"oldValue\": null,\n      \"newValue\": \"I cannot find a publication year in the provided text. The guideline does not explicitly state its publication or revision year\",\n      \"action\": \"added\"\n    },\n    {\n      \"field\": \"summary\",\n      \"oldValue\": null,\n      \"newValue\": \"**Summary of Diabetes in Pregnancy Guideline** - **Pre-pregnancy counseling**: Discuss risks, optimize glucose monitoring, review medications, and screen for complications in women with pre-existing diabetes. - **Screening for GDM**: Follow diagnostic criteria; refer to the Diabetes Pregnancy Team if diagnosed. After 34 weeks, GTT is rarely useful unless new concerns arise. - **Diagnosis without GTT**: Urgently refer if glucose >11.0 mmol/L (anytime) or fasting glucose ≥5.6 mmol/L. - **Management**: For GDM with fasting glucose <7 mmol/L, trial diet/exercise first. Monitor closely if on corticosteroids or with hyperemesis. - **Labor & delivery**: Continue insulin; consider VRIII. Post-delivery, adjust insulin and monitor glucose. - **Breastfeeding**: Frequent glucose monitoring advised. - **Fetal monitoring**: Include 20-week ultrasound and fetal heart exam. - **Vaccination**: Offer COVID-19 vaccination per JCVI guidance, prioritizing those with GDM. - **Emergency care**: Diabetic emergencies require immediate attention. - **Audit**: Regular audits to ensure guideline adherence\",\n      \"action\": \"added\"\n    }\n  ]\n}",
  "ai_provider": "DeepSeek",
  "ai_model": "deepseek-chat",
  "token_usage": null
}