{
  "prompt": {
    "guidelineId": "md090-disengaging-a-deeply-impacted-head-at-lscs-and-use-of-fetal-pillow-pdf",
    "fieldsProcessed": [
      "humanFriendlyName",
      "organisation",
      "yearProduced",
      "summary"
    ],
    "enhancedFields": 4,
    "contentLength": 2686
  },
  "response": "{\n  \"success\": true,\n  \"enhancedFields\": [\n    {\n      \"field\": \"humanFriendlyName\",\n      \"oldValue\": null,\n      \"newValue\": \"Managing Impacted Fetal Head During C-Section with Fetal Pillow\",\n      \"action\": \"added\"\n    },\n    {\n      \"field\": \"organisation\",\n      \"oldValue\": null,\n      \"newValue\": \"RCOG\",\n      \"action\": \"added\"\n    },\n    {\n      \"field\": \"yearProduced\",\n      \"oldValue\": null,\n      \"newValue\": \"The text does not contain a clear publication year. If you have the year from another source or can provide more context, I can help extract it. Otherwise, I cannot determine the publication year from the given text\",\n      \"action\": \"added\"\n    },\n    {\n      \"field\": \"summary\",\n      \"oldValue\": null,\n      \"newValue\": \"**Summary of Guideline: Disengaging a Deeply Impacted Fetal Head at LSCS and Use of Fetal Pillow** This guideline addresses managing an impacted fetal head during lower segment Caesarean section (LSCS) at ≥37 weeks with cephalic presentation. **Key Recommendations:** - **Second-stage LSCS:** Higher maternal/neonatal risks; first-line use of **Fetal Pillow** (disposable silicone balloon to elevate the head). If unsuccessful, perform **reverse breech extraction**. - **First-stage LSCS:** First-line **reverse breech extraction**; if unsuccessful, use the **push technique**. **Fetal Pillow Criteria:** - Failed instrumental delivery. - Full dilatation LSCS with head at/below ischial spines or severe caput/moulding (3+). **Procedure Notes:** - Requires pre-use training (hands-on/online). - Document vaginal/abdominal findings pre-insertion. - Monitor delivery difficulty, time, mode, and neonatal outcomes (Apgar, injuries, SCBU admission). - Record maternal complications (uterine extensions, bladder injury, EBL, ICU admission). **Audit:** Proforma tracks compliance and outcomes. (Word count: 200)\",\n      \"action\": \"added\"\n    }\n  ]\n}",
  "endpoint": "enhanceGuidelineMetadata",
  "timestamp": "2025-06-18T22-30-19",
  "textContent": "AI: DeepSeek (deepseek-chat)\n\nQ: {\n  \"guidelineId\": \"md090-disengaging-a-deeply-impacted-head-at-lscs-and-use-of-fetal-pillow-pdf\",\n  \"fieldsProcessed\": [\n    \"humanFriendlyName\",\n    \"organisation\",\n    \"yearProduced\",\n    \"summary\"\n  ],\n  \"enhancedFields\": 4,\n  \"contentLength\": 2686\n}\n\nA: {\n  \"success\": true,\n  \"enhancedFields\": [\n    {\n      \"field\": \"humanFriendlyName\",\n      \"oldValue\": null,\n      \"newValue\": \"Managing Impacted Fetal Head During C-Section with Fetal Pillow\",\n      \"action\": \"added\"\n    },\n    {\n      \"field\": \"organisation\",\n      \"oldValue\": null,\n      \"newValue\": \"RCOG\",\n      \"action\": \"added\"\n    },\n    {\n      \"field\": \"yearProduced\",\n      \"oldValue\": null,\n      \"newValue\": \"The text does not contain a clear publication year. If you have the year from another source or can provide more context, I can help extract it. Otherwise, I cannot determine the publication year from the given text\",\n      \"action\": \"added\"\n    },\n    {\n      \"field\": \"summary\",\n      \"oldValue\": null,\n      \"newValue\": \"**Summary of Guideline: Disengaging a Deeply Impacted Fetal Head at LSCS and Use of Fetal Pillow** This guideline addresses managing an impacted fetal head during lower segment Caesarean section (LSCS) at ≥37 weeks with cephalic presentation. **Key Recommendations:** - **Second-stage LSCS:** Higher maternal/neonatal risks; first-line use of **Fetal Pillow** (disposable silicone balloon to elevate the head). If unsuccessful, perform **reverse breech extraction**. - **First-stage LSCS:** First-line **reverse breech extraction**; if unsuccessful, use the **push technique**. **Fetal Pillow Criteria:** - Failed instrumental delivery. - Full dilatation LSCS with head at/below ischial spines or severe caput/moulding (3+). **Procedure Notes:** - Requires pre-use training (hands-on/online). - Document vaginal/abdominal findings pre-insertion. - Monitor delivery difficulty, time, mode, and neonatal outcomes (Apgar, injuries, SCBU admission). - Record maternal complications (uterine extensions, bladder injury, EBL, ICU admission). **Audit:** Proforma tracks compliance and outcomes. (Word count: 200)\",\n      \"action\": \"added\"\n    }\n  ]\n}",
  "ai_provider": "DeepSeek",
  "ai_model": "deepseek-chat",
  "token_usage": null
}