{
  "prompt": {
    "guidelineId": "cg1118-neonatal-hypothermia-pdf",
    "fieldsProcessed": [
      "humanFriendlyName",
      "organisation",
      "yearProduced",
      "summary"
    ],
    "enhancedFields": 4,
    "contentLength": 1134
  },
  "response": "{\n  \"success\": true,\n  \"enhancedFields\": [\n    {\n      \"field\": \"humanFriendlyName\",\n      \"oldValue\": null,\n      \"newValue\": \"Neonatal Hypothermia Detection and Management Guide\",\n      \"action\": \"added\"\n    },\n    {\n      \"field\": \"organisation\",\n      \"oldValue\": null,\n      \"newValue\": \"The text provided does not explicitly mention a specific publishing organization or institution such as NHS, NICE, WHO, RCOG, etc. Therefore, I cannot identify the organization name from the given guideline text. If you have additional context or a source for this guideline, please provide it, and I can assist further\",\n      \"action\": \"added\"\n    },\n    {\n      \"field\": \"yearProduced\",\n      \"oldValue\": null,\n      \"newValue\": \"The provided text does not contain a publication year. If you have another guideline text that includes the year, please share it, and I can extract the 4-digit year for you\",\n      \"action\": \"added\"\n    },\n    {\n      \"field\": \"summary\",\n      \"oldValue\": null,\n      \"newValue\": \"**Summary of Neonatal Hypothermia Guideline:** This guideline provides staff with protocols for detecting and managing neonatal hypothermia. It applies to all caregivers of newborns, emphasizing prevention, monitoring, and timely intervention. **Key Recommendations:** - **Prevention:** Anticipate hypothermia in at-risk infants; maintain a warm environment, encourage skin-to-skin contact, and ensure drying after birth. - **Immediate Post-Birth Care:** Dry the baby, initiate skin-to-skin contact, and encourage feeding to stabilize temperature. - **Management of Hypothermia:** Use skin-to-skin contact, continuous monitoring, and a hot cot if needed (keep it pre-warmed, monitor closely, and gradually reduce heat). - **Ongoing Care:** Discontinue monitoring once temperature stabilizes; prioritize feeding. - **Parental Communication:** Explain procedures and monitoring to parents. - **Audit:** Compliance and outcomes are tracked via the Maternity Audit Document. Staff must use professional judgment while adhering to these guidelines\",\n      \"action\": \"added\"\n    }\n  ]\n}",
  "endpoint": "enhanceGuidelineMetadata",
  "timestamp": "2025-06-18T21-44-25",
  "textContent": "AI: DeepSeek (deepseek-chat)\n\nQ: {\n  \"guidelineId\": \"cg1118-neonatal-hypothermia-pdf\",\n  \"fieldsProcessed\": [\n    \"humanFriendlyName\",\n    \"organisation\",\n    \"yearProduced\",\n    \"summary\"\n  ],\n  \"enhancedFields\": 4,\n  \"contentLength\": 1134\n}\n\nA: {\n  \"success\": true,\n  \"enhancedFields\": [\n    {\n      \"field\": \"humanFriendlyName\",\n      \"oldValue\": null,\n      \"newValue\": \"Neonatal Hypothermia Detection and Management Guide\",\n      \"action\": \"added\"\n    },\n    {\n      \"field\": \"organisation\",\n      \"oldValue\": null,\n      \"newValue\": \"The text provided does not explicitly mention a specific publishing organization or institution such as NHS, NICE, WHO, RCOG, etc. Therefore, I cannot identify the organization name from the given guideline text. If you have additional context or a source for this guideline, please provide it, and I can assist further\",\n      \"action\": \"added\"\n    },\n    {\n      \"field\": \"yearProduced\",\n      \"oldValue\": null,\n      \"newValue\": \"The provided text does not contain a publication year. If you have another guideline text that includes the year, please share it, and I can extract the 4-digit year for you\",\n      \"action\": \"added\"\n    },\n    {\n      \"field\": \"summary\",\n      \"oldValue\": null,\n      \"newValue\": \"**Summary of Neonatal Hypothermia Guideline:** This guideline provides staff with protocols for detecting and managing neonatal hypothermia. It applies to all caregivers of newborns, emphasizing prevention, monitoring, and timely intervention. **Key Recommendations:** - **Prevention:** Anticipate hypothermia in at-risk infants; maintain a warm environment, encourage skin-to-skin contact, and ensure drying after birth. - **Immediate Post-Birth Care:** Dry the baby, initiate skin-to-skin contact, and encourage feeding to stabilize temperature. - **Management of Hypothermia:** Use skin-to-skin contact, continuous monitoring, and a hot cot if needed (keep it pre-warmed, monitor closely, and gradually reduce heat). - **Ongoing Care:** Discontinue monitoring once temperature stabilizes; prioritize feeding. - **Parental Communication:** Explain procedures and monitoring to parents. - **Audit:** Compliance and outcomes are tracked via the Maternity Audit Document. Staff must use professional judgment while adhering to these guidelines\",\n      \"action\": \"added\"\n    }\n  ]\n}",
  "ai_provider": "DeepSeek",
  "ai_model": "deepseek-chat",
  "token_usage": null
}