{
  "prompt": {
    "guidelineId": "uhsx-cord-prolapse-protocol-pdf",
    "fieldsProcessed": [
      "humanFriendlyName",
      "organisation",
      "yearProduced",
      "summary"
    ],
    "enhancedFields": 4,
    "contentLength": 2215
  },
  "response": "{\n  \"success\": true,\n  \"enhancedFields\": [\n    {\n      \"field\": \"humanFriendlyName\",\n      \"oldValue\": null,\n      \"newValue\": \"Cord Prolapse Management Protocol\",\n      \"action\": \"added\"\n    },\n    {\n      \"field\": \"organisation\",\n      \"oldValue\": null,\n      \"newValue\": \"NICE\",\n      \"action\": \"added\"\n    },\n    {\n      \"field\": \"yearProduced\",\n      \"oldValue\": null,\n      \"newValue\": \"2024\",\n      \"action\": \"added\"\n    },\n    {\n      \"field\": \"summary\",\n      \"oldValue\": null,\n      \"newValue\": \"**Summary of Cord Prolapse Management Guideline** Cord prolapse occurs when the umbilical cord descends past the presenting part after membrane rupture, with an incidence of 0.1–0.6%. Risk factors include breech presentation, long cord, and artificial rupture of membranes. **Key Recommendations:** - **Antenatal Care:** High-risk pregnancies (e.g., breech) should be reviewed by an obstetric consultant; urgent hospital presentation is advised if labor signs appear. - **Immediate Management:** - Call for help and prepare for emergency caesarean section. - Manual elevation of the presenting part and maternal repositioning (e.g., knee-chest) may relieve cord compression. - **Postnatal Care:** Offer debriefing to reduce post-traumatic stress. - **Training & Audit:** Annual training in obstetric emergencies, including cord prolapse, is required. Submit clinical incident forms and conduct audits for all cases. **Governance:** Aligns with NICE (2023) intrapartum care standards. Replaces prior protocols (MP047, CG12026). Next review due November 2027\",\n      \"action\": \"added\"\n    }\n  ]\n}",
  "endpoint": "enhanceGuidelineMetadata",
  "timestamp": "2025-06-18T23-08-42",
  "textContent": "AI: DeepSeek (deepseek-chat)\n\nQ: {\n  \"guidelineId\": \"uhsx-cord-prolapse-protocol-pdf\",\n  \"fieldsProcessed\": [\n    \"humanFriendlyName\",\n    \"organisation\",\n    \"yearProduced\",\n    \"summary\"\n  ],\n  \"enhancedFields\": 4,\n  \"contentLength\": 2215\n}\n\nA: {\n  \"success\": true,\n  \"enhancedFields\": [\n    {\n      \"field\": \"humanFriendlyName\",\n      \"oldValue\": null,\n      \"newValue\": \"Cord Prolapse Management Protocol\",\n      \"action\": \"added\"\n    },\n    {\n      \"field\": \"organisation\",\n      \"oldValue\": null,\n      \"newValue\": \"NICE\",\n      \"action\": \"added\"\n    },\n    {\n      \"field\": \"yearProduced\",\n      \"oldValue\": null,\n      \"newValue\": \"2024\",\n      \"action\": \"added\"\n    },\n    {\n      \"field\": \"summary\",\n      \"oldValue\": null,\n      \"newValue\": \"**Summary of Cord Prolapse Management Guideline** Cord prolapse occurs when the umbilical cord descends past the presenting part after membrane rupture, with an incidence of 0.1–0.6%. Risk factors include breech presentation, long cord, and artificial rupture of membranes. **Key Recommendations:** - **Antenatal Care:** High-risk pregnancies (e.g., breech) should be reviewed by an obstetric consultant; urgent hospital presentation is advised if labor signs appear. - **Immediate Management:** - Call for help and prepare for emergency caesarean section. - Manual elevation of the presenting part and maternal repositioning (e.g., knee-chest) may relieve cord compression. - **Postnatal Care:** Offer debriefing to reduce post-traumatic stress. - **Training & Audit:** Annual training in obstetric emergencies, including cord prolapse, is required. Submit clinical incident forms and conduct audits for all cases. **Governance:** Aligns with NICE (2023) intrapartum care standards. Replaces prior protocols (MP047, CG12026). Next review due November 2027\",\n      \"action\": \"added\"\n    }\n  ]\n}",
  "ai_provider": "DeepSeek",
  "ai_model": "deepseek-chat",
  "token_usage": null
}