{
  "prompt": {
    "guidelineId": "mp069-care-of-the-newborn-pdf",
    "fieldsProcessed": [
      "humanFriendlyName",
      "organisation",
      "yearProduced",
      "summary"
    ],
    "enhancedFields": 4,
    "contentLength": 4514
  },
  "response": "{\n  \"success\": true,\n  \"enhancedFields\": [\n    {\n      \"field\": \"humanFriendlyName\",\n      \"oldValue\": null,\n      \"newValue\": \"Newborn Care Guidelines for Health Professionals\",\n      \"action\": \"added\"\n    },\n    {\n      \"field\": \"organisation\",\n      \"oldValue\": null,\n      \"newValue\": \"Public Health England\",\n      \"action\": \"added\"\n    },\n    {\n      \"field\": \"yearProduced\",\n      \"oldValue\": null,\n      \"newValue\": \"I cannot find a publication year in the provided text. The guideline does not explicitly mention a 4-digit year\",\n      \"action\": \"added\"\n    },\n    {\n      \"field\": \"summary\",\n      \"oldValue\": null,\n      \"newValue\": \"**Summary of Newborn Care Guideline:** - **Immediate care:** Ensure warmth, prevent heat loss, promote skin-to-skin contact. - **Routine postnatal care:** Monitor wellbeing, feeding, development; conduct screenings; educate parents on bathing, umbilical care, feeding, illness recognition, safe sleep, and immunizations. - **Meconium-stained liquor:** Call neonatologist/advanced neonatal nurse; management varies by baby’s condition. - **Jaundice:** Assess via visual inspection and bilirubin levels; use treatment threshold graphs for phototherapy/exchange transfusion. - **Phototherapy care:** Monitor bilirubin, stop once stable; ensure supine position, hydration, and parental interaction. - **Hypoglycaemia:** Assess risk factors, monitor glucose; treat with glucose gel if symptomatic (irritability, poor feeding, seizures). - **Infections:** Antibiotics (e.g., cefotaxime) based on infection type; duration varies (7–21 days for positive cultures/GBS meningitis). - **GBS management:** Inform parents, document observations; escalate care if abnormal signs appear. - **Late preterm babies:** Monitor weight loss; avoid early discharge to reduce readmission risk. - **Early-onset sepsis risk factors:** Maternal (e.g., chorioamnionitis, GBS) and neonatal (e.g., respiratory distress, poor feeding). Document all care on BadgerNet Maternity\",\n      \"action\": \"added\"\n    }\n  ]\n}",
  "endpoint": "enhanceGuidelineMetadata",
  "timestamp": "2025-06-18T22-53-41",
  "textContent": "AI: DeepSeek (deepseek-chat)\n\nQ: {\n  \"guidelineId\": \"mp069-care-of-the-newborn-pdf\",\n  \"fieldsProcessed\": [\n    \"humanFriendlyName\",\n    \"organisation\",\n    \"yearProduced\",\n    \"summary\"\n  ],\n  \"enhancedFields\": 4,\n  \"contentLength\": 4514\n}\n\nA: {\n  \"success\": true,\n  \"enhancedFields\": [\n    {\n      \"field\": \"humanFriendlyName\",\n      \"oldValue\": null,\n      \"newValue\": \"Newborn Care Guidelines for Health Professionals\",\n      \"action\": \"added\"\n    },\n    {\n      \"field\": \"organisation\",\n      \"oldValue\": null,\n      \"newValue\": \"Public Health England\",\n      \"action\": \"added\"\n    },\n    {\n      \"field\": \"yearProduced\",\n      \"oldValue\": null,\n      \"newValue\": \"I cannot find a publication year in the provided text. The guideline does not explicitly mention a 4-digit year\",\n      \"action\": \"added\"\n    },\n    {\n      \"field\": \"summary\",\n      \"oldValue\": null,\n      \"newValue\": \"**Summary of Newborn Care Guideline:** - **Immediate care:** Ensure warmth, prevent heat loss, promote skin-to-skin contact. - **Routine postnatal care:** Monitor wellbeing, feeding, development; conduct screenings; educate parents on bathing, umbilical care, feeding, illness recognition, safe sleep, and immunizations. - **Meconium-stained liquor:** Call neonatologist/advanced neonatal nurse; management varies by baby’s condition. - **Jaundice:** Assess via visual inspection and bilirubin levels; use treatment threshold graphs for phototherapy/exchange transfusion. - **Phototherapy care:** Monitor bilirubin, stop once stable; ensure supine position, hydration, and parental interaction. - **Hypoglycaemia:** Assess risk factors, monitor glucose; treat with glucose gel if symptomatic (irritability, poor feeding, seizures). - **Infections:** Antibiotics (e.g., cefotaxime) based on infection type; duration varies (7–21 days for positive cultures/GBS meningitis). - **GBS management:** Inform parents, document observations; escalate care if abnormal signs appear. - **Late preterm babies:** Monitor weight loss; avoid early discharge to reduce readmission risk. - **Early-onset sepsis risk factors:** Maternal (e.g., chorioamnionitis, GBS) and neonatal (e.g., respiratory distress, poor feeding). Document all care on BadgerNet Maternity\",\n      \"action\": \"added\"\n    }\n  ]\n}",
  "ai_provider": "DeepSeek",
  "ai_model": "deepseek-chat",
  "token_usage": null
}