{
  "prompt": {
    "guidelineId": "cg1129-newborn-feeding-pdf",
    "fieldsProcessed": [
      "humanFriendlyName",
      "organisation",
      "yearProduced",
      "summary"
    ],
    "enhancedFields": 4,
    "contentLength": 4995
  },
  "response": "{\n  \"success\": true,\n  \"enhancedFields\": [\n    {\n      \"field\": \"humanFriendlyName\",\n      \"oldValue\": null,\n      \"newValue\": \"Newborn Feeding Guidelines for Breastfeeding and Formula Support\",\n      \"action\": \"added\"\n    },\n    {\n      \"field\": \"organisation\",\n      \"oldValue\": null,\n      \"newValue\": \"UNICEF\",\n      \"action\": \"added\"\n    },\n    {\n      \"field\": \"yearProduced\",\n      \"oldValue\": null,\n      \"newValue\": \"The text provided does not contain a publication year. If you have another guideline text that includes the year, please share it, and I can extract the 4-digit year for you\",\n      \"action\": \"added\"\n    },\n    {\n      \"field\": \"summary\",\n      \"oldValue\": null,\n      \"newValue\": \"**Summary of Newborn Feeding Guideline:** - **Breastfeeding support** is prioritized, emphasizing **exclusive breastfeeding** for optimal outcomes. **Skin-to-skin contact** post-birth aids initiation. - **Expressing milk early** is advised for mothers separated from their baby. **Responsive feeding** and assessments are critical in the first week. - **Alternative feeding methods** (finger feeding, cup feeding) are used when needed to avoid teat confusion. - **Formula feeding guidance** includes safe preparation, responsive practices, and medical supplementation only when necessary. - **Parent-infant bonding** is encouraged via skin-to-skin contact, rooming-in, and safe sleeping practices (cot by the bed, avoiding sofas). - **Staff responsibilities** include mandatory breastfeeding training, promoting breastfeeding, and addressing feeding problems (e.g., tongue-tie referrals). - **Monitoring & compliance** involve regular weight checks (birth, day 5, day 10), UNICEF BFI audits, and reporting supplementation rates. - **Feeding cues** should be recognized early; avoid unnecessary formula to prevent supply issues or infections. - **Mothers’ choices** are supported, with individualized care plans for supplementation while maintaining breastfeeding where possible\",\n      \"action\": \"added\"\n    }\n  ]\n}",
  "endpoint": "enhanceGuidelineMetadata",
  "timestamp": "2025-06-18T21-49-21",
  "textContent": "AI: DeepSeek (deepseek-chat)\n\nQ: {\n  \"guidelineId\": \"cg1129-newborn-feeding-pdf\",\n  \"fieldsProcessed\": [\n    \"humanFriendlyName\",\n    \"organisation\",\n    \"yearProduced\",\n    \"summary\"\n  ],\n  \"enhancedFields\": 4,\n  \"contentLength\": 4995\n}\n\nA: {\n  \"success\": true,\n  \"enhancedFields\": [\n    {\n      \"field\": \"humanFriendlyName\",\n      \"oldValue\": null,\n      \"newValue\": \"Newborn Feeding Guidelines for Breastfeeding and Formula Support\",\n      \"action\": \"added\"\n    },\n    {\n      \"field\": \"organisation\",\n      \"oldValue\": null,\n      \"newValue\": \"UNICEF\",\n      \"action\": \"added\"\n    },\n    {\n      \"field\": \"yearProduced\",\n      \"oldValue\": null,\n      \"newValue\": \"The text provided does not contain a publication year. If you have another guideline text that includes the year, please share it, and I can extract the 4-digit year for you\",\n      \"action\": \"added\"\n    },\n    {\n      \"field\": \"summary\",\n      \"oldValue\": null,\n      \"newValue\": \"**Summary of Newborn Feeding Guideline:** - **Breastfeeding support** is prioritized, emphasizing **exclusive breastfeeding** for optimal outcomes. **Skin-to-skin contact** post-birth aids initiation. - **Expressing milk early** is advised for mothers separated from their baby. **Responsive feeding** and assessments are critical in the first week. - **Alternative feeding methods** (finger feeding, cup feeding) are used when needed to avoid teat confusion. - **Formula feeding guidance** includes safe preparation, responsive practices, and medical supplementation only when necessary. - **Parent-infant bonding** is encouraged via skin-to-skin contact, rooming-in, and safe sleeping practices (cot by the bed, avoiding sofas). - **Staff responsibilities** include mandatory breastfeeding training, promoting breastfeeding, and addressing feeding problems (e.g., tongue-tie referrals). - **Monitoring & compliance** involve regular weight checks (birth, day 5, day 10), UNICEF BFI audits, and reporting supplementation rates. - **Feeding cues** should be recognized early; avoid unnecessary formula to prevent supply issues or infections. - **Mothers’ choices** are supported, with individualized care plans for supplementation while maintaining breastfeeding where possible\",\n      \"action\": \"added\"\n    }\n  ]\n}",
  "ai_provider": "DeepSeek",
  "ai_model": "deepseek-chat",
  "token_usage": null
}