{
  "prompt": {
    "guidelineId": "cg1129-newborn-feeding-pdf",
    "fieldsProcessed": [
      "humanFriendlyName",
      "organisation",
      "yearProduced",
      "summary"
    ],
    "enhancedFields": 4,
    "contentLength": 4995
  },
  "response": "{\n  \"success\": true,\n  \"enhancedFields\": [\n    {\n      \"field\": \"humanFriendlyName\",\n      \"oldValue\": null,\n      \"newValue\": \"Newborn Feeding and Breastfeeding Support Guidelines\",\n      \"action\": \"added\"\n    },\n    {\n      \"field\": \"organisation\",\n      \"oldValue\": null,\n      \"newValue\": \"UNICEF\",\n      \"action\": \"added\"\n    },\n    {\n      \"field\": \"yearProduced\",\n      \"oldValue\": null,\n      \"newValue\": \"The text provided does not contain a publication year. If you have another guideline text that includes the year, please share it, and I can extract the 4-digit year for you\",\n      \"action\": \"added\"\n    },\n    {\n      \"field\": \"summary\",\n      \"oldValue\": null,\n      \"newValue\": \"**Summary of Newborn Feeding Guideline:** - **Breastfeeding support** is prioritized, emphasizing **exclusive breastfeeding** for optimal outcomes. **Skin-to-skin contact** post-birth aids initiation. - **Expressing milk early** is advised if mother-baby separation occurs. **Safe skin-to-skin practices** must be followed. - **Alternative feeding methods** (finger feeding, cup feeding) are used when needed to avoid teat confusion. - **Formula feeding guidance** includes responsive feeding, safe preparation, and medical supplementation only when necessary. - **Parent-infant bonding** is encouraged via skin-to-skin contact and **rooming-in**. **Feeding assessments** and support plans address challenges. - **Staff responsibilities**: Midwives lead breastfeeding support; all staff receive **mandatory infant feeding training**. Compliance is audited via **UNICEF Baby Friendly Initiative**. - **Monitoring**: Newborns weighed at birth, day 5, and day 10. **Supplementation rates** are tracked to assess care quality. - **Safe sleep practices** are discussed, including avoiding co-sleeping on sofas. - **Referrals** are made for complex breastfeeding issues (e.g., tongue-tie). Incidents are reported via Trust systems. Mothers’ choices are respected, with support provided regardless of feeding method\",\n      \"action\": \"added\"\n    }\n  ]\n}",
  "endpoint": "enhanceGuidelineMetadata",
  "timestamp": "2025-06-18T21-49-30",
  "textContent": "AI: DeepSeek (deepseek-chat)\n\nQ: {\n  \"guidelineId\": \"cg1129-newborn-feeding-pdf\",\n  \"fieldsProcessed\": [\n    \"humanFriendlyName\",\n    \"organisation\",\n    \"yearProduced\",\n    \"summary\"\n  ],\n  \"enhancedFields\": 4,\n  \"contentLength\": 4995\n}\n\nA: {\n  \"success\": true,\n  \"enhancedFields\": [\n    {\n      \"field\": \"humanFriendlyName\",\n      \"oldValue\": null,\n      \"newValue\": \"Newborn Feeding and Breastfeeding Support Guidelines\",\n      \"action\": \"added\"\n    },\n    {\n      \"field\": \"organisation\",\n      \"oldValue\": null,\n      \"newValue\": \"UNICEF\",\n      \"action\": \"added\"\n    },\n    {\n      \"field\": \"yearProduced\",\n      \"oldValue\": null,\n      \"newValue\": \"The text provided does not contain a publication year. If you have another guideline text that includes the year, please share it, and I can extract the 4-digit year for you\",\n      \"action\": \"added\"\n    },\n    {\n      \"field\": \"summary\",\n      \"oldValue\": null,\n      \"newValue\": \"**Summary of Newborn Feeding Guideline:** - **Breastfeeding support** is prioritized, emphasizing **exclusive breastfeeding** for optimal outcomes. **Skin-to-skin contact** post-birth aids initiation. - **Expressing milk early** is advised if mother-baby separation occurs. **Safe skin-to-skin practices** must be followed. - **Alternative feeding methods** (finger feeding, cup feeding) are used when needed to avoid teat confusion. - **Formula feeding guidance** includes responsive feeding, safe preparation, and medical supplementation only when necessary. - **Parent-infant bonding** is encouraged via skin-to-skin contact and **rooming-in**. **Feeding assessments** and support plans address challenges. - **Staff responsibilities**: Midwives lead breastfeeding support; all staff receive **mandatory infant feeding training**. Compliance is audited via **UNICEF Baby Friendly Initiative**. - **Monitoring**: Newborns weighed at birth, day 5, and day 10. **Supplementation rates** are tracked to assess care quality. - **Safe sleep practices** are discussed, including avoiding co-sleeping on sofas. - **Referrals** are made for complex breastfeeding issues (e.g., tongue-tie). Incidents are reported via Trust systems. Mothers’ choices are respected, with support provided regardless of feeding method\",\n      \"action\": \"added\"\n    }\n  ]\n}",
  "ai_provider": "DeepSeek",
  "ai_model": "deepseek-chat",
  "token_usage": null
}