{
  "prompt": {
    "guidelineId": "uhs-intrahepatic-cholestasisicp-protocol-pdf",
    "fieldsProcessed": [
      "humanFriendlyName",
      "organisation",
      "yearProduced",
      "summary"
    ],
    "enhancedFields": 4,
    "contentLength": 2280
  },
  "response": "{\n  \"success\": true,\n  \"enhancedFields\": [\n    {\n      \"field\": \"humanFriendlyName\",\n      \"oldValue\": null,\n      \"newValue\": \"Intrahepatic Cholestasis of Pregnancy Management Guidelines\",\n      \"action\": \"added\"\n    },\n    {\n      \"field\": \"organisation\",\n      \"oldValue\": null,\n      \"newValue\": \"RCOG\",\n      \"action\": \"added\"\n    },\n    {\n      \"field\": \"yearProduced\",\n      \"oldValue\": null,\n      \"newValue\": \"There is no publication year mentioned in the provided text. If you have additional information or a different section of the guideline that includes the year, please share it\",\n      \"action\": \"added\"\n    },\n    {\n      \"field\": \"summary\",\n      \"oldValue\": null,\n      \"newValue\": \"**Summary of Intrahepatic Cholestasis of Pregnancy (ICP) Guideline:** - **Diagnosis:** Suspect ICP in pregnant individuals with pruritus and raised bile acids; confirm postnatally. - **Investigations:** Measure bile acids; additional tests if atypical. - **Management:** - Offer water-soluble vitamin K (10mg) if elevated prothrombin time or fat malabsorption. - Urgent consultant review if bile acids >100 µmol/L. - Plan delivery timing based on severity: 38–39 weeks (moderate), 35–36 weeks (severe). - Continuous fetal monitoring if bile acids ≥100 µmol/L. - **Postnatal Care:** Itch resolves after birth; LFTs normalize within weeks. Check bile acids and LFTs at 4 weeks postpartum; investigate persistent abnormalities. - **Recurrence & Contraception:** Advise recurrence risk; recommend progesterone-only/non-hormonal contraception. Refer for consultant-led care in future pregnancies. - **Audit:** Monitor adherence to birth timing and fetal monitoring recommendations\",\n      \"action\": \"added\"\n    }\n  ]\n}",
  "endpoint": "enhanceGuidelineMetadata",
  "timestamp": "2025-06-18T23-07-05",
  "textContent": "AI: DeepSeek (deepseek-chat)\n\nQ: {\n  \"guidelineId\": \"uhs-intrahepatic-cholestasisicp-protocol-pdf\",\n  \"fieldsProcessed\": [\n    \"humanFriendlyName\",\n    \"organisation\",\n    \"yearProduced\",\n    \"summary\"\n  ],\n  \"enhancedFields\": 4,\n  \"contentLength\": 2280\n}\n\nA: {\n  \"success\": true,\n  \"enhancedFields\": [\n    {\n      \"field\": \"humanFriendlyName\",\n      \"oldValue\": null,\n      \"newValue\": \"Intrahepatic Cholestasis of Pregnancy Management Guidelines\",\n      \"action\": \"added\"\n    },\n    {\n      \"field\": \"organisation\",\n      \"oldValue\": null,\n      \"newValue\": \"RCOG\",\n      \"action\": \"added\"\n    },\n    {\n      \"field\": \"yearProduced\",\n      \"oldValue\": null,\n      \"newValue\": \"There is no publication year mentioned in the provided text. If you have additional information or a different section of the guideline that includes the year, please share it\",\n      \"action\": \"added\"\n    },\n    {\n      \"field\": \"summary\",\n      \"oldValue\": null,\n      \"newValue\": \"**Summary of Intrahepatic Cholestasis of Pregnancy (ICP) Guideline:** - **Diagnosis:** Suspect ICP in pregnant individuals with pruritus and raised bile acids; confirm postnatally. - **Investigations:** Measure bile acids; additional tests if atypical. - **Management:** - Offer water-soluble vitamin K (10mg) if elevated prothrombin time or fat malabsorption. - Urgent consultant review if bile acids >100 µmol/L. - Plan delivery timing based on severity: 38–39 weeks (moderate), 35–36 weeks (severe). - Continuous fetal monitoring if bile acids ≥100 µmol/L. - **Postnatal Care:** Itch resolves after birth; LFTs normalize within weeks. Check bile acids and LFTs at 4 weeks postpartum; investigate persistent abnormalities. - **Recurrence & Contraception:** Advise recurrence risk; recommend progesterone-only/non-hormonal contraception. Refer for consultant-led care in future pregnancies. - **Audit:** Monitor adherence to birth timing and fetal monitoring recommendations\",\n      \"action\": \"added\"\n    }\n  ]\n}",
  "ai_provider": "DeepSeek",
  "ai_model": "deepseek-chat",
  "token_usage": null
}