{
  "prompt": {
    "guidelineId": "p19011-referral-for-low-platelets-in-pregnancy-protocol-pdf",
    "fieldsProcessed": [
      "humanFriendlyName",
      "organisation",
      "yearProduced",
      "summary"
    ],
    "enhancedFields": 4,
    "contentLength": 809
  },
  "response": "{\n  \"success\": true,\n  \"enhancedFields\": [\n    {\n      \"field\": \"humanFriendlyName\",\n      \"oldValue\": null,\n      \"newValue\": \"Low Platelets in Pregnancy Referral Protocol\",\n      \"action\": \"added\"\n    },\n    {\n      \"field\": \"organisation\",\n      \"oldValue\": null,\n      \"newValue\": \"RCOG\",\n      \"action\": \"added\"\n    },\n    {\n      \"field\": \"yearProduced\",\n      \"oldValue\": null,\n      \"newValue\": \"I cannot find a publication year in the provided text. The guideline does not contain a visible 4-digit year\",\n      \"action\": \"added\"\n    },\n    {\n      \"field\": \"summary\",\n      \"oldValue\": null,\n      \"newValue\": \"**Summary of Referral for Low Platelets in Pregnancy Protocol:** This protocol provides a clear referral pathway for managing thrombocytopenia (low platelets) in pregnancy, occurring in 8-10% of cases, often mild but potentially severe. Key recommendations: - **Referral Criteria:** - Urgent referral if platelets <50 (via Joint Haematology and Obstetric Clinic). - Include medical history and prior investigations in referrals. - **Roles:** - Midwives/obstetricians ensure compliance and accessibility. - **Process:** - Contact ANC/labor ward for urgent reviews; liaise with hematologist if needed. - All referrals directed to the Joint Haematology and Obstetric Clinic. Focuses on timely, standardized management to mitigate complications\",\n      \"action\": \"added\"\n    }\n  ]\n}",
  "endpoint": "enhanceGuidelineMetadata",
  "timestamp": "2025-06-18T22-58-11",
  "textContent": "AI: DeepSeek (deepseek-chat)\n\nQ: {\n  \"guidelineId\": \"p19011-referral-for-low-platelets-in-pregnancy-protocol-pdf\",\n  \"fieldsProcessed\": [\n    \"humanFriendlyName\",\n    \"organisation\",\n    \"yearProduced\",\n    \"summary\"\n  ],\n  \"enhancedFields\": 4,\n  \"contentLength\": 809\n}\n\nA: {\n  \"success\": true,\n  \"enhancedFields\": [\n    {\n      \"field\": \"humanFriendlyName\",\n      \"oldValue\": null,\n      \"newValue\": \"Low Platelets in Pregnancy Referral Protocol\",\n      \"action\": \"added\"\n    },\n    {\n      \"field\": \"organisation\",\n      \"oldValue\": null,\n      \"newValue\": \"RCOG\",\n      \"action\": \"added\"\n    },\n    {\n      \"field\": \"yearProduced\",\n      \"oldValue\": null,\n      \"newValue\": \"I cannot find a publication year in the provided text. The guideline does not contain a visible 4-digit year\",\n      \"action\": \"added\"\n    },\n    {\n      \"field\": \"summary\",\n      \"oldValue\": null,\n      \"newValue\": \"**Summary of Referral for Low Platelets in Pregnancy Protocol:** This protocol provides a clear referral pathway for managing thrombocytopenia (low platelets) in pregnancy, occurring in 8-10% of cases, often mild but potentially severe. Key recommendations: - **Referral Criteria:** - Urgent referral if platelets <50 (via Joint Haematology and Obstetric Clinic). - Include medical history and prior investigations in referrals. - **Roles:** - Midwives/obstetricians ensure compliance and accessibility. - **Process:** - Contact ANC/labor ward for urgent reviews; liaise with hematologist if needed. - All referrals directed to the Joint Haematology and Obstetric Clinic. Focuses on timely, standardized management to mitigate complications\",\n      \"action\": \"added\"\n    }\n  ]\n}",
  "ai_provider": "DeepSeek",
  "ai_model": "deepseek-chat",
  "token_usage": null
}