{
  "prompt": {
    "guidelineId": "cg1130-assisted-vaginal-birth-guideline-pdf",
    "fieldsProcessed": [
      "humanFriendlyName",
      "organisation",
      "yearProduced",
      "summary"
    ],
    "enhancedFields": 4,
    "contentLength": 2258
  },
  "response": "{\n  \"success\": true,\n  \"enhancedFields\": [\n    {\n      \"field\": \"humanFriendlyName\",\n      \"oldValue\": null,\n      \"newValue\": \"Assisted Vaginal Birth: Forceps and Vacuum Extraction Guidelines\",\n      \"action\": \"added\"\n    },\n    {\n      \"field\": \"organisation\",\n      \"oldValue\": null,\n      \"newValue\": \"RCOG\",\n      \"action\": \"added\"\n    },\n    {\n      \"field\": \"yearProduced\",\n      \"oldValue\": null,\n      \"newValue\": \"The text you provided does not contain a publication year. If you have another guideline text that includes the year, please share it, and I can extract the 4-digit year for you\",\n      \"action\": \"added\"\n    },\n    {\n      \"field\": \"summary\",\n      \"oldValue\": null,\n      \"newValue\": \"**Summary of Assisted Vaginal Birth Guideline:** - **Instrument choice**: Select the most appropriate instrument (forceps or vacuum) for the first attempt. Vacuum extraction has higher failure rates but less maternal trauma; forceps carry higher maternal risks but lower neonatal risks like cephalohematoma. - **Risk factors for failure**: Mid-cavity/rotational birth, maternal obesity, fetal weight >4000g, occipito-posterior position, short maternal stature, or large fetal head circumference. - **Pre-procedure**: Use ultrasound to confirm fetal head position if uncertain. Administer antibiotics to reduce infection risk. - **Post-birth care**: Monitor for complications, ensure bladder care, thromboprophylaxis, and analgesia. Document thoroughly and provide postnatal follow-up discussions. - **Psychological support**: Offer referral to midwife counselors for traumatic births but avoid single-session, trauma-focused interventions. - **Adverse events**: Units must support families and staff, adhere to duty of candour, and complete incident reports when required. - **Audit**: Monitor compliance with RCOG standards\",\n      \"action\": \"added\"\n    }\n  ]\n}",
  "endpoint": "enhanceGuidelineMetadata",
  "timestamp": "2025-06-18T21-50-10",
  "textContent": "AI: DeepSeek (deepseek-chat)\n\nQ: {\n  \"guidelineId\": \"cg1130-assisted-vaginal-birth-guideline-pdf\",\n  \"fieldsProcessed\": [\n    \"humanFriendlyName\",\n    \"organisation\",\n    \"yearProduced\",\n    \"summary\"\n  ],\n  \"enhancedFields\": 4,\n  \"contentLength\": 2258\n}\n\nA: {\n  \"success\": true,\n  \"enhancedFields\": [\n    {\n      \"field\": \"humanFriendlyName\",\n      \"oldValue\": null,\n      \"newValue\": \"Assisted Vaginal Birth: Forceps and Vacuum Extraction Guidelines\",\n      \"action\": \"added\"\n    },\n    {\n      \"field\": \"organisation\",\n      \"oldValue\": null,\n      \"newValue\": \"RCOG\",\n      \"action\": \"added\"\n    },\n    {\n      \"field\": \"yearProduced\",\n      \"oldValue\": null,\n      \"newValue\": \"The text you provided does not contain a publication year. If you have another guideline text that includes the year, please share it, and I can extract the 4-digit year for you\",\n      \"action\": \"added\"\n    },\n    {\n      \"field\": \"summary\",\n      \"oldValue\": null,\n      \"newValue\": \"**Summary of Assisted Vaginal Birth Guideline:** - **Instrument choice**: Select the most appropriate instrument (forceps or vacuum) for the first attempt. Vacuum extraction has higher failure rates but less maternal trauma; forceps carry higher maternal risks but lower neonatal risks like cephalohematoma. - **Risk factors for failure**: Mid-cavity/rotational birth, maternal obesity, fetal weight >4000g, occipito-posterior position, short maternal stature, or large fetal head circumference. - **Pre-procedure**: Use ultrasound to confirm fetal head position if uncertain. Administer antibiotics to reduce infection risk. - **Post-birth care**: Monitor for complications, ensure bladder care, thromboprophylaxis, and analgesia. Document thoroughly and provide postnatal follow-up discussions. - **Psychological support**: Offer referral to midwife counselors for traumatic births but avoid single-session, trauma-focused interventions. - **Adverse events**: Units must support families and staff, adhere to duty of candour, and complete incident reports when required. - **Audit**: Monitor compliance with RCOG standards\",\n      \"action\": \"added\"\n    }\n  ]\n}",
  "ai_provider": "DeepSeek",
  "ai_model": "deepseek-chat",
  "token_usage": null
}