{
  "prompt": {
    "guidelineId": "cg16016-management-of-pregnancies-with-previous-bariatric-surgery-pdf",
    "fieldsProcessed": [
      "humanFriendlyName",
      "organisation",
      "yearProduced",
      "summary"
    ],
    "enhancedFields": 4,
    "contentLength": 2133
  },
  "response": "{\n  \"success\": true,\n  \"enhancedFields\": [\n    {\n      \"field\": \"humanFriendlyName\",\n      \"oldValue\": null,\n      \"newValue\": \"Pregnancy Care After Bariatric Surgery Guidelines\",\n      \"action\": \"added\"\n    },\n    {\n      \"field\": \"organisation\",\n      \"oldValue\": null,\n      \"newValue\": \"RCOG\",\n      \"action\": \"added\"\n    },\n    {\n      \"field\": \"yearProduced\",\n      \"oldValue\": null,\n      \"newValue\": \"I cannot find a publication year in the provided text. The guideline text does not contain an explicit mention of a 4-digit year\",\n      \"action\": \"added\"\n    },\n    {\n      \"field\": \"summary\",\n      \"oldValue\": null,\n      \"newValue\": \"**Summary:** Pregnant women with prior bariatric surgery require specialized care to mitigate risks. Key recommendations: - **Timing:** Postpone pregnancy until weight stabilizes post-surgery. - **Antenatal Care:** Early booking, nutritional screening (FBC, ferritin), and pregnancy-safe multivitamins (e.g., Pregnacare OD, Seven Seas OD, Forceval OD). Avoid retinol (Vitamin A). Continue pre-pregnancy supplements (calcium, vitamin D, iron, B12). High-dose folate (5mg/day) if BMI >30 or T2DM. - **Monitoring:** Growth scans 4-weekly from 32 weeks; GTT for gestational diabetes screening. - **Anaesthetic Assessment:** Referral in third trimester. - **Complications:** Monitor for internal hernia, hyperemesis, and adhere to BMI-based weight gain guidelines. - **Labor/Postnatal:** Follow specific care recommendations. - **Audit:** Ensure adherence to antenatal protocols\",\n      \"action\": \"added\"\n    }\n  ]\n}",
  "endpoint": "enhanceGuidelineMetadata",
  "timestamp": "2025-06-18T22-10-15",
  "textContent": "AI: DeepSeek (deepseek-chat)\n\nQ: {\n  \"guidelineId\": \"cg16016-management-of-pregnancies-with-previous-bariatric-surgery-pdf\",\n  \"fieldsProcessed\": [\n    \"humanFriendlyName\",\n    \"organisation\",\n    \"yearProduced\",\n    \"summary\"\n  ],\n  \"enhancedFields\": 4,\n  \"contentLength\": 2133\n}\n\nA: {\n  \"success\": true,\n  \"enhancedFields\": [\n    {\n      \"field\": \"humanFriendlyName\",\n      \"oldValue\": null,\n      \"newValue\": \"Pregnancy Care After Bariatric Surgery Guidelines\",\n      \"action\": \"added\"\n    },\n    {\n      \"field\": \"organisation\",\n      \"oldValue\": null,\n      \"newValue\": \"RCOG\",\n      \"action\": \"added\"\n    },\n    {\n      \"field\": \"yearProduced\",\n      \"oldValue\": null,\n      \"newValue\": \"I cannot find a publication year in the provided text. The guideline text does not contain an explicit mention of a 4-digit year\",\n      \"action\": \"added\"\n    },\n    {\n      \"field\": \"summary\",\n      \"oldValue\": null,\n      \"newValue\": \"**Summary:** Pregnant women with prior bariatric surgery require specialized care to mitigate risks. Key recommendations: - **Timing:** Postpone pregnancy until weight stabilizes post-surgery. - **Antenatal Care:** Early booking, nutritional screening (FBC, ferritin), and pregnancy-safe multivitamins (e.g., Pregnacare OD, Seven Seas OD, Forceval OD). Avoid retinol (Vitamin A). Continue pre-pregnancy supplements (calcium, vitamin D, iron, B12). High-dose folate (5mg/day) if BMI >30 or T2DM. - **Monitoring:** Growth scans 4-weekly from 32 weeks; GTT for gestational diabetes screening. - **Anaesthetic Assessment:** Referral in third trimester. - **Complications:** Monitor for internal hernia, hyperemesis, and adhere to BMI-based weight gain guidelines. - **Labor/Postnatal:** Follow specific care recommendations. - **Audit:** Ensure adherence to antenatal protocols\",\n      \"action\": \"added\"\n    }\n  ]\n}",
  "ai_provider": "DeepSeek",
  "ai_model": "deepseek-chat",
  "token_usage": null
}