{
  "prompt": {
    "prompt": "Original Transcript:\n29 years old tarot one nurses their inspection for sepsis and labor and 2023  current gestation 30 weeks and three days body mass index of 24 but group a positive VVC Council by Mr amtoo and  15 weeks regarding  associated risks of low pregnancies associated plasma protein a  it was impression's clinic with Harley Robertson at 23 weeks and one day and decided regarding motor delivery  routine discussed  20  four weeks with  no decisions delivery  phone engine may see  reviewed a 31 weeks leaning towards Jennifer in section and decided is the weather would accept induction of labor  worked for birth options kind of get 39 weeks with membrane suite and/or induction major by artificial membrane  growth that is appropriate for the gestational age with normal growth philosophy\n\nGuideline Analysis:\n### CG20013 Preterm birth risk pathway\n\nGiven the lack of available guideline content (CG20013 Preterm birth risk pathway), it is impossible to perform a meaningful analysis or provide specific recommendations for improving the clinical note's alignment with the guideline. The clinical note itself is also highly fragmented and difficult to interpret, which further complicates the analysis.  \n\nTo proceed, the following would be required:  \n1. **Complete guideline content** (CG20013) to reference specific recommendations.  \n2. **A clearer, structured clinical note** to assess adherence to the guideline.  \n\n### Very Important Recommendations  \n**Additional information needed** - Obtain and review the full CG20013 guideline to assess compliance.  \nReason: Without the guideline content, no meaningful analysis can be performed.  \n\n**Different management plan** - Clarify and structure the clinical note to ensure accurate interpretation.  \nReason: The current note is disjointed and contains unclear phrasing, making it difficult to assess adherence to any guideline.  \n\nWould you be able to provide the full guideline text or a more structured clinical note for proper analysis?\n\n\n## Summary\n\nAnalyzed against the most relevant guideline successfully.\n\n*Note: Found 198 relevant guidelines total, analyzed against the most relevant one.*\n\n\nGuideline: CG20013 Preterm birth risk pathway\n\n\nFull Guideline Content:\nSummary: The document provides guidance for the diagnosis and management of pregnant individuals at risk of preterm birth, aiming to improve outcomes for both mother and baby. It includes information on risk factors, definitions, and responsibilities of medical staff.\n\nGroup B Streptococcal colonization is normally seen in up to 25% of inner-city populations and is not an indication for antepartum treatment unless accompanied by symptomatic discharge or bacteriuria. Urinary tract infection (UTI) including asymptomatic bacteriuria, cystitis, and pyelonephritis should be treated as per Microguide. Systemic bacteraemia, cervical incompetence, uterine capacity, and placentation are all factors associated with preterm birth. Screening and intervention tailored to specific risk factors are important for the prevention of preterm labor. Risk factors such as smoking, maternal age, domestic violence, and vaginal infections should be identified and addressed. Referral to the Preterm Prevention Clinic is necessary for high-risk individuals with factors such as previous preterm birth or cervical incompetence. Prevention of preterm birth in high-risk individuals may involve interventions such as cervical cerclage, progesterone, and pessaries. Transvaginal sonography and quantitative fetal fibronectin can be used to assess risk and determine appropriate interventions. Care must be individualized and involve discussions with healthcare providers to determine the most suitable treatment options.\n\n8.4.4 Performing the analysis\n\n- Insert the rapid fFN cassette into the analyzer and follow the on-screen instructions.\n- Enter your user ID and patient ID as instructed.\n- Pipette 200Î¼L sample into the well of the rapid fFN cassette.\n- Wait for the analyzer to run the test and print out the results.\n\n8.4.5 Interpreting the results\n\n- A negative fFN result has a negative predictive value for birth within 14 days and delivery before 34 weeks.\n- Management decisions for negative results will be made by the consultant or middle grade.\n- Education on signs of preterm labor will be provided to all with a negative test.\n- Positive test results will lead to specific management protocols.\n- Special Care Baby Unit will be notified for positive test patients.\n- Consideration of corticosteroid prophylaxis and tocolysis will be made based on test results.\n- A plan of care will be decided if birth does not occur within 7 days.\n\n8.4.6 The QUiPP App\n\n- The QUiPP app can be used in connection with the fFN test to predict the risk of preterm labor.\n\n9.0 Diagnosis of preterm labor\n\n- Diagnosis is based on regular contractions and cervical changes.\n- A negative fFN test may indicate a low likelihood of preterm labor.\n- Emergency cervical cerclage is not recommended in certain cases.\n\n10.0 Emergency cervical cerclage\n\n- Emergency cervical cerclage is considered for specific cases between 16+0 and 27+6 weeks of pregnancy.\n\n11.0 Counseling the family\n\n- Counseling should cover neonatal care, possible consequences of prematurity, and opportunities for discussion with specialists.\n\n12.0 Corticosteroid prophylaxis\n\n- Antenatal corticosteroids should be offered in suspected or established preterm labor.\n- Considerations for repeat corticosteroid courses are based on gestational age and risk factors.\n\n13.0 Tocolysis\n\n- Tocolysis may be considered to prolong pregnancy in specific cases, such as completing a course of corticosteroids.\n\nPreterm labor without recent corticosteroid prophylaxis should consider tocolysis, taking into account various factors. Nifedipine is the first choice, with specific dosing instructions. Contraindications to tocolysis and Nifedipine should be considered. Magnesium Sulfate can be used for neuroprotection in preterm labor, with specific dosing and monitoring guidelines. In cases of preterm prelabour rupture of membranes, infection should be identified using a combination of tests. Admission may be offered for P-PROM before 37 weeks gestation.\n\n- Take FBC, CRP, HVS to rule out GBS \n- Maternal observations every 4 hours \n- CTG twice daily \n- Ultrasound for growth and amniotic fluid \n- Administer oral Erythromycin or Penicillin \n- IV Benzylpenicillin in labor \n- Consult named Consultant \n- Outpatient monitoring: CTG, FBC, CRP, LVS, temperature monitoring, scan as needed \n- Contact medical staff if unwell \n- Admission and antibiotics for chorioamnionitis \n- Management of Penicillin allergy \n- Induction of labor for PPROM after 24 weeks \n- Preterm labor management considerations \n- Fetal monitoring discussions \n- Avoid fetal scalp electrode before 34 weeks \n- Management of preterm birth \n- Mode of birth counseling \n- Timing of cord clamping \n- In utero transfer when necessary\n\nIt is safe to arrange in utero transfer to an obstetric unit with Level 2/3 neonatal unit. SCBU is closed. Pregnant women and people with a singleton pregnancy at risk of preterm birth should have documented evidence of involvement with a Paediatrician and Consultant Obstetrician. Antenatal corticosteroids should be considered up to 34+6 weeks gestation. Magnesium Sulfate for neuroprotection should be discussed and offered based on gestational age. Pregnant women and people with PROM before 37+0 weeks should be prescribed oral Erythromycin. Discussions of risks and benefits should be documented when offering antenatal corticosteroids. Actim PROM test should be used for suspected PPROM. Signs and symptoms of preterm labor should prompt urgent review and appropriate management. Tocolysis, vaginal progesterone, and cervical cerclage should be considered. Magnesium Sulfate should be administered based on gestational age and contraindications. Intrauterine transfer should be considered if necessary. Monitoring and observation should be conducted during and after administration of Magnesium Sulfate.\n\nPP  \nTo access on a desktop  \nGoogle Play  App Store  \nApple App Store  \n \nPerinatal Management of Extreme Preterm Birth Before 27 weeks of Gestation (2019) A BAPM Framework for Practice  \n \n2020-10 SECAmb Suspected Preterm Labour Guidance v0.0.1.pdf  \nCG20013 Preterm Birth Risk Pathway (Guideline) v2.1 Oct 2022 Page 42 of 42  \nPlease check against the intranet that this printout is the most recent version of this document.  \nAppendix 6: Antenatal Corticosteroids to reduce neonatal morbidity and mortality\n\nPlease extract actionable suggestions from this analysis and format them as specified. For each suggestion, include detailed context with relevant quoted text from the guideline to help the user understand the reasoning behind the recommendation.",
    "system_prompt": "You are a medical AI assistant that converts clinical guideline analysis into structured, actionable suggestions. \n\nYour task is to analyze the provided guideline analysis and extract specific, actionable suggestions that can be presented to the user for acceptance, rejection, or modification.\n\nCRITICAL CLINICAL REASONING REQUIREMENTS:\n- You must first understand the specific clinical scenario and current diagnosis from the transcript\n- Carefully assess whether each potential recommendation is APPROPRIATE and INDICATED for this specific case\n- Apply the fundamental principle: \"Will this investigation or intervention change management or improve patient care in this specific scenario?\"\n- Consider the clinical context: is this an acute emergency, established diagnosis, or uncertain diagnostic situation?\n- Distinguish between situations where additional testing is needed vs. where diagnosis is already established\n- Only recommend interventions that would genuinely improve patient care in THIS specific scenario\n\nGENERAL CLINICAL APPROPRIATENESS PRINCIPLES:\n- Do NOT suggest diagnostic investigations when the diagnosis is already established through adequate clinical and/or imaging findings\n- Do NOT recommend interventions that conflict with the current evidence-based management plan\n- Do NOT suggest serial monitoring of biomarkers when the clinical picture and imaging provide sufficient diagnostic certainty\n- Consider whether additional investigations would actually change the management approach\n- Evaluate the timing: is this the appropriate point in the clinical course for this intervention?\n- Apply cost-benefit analysis: does the potential benefit justify the intervention in this specific case?\n\nFor each suggestion you identify, return ONLY a valid JSON object with the following structure:\n{\n  \"suggestions\": [\n    {\n      \"id\": \"1\",\n      \"originalText\": \"text from transcript that needs changing OR description of missing element\",\n      \"suggestedText\": \"proposed replacement text\",\n      \"context\": \"detailed explanation of why this change is suggested, including relevant quoted text from the guideline in quotation marks, and confirmation that this recommendation is appropriate for the specific clinical scenario\",\n      \"category\": \"addition|modification|deletion|formatting\",\n      \"priority\": \"high|medium|low\",\n      \"guidelineReference\": \"specific guideline section or rule\"\n    }\n  ]\n}\n\nCRITICAL FORMATTING REQUIREMENTS:\n- Return ONLY the JSON object - no markdown code blocks, no explanatory text\n- Do not wrap the JSON in ```json or ``` blocks\n- Start your response directly with { and end with }\n- Use sequential numeric IDs starting from \"1\"\n- Ensure all JSON is properly formatted and valid\n\nImportant guidelines for originalText field:\n- For MODIFICATIONS: Use the exact text from the transcript that needs to be changed\n- For ADDITIONS (missing elements): Use descriptive text like \"Missing: cervical length screening documentation\" or \"Gap: no discussion of antenatal corticosteroids\"\n- DO NOT use phrases like \"no additional cervical length screening ordered\" unless those exact words appear in the transcript\n- For missing elements, be clear that you're identifying an absence, not quoting existing text\n\nImportant guidelines for context field:\n- Provide detailed explanations including WHY the change is needed AND why it's appropriate for this specific case\n- Include specific quoted text from the guideline using quotation marks (e.g., \"According to the guideline: 'All women should receive screening for...'\")\n- Reference specific guideline recommendations or requirements\n- Explain the clinical rationale behind the suggestion\n- EXPLICITLY state why this recommendation is indicated in this particular clinical scenario\n- Make the context informative and educational\n\nOther important guidelines:\n- Only suggest changes that are explicitly supported by the guideline analysis AND clinically appropriate for the specific scenario\n- Make suggestions specific and actionable\n- For modifications, ensure original text selections are precise and findable in the transcript\n- Prioritize suggestions based on clinical importance and appropriateness\n- If no clinically appropriate suggestions can be made, return {\"suggestions\": []}\n- When in doubt about appropriateness, err on the side of NOT making the suggestion",
    "transcript_length": 782,
    "analysis_length": 1345,
    "guideline_id": "cg20013-preterm-birth-risk-pathway-pdf",
    "guideline_title": "CG20013 Preterm birth risk pathway"
  },
  "response": "{\n  \"suggestions\": [\n    {\n      \"id\": \"1\",\n      \"originalText\": \"Missing: documentation of Group B Streptococcus (GBS) management plan\",\n      \"suggestedText\": \"Document GBS status and management plan, including intrapartum antibiotic prophylaxis if indicated\",\n      \"context\": \"The guideline states: 'Group B Streptococcal colonization...is not an indication for antepartum treatment unless accompanied by symptomatic discharge or bacteriuria.' Since the patient is GBS positive, documentation should confirm whether symptomatic treatment was needed and plan for intrapartum prophylaxis. This is clinically important as GBS status directly impacts delivery management.\",\n      \"category\": \"addition\",\n      \"priority\": \"high\",\n      \"guidelineReference\": \"Group B Streptococcal colonization section\"\n    },\n    {\n      \"id\": \"2\",\n      \"originalText\": \"Missing: preterm birth risk assessment documentation\",\n      \"suggestedText\": \"Document formal preterm birth risk assessment including cervical length measurement and fetal fibronectin testing if indicated\",\n      \"context\": \"The guideline recommends: 'Screening and intervention tailored to specific risk factors are important for prevention of preterm labor.' At 30+3 weeks with previous preterm birth concerns, this patient requires proper risk stratification. 'Transvaginal sonography and quantitative fetal fibronectin can be used to assess risk' per the guideline.\",\n      \"category\": \"addition\",\n      \"priority\": \"high\",\n      \"guidelineReference\": \"Screening and intervention section\"\n    },\n    {\n      \"id\": \"3\",\n      \"originalText\": \"Missing: antenatal corticosteroids discussion\",\n      \"suggestedText\": \"Document discussion of antenatal corticosteroids given gestational age of 30+3 weeks\",\n      \"context\": \"The guideline states: 'Antenatal corticosteroids should be offered in suspected or established preterm labor' and should be 'considered up to 34+6 weeks gestation.' This patient is in the key gestational window where corticosteroids would be beneficial if delivery seems likely.\",\n      \"category\": \"addition\",\n      \"priority\": \"high\",\n      \"guidelineReference\": \"12.0 Corticosteroid prophylaxis\"\n    },\n    {\n      \"id\": \"4\",\n      \"originalText\": \"Missing: magnesium sulfate neuroprotection discussion\",\n      \"suggestedText\": \"Document discussion of magnesium sulfate for neuroprotection if preterm delivery appears imminent\",\n      \"context\": \"The guideline recommends: 'Magnesium Sulfate for neuroprotection should be discussed and offered based on gestational age.' For this patient at 30+3 weeks, this is a time-sensitive intervention that should be considered if delivery seems likely within 24 hours.\",\n      \"category\": \"addition\",\n      \"priority\": \"medium\",\n      \"guidelineReference\": \"Magnesium Sulfate neuroprotection section\"\n    },\n    {\n      \"id\": \"5\",\n      \"originalText\": \"routine discussed 20 four weeks with no decisions delivery\",\n      \"suggestedText\": \"Documented clear birth plan including contingencies for preterm delivery\",\n      \"context\": \"The guideline emphasizes: 'A plan of care will be decided if birth does not occur within 7 days.' The current documentation is unclear about delivery planning. At 30+3 weeks with preterm birth concerns, a clear documented plan is essential for coordinated care.\",\n      \"category\": \"modification\",\n      \"priority\": \"high\",\n      \"guidelineReference\": \"8.4.5 Interpreting the results\"\n    },\n    {\n      \"id\": \"6\",\n      \"originalText\": \"Missing: pediatric consultation documentation\",\n      \"suggestedText\": \"Document consultation with pediatric team regarding potential preterm delivery\",\n      \"context\": \"The guideline requires: 'Pregnant women...at risk of preterm birth should have documented evidence of involvement with a Paediatrician.' This is particularly important at 30+3 weeks to prepare for potential neonatal resuscitation needs.\",\n      \"category\": \"addition\",\n      \"priority\": \"high\",\n      \"guidelineReference\": \"Documentation requirements section\"\n    }\n  ]\n}",
  "endpoint": "dynamicAdvice",
  "timestamp": "2025-06-22T15-47-33",
  "textContent": "AI: DeepSeek (deepseek-chat)\n\nQ: {\n  \"prompt\": \"Original Transcript:\\n29 years old tarot one nurses their inspection for sepsis and labor and 2023  current gestation 30 weeks and three days body mass index of 24 but group a positive VVC Council by Mr amtoo and  15 weeks regarding  associated risks of low pregnancies associated plasma protein a  it was impression's clinic with Harley Robertson at 23 weeks and one day and decided regarding motor delivery  routine discussed  20  four weeks with  no decisions delivery  phone engine may see  reviewed a 31 weeks leaning towards Jennifer in section and decided is the weather would accept induction of labor  worked for birth options kind of get 39 weeks with membrane suite and/or induction major by artificial membrane  growth that is appropriate for the gestational age with normal growth philosophy\\n\\nGuideline Analysis:\\n### CG20013 Preterm birth risk pathway\\n\\nGiven the lack of available guideline content (CG20013 Preterm birth risk pathway), it is impossible to perform a meaningful analysis or provide specific recommendations for improving the clinical note's alignment with the guideline. The clinical note itself is also highly fragmented and difficult to interpret, which further complicates the analysis.  \\n\\nTo proceed, the following would be required:  \\n1. **Complete guideline content** (CG20013) to reference specific recommendations.  \\n2. **A clearer, structured clinical note** to assess adherence to the guideline.  \\n\\n### Very Important Recommendations  \\n**Additional information needed** - Obtain and review the full CG20013 guideline to assess compliance.  \\nReason: Without the guideline content, no meaningful analysis can be performed.  \\n\\n**Different management plan** - Clarify and structure the clinical note to ensure accurate interpretation.  \\nReason: The current note is disjointed and contains unclear phrasing, making it difficult to assess adherence to any guideline.  \\n\\nWould you be able to provide the full guideline text or a more structured clinical note for proper analysis?\\n\\n\\n## Summary\\n\\nAnalyzed against the most relevant guideline successfully.\\n\\n*Note: Found 198 relevant guidelines total, analyzed against the most relevant one.*\\n\\n\\nGuideline: CG20013 Preterm birth risk pathway\\n\\n\\nFull Guideline Content:\\nSummary: The document provides guidance for the diagnosis and management of pregnant individuals at risk of preterm birth, aiming to improve outcomes for both mother and baby. It includes information on risk factors, definitions, and responsibilities of medical staff.\\n\\nGroup B Streptococcal colonization is normally seen in up to 25% of inner-city populations and is not an indication for antepartum treatment unless accompanied by symptomatic discharge or bacteriuria. Urinary tract infection (UTI) including asymptomatic bacteriuria, cystitis, and pyelonephritis should be treated as per Microguide. Systemic bacteraemia, cervical incompetence, uterine capacity, and placentation are all factors associated with preterm birth. Screening and intervention tailored to specific risk factors are important for the prevention of preterm labor. Risk factors such as smoking, maternal age, domestic violence, and vaginal infections should be identified and addressed. Referral to the Preterm Prevention Clinic is necessary for high-risk individuals with factors such as previous preterm birth or cervical incompetence. Prevention of preterm birth in high-risk individuals may involve interventions such as cervical cerclage, progesterone, and pessaries. Transvaginal sonography and quantitative fetal fibronectin can be used to assess risk and determine appropriate interventions. Care must be individualized and involve discussions with healthcare providers to determine the most suitable treatment options.\\n\\n8.4.4 Performing the analysis\\n\\n- Insert the rapid fFN cassette into the analyzer and follow the on-screen instructions.\\n- Enter your user ID and patient ID as instructed.\\n- Pipette 200Î¼L sample into the well of the rapid fFN cassette.\\n- Wait for the analyzer to run the test and print out the results.\\n\\n8.4.5 Interpreting the results\\n\\n- A negative fFN result has a negative predictive value for birth within 14 days and delivery before 34 weeks.\\n- Management decisions for negative results will be made by the consultant or middle grade.\\n- Education on signs of preterm labor will be provided to all with a negative test.\\n- Positive test results will lead to specific management protocols.\\n- Special Care Baby Unit will be notified for positive test patients.\\n- Consideration of corticosteroid prophylaxis and tocolysis will be made based on test results.\\n- A plan of care will be decided if birth does not occur within 7 days.\\n\\n8.4.6 The QUiPP App\\n\\n- The QUiPP app can be used in connection with the fFN test to predict the risk of preterm labor.\\n\\n9.0 Diagnosis of preterm labor\\n\\n- Diagnosis is based on regular contractions and cervical changes.\\n- A negative fFN test may indicate a low likelihood of preterm labor.\\n- Emergency cervical cerclage is not recommended in certain cases.\\n\\n10.0 Emergency cervical cerclage\\n\\n- Emergency cervical cerclage is considered for specific cases between 16+0 and 27+6 weeks of pregnancy.\\n\\n11.0 Counseling the family\\n\\n- Counseling should cover neonatal care, possible consequences of prematurity, and opportunities for discussion with specialists.\\n\\n12.0 Corticosteroid prophylaxis\\n\\n- Antenatal corticosteroids should be offered in suspected or established preterm labor.\\n- Considerations for repeat corticosteroid courses are based on gestational age and risk factors.\\n\\n13.0 Tocolysis\\n\\n- Tocolysis may be considered to prolong pregnancy in specific cases, such as completing a course of corticosteroids.\\n\\nPreterm labor without recent corticosteroid prophylaxis should consider tocolysis, taking into account various factors. Nifedipine is the first choice, with specific dosing instructions. Contraindications to tocolysis and Nifedipine should be considered. Magnesium Sulfate can be used for neuroprotection in preterm labor, with specific dosing and monitoring guidelines. In cases of preterm prelabour rupture of membranes, infection should be identified using a combination of tests. Admission may be offered for P-PROM before 37 weeks gestation.\\n\\n- Take FBC, CRP, HVS to rule out GBS \\n- Maternal observations every 4 hours \\n- CTG twice daily \\n- Ultrasound for growth and amniotic fluid \\n- Administer oral Erythromycin or Penicillin \\n- IV Benzylpenicillin in labor \\n- Consult named Consultant \\n- Outpatient monitoring: CTG, FBC, CRP, LVS, temperature monitoring, scan as needed \\n- Contact medical staff if unwell \\n- Admission and antibiotics for chorioamnionitis \\n- Management of Penicillin allergy \\n- Induction of labor for PPROM after 24 weeks \\n- Preterm labor management considerations \\n- Fetal monitoring discussions \\n- Avoid fetal scalp electrode before 34 weeks \\n- Management of preterm birth \\n- Mode of birth counseling \\n- Timing of cord clamping \\n- In utero transfer when necessary\\n\\nIt is safe to arrange in utero transfer to an obstetric unit with Level 2/3 neonatal unit. SCBU is closed. Pregnant women and people with a singleton pregnancy at risk of preterm birth should have documented evidence of involvement with a Paediatrician and Consultant Obstetrician. Antenatal corticosteroids should be considered up to 34+6 weeks gestation. Magnesium Sulfate for neuroprotection should be discussed and offered based on gestational age. Pregnant women and people with PROM before 37+0 weeks should be prescribed oral Erythromycin. Discussions of risks and benefits should be documented when offering antenatal corticosteroids. Actim PROM test should be used for suspected PPROM. Signs and symptoms of preterm labor should prompt urgent review and appropriate management. Tocolysis, vaginal progesterone, and cervical cerclage should be considered. Magnesium Sulfate should be administered based on gestational age and contraindications. Intrauterine transfer should be considered if necessary. Monitoring and observation should be conducted during and after administration of Magnesium Sulfate.\\n\\nPP  \\nTo access on a desktop  \\nGoogle Play  App Store  \\nApple App Store  \\n \\nPerinatal Management of Extreme Preterm Birth Before 27 weeks of Gestation (2019) A BAPM Framework for Practice  \\n \\n2020-10 SECAmb Suspected Preterm Labour Guidance v0.0.1.pdf  \\nCG20013 Preterm Birth Risk Pathway (Guideline) v2.1 Oct 2022 Page 42 of 42  \\nPlease check against the intranet that this printout is the most recent version of this document.  \\nAppendix 6: Antenatal Corticosteroids to reduce neonatal morbidity and mortality\\n\\nPlease extract actionable suggestions from this analysis and format them as specified. For each suggestion, include detailed context with relevant quoted text from the guideline to help the user understand the reasoning behind the recommendation.\",\n  \"system_prompt\": \"You are a medical AI assistant that converts clinical guideline analysis into structured, actionable suggestions. \\n\\nYour task is to analyze the provided guideline analysis and extract specific, actionable suggestions that can be presented to the user for acceptance, rejection, or modification.\\n\\nCRITICAL CLINICAL REASONING REQUIREMENTS:\\n- You must first understand the specific clinical scenario and current diagnosis from the transcript\\n- Carefully assess whether each potential recommendation is APPROPRIATE and INDICATED for this specific case\\n- Apply the fundamental principle: \\\"Will this investigation or intervention change management or improve patient care in this specific scenario?\\\"\\n- Consider the clinical context: is this an acute emergency, established diagnosis, or uncertain diagnostic situation?\\n- Distinguish between situations where additional testing is needed vs. where diagnosis is already established\\n- Only recommend interventions that would genuinely improve patient care in THIS specific scenario\\n\\nGENERAL CLINICAL APPROPRIATENESS PRINCIPLES:\\n- Do NOT suggest diagnostic investigations when the diagnosis is already established through adequate clinical and/or imaging findings\\n- Do NOT recommend interventions that conflict with the current evidence-based management plan\\n- Do NOT suggest serial monitoring of biomarkers when the clinical picture and imaging provide sufficient diagnostic certainty\\n- Consider whether additional investigations would actually change the management approach\\n- Evaluate the timing: is this the appropriate point in the clinical course for this intervention?\\n- Apply cost-benefit analysis: does the potential benefit justify the intervention in this specific case?\\n\\nFor each suggestion you identify, return ONLY a valid JSON object with the following structure:\\n{\\n  \\\"suggestions\\\": [\\n    {\\n      \\\"id\\\": \\\"1\\\",\\n      \\\"originalText\\\": \\\"text from transcript that needs changing OR description of missing element\\\",\\n      \\\"suggestedText\\\": \\\"proposed replacement text\\\",\\n      \\\"context\\\": \\\"detailed explanation of why this change is suggested, including relevant quoted text from the guideline in quotation marks, and confirmation that this recommendation is appropriate for the specific clinical scenario\\\",\\n      \\\"category\\\": \\\"addition|modification|deletion|formatting\\\",\\n      \\\"priority\\\": \\\"high|medium|low\\\",\\n      \\\"guidelineReference\\\": \\\"specific guideline section or rule\\\"\\n    }\\n  ]\\n}\\n\\nCRITICAL FORMATTING REQUIREMENTS:\\n- Return ONLY the JSON object - no markdown code blocks, no explanatory text\\n- Do not wrap the JSON in ```json or ``` blocks\\n- Start your response directly with { and end with }\\n- Use sequential numeric IDs starting from \\\"1\\\"\\n- Ensure all JSON is properly formatted and valid\\n\\nImportant guidelines for originalText field:\\n- For MODIFICATIONS: Use the exact text from the transcript that needs to be changed\\n- For ADDITIONS (missing elements): Use descriptive text like \\\"Missing: cervical length screening documentation\\\" or \\\"Gap: no discussion of antenatal corticosteroids\\\"\\n- DO NOT use phrases like \\\"no additional cervical length screening ordered\\\" unless those exact words appear in the transcript\\n- For missing elements, be clear that you're identifying an absence, not quoting existing text\\n\\nImportant guidelines for context field:\\n- Provide detailed explanations including WHY the change is needed AND why it's appropriate for this specific case\\n- Include specific quoted text from the guideline using quotation marks (e.g., \\\"According to the guideline: 'All women should receive screening for...'\\\")\\n- Reference specific guideline recommendations or requirements\\n- Explain the clinical rationale behind the suggestion\\n- EXPLICITLY state why this recommendation is indicated in this particular clinical scenario\\n- Make the context informative and educational\\n\\nOther important guidelines:\\n- Only suggest changes that are explicitly supported by the guideline analysis AND clinically appropriate for the specific scenario\\n- Make suggestions specific and actionable\\n- For modifications, ensure original text selections are precise and findable in the transcript\\n- Prioritize suggestions based on clinical importance and appropriateness\\n- If no clinically appropriate suggestions can be made, return {\\\"suggestions\\\": []}\\n- When in doubt about appropriateness, err on the side of NOT making the suggestion\",\n  \"transcript_length\": 782,\n  \"analysis_length\": 1345,\n  \"guideline_id\": \"cg20013-preterm-birth-risk-pathway-pdf\",\n  \"guideline_title\": \"CG20013 Preterm birth risk pathway\"\n}\n\nA: {\n  \"suggestions\": [\n    {\n      \"id\": \"1\",\n      \"originalText\": \"Missing: documentation of Group B Streptococcus (GBS) management plan\",\n      \"suggestedText\": \"Document GBS status and management plan, including intrapartum antibiotic prophylaxis if indicated\",\n      \"context\": \"The guideline states: 'Group B Streptococcal colonization...is not an indication for antepartum treatment unless accompanied by symptomatic discharge or bacteriuria.' Since the patient is GBS positive, documentation should confirm whether symptomatic treatment was needed and plan for intrapartum prophylaxis. This is clinically important as GBS status directly impacts delivery management.\",\n      \"category\": \"addition\",\n      \"priority\": \"high\",\n      \"guidelineReference\": \"Group B Streptococcal colonization section\"\n    },\n    {\n      \"id\": \"2\",\n      \"originalText\": \"Missing: preterm birth risk assessment documentation\",\n      \"suggestedText\": \"Document formal preterm birth risk assessment including cervical length measurement and fetal fibronectin testing if indicated\",\n      \"context\": \"The guideline recommends: 'Screening and intervention tailored to specific risk factors are important for prevention of preterm labor.' At 30+3 weeks with previous preterm birth concerns, this patient requires proper risk stratification. 'Transvaginal sonography and quantitative fetal fibronectin can be used to assess risk' per the guideline.\",\n      \"category\": \"addition\",\n      \"priority\": \"high\",\n      \"guidelineReference\": \"Screening and intervention section\"\n    },\n    {\n      \"id\": \"3\",\n      \"originalText\": \"Missing: antenatal corticosteroids discussion\",\n      \"suggestedText\": \"Document discussion of antenatal corticosteroids given gestational age of 30+3 weeks\",\n      \"context\": \"The guideline states: 'Antenatal corticosteroids should be offered in suspected or established preterm labor' and should be 'considered up to 34+6 weeks gestation.' This patient is in the key gestational window where corticosteroids would be beneficial if delivery seems likely.\",\n      \"category\": \"addition\",\n      \"priority\": \"high\",\n      \"guidelineReference\": \"12.0 Corticosteroid prophylaxis\"\n    },\n    {\n      \"id\": \"4\",\n      \"originalText\": \"Missing: magnesium sulfate neuroprotection discussion\",\n      \"suggestedText\": \"Document discussion of magnesium sulfate for neuroprotection if preterm delivery appears imminent\",\n      \"context\": \"The guideline recommends: 'Magnesium Sulfate for neuroprotection should be discussed and offered based on gestational age.' For this patient at 30+3 weeks, this is a time-sensitive intervention that should be considered if delivery seems likely within 24 hours.\",\n      \"category\": \"addition\",\n      \"priority\": \"medium\",\n      \"guidelineReference\": \"Magnesium Sulfate neuroprotection section\"\n    },\n    {\n      \"id\": \"5\",\n      \"originalText\": \"routine discussed 20 four weeks with no decisions delivery\",\n      \"suggestedText\": \"Documented clear birth plan including contingencies for preterm delivery\",\n      \"context\": \"The guideline emphasizes: 'A plan of care will be decided if birth does not occur within 7 days.' The current documentation is unclear about delivery planning. At 30+3 weeks with preterm birth concerns, a clear documented plan is essential for coordinated care.\",\n      \"category\": \"modification\",\n      \"priority\": \"high\",\n      \"guidelineReference\": \"8.4.5 Interpreting the results\"\n    },\n    {\n      \"id\": \"6\",\n      \"originalText\": \"Missing: pediatric consultation documentation\",\n      \"suggestedText\": \"Document consultation with pediatric team regarding potential preterm delivery\",\n      \"context\": \"The guideline requires: 'Pregnant women...at risk of preterm birth should have documented evidence of involvement with a Paediatrician.' This is particularly important at 30+3 weeks to prepare for potential neonatal resuscitation needs.\",\n      \"category\": \"addition\",\n      \"priority\": \"high\",\n      \"guidelineReference\": \"Documentation requirements section\"\n    }\n  ]\n}\n\n--- Token Usage Report ---\nPrompt tokens: 2559\nCompletion tokens: 839\nTotal tokens: 3398\nEstimated cost: $0.001699",
  "ai_provider": "DeepSeek",
  "ai_model": "deepseek-chat",
  "token_usage": {
    "prompt_tokens": 2559,
    "completion_tokens": 839,
    "total_tokens": 3398,
    "estimated_cost_usd": 0.001699
  }
}