{
  "prompt": {
    "guidelineId": "cg1145-fetal-abnormality-guideline-including-fetal-echo-referral-criteria-pdf",
    "fieldsProcessed": [
      "humanFriendlyName",
      "organisation",
      "yearProduced",
      "summary"
    ],
    "enhancedFields": 4,
    "contentLength": 1726
  },
  "response": "{\n  \"success\": true,\n  \"enhancedFields\": [\n    {\n      \"field\": \"humanFriendlyName\",\n      \"oldValue\": null,\n      \"newValue\": \"Fetal Abnormality Care and Referral Guidelines\",\n      \"action\": \"added\"\n    },\n    {\n      \"field\": \"organisation\",\n      \"oldValue\": null,\n      \"newValue\": \"RCOG\",\n      \"action\": \"added\"\n    },\n    {\n      \"field\": \"yearProduced\",\n      \"oldValue\": null,\n      \"newValue\": \"The text provided does not explicitly mention a publication year. If you have access to the full guideline document or its title page, please check there for the publication date. Let me know if you'd like me to extract the year from a different section of the text\",\n      \"action\": \"added\"\n    },\n    {\n      \"field\": \"summary\",\n      \"oldValue\": null,\n      \"newValue\": \"**Summary:** This guideline ensures effective communication and care for fetal abnormalities. It applies to all antenatal staff, emphasizing adherence, quarterly review of anomalies, and data sharing with national registries. Key steps include prompt referral after abnormal scans, designated midwife care, and notifying pediatric/obstetric teams during birth. Postnatal care involves recording outcomes and follow-ups. Referral for fetal echocardiography is advised for familial cardiac abnormalities or NT > 3.5mm, but not for maternal anti-Ro/La antibodies or diabetes (routine 20-week scan suffices). Early fetal medicine scans are indicated for prior major structural abnormalities or teratogenic drug use. Annual KPI data is submitted to Public Health England for monitoring\",\n      \"action\": \"added\"\n    }\n  ]\n}",
  "endpoint": "enhanceGuidelineMetadata",
  "timestamp": "2025-06-18T22-00-04",
  "textContent": "AI: DeepSeek (deepseek-chat)\n\nQ: {\n  \"guidelineId\": \"cg1145-fetal-abnormality-guideline-including-fetal-echo-referral-criteria-pdf\",\n  \"fieldsProcessed\": [\n    \"humanFriendlyName\",\n    \"organisation\",\n    \"yearProduced\",\n    \"summary\"\n  ],\n  \"enhancedFields\": 4,\n  \"contentLength\": 1726\n}\n\nA: {\n  \"success\": true,\n  \"enhancedFields\": [\n    {\n      \"field\": \"humanFriendlyName\",\n      \"oldValue\": null,\n      \"newValue\": \"Fetal Abnormality Care and Referral Guidelines\",\n      \"action\": \"added\"\n    },\n    {\n      \"field\": \"organisation\",\n      \"oldValue\": null,\n      \"newValue\": \"RCOG\",\n      \"action\": \"added\"\n    },\n    {\n      \"field\": \"yearProduced\",\n      \"oldValue\": null,\n      \"newValue\": \"The text provided does not explicitly mention a publication year. If you have access to the full guideline document or its title page, please check there for the publication date. Let me know if you'd like me to extract the year from a different section of the text\",\n      \"action\": \"added\"\n    },\n    {\n      \"field\": \"summary\",\n      \"oldValue\": null,\n      \"newValue\": \"**Summary:** This guideline ensures effective communication and care for fetal abnormalities. It applies to all antenatal staff, emphasizing adherence, quarterly review of anomalies, and data sharing with national registries. Key steps include prompt referral after abnormal scans, designated midwife care, and notifying pediatric/obstetric teams during birth. Postnatal care involves recording outcomes and follow-ups. Referral for fetal echocardiography is advised for familial cardiac abnormalities or NT > 3.5mm, but not for maternal anti-Ro/La antibodies or diabetes (routine 20-week scan suffices). Early fetal medicine scans are indicated for prior major structural abnormalities or teratogenic drug use. Annual KPI data is submitted to Public Health England for monitoring\",\n      \"action\": \"added\"\n    }\n  ]\n}",
  "ai_provider": "DeepSeek",
  "ai_model": "deepseek-chat",
  "token_usage": null
}