{
  "prompt": {
    "guidelineId": "cg20003-first-trimester-dating-uss-protocol-pdf",
    "fieldsProcessed": [
      "humanFriendlyName",
      "organisation",
      "yearProduced",
      "summary"
    ],
    "enhancedFields": 4,
    "contentLength": 2729
  },
  "response": "{\n  \"success\": true,\n  \"enhancedFields\": [\n    {\n      \"field\": \"humanFriendlyName\",\n      \"oldValue\": null,\n      \"newValue\": \"First Trimester Ultrasound Screening Protocol\",\n      \"action\": \"added\"\n    },\n    {\n      \"field\": \"organisation\",\n      \"oldValue\": null,\n      \"newValue\": \"FASP\",\n      \"action\": \"added\"\n    },\n    {\n      \"field\": \"yearProduced\",\n      \"oldValue\": null,\n      \"newValue\": \"The text does not explicitly mention a publication year. Could you provide the relevant section or confirm if the year is included elsewhere in the document?\",\n      \"action\": \"added\"\n    },\n    {\n      \"field\": \"summary\",\n      \"oldValue\": null,\n      \"newValue\": \"**Summary of CG20003 First Trimester US Screening Protocol** This protocol guides sonographers in performing first-trimester scans, including dating and combined screening (nuchal translucency [NT] and serum markers). Key points: - **Pregnancy Dating & Combined Test**: Measure crown-rump length (CRL) and NT to one decimal point. Use the larger CRL in twin pregnancies for risk calculation. - **NT Measurement**: Follow standardized criteria for placement of calipers. If NT cannot be obtained, document reasons. - **Increased NT**: Requires further assessment and counseling. - **Twin Pregnancies**: - Offer combined test (preferred); measure NT for each fetus. - Dichorionic twins: Individual risk results. Monochorionic twins: Shared risk result. - If combined test is missed, offer second-trimester quadruple test (less sensitive, Down’s syndrome only). - Use larger head circumference (HC) if CRL >84mm in quadruple test. - **Vanished Twin**: Document non-viable fetus or empty sac; adjust screening approach accordingly. Emphasis is on accurate measurement, standardized reporting, and patient counseling for informed decision-making\",\n      \"action\": \"added\"\n    }\n  ]\n}",
  "endpoint": "enhanceGuidelineMetadata",
  "timestamp": "2025-06-18T22-13-43",
  "textContent": "AI: DeepSeek (deepseek-chat)\n\nQ: {\n  \"guidelineId\": \"cg20003-first-trimester-dating-uss-protocol-pdf\",\n  \"fieldsProcessed\": [\n    \"humanFriendlyName\",\n    \"organisation\",\n    \"yearProduced\",\n    \"summary\"\n  ],\n  \"enhancedFields\": 4,\n  \"contentLength\": 2729\n}\n\nA: {\n  \"success\": true,\n  \"enhancedFields\": [\n    {\n      \"field\": \"humanFriendlyName\",\n      \"oldValue\": null,\n      \"newValue\": \"First Trimester Ultrasound Screening Protocol\",\n      \"action\": \"added\"\n    },\n    {\n      \"field\": \"organisation\",\n      \"oldValue\": null,\n      \"newValue\": \"FASP\",\n      \"action\": \"added\"\n    },\n    {\n      \"field\": \"yearProduced\",\n      \"oldValue\": null,\n      \"newValue\": \"The text does not explicitly mention a publication year. Could you provide the relevant section or confirm if the year is included elsewhere in the document?\",\n      \"action\": \"added\"\n    },\n    {\n      \"field\": \"summary\",\n      \"oldValue\": null,\n      \"newValue\": \"**Summary of CG20003 First Trimester US Screening Protocol** This protocol guides sonographers in performing first-trimester scans, including dating and combined screening (nuchal translucency [NT] and serum markers). Key points: - **Pregnancy Dating & Combined Test**: Measure crown-rump length (CRL) and NT to one decimal point. Use the larger CRL in twin pregnancies for risk calculation. - **NT Measurement**: Follow standardized criteria for placement of calipers. If NT cannot be obtained, document reasons. - **Increased NT**: Requires further assessment and counseling. - **Twin Pregnancies**: - Offer combined test (preferred); measure NT for each fetus. - Dichorionic twins: Individual risk results. Monochorionic twins: Shared risk result. - If combined test is missed, offer second-trimester quadruple test (less sensitive, Down’s syndrome only). - Use larger head circumference (HC) if CRL >84mm in quadruple test. - **Vanished Twin**: Document non-viable fetus or empty sac; adjust screening approach accordingly. Emphasis is on accurate measurement, standardized reporting, and patient counseling for informed decision-making\",\n      \"action\": \"added\"\n    }\n  ]\n}",
  "ai_provider": "DeepSeek",
  "ai_model": "deepseek-chat",
  "token_usage": null
}