{
  "prompt": {
    "guidelineId": "uhsx-surrogacy-protocol-pdf",
    "fieldsProcessed": [
      "humanFriendlyName",
      "organisation",
      "yearProduced",
      "summary"
    ],
    "enhancedFields": 4,
    "contentLength": 7663
  },
  "response": "{\n  \"success\": true,\n  \"enhancedFields\": [\n    {\n      \"field\": \"humanFriendlyName\",\n      \"oldValue\": null,\n      \"newValue\": \"Surrogacy Care and Planning Guidelines\",\n      \"action\": \"added\"\n    },\n    {\n      \"field\": \"organisation\",\n      \"oldValue\": null,\n      \"newValue\": \"RCOG\",\n      \"action\": \"added\"\n    },\n    {\n      \"field\": \"yearProduced\",\n      \"oldValue\": null,\n      \"newValue\": \"2007\",\n      \"action\": \"added\"\n    },\n    {\n      \"field\": \"summary\",\n      \"oldValue\": null,\n      \"newValue\": \"**Summary of Medical Guideline on Surrogacy:** This guideline ensures robust antenatal, labor, and postnatal planning for surrogacy arrangements. Key recommendations: - **Legal Framework**: The surrogate is the legal mother until a parental order or adoption transfers rights. Same-sex couples and foreign parents may apply. - **Clinical Care**: Provide non-judgmental, supportive care. The surrogate retains decision-making rights, including termination. - **Postnatal Handling**: Sensitive management is required; the baby is registered under the surrogate until legal transfer. - **Roles & Responsibilities**: - Surrogate gives newborn screening consent. - Commissioning parents apply for parental/adoption orders. - Joint decisions on baby’s care between surrogate and parents. - **Inclusive Language**: Use terms like \\\"surrogate\\\" (not \\\"surrogate mother\\\") and \\\"your baby\\\" for intended parents. - **Equality & Compliance**: Adhere to the Equality Act (2010), ensuring non-discriminatory care. Audit cases annually. **Appendix 3**: Promotes inclusive language (e.g., \\\"commissioning parent\\\" instead of \\\"intended mother/father\\\"). **Appendix 4**: Outlines newborn screening consent, with the surrogate providing initial consent. (Word count: 200)\",\n      \"action\": \"added\"\n    }\n  ]\n}",
  "endpoint": "enhanceGuidelineMetadata",
  "timestamp": "2025-06-18T23-15-53",
  "textContent": "AI: DeepSeek (deepseek-chat)\n\nQ: {\n  \"guidelineId\": \"uhsx-surrogacy-protocol-pdf\",\n  \"fieldsProcessed\": [\n    \"humanFriendlyName\",\n    \"organisation\",\n    \"yearProduced\",\n    \"summary\"\n  ],\n  \"enhancedFields\": 4,\n  \"contentLength\": 7663\n}\n\nA: {\n  \"success\": true,\n  \"enhancedFields\": [\n    {\n      \"field\": \"humanFriendlyName\",\n      \"oldValue\": null,\n      \"newValue\": \"Surrogacy Care and Planning Guidelines\",\n      \"action\": \"added\"\n    },\n    {\n      \"field\": \"organisation\",\n      \"oldValue\": null,\n      \"newValue\": \"RCOG\",\n      \"action\": \"added\"\n    },\n    {\n      \"field\": \"yearProduced\",\n      \"oldValue\": null,\n      \"newValue\": \"2007\",\n      \"action\": \"added\"\n    },\n    {\n      \"field\": \"summary\",\n      \"oldValue\": null,\n      \"newValue\": \"**Summary of Medical Guideline on Surrogacy:** This guideline ensures robust antenatal, labor, and postnatal planning for surrogacy arrangements. Key recommendations: - **Legal Framework**: The surrogate is the legal mother until a parental order or adoption transfers rights. Same-sex couples and foreign parents may apply. - **Clinical Care**: Provide non-judgmental, supportive care. The surrogate retains decision-making rights, including termination. - **Postnatal Handling**: Sensitive management is required; the baby is registered under the surrogate until legal transfer. - **Roles & Responsibilities**: - Surrogate gives newborn screening consent. - Commissioning parents apply for parental/adoption orders. - Joint decisions on baby’s care between surrogate and parents. - **Inclusive Language**: Use terms like \\\"surrogate\\\" (not \\\"surrogate mother\\\") and \\\"your baby\\\" for intended parents. - **Equality & Compliance**: Adhere to the Equality Act (2010), ensuring non-discriminatory care. Audit cases annually. **Appendix 3**: Promotes inclusive language (e.g., \\\"commissioning parent\\\" instead of \\\"intended mother/father\\\"). **Appendix 4**: Outlines newborn screening consent, with the surrogate providing initial consent. (Word count: 200)\",\n      \"action\": \"added\"\n    }\n  ]\n}",
  "ai_provider": "DeepSeek",
  "ai_model": "deepseek-chat",
  "token_usage": null
}