{
  "prompt": {
    "guidelineId": "mp001-provision-and-schedules-of-antenatal-care-pdf",
    "fieldsProcessed": [
      "humanFriendlyName",
      "organisation",
      "yearProduced",
      "summary"
    ],
    "enhancedFields": 4,
    "contentLength": 8638
  },
  "response": "{\n  \"success\": true,\n  \"enhancedFields\": [\n    {\n      \"field\": \"humanFriendlyName\",\n      \"oldValue\": null,\n      \"newValue\": \"Antenatal Care Guidelines for Pregnancy Management\",\n      \"action\": \"added\"\n    },\n    {\n      \"field\": \"organisation\",\n      \"oldValue\": null,\n      \"newValue\": \"RSCH PRH\",\n      \"action\": \"added\"\n    },\n    {\n      \"field\": \"yearProduced\",\n      \"oldValue\": null,\n      \"newValue\": \"The text provided does not contain a publication year. If you have another section or part of the guideline that includes the year, please share it, and I can extract it for you\",\n      \"action\": \"added\"\n    },\n    {\n      \"field\": \"summary\",\n      \"oldValue\": null,\n      \"newValue\": \"**Summary of Antenatal Care Guidelines (RSCH PRH):** - **Booking Visit:** Must be completed by 10 weeks, including risk assessment, care plans, and place of birth discussion. Late bookers (after 20 weeks) require tailored scans/referrals. - **Risk Assessment:** Ongoing, with pre-eclampsia screening at booking (high/moderate/low risk). Referrals made for neonatal risks, anaesthetic concerns (e.g., past complications, BMI >50), or obstetric conditions (e.g., placenta praevia). - **Screening & Tests:** Offer Downs/Edwards/Patau screening, 20-week anomaly scan, GTT for high-risk patients, Hb/antibody checks, and carbon monoxide screening. - **Communication:** Provide interpreter support and tailored information (e.g., perineal care leaflets for 3rd/4th-degree tears). - **Schedule Highlights:** - **16–28 weeks:** BP/proteinuria checks, SFH measurements, fetal movement advice, anti-D for Rh-ve patients. - **28+ weeks:** Diabetic screening, breastfeeding/newborn care discussions, membrane sweeps/IOL for prolonged pregnancy. - **Safeguarding:** Immediate referral for concealed pregnancies; follow-up for domestic abuse, mental health, or social concerns. - **Growth Monitoring:** SFH measurements; growth scans at 30/34 weeks for high-risk pregnancies (e.g., multiples), not routinely for low-risk. *Key: Ensure personalized care, document all actions, and review risks at each visit.* (Words: 200)\",\n      \"action\": \"added\"\n    }\n  ]\n}",
  "endpoint": "enhanceGuidelineMetadata",
  "timestamp": "2025-06-18T22-30-50",
  "textContent": "AI: DeepSeek (deepseek-chat)\n\nQ: {\n  \"guidelineId\": \"mp001-provision-and-schedules-of-antenatal-care-pdf\",\n  \"fieldsProcessed\": [\n    \"humanFriendlyName\",\n    \"organisation\",\n    \"yearProduced\",\n    \"summary\"\n  ],\n  \"enhancedFields\": 4,\n  \"contentLength\": 8638\n}\n\nA: {\n  \"success\": true,\n  \"enhancedFields\": [\n    {\n      \"field\": \"humanFriendlyName\",\n      \"oldValue\": null,\n      \"newValue\": \"Antenatal Care Guidelines for Pregnancy Management\",\n      \"action\": \"added\"\n    },\n    {\n      \"field\": \"organisation\",\n      \"oldValue\": null,\n      \"newValue\": \"RSCH PRH\",\n      \"action\": \"added\"\n    },\n    {\n      \"field\": \"yearProduced\",\n      \"oldValue\": null,\n      \"newValue\": \"The text provided does not contain a publication year. If you have another section or part of the guideline that includes the year, please share it, and I can extract it for you\",\n      \"action\": \"added\"\n    },\n    {\n      \"field\": \"summary\",\n      \"oldValue\": null,\n      \"newValue\": \"**Summary of Antenatal Care Guidelines (RSCH PRH):** - **Booking Visit:** Must be completed by 10 weeks, including risk assessment, care plans, and place of birth discussion. Late bookers (after 20 weeks) require tailored scans/referrals. - **Risk Assessment:** Ongoing, with pre-eclampsia screening at booking (high/moderate/low risk). Referrals made for neonatal risks, anaesthetic concerns (e.g., past complications, BMI >50), or obstetric conditions (e.g., placenta praevia). - **Screening & Tests:** Offer Downs/Edwards/Patau screening, 20-week anomaly scan, GTT for high-risk patients, Hb/antibody checks, and carbon monoxide screening. - **Communication:** Provide interpreter support and tailored information (e.g., perineal care leaflets for 3rd/4th-degree tears). - **Schedule Highlights:** - **16–28 weeks:** BP/proteinuria checks, SFH measurements, fetal movement advice, anti-D for Rh-ve patients. - **28+ weeks:** Diabetic screening, breastfeeding/newborn care discussions, membrane sweeps/IOL for prolonged pregnancy. - **Safeguarding:** Immediate referral for concealed pregnancies; follow-up for domestic abuse, mental health, or social concerns. - **Growth Monitoring:** SFH measurements; growth scans at 30/34 weeks for high-risk pregnancies (e.g., multiples), not routinely for low-risk. *Key: Ensure personalized care, document all actions, and review risks at each visit.* (Words: 200)\",\n      \"action\": \"added\"\n    }\n  ]\n}",
  "ai_provider": "DeepSeek",
  "ai_model": "deepseek-chat",
  "token_usage": null
}