{
  "prompt": {
    "guidelineId": "cg1111-screening-for-downs-edwards-and-pataus-syndrome-pdf",
    "fieldsProcessed": [
      "humanFriendlyName",
      "organisation",
      "yearProduced",
      "summary"
    ],
    "enhancedFields": 4,
    "contentLength": 1330
  },
  "response": "{\n  \"success\": true,\n  \"enhancedFields\": [\n    {\n      \"field\": \"humanFriendlyName\",\n      \"oldValue\": null,\n      \"newValue\": \"NIPT Screening for Down’s, Edward’s, and Patau’s Syndromes\",\n      \"action\": \"added\"\n    },\n    {\n      \"field\": \"organisation\",\n      \"oldValue\": null,\n      \"newValue\": \"NICE\",\n      \"action\": \"added\"\n    },\n    {\n      \"field\": \"yearProduced\",\n      \"oldValue\": null,\n      \"newValue\": \"The text provided does not contain a publication year. If you have another guideline text that includes the year, please share it, and I can extract the 4-digit year for you\",\n      \"action\": \"added\"\n    },\n    {\n      \"field\": \"summary\",\n      \"oldValue\": null,\n      \"newValue\": \"**Summary of Screening for Down’s, Edward’s, and Patau’s Syndrome Guideline:** - **Screening Offer**: NIPT (non-invasive prenatal testing) for T21, T18, and T13 is offered after a higher-chance result from combined or quadruple tests. - **Options**: Women may choose no further testing, NIPT, or prenatal diagnosis. Results are reported as lower or higher chance. - **Timing**: Testing available up to 21+6 weeks, with results expected within 2 weeks. Samples may be retained for quality assurance. - **Eligibility**: Includes IVF and donor egg pregnancies. - **Follow-up**: Clear referral pathways for abnormal results. - **Staff Requirements**: Midwives must meet education/training standards. - **Audit**: Monitoring processes ensure guideline adherence. **Purpose**: Supports informed decision-making, timely results, and optimal care for confirmed diagnoses. Applies to all involved staff\",\n      \"action\": \"added\"\n    }\n  ]\n}",
  "endpoint": "enhanceGuidelineMetadata",
  "timestamp": "2025-06-18T21-39-42",
  "textContent": "AI: DeepSeek (deepseek-chat)\n\nQ: {\n  \"guidelineId\": \"cg1111-screening-for-downs-edwards-and-pataus-syndrome-pdf\",\n  \"fieldsProcessed\": [\n    \"humanFriendlyName\",\n    \"organisation\",\n    \"yearProduced\",\n    \"summary\"\n  ],\n  \"enhancedFields\": 4,\n  \"contentLength\": 1330\n}\n\nA: {\n  \"success\": true,\n  \"enhancedFields\": [\n    {\n      \"field\": \"humanFriendlyName\",\n      \"oldValue\": null,\n      \"newValue\": \"NIPT Screening for Down’s, Edward’s, and Patau’s Syndromes\",\n      \"action\": \"added\"\n    },\n    {\n      \"field\": \"organisation\",\n      \"oldValue\": null,\n      \"newValue\": \"NICE\",\n      \"action\": \"added\"\n    },\n    {\n      \"field\": \"yearProduced\",\n      \"oldValue\": null,\n      \"newValue\": \"The text provided does not contain a publication year. If you have another guideline text that includes the year, please share it, and I can extract the 4-digit year for you\",\n      \"action\": \"added\"\n    },\n    {\n      \"field\": \"summary\",\n      \"oldValue\": null,\n      \"newValue\": \"**Summary of Screening for Down’s, Edward’s, and Patau’s Syndrome Guideline:** - **Screening Offer**: NIPT (non-invasive prenatal testing) for T21, T18, and T13 is offered after a higher-chance result from combined or quadruple tests. - **Options**: Women may choose no further testing, NIPT, or prenatal diagnosis. Results are reported as lower or higher chance. - **Timing**: Testing available up to 21+6 weeks, with results expected within 2 weeks. Samples may be retained for quality assurance. - **Eligibility**: Includes IVF and donor egg pregnancies. - **Follow-up**: Clear referral pathways for abnormal results. - **Staff Requirements**: Midwives must meet education/training standards. - **Audit**: Monitoring processes ensure guideline adherence. **Purpose**: Supports informed decision-making, timely results, and optimal care for confirmed diagnoses. Applies to all involved staff\",\n      \"action\": \"added\"\n    }\n  ]\n}",
  "ai_provider": "DeepSeek",
  "ai_model": "deepseek-chat",
  "token_usage": null
}