{
  "prompt": {
    "guidelineId": "sp22006-in-patient-maternity-observations-sop-pdf",
    "fieldsProcessed": [
      "humanFriendlyName",
      "organisation",
      "yearProduced",
      "summary"
    ],
    "enhancedFields": 4,
    "contentLength": 1728
  },
  "response": "{\n  \"success\": true,\n  \"enhancedFields\": [\n    {\n      \"field\": \"humanFriendlyName\",\n      \"oldValue\": null,\n      \"newValue\": \"Maternity In-Patient Monitoring and MEOWS Guidelines\",\n      \"action\": \"added\"\n    },\n    {\n      \"field\": \"organisation\",\n      \"oldValue\": null,\n      \"newValue\": \"UH Sussex\",\n      \"action\": \"added\"\n    },\n    {\n      \"field\": \"yearProduced\",\n      \"oldValue\": null,\n      \"newValue\": \"I cannot find a publication year in the provided text. The guideline does not include a specific 4-digit year indicating its publication date\",\n      \"action\": \"added\"\n    },\n    {\n      \"field\": \"summary\",\n      \"oldValue\": null,\n      \"newValue\": \"**Summary of In-Patient Maternity Observations and Monitoring SOP:** This guideline ensures standardized monitoring for pregnant or postpartum individuals at UH Sussex using the MEOWS chart. Staff (midwives, obstetricians, etc.) must follow defined responsibilities, with training required for equipment use. Student midwives require mentor assessment. **Key Clinical Recommendations:** - **Baseline vital signs** must be recorded on admission (maternity unit/DAU/Triage). - **MEOWS score** calculated with each observation set; escalate per MEOWS table. - **Frequency of observations** follows flowchart, adjusted per clinical need, MEOWS escalation, or obstetric plan. - **Specific assessments**: carotid pulse if radial absent, ACVPU for consciousness, appropriate temperature methods. - **Emergency Team criteria**: airway, breathing, circulation, disability, exposure, urine output, or other concerns. Deficiencies in student performance must be reported to the university link tutor and documented. Local processes for the Maternal Observation Bundle must be completed at placement start\",\n      \"action\": \"added\"\n    }\n  ]\n}",
  "endpoint": "enhanceGuidelineMetadata",
  "timestamp": "2025-06-18T23-04-08",
  "textContent": "AI: DeepSeek (deepseek-chat)\n\nQ: {\n  \"guidelineId\": \"sp22006-in-patient-maternity-observations-sop-pdf\",\n  \"fieldsProcessed\": [\n    \"humanFriendlyName\",\n    \"organisation\",\n    \"yearProduced\",\n    \"summary\"\n  ],\n  \"enhancedFields\": 4,\n  \"contentLength\": 1728\n}\n\nA: {\n  \"success\": true,\n  \"enhancedFields\": [\n    {\n      \"field\": \"humanFriendlyName\",\n      \"oldValue\": null,\n      \"newValue\": \"Maternity In-Patient Monitoring and MEOWS Guidelines\",\n      \"action\": \"added\"\n    },\n    {\n      \"field\": \"organisation\",\n      \"oldValue\": null,\n      \"newValue\": \"UH Sussex\",\n      \"action\": \"added\"\n    },\n    {\n      \"field\": \"yearProduced\",\n      \"oldValue\": null,\n      \"newValue\": \"I cannot find a publication year in the provided text. The guideline does not include a specific 4-digit year indicating its publication date\",\n      \"action\": \"added\"\n    },\n    {\n      \"field\": \"summary\",\n      \"oldValue\": null,\n      \"newValue\": \"**Summary of In-Patient Maternity Observations and Monitoring SOP:** This guideline ensures standardized monitoring for pregnant or postpartum individuals at UH Sussex using the MEOWS chart. Staff (midwives, obstetricians, etc.) must follow defined responsibilities, with training required for equipment use. Student midwives require mentor assessment. **Key Clinical Recommendations:** - **Baseline vital signs** must be recorded on admission (maternity unit/DAU/Triage). - **MEOWS score** calculated with each observation set; escalate per MEOWS table. - **Frequency of observations** follows flowchart, adjusted per clinical need, MEOWS escalation, or obstetric plan. - **Specific assessments**: carotid pulse if radial absent, ACVPU for consciousness, appropriate temperature methods. - **Emergency Team criteria**: airway, breathing, circulation, disability, exposure, urine output, or other concerns. Deficiencies in student performance must be reported to the university link tutor and documented. Local processes for the Maternal Observation Bundle must be completed at placement start\",\n      \"action\": \"added\"\n    }\n  ]\n}",
  "ai_provider": "DeepSeek",
  "ai_model": "deepseek-chat",
  "token_usage": null
}