{
  "prompt": {
    "guidelineId": "mp034-vaginal-birth-after-caesarean-section-vbac-pdf",
    "fieldsProcessed": [
      "humanFriendlyName",
      "organisation",
      "yearProduced",
      "summary"
    ],
    "enhancedFields": 4,
    "contentLength": 2727
  },
  "response": "{\n  \"success\": true,\n  \"enhancedFields\": [\n    {\n      \"field\": \"humanFriendlyName\",\n      \"oldValue\": null,\n      \"newValue\": \"VBAC Maternity Protocol: Guidelines and Considerations\",\n      \"action\": \"added\"\n    },\n    {\n      \"field\": \"organisation\",\n      \"oldValue\": null,\n      \"newValue\": \"The organization name cannot be identified from the provided text. The guideline does not explicitly mention a publishing organization or institution such as NHS, NICE, WHO, RCOG, etc\",\n      \"action\": \"added\"\n    },\n    {\n      \"field\": \"yearProduced\",\n      \"oldValue\": null,\n      \"newValue\": \"2022\",\n      \"action\": \"added\"\n    },\n    {\n      \"field\": \"summary\",\n      \"oldValue\": null,\n      \"newValue\": \"**Summary of VBAC Maternity Protocol (MP034):** - **Eligibility:** VBAC is contraindicated with prior classical incision, uterine rupture, or ≥3 caesareans. May be considered after 2 uncomplicated caesareans. - **Antenatal Care:** Consultant-led Birth Options clinic for counseling. Documented discussion on mode/place of birth, risks, and benefits. - **Intrapartum Care:** Continuous fetal monitoring recommended. Birth plan must be documented. Birthing pool use permitted with monitoring. - **Induction:** Options discussed at 40 weeks; continuous monitoring advised. - **Risks/Benefits of VBAC vs. ERCS:** - **VBAC:** Shorter recovery, 72-75% success rate, 0.5% uterine rupture risk, 5% anal sphincter injury, 8/10,000 HIE risk. - **ERCS:** Avoids uterine rupture but has higher maternal death risk (13/100,000), longer recovery, and increased future placental risks. - **Infant Outcomes:** VBAC has higher HIE risk; ERCS has lower HIE risk but higher transient respiratory morbidity (4-5%). Staff must provide evidence-based counseling and document preferences. Compliance monitored via Badgernet\",\n      \"action\": \"added\"\n    }\n  ]\n}",
  "endpoint": "enhanceGuidelineMetadata",
  "timestamp": "2025-06-18T22-43-14",
  "textContent": "AI: DeepSeek (deepseek-chat)\n\nQ: {\n  \"guidelineId\": \"mp034-vaginal-birth-after-caesarean-section-vbac-pdf\",\n  \"fieldsProcessed\": [\n    \"humanFriendlyName\",\n    \"organisation\",\n    \"yearProduced\",\n    \"summary\"\n  ],\n  \"enhancedFields\": 4,\n  \"contentLength\": 2727\n}\n\nA: {\n  \"success\": true,\n  \"enhancedFields\": [\n    {\n      \"field\": \"humanFriendlyName\",\n      \"oldValue\": null,\n      \"newValue\": \"VBAC Maternity Protocol: Guidelines and Considerations\",\n      \"action\": \"added\"\n    },\n    {\n      \"field\": \"organisation\",\n      \"oldValue\": null,\n      \"newValue\": \"The organization name cannot be identified from the provided text. The guideline does not explicitly mention a publishing organization or institution such as NHS, NICE, WHO, RCOG, etc\",\n      \"action\": \"added\"\n    },\n    {\n      \"field\": \"yearProduced\",\n      \"oldValue\": null,\n      \"newValue\": \"2022\",\n      \"action\": \"added\"\n    },\n    {\n      \"field\": \"summary\",\n      \"oldValue\": null,\n      \"newValue\": \"**Summary of VBAC Maternity Protocol (MP034):** - **Eligibility:** VBAC is contraindicated with prior classical incision, uterine rupture, or ≥3 caesareans. May be considered after 2 uncomplicated caesareans. - **Antenatal Care:** Consultant-led Birth Options clinic for counseling. Documented discussion on mode/place of birth, risks, and benefits. - **Intrapartum Care:** Continuous fetal monitoring recommended. Birth plan must be documented. Birthing pool use permitted with monitoring. - **Induction:** Options discussed at 40 weeks; continuous monitoring advised. - **Risks/Benefits of VBAC vs. ERCS:** - **VBAC:** Shorter recovery, 72-75% success rate, 0.5% uterine rupture risk, 5% anal sphincter injury, 8/10,000 HIE risk. - **ERCS:** Avoids uterine rupture but has higher maternal death risk (13/100,000), longer recovery, and increased future placental risks. - **Infant Outcomes:** VBAC has higher HIE risk; ERCS has lower HIE risk but higher transient respiratory morbidity (4-5%). Staff must provide evidence-based counseling and document preferences. Compliance monitored via Badgernet\",\n      \"action\": \"added\"\n    }\n  ]\n}",
  "ai_provider": "DeepSeek",
  "ai_model": "deepseek-chat",
  "token_usage": null
}