{
  "prompt": {
    "guidelineId": "mp020-multiple-pregnancy-and-birth-pdf",
    "fieldsProcessed": [
      "humanFriendlyName",
      "organisation",
      "yearProduced",
      "summary"
    ],
    "enhancedFields": 4,
    "contentLength": 11135
  },
  "response": "{\n  \"success\": true,\n  \"enhancedFields\": [\n    {\n      \"field\": \"humanFriendlyName\",\n      \"oldValue\": null,\n      \"newValue\": \"Multiple Pregnancy and Birth Management Protocol\",\n      \"action\": \"added\"\n    },\n    {\n      \"field\": \"organisation\",\n      \"oldValue\": null,\n      \"newValue\": \"RCOG\",\n      \"action\": \"added\"\n    },\n    {\n      \"field\": \"yearProduced\",\n      \"oldValue\": null,\n      \"newValue\": \"I'm sorry, but I cannot find a publication year in the provided text. The guideline does not explicitly state a 4-digit publication year. If you have additional information or a different section of the guideline that includes the year, please provide it, and I can assist further\",\n      \"action\": \"added\"\n    },\n    {\n      \"field\": \"summary\",\n      \"oldValue\": null,\n      \"newValue\": \"**Summary of Multiple Pregnancy and Birth Guidelines** - **Scope**: Applies to twin and higher-order pregnancies. Management requires obstetric-led care, with triplet pregnancies referred directly to fetal medicine. - **Chorionicity**: Ultrasound determines chorionicity/amnionicity (DCDA, MCDA, MCMA), guiding risk stratification and monitoring. - **Antenatal Care**: - Twin pregnancies: Consultant-led care with frequent scans (growth/anomaly) based on chorionicity. - Triplet pregnancies: Managed by fetal medicine team with regular scans. - Discuss risks (preterm labor, interventions) and birth plan early. - **Delivery Planning**: - Active management of third stage (oxytocin) recommended; avoid physiological management. - Continuous CTG monitoring ≥26 weeks; ultrasound on labor onset to confirm fetal positions. - Senior obstetrician involvement for preterm labor (23–25+6 weeks). - **Intrapartum Management**: - Twin I: Midwife-led if cephalic; Twin II requires obstetrician for position assessment (external/internal version if needed). - Aim for ≤45-minute interval between twins; cesarean if vaginal delivery not imminent for compromised twin. - Neonatal team must attend all twin deliveries. - **Staff Requirements**: Middle-grade/consultant obstetrician present; experienced midwives may lead uncomplicated term deliveries. - **Postnatal/Prep**: Discuss PPH risk, steroids for lung maturation, and postnatal support. Weekly reviews if delivery declines. (Word count: 200)\",\n      \"action\": \"added\"\n    }\n  ]\n}",
  "endpoint": "enhanceGuidelineMetadata",
  "timestamp": "2025-06-18T22-37-52",
  "textContent": "AI: DeepSeek (deepseek-chat)\n\nQ: {\n  \"guidelineId\": \"mp020-multiple-pregnancy-and-birth-pdf\",\n  \"fieldsProcessed\": [\n    \"humanFriendlyName\",\n    \"organisation\",\n    \"yearProduced\",\n    \"summary\"\n  ],\n  \"enhancedFields\": 4,\n  \"contentLength\": 11135\n}\n\nA: {\n  \"success\": true,\n  \"enhancedFields\": [\n    {\n      \"field\": \"humanFriendlyName\",\n      \"oldValue\": null,\n      \"newValue\": \"Multiple Pregnancy and Birth Management Protocol\",\n      \"action\": \"added\"\n    },\n    {\n      \"field\": \"organisation\",\n      \"oldValue\": null,\n      \"newValue\": \"RCOG\",\n      \"action\": \"added\"\n    },\n    {\n      \"field\": \"yearProduced\",\n      \"oldValue\": null,\n      \"newValue\": \"I'm sorry, but I cannot find a publication year in the provided text. The guideline does not explicitly state a 4-digit publication year. If you have additional information or a different section of the guideline that includes the year, please provide it, and I can assist further\",\n      \"action\": \"added\"\n    },\n    {\n      \"field\": \"summary\",\n      \"oldValue\": null,\n      \"newValue\": \"**Summary of Multiple Pregnancy and Birth Guidelines** - **Scope**: Applies to twin and higher-order pregnancies. Management requires obstetric-led care, with triplet pregnancies referred directly to fetal medicine. - **Chorionicity**: Ultrasound determines chorionicity/amnionicity (DCDA, MCDA, MCMA), guiding risk stratification and monitoring. - **Antenatal Care**: - Twin pregnancies: Consultant-led care with frequent scans (growth/anomaly) based on chorionicity. - Triplet pregnancies: Managed by fetal medicine team with regular scans. - Discuss risks (preterm labor, interventions) and birth plan early. - **Delivery Planning**: - Active management of third stage (oxytocin) recommended; avoid physiological management. - Continuous CTG monitoring ≥26 weeks; ultrasound on labor onset to confirm fetal positions. - Senior obstetrician involvement for preterm labor (23–25+6 weeks). - **Intrapartum Management**: - Twin I: Midwife-led if cephalic; Twin II requires obstetrician for position assessment (external/internal version if needed). - Aim for ≤45-minute interval between twins; cesarean if vaginal delivery not imminent for compromised twin. - Neonatal team must attend all twin deliveries. - **Staff Requirements**: Middle-grade/consultant obstetrician present; experienced midwives may lead uncomplicated term deliveries. - **Postnatal/Prep**: Discuss PPH risk, steroids for lung maturation, and postnatal support. Weekly reviews if delivery declines. (Word count: 200)\",\n      \"action\": \"added\"\n    }\n  ]\n}",
  "ai_provider": "DeepSeek",
  "ai_model": "deepseek-chat",
  "token_usage": null
}