{
  "prompt": {
    "guidelineId": "sp22003-maternity-telephone-triage-sop-pdf",
    "fieldsProcessed": [
      "humanFriendlyName",
      "organisation",
      "yearProduced",
      "summary"
    ],
    "enhancedFields": 4,
    "contentLength": 1110
  },
  "response": "{\n  \"success\": true,\n  \"enhancedFields\": [\n    {\n      \"field\": \"humanFriendlyName\",\n      \"oldValue\": null,\n      \"newValue\": \"Maternity Telephone Triage Guidelines\",\n      \"action\": \"added\"\n    },\n    {\n      \"field\": \"organisation\",\n      \"oldValue\": null,\n      \"newValue\": \"UH Sussex SRH & WH\",\n      \"action\": \"added\"\n    },\n    {\n      \"field\": \"yearProduced\",\n      \"oldValue\": null,\n      \"newValue\": \"2023\",\n      \"action\": \"added\"\n    },\n    {\n      \"field\": \"summary\",\n      \"oldValue\": null,\n      \"newValue\": \"**Summary of Maternity Telephone Triage SOP:** This guideline standardizes telephone triage for maternity care at UH Sussex SRH & WH, ensuring consistent, safe, and efficient service. Midwives and medical staff must follow the SOP, using professional judgment. Calls are triaged via NetCall or diverted to the labor ward. Assessments at referral determine care pathways, with all advice documented on MIS. Patients should be advised to attend after the third call unless concerns resolve. Escalation pathways address patient concerns. Appendices include a triage assessment card and care pathways for specific issues. Key focus: quality, safety, and patient satisfaction. (SP22003 v1.1 July 2023)\",\n      \"action\": \"added\"\n    }\n  ]\n}",
  "endpoint": "enhanceGuidelineMetadata",
  "timestamp": "2025-06-18T23-03-34",
  "textContent": "AI: DeepSeek (deepseek-chat)\n\nQ: {\n  \"guidelineId\": \"sp22003-maternity-telephone-triage-sop-pdf\",\n  \"fieldsProcessed\": [\n    \"humanFriendlyName\",\n    \"organisation\",\n    \"yearProduced\",\n    \"summary\"\n  ],\n  \"enhancedFields\": 4,\n  \"contentLength\": 1110\n}\n\nA: {\n  \"success\": true,\n  \"enhancedFields\": [\n    {\n      \"field\": \"humanFriendlyName\",\n      \"oldValue\": null,\n      \"newValue\": \"Maternity Telephone Triage Guidelines\",\n      \"action\": \"added\"\n    },\n    {\n      \"field\": \"organisation\",\n      \"oldValue\": null,\n      \"newValue\": \"UH Sussex SRH & WH\",\n      \"action\": \"added\"\n    },\n    {\n      \"field\": \"yearProduced\",\n      \"oldValue\": null,\n      \"newValue\": \"2023\",\n      \"action\": \"added\"\n    },\n    {\n      \"field\": \"summary\",\n      \"oldValue\": null,\n      \"newValue\": \"**Summary of Maternity Telephone Triage SOP:** This guideline standardizes telephone triage for maternity care at UH Sussex SRH & WH, ensuring consistent, safe, and efficient service. Midwives and medical staff must follow the SOP, using professional judgment. Calls are triaged via NetCall or diverted to the labor ward. Assessments at referral determine care pathways, with all advice documented on MIS. Patients should be advised to attend after the third call unless concerns resolve. Escalation pathways address patient concerns. Appendices include a triage assessment card and care pathways for specific issues. Key focus: quality, safety, and patient satisfaction. (SP22003 v1.1 July 2023)\",\n      \"action\": \"added\"\n    }\n  ]\n}",
  "ai_provider": "DeepSeek",
  "ai_model": "deepseek-chat",
  "token_usage": null
}