{
  "prompt": {
    "guidelineId": "management-of-acute-pelvic-inflammatory-disease-pdf",
    "fieldsProcessed": [
      "humanFriendlyName",
      "organisation",
      "yearProduced",
      "summary"
    ],
    "enhancedFields": 4,
    "contentLength": 1394
  },
  "response": "{\n  \"success\": true,\n  \"enhancedFields\": [\n    {\n      \"field\": \"humanFriendlyName\",\n      \"oldValue\": null,\n      \"newValue\": \"Acute Pelvic Inflammatory Disease (PID) Management Guideline\",\n      \"action\": \"added\"\n    },\n    {\n      \"field\": \"organisation\",\n      \"oldValue\": null,\n      \"newValue\": \"RCOG\",\n      \"action\": \"added\"\n    },\n    {\n      \"field\": \"yearProduced\",\n      \"oldValue\": null,\n      \"newValue\": \"The text provided does not contain a publication year. If you have another guideline text that includes the year, please share it, and I can extract the 4-digit year for you\",\n      \"action\": \"added\"\n    },\n    {\n      \"field\": \"summary\",\n      \"oldValue\": null,\n      \"newValue\": \"**Summary of Acute PID Management Guidelines** **Clinical Recommendations:** - **Diagnosis:** Suspect PID in women with lower abdominal pain, abnormal vaginal discharge, fever, or dyspareunia. Rule out differentials (e.g., ectopic pregnancy, appendicitis). - **Investigations:** Use cervical swabs (NAAT for *Chlamydia/gonorrhea*), pregnancy test, and ultrasound if complications (e.g., abscess) are suspected. - **Treatment:** - **Outpatient:** Ceftriaxone IM + doxycycline + metronidazole (14 days). - **Inpatient:** IV ceftriaxone + doxycycline ± metronidazole, switching to oral therapy after 24–48 hours if improved. - **Pregnancy:** Use safe antibiotics (e.g., erythromycin for *Chlamydia*). Avoid doxycycline. - **Complications:** Manage tubo-ovarian abscess with drainage if needed; consider IUCD removal if severe. - **Partner Management:** Treat all sexual partners within 60 days; abstain until treatment completion. - **Follow-up:** Reassess at 3 days for improvement; retest for STIs if persistent symptoms. **Key Points:** Early treatment reduces infertility risk. Counsel on STI prevention and adherence to therapy\",\n      \"action\": \"added\"\n    }\n  ]\n}",
  "endpoint": "enhanceGuidelineMetadata",
  "timestamp": "2025-06-18T22-29-01",
  "textContent": "AI: DeepSeek (deepseek-chat)\n\nQ: {\n  \"guidelineId\": \"management-of-acute-pelvic-inflammatory-disease-pdf\",\n  \"fieldsProcessed\": [\n    \"humanFriendlyName\",\n    \"organisation\",\n    \"yearProduced\",\n    \"summary\"\n  ],\n  \"enhancedFields\": 4,\n  \"contentLength\": 1394\n}\n\nA: {\n  \"success\": true,\n  \"enhancedFields\": [\n    {\n      \"field\": \"humanFriendlyName\",\n      \"oldValue\": null,\n      \"newValue\": \"Acute Pelvic Inflammatory Disease (PID) Management Guideline\",\n      \"action\": \"added\"\n    },\n    {\n      \"field\": \"organisation\",\n      \"oldValue\": null,\n      \"newValue\": \"RCOG\",\n      \"action\": \"added\"\n    },\n    {\n      \"field\": \"yearProduced\",\n      \"oldValue\": null,\n      \"newValue\": \"The text provided does not contain a publication year. If you have another guideline text that includes the year, please share it, and I can extract the 4-digit year for you\",\n      \"action\": \"added\"\n    },\n    {\n      \"field\": \"summary\",\n      \"oldValue\": null,\n      \"newValue\": \"**Summary of Acute PID Management Guidelines** **Clinical Recommendations:** - **Diagnosis:** Suspect PID in women with lower abdominal pain, abnormal vaginal discharge, fever, or dyspareunia. Rule out differentials (e.g., ectopic pregnancy, appendicitis). - **Investigations:** Use cervical swabs (NAAT for *Chlamydia/gonorrhea*), pregnancy test, and ultrasound if complications (e.g., abscess) are suspected. - **Treatment:** - **Outpatient:** Ceftriaxone IM + doxycycline + metronidazole (14 days). - **Inpatient:** IV ceftriaxone + doxycycline ± metronidazole, switching to oral therapy after 24–48 hours if improved. - **Pregnancy:** Use safe antibiotics (e.g., erythromycin for *Chlamydia*). Avoid doxycycline. - **Complications:** Manage tubo-ovarian abscess with drainage if needed; consider IUCD removal if severe. - **Partner Management:** Treat all sexual partners within 60 days; abstain until treatment completion. - **Follow-up:** Reassess at 3 days for improvement; retest for STIs if persistent symptoms. **Key Points:** Early treatment reduces infertility risk. Counsel on STI prevention and adherence to therapy\",\n      \"action\": \"added\"\n    }\n  ]\n}",
  "ai_provider": "DeepSeek",
  "ai_model": "deepseek-chat",
  "token_usage": null
}