{
  "prompt": {
    "guidelineId": "cg12035-neonatal-jaundice-pdf",
    "fieldsProcessed": [
      "humanFriendlyName",
      "organisation",
      "yearProduced",
      "summary"
    ],
    "enhancedFields": 4,
    "contentLength": 3395
  },
  "response": "{\n  \"success\": true,\n  \"enhancedFields\": [\n    {\n      \"field\": \"humanFriendlyName\",\n      \"oldValue\": null,\n      \"newValue\": \"Neonatal Jaundice Management Guidelines\",\n      \"action\": \"added\"\n    },\n    {\n      \"field\": \"organisation\",\n      \"oldValue\": null,\n      \"newValue\": \"NICE\",\n      \"action\": \"added\"\n    },\n    {\n      \"field\": \"yearProduced\",\n      \"oldValue\": null,\n      \"newValue\": \"The text does not contain a publication year. If you have additional information or a different section of the guideline that includes the year, please provide it, and I can extract it for you\",\n      \"action\": \"added\"\n    },\n    {\n      \"field\": \"summary\",\n      \"oldValue\": null,\n      \"newValue\": \"**Summary of Neonatal Jaundice Management Guideline** - **Target group**: Babies from birth to 28 days; healthcare professionals (midwives, neonatal staff, paediatricians). - **Key priorities**: Antenatal/postnatal care, risk factor assessment (gestational age, family history, early jaundice), visual inspection, and bilirubin measurement. - **Diagnosis**: Use serum/gas bilirubin (not icterometer) in first 24 hours, preterm (<35 weeks), or if above treatment thresholds. Avoid umbilical cord bilirubin, ETCOc, or DAT for hyperbilirubinaemia prediction. - **Treatment**: - **Phototherapy**: Start if bilirubin exceeds threshold; stop once below threshold. Provide parental education. - **Exchange transfusion**: Required for severe hyperbilirubinaemia or acute bilirubin encephalopathy; perform in tertiary units with parental counseling. - **IVIG**: Adjunct to phototherapy in select cases. - **Prolonged jaundice (term ≥14 days, preterm ≥21 days)**: Assess for pale stools/dark urine, measure conjugated bilirubin, perform FBC, blood group/DAT, urine culture, and metabolic screening. Refer if conjugated bilirubin >25 µmol/L. - **Monitoring**: Continuous phototherapy during/after exchange transfusion\",\n      \"action\": \"added\"\n    }\n  ]\n}",
  "endpoint": "enhanceGuidelineMetadata",
  "timestamp": "2025-06-18T22-06-45",
  "textContent": "AI: DeepSeek (deepseek-chat)\n\nQ: {\n  \"guidelineId\": \"cg12035-neonatal-jaundice-pdf\",\n  \"fieldsProcessed\": [\n    \"humanFriendlyName\",\n    \"organisation\",\n    \"yearProduced\",\n    \"summary\"\n  ],\n  \"enhancedFields\": 4,\n  \"contentLength\": 3395\n}\n\nA: {\n  \"success\": true,\n  \"enhancedFields\": [\n    {\n      \"field\": \"humanFriendlyName\",\n      \"oldValue\": null,\n      \"newValue\": \"Neonatal Jaundice Management Guidelines\",\n      \"action\": \"added\"\n    },\n    {\n      \"field\": \"organisation\",\n      \"oldValue\": null,\n      \"newValue\": \"NICE\",\n      \"action\": \"added\"\n    },\n    {\n      \"field\": \"yearProduced\",\n      \"oldValue\": null,\n      \"newValue\": \"The text does not contain a publication year. If you have additional information or a different section of the guideline that includes the year, please provide it, and I can extract it for you\",\n      \"action\": \"added\"\n    },\n    {\n      \"field\": \"summary\",\n      \"oldValue\": null,\n      \"newValue\": \"**Summary of Neonatal Jaundice Management Guideline** - **Target group**: Babies from birth to 28 days; healthcare professionals (midwives, neonatal staff, paediatricians). - **Key priorities**: Antenatal/postnatal care, risk factor assessment (gestational age, family history, early jaundice), visual inspection, and bilirubin measurement. - **Diagnosis**: Use serum/gas bilirubin (not icterometer) in first 24 hours, preterm (<35 weeks), or if above treatment thresholds. Avoid umbilical cord bilirubin, ETCOc, or DAT for hyperbilirubinaemia prediction. - **Treatment**: - **Phototherapy**: Start if bilirubin exceeds threshold; stop once below threshold. Provide parental education. - **Exchange transfusion**: Required for severe hyperbilirubinaemia or acute bilirubin encephalopathy; perform in tertiary units with parental counseling. - **IVIG**: Adjunct to phototherapy in select cases. - **Prolonged jaundice (term ≥14 days, preterm ≥21 days)**: Assess for pale stools/dark urine, measure conjugated bilirubin, perform FBC, blood group/DAT, urine culture, and metabolic screening. Refer if conjugated bilirubin >25 µmol/L. - **Monitoring**: Continuous phototherapy during/after exchange transfusion\",\n      \"action\": \"added\"\n    }\n  ]\n}",
  "ai_provider": "DeepSeek",
  "ai_model": "deepseek-chat",
  "token_usage": null
}