{
  "prompt": {
    "guidelineId": "cg1109-diabetes-in-pregnancy-guideline-pdf",
    "fieldsProcessed": [
      "humanFriendlyName",
      "organisation",
      "yearProduced",
      "summary"
    ],
    "enhancedFields": 4,
    "contentLength": 3289
  },
  "response": "{\n  \"success\": true,\n  \"enhancedFields\": [\n    {\n      \"field\": \"humanFriendlyName\",\n      \"oldValue\": null,\n      \"newValue\": \"Diabetes in Pregnancy Care Guidelines\",\n      \"action\": \"added\"\n    },\n    {\n      \"field\": \"organisation\",\n      \"oldValue\": null,\n      \"newValue\": \"RCOG\",\n      \"action\": \"added\"\n    },\n    {\n      \"field\": \"yearProduced\",\n      \"oldValue\": null,\n      \"newValue\": \"The text provided does not explicitly mention a publication year. If you have access to the full guideline document, please check the title page, footer, or references section for the publication year. Let me know if you'd like me to review another section of the text\",\n      \"action\": \"added\"\n    },\n    {\n      \"field\": \"summary\",\n      \"oldValue\": null,\n      \"newValue\": \"**Summary of Diabetes in Pregnancy Guideline** - **Pre-pregnancy counseling**: Discuss risks, optimize glucose monitoring, review medications, and screen for complications in women with pre-existing diabetes. - **Gestational diabetes (GDM) screening**: Follow diagnostic criteria; refer to Diabetes Pregnancy Team if diagnosed. - **Late pregnancy (after 34 weeks)**: Routine GTT or glucose monitoring is unnecessary if prior normal OGTT; random glucose ≥7mmol/L warrants discussion. - **Diagnosis without GTT**: Fasting glucose ≥5.6mmol/L or any glucose >11.0mmol/L requires urgent referral. - **Management**: Diet/exercise trial if fasting glucose <7mmol/L; corticosteroids may require hospitalization for glucose monitoring and insulin adjustment. - **Labor/delivery**: Continue insulin; consider VRIII; adjust doses postpartum. - **Postpartum care**: Monitor glucose closely, especially when breastfeeding. - **Additional care**: Offer 20-week ultrasound, self-monitoring, COVID-19 vaccination (per JCVI), and diabetic emergency protocols. - **Audit**: Regular reviews to ensure guideline adherence and optimal care\",\n      \"action\": \"added\"\n    }\n  ]\n}",
  "endpoint": "enhanceGuidelineMetadata",
  "timestamp": "2025-06-18T18-41-37",
  "textContent": "AI: DeepSeek (deepseek-chat)\n\nQ: {\n  \"guidelineId\": \"cg1109-diabetes-in-pregnancy-guideline-pdf\",\n  \"fieldsProcessed\": [\n    \"humanFriendlyName\",\n    \"organisation\",\n    \"yearProduced\",\n    \"summary\"\n  ],\n  \"enhancedFields\": 4,\n  \"contentLength\": 3289\n}\n\nA: {\n  \"success\": true,\n  \"enhancedFields\": [\n    {\n      \"field\": \"humanFriendlyName\",\n      \"oldValue\": null,\n      \"newValue\": \"Diabetes in Pregnancy Care Guidelines\",\n      \"action\": \"added\"\n    },\n    {\n      \"field\": \"organisation\",\n      \"oldValue\": null,\n      \"newValue\": \"RCOG\",\n      \"action\": \"added\"\n    },\n    {\n      \"field\": \"yearProduced\",\n      \"oldValue\": null,\n      \"newValue\": \"The text provided does not explicitly mention a publication year. If you have access to the full guideline document, please check the title page, footer, or references section for the publication year. Let me know if you'd like me to review another section of the text\",\n      \"action\": \"added\"\n    },\n    {\n      \"field\": \"summary\",\n      \"oldValue\": null,\n      \"newValue\": \"**Summary of Diabetes in Pregnancy Guideline** - **Pre-pregnancy counseling**: Discuss risks, optimize glucose monitoring, review medications, and screen for complications in women with pre-existing diabetes. - **Gestational diabetes (GDM) screening**: Follow diagnostic criteria; refer to Diabetes Pregnancy Team if diagnosed. - **Late pregnancy (after 34 weeks)**: Routine GTT or glucose monitoring is unnecessary if prior normal OGTT; random glucose ≥7mmol/L warrants discussion. - **Diagnosis without GTT**: Fasting glucose ≥5.6mmol/L or any glucose >11.0mmol/L requires urgent referral. - **Management**: Diet/exercise trial if fasting glucose <7mmol/L; corticosteroids may require hospitalization for glucose monitoring and insulin adjustment. - **Labor/delivery**: Continue insulin; consider VRIII; adjust doses postpartum. - **Postpartum care**: Monitor glucose closely, especially when breastfeeding. - **Additional care**: Offer 20-week ultrasound, self-monitoring, COVID-19 vaccination (per JCVI), and diabetic emergency protocols. - **Audit**: Regular reviews to ensure guideline adherence and optimal care\",\n      \"action\": \"added\"\n    }\n  ]\n}",
  "ai_provider": "DeepSeek",
  "ai_model": "deepseek-chat",
  "token_usage": null
}