{
  "prompt": {
    "guidelineId": "pid-proforma-june-2011v2-pdf",
    "fieldsProcessed": [
      "humanFriendlyName",
      "organisation",
      "yearProduced",
      "summary"
    ],
    "enhancedFields": 4,
    "contentLength": 638
  },
  "response": "{\n  \"success\": true,\n  \"enhancedFields\": [\n    {\n      \"field\": \"humanFriendlyName\",\n      \"oldValue\": null,\n      \"newValue\": \"Suspected Pelvic Inflammatory Disease Protocol\",\n      \"action\": \"added\"\n    },\n    {\n      \"field\": \"organisation\",\n      \"oldValue\": null,\n      \"newValue\": \"RCOG\",\n      \"action\": \"added\"\n    },\n    {\n      \"field\": \"yearProduced\",\n      \"oldValue\": null,\n      \"newValue\": \"I cannot find a publication year in the provided text. The text appears to be a clinical protocol or form rather than a published guideline with a visible year\",\n      \"action\": \"added\"\n    },\n    {\n      \"field\": \"summary\",\n      \"oldValue\": null,\n      \"newValue\": \"**Summary of Suspected Pelvic Inflammatory Disease (PID) Protocol** **Key Recommendations:** 1. **Assessment:** Evaluate presenting complaints (abdominal pain, abnormal bleeding, vaginal discharge, dyspareunia) and obtain sexual/gynaecological history. 2. **Examinations/Investigations:** Conduct general and pelvic exams; perform STI screening (e.g., chlamydia/gonorrhoea NAAT), pregnancy test, and bloods (CRP/WCC) if indicated. 3. **Management:** - **Empirical Treatment:** Start antibiotics promptly (e.g., ceftriaxone + doxycycline + metronidazole) if PID is suspected. - **Follow-up:** Schedule a 2-week review to assess response and confirm STI results. 4. **Counselling:** Advise on abstinence until treatment completion, partner notification, and condom use. 5. **Partner Notification:** Obtain consent for health advisor involvement to arrange partner testing/treatment. 6. **Documentation:** Complete consent, fax proforma to Claude Nicol Clinic, and ensure contact details are recorded. **Note:** High suspicion warrants urgent treatment to prevent complications (e.g., infertility). Always rule out ectopic pregnancy\",\n      \"action\": \"added\"\n    }\n  ]\n}",
  "endpoint": "enhanceGuidelineMetadata",
  "timestamp": "2025-06-18T22-58-59",
  "textContent": "AI: DeepSeek (deepseek-chat)\n\nQ: {\n  \"guidelineId\": \"pid-proforma-june-2011v2-pdf\",\n  \"fieldsProcessed\": [\n    \"humanFriendlyName\",\n    \"organisation\",\n    \"yearProduced\",\n    \"summary\"\n  ],\n  \"enhancedFields\": 4,\n  \"contentLength\": 638\n}\n\nA: {\n  \"success\": true,\n  \"enhancedFields\": [\n    {\n      \"field\": \"humanFriendlyName\",\n      \"oldValue\": null,\n      \"newValue\": \"Suspected Pelvic Inflammatory Disease Protocol\",\n      \"action\": \"added\"\n    },\n    {\n      \"field\": \"organisation\",\n      \"oldValue\": null,\n      \"newValue\": \"RCOG\",\n      \"action\": \"added\"\n    },\n    {\n      \"field\": \"yearProduced\",\n      \"oldValue\": null,\n      \"newValue\": \"I cannot find a publication year in the provided text. The text appears to be a clinical protocol or form rather than a published guideline with a visible year\",\n      \"action\": \"added\"\n    },\n    {\n      \"field\": \"summary\",\n      \"oldValue\": null,\n      \"newValue\": \"**Summary of Suspected Pelvic Inflammatory Disease (PID) Protocol** **Key Recommendations:** 1. **Assessment:** Evaluate presenting complaints (abdominal pain, abnormal bleeding, vaginal discharge, dyspareunia) and obtain sexual/gynaecological history. 2. **Examinations/Investigations:** Conduct general and pelvic exams; perform STI screening (e.g., chlamydia/gonorrhoea NAAT), pregnancy test, and bloods (CRP/WCC) if indicated. 3. **Management:** - **Empirical Treatment:** Start antibiotics promptly (e.g., ceftriaxone + doxycycline + metronidazole) if PID is suspected. - **Follow-up:** Schedule a 2-week review to assess response and confirm STI results. 4. **Counselling:** Advise on abstinence until treatment completion, partner notification, and condom use. 5. **Partner Notification:** Obtain consent for health advisor involvement to arrange partner testing/treatment. 6. **Documentation:** Complete consent, fax proforma to Claude Nicol Clinic, and ensure contact details are recorded. **Note:** High suspicion warrants urgent treatment to prevent complications (e.g., infertility). Always rule out ectopic pregnancy\",\n      \"action\": \"added\"\n    }\n  ]\n}",
  "ai_provider": "DeepSeek",
  "ai_model": "deepseek-chat",
  "token_usage": null
}