{
  "prompt": {
    "guidelineId": "cg1114-breech-guideline-pdf",
    "fieldsProcessed": [
      "humanFriendlyName",
      "organisation",
      "yearProduced",
      "summary"
    ],
    "enhancedFields": 4,
    "contentLength": 3458
  },
  "response": "{\n  \"success\": true,\n  \"enhancedFields\": [\n    {\n      \"field\": \"humanFriendlyName\",\n      \"oldValue\": null,\n      \"newValue\": \"Breech Management Guideline: ECV and Vaginal Birth\",\n      \"action\": \"added\"\n    },\n    {\n      \"field\": \"organisation\",\n      \"oldValue\": null,\n      \"newValue\": \"RCOG\",\n      \"action\": \"added\"\n    },\n    {\n      \"field\": \"yearProduced\",\n      \"oldValue\": null,\n      \"newValue\": \"2017\",\n      \"action\": \"added\"\n    },\n    {\n      \"field\": \"summary\",\n      \"oldValue\": null,\n      \"newValue\": \"**Summary of Breech Management Guideline v6.0** This guideline provides evidence-based recommendations for managing breech presentation, focusing on **external cephalic version (ECV)** and **vaginal breech birth**. ### **Key Recommendations:** - **ECV should be offered** to women with confirmed breech presentation after **36 weeks**, unless contraindicated (e.g., placenta previa, fetal compromise). - **ECV procedure**: Performed by a trained obstetrician in a labor ward setting. Administer **Anti-D 1500 units** if Rh-negative, document outcomes, and arrange follow-up. - **Vaginal breech birth** is an option if ECV fails or is declined. Factors favoring vaginal birth include **frank/extended breech**, adequate pelvis, and experienced staff. - **Intrapartum management**: - Monitor fetal heart rate; ensure **anterior fetal back**. - Assist delivery by grasping the fetal pelvis; allow **body to hang** to aid head flexion. - Use maneuvers (e.g., Mauriceau-Smellie-Veit) for head delivery if needed. - Take **paired cord blood samples** post-delivery. - **Contraindications for vaginal breech birth**: Footling breech, fetal growth restriction, or unfavorable maternal/pelvic factors. - **Complications** (e.g., cord prolapse, nuchal arm) require prompt intervention. Staff must counsel women on risks/benefits of ECV and birth options, ensuring informed decision-making. Follow RCOG Green-Top Guideline 20b (2017) standards\",\n      \"action\": \"added\"\n    }\n  ]\n}",
  "endpoint": "enhanceGuidelineMetadata",
  "timestamp": "2025-06-18T21-42-16",
  "textContent": "AI: DeepSeek (deepseek-chat)\n\nQ: {\n  \"guidelineId\": \"cg1114-breech-guideline-pdf\",\n  \"fieldsProcessed\": [\n    \"humanFriendlyName\",\n    \"organisation\",\n    \"yearProduced\",\n    \"summary\"\n  ],\n  \"enhancedFields\": 4,\n  \"contentLength\": 3458\n}\n\nA: {\n  \"success\": true,\n  \"enhancedFields\": [\n    {\n      \"field\": \"humanFriendlyName\",\n      \"oldValue\": null,\n      \"newValue\": \"Breech Management Guideline: ECV and Vaginal Birth\",\n      \"action\": \"added\"\n    },\n    {\n      \"field\": \"organisation\",\n      \"oldValue\": null,\n      \"newValue\": \"RCOG\",\n      \"action\": \"added\"\n    },\n    {\n      \"field\": \"yearProduced\",\n      \"oldValue\": null,\n      \"newValue\": \"2017\",\n      \"action\": \"added\"\n    },\n    {\n      \"field\": \"summary\",\n      \"oldValue\": null,\n      \"newValue\": \"**Summary of Breech Management Guideline v6.0** This guideline provides evidence-based recommendations for managing breech presentation, focusing on **external cephalic version (ECV)** and **vaginal breech birth**. ### **Key Recommendations:** - **ECV should be offered** to women with confirmed breech presentation after **36 weeks**, unless contraindicated (e.g., placenta previa, fetal compromise). - **ECV procedure**: Performed by a trained obstetrician in a labor ward setting. Administer **Anti-D 1500 units** if Rh-negative, document outcomes, and arrange follow-up. - **Vaginal breech birth** is an option if ECV fails or is declined. Factors favoring vaginal birth include **frank/extended breech**, adequate pelvis, and experienced staff. - **Intrapartum management**: - Monitor fetal heart rate; ensure **anterior fetal back**. - Assist delivery by grasping the fetal pelvis; allow **body to hang** to aid head flexion. - Use maneuvers (e.g., Mauriceau-Smellie-Veit) for head delivery if needed. - Take **paired cord blood samples** post-delivery. - **Contraindications for vaginal breech birth**: Footling breech, fetal growth restriction, or unfavorable maternal/pelvic factors. - **Complications** (e.g., cord prolapse, nuchal arm) require prompt intervention. Staff must counsel women on risks/benefits of ECV and birth options, ensuring informed decision-making. Follow RCOG Green-Top Guideline 20b (2017) standards\",\n      \"action\": \"added\"\n    }\n  ]\n}",
  "ai_provider": "DeepSeek",
  "ai_model": "deepseek-chat",
  "token_usage": null
}