{
  "prompt": {
    "guidelineId": "sensitive-disposal-of-fetal-remains-under-24-weeks-pdf",
    "fieldsProcessed": [
      "humanFriendlyName",
      "organisation",
      "yearProduced",
      "summary"
    ],
    "enhancedFields": 4,
    "contentLength": 1979
  },
  "response": "{\n  \"success\": true,\n  \"enhancedFields\": [\n    {\n      \"field\": \"humanFriendlyName\",\n      \"oldValue\": null,\n      \"newValue\": \"Sensitive Disposal of Fetal Remains Under 24 Weeks\",\n      \"action\": \"added\"\n    },\n    {\n      \"field\": \"organisation\",\n      \"oldValue\": null,\n      \"newValue\": \"The organization name is not explicitly mentioned in the provided text. However, based on the context and terms like \\\"Trust process,\\\" it is likely a hospital trust or NHS-related entity. Since no specific acronym like NHS, NICE, WHO, etc., is present, I cannot extract a clear organization name. If you can provide more context or a specific mention of an organization, I can assist further. Otherwise, the text does not contain a recognizable publishing organization name\",\n      \"action\": \"added\"\n    },\n    {\n      \"field\": \"yearProduced\",\n      \"oldValue\": null,\n      \"newValue\": \"I cannot find a publication year in the provided text. The guideline does not explicitly state its publication or revision year. If you have another version of the document or a different section that includes the year, please share it, and I can extract it for you\",\n      \"action\": \"added\"\n    },\n    {\n      \"field\": \"summary\",\n      \"oldValue\": null,\n      \"newValue\": \"**Summary of Sensitive Disposal of Fetal Remains Under 24 Weeks Guidance** This guideline provides a framework for respectful disposal of fetal remains under 24 weeks, emphasizing patient and family wishes. Key stakeholders include mortuary, histopathology, crematorium, and clinical staff. **Key Recommendations:** - **Options for disposal:** Hospital-arranged cremation, private burial/cremation, or home burial. - **Non-recognizable fetus:** Provide information, obtain consent, and follow mortuary transfer protocols (waterproof pad, wrapping, labeled box with forms). - **Recognizable fetus:** Offer funeral arrangement options and ensure proper documentation. - **Post-mortem & cytogenetics:** Obtain consent for examinations and send remains to designated labs if needed. - **Compliance:** Staff must follow procedures, use correct forms, and participate in annual audits. The guideline stresses dignity, consent, and clear processes for handling fetal remains\",\n      \"action\": \"added\"\n    }\n  ]\n}",
  "endpoint": "enhanceGuidelineMetadata",
  "timestamp": "2025-06-18T23-01-41",
  "textContent": "AI: DeepSeek (deepseek-chat)\n\nQ: {\n  \"guidelineId\": \"sensitive-disposal-of-fetal-remains-under-24-weeks-pdf\",\n  \"fieldsProcessed\": [\n    \"humanFriendlyName\",\n    \"organisation\",\n    \"yearProduced\",\n    \"summary\"\n  ],\n  \"enhancedFields\": 4,\n  \"contentLength\": 1979\n}\n\nA: {\n  \"success\": true,\n  \"enhancedFields\": [\n    {\n      \"field\": \"humanFriendlyName\",\n      \"oldValue\": null,\n      \"newValue\": \"Sensitive Disposal of Fetal Remains Under 24 Weeks\",\n      \"action\": \"added\"\n    },\n    {\n      \"field\": \"organisation\",\n      \"oldValue\": null,\n      \"newValue\": \"The organization name is not explicitly mentioned in the provided text. However, based on the context and terms like \\\"Trust process,\\\" it is likely a hospital trust or NHS-related entity. Since no specific acronym like NHS, NICE, WHO, etc., is present, I cannot extract a clear organization name. If you can provide more context or a specific mention of an organization, I can assist further. Otherwise, the text does not contain a recognizable publishing organization name\",\n      \"action\": \"added\"\n    },\n    {\n      \"field\": \"yearProduced\",\n      \"oldValue\": null,\n      \"newValue\": \"I cannot find a publication year in the provided text. The guideline does not explicitly state its publication or revision year. If you have another version of the document or a different section that includes the year, please share it, and I can extract it for you\",\n      \"action\": \"added\"\n    },\n    {\n      \"field\": \"summary\",\n      \"oldValue\": null,\n      \"newValue\": \"**Summary of Sensitive Disposal of Fetal Remains Under 24 Weeks Guidance** This guideline provides a framework for respectful disposal of fetal remains under 24 weeks, emphasizing patient and family wishes. Key stakeholders include mortuary, histopathology, crematorium, and clinical staff. **Key Recommendations:** - **Options for disposal:** Hospital-arranged cremation, private burial/cremation, or home burial. - **Non-recognizable fetus:** Provide information, obtain consent, and follow mortuary transfer protocols (waterproof pad, wrapping, labeled box with forms). - **Recognizable fetus:** Offer funeral arrangement options and ensure proper documentation. - **Post-mortem & cytogenetics:** Obtain consent for examinations and send remains to designated labs if needed. - **Compliance:** Staff must follow procedures, use correct forms, and participate in annual audits. The guideline stresses dignity, consent, and clear processes for handling fetal remains\",\n      \"action\": \"added\"\n    }\n  ]\n}",
  "ai_provider": "DeepSeek",
  "ai_model": "deepseek-chat",
  "token_usage": null
}