{
  "prompt": {
    "guidelineId": "gp016-operational-guideline-for-admission-to-gynaecology-maternity-ward-pdf",
    "fieldsProcessed": [
      "humanFriendlyName",
      "organisation",
      "yearProduced",
      "summary"
    ],
    "enhancedFields": 4,
    "contentLength": 1352
  },
  "response": "{\n  \"success\": true,\n  \"enhancedFields\": [\n    {\n      \"field\": \"humanFriendlyName\",\n      \"oldValue\": null,\n      \"newValue\": \"Gynaecology & Maternity Ward Admission and Cancellation Protocol\",\n      \"action\": \"added\"\n    },\n    {\n      \"field\": \"organisation\",\n      \"oldValue\": null,\n      \"newValue\": \"Brighton & Sussex University Hospitals\",\n      \"action\": \"added\"\n    },\n    {\n      \"field\": \"yearProduced\",\n      \"oldValue\": null,\n      \"newValue\": \"The text provided does not contain a publication year. If you have another guideline text that includes the year, please share it, and I can extract the 4-digit year for you\",\n      \"action\": \"added\"\n    },\n    {\n      \"field\": \"summary\",\n      \"oldValue\": null,\n      \"newValue\": \"**Summary of Gynaecology Operational & Escalation Protocol GP016:** This protocol outlines admission criteria for gynaecology and maternity wards at Brighton & Sussex University Hospitals, emphasizing professional judgement and guideline compliance. Key points include ward organization, non-gynaecology patient admissions, and escalation for clinically sick patients. **Cancellation of Operations Process:** - **Reasons:** Lack of equipment/staffing or bed capacity. - **Steps:** - Contact Gynaecology Service Manager. - Agree cancellation with the consultant in charge. - Inform the patient and reschedule surgery. - Notify theatres, ward manager, and clinical site manager. - Complete Datix reporting. - **Key Contacts:** - Chloe Rogers (Service Manager): 07825833737 - Nicky Van Eerde (PRH Manager): 07795416615 - Dawn Elson (RSCH Manager): 0779416591 - **Admissions:** Contact Gynae Admissions (ext 2863) or Clare Halton (out of hours). Compliance monitoring and appendix details are included\",\n      \"action\": \"added\"\n    }\n  ]\n}",
  "endpoint": "enhanceGuidelineMetadata",
  "timestamp": "2025-06-18T22-25-26",
  "textContent": "AI: DeepSeek (deepseek-chat)\n\nQ: {\n  \"guidelineId\": \"gp016-operational-guideline-for-admission-to-gynaecology-maternity-ward-pdf\",\n  \"fieldsProcessed\": [\n    \"humanFriendlyName\",\n    \"organisation\",\n    \"yearProduced\",\n    \"summary\"\n  ],\n  \"enhancedFields\": 4,\n  \"contentLength\": 1352\n}\n\nA: {\n  \"success\": true,\n  \"enhancedFields\": [\n    {\n      \"field\": \"humanFriendlyName\",\n      \"oldValue\": null,\n      \"newValue\": \"Gynaecology & Maternity Ward Admission and Cancellation Protocol\",\n      \"action\": \"added\"\n    },\n    {\n      \"field\": \"organisation\",\n      \"oldValue\": null,\n      \"newValue\": \"Brighton & Sussex University Hospitals\",\n      \"action\": \"added\"\n    },\n    {\n      \"field\": \"yearProduced\",\n      \"oldValue\": null,\n      \"newValue\": \"The text provided does not contain a publication year. If you have another guideline text that includes the year, please share it, and I can extract the 4-digit year for you\",\n      \"action\": \"added\"\n    },\n    {\n      \"field\": \"summary\",\n      \"oldValue\": null,\n      \"newValue\": \"**Summary of Gynaecology Operational & Escalation Protocol GP016:** This protocol outlines admission criteria for gynaecology and maternity wards at Brighton & Sussex University Hospitals, emphasizing professional judgement and guideline compliance. Key points include ward organization, non-gynaecology patient admissions, and escalation for clinically sick patients. **Cancellation of Operations Process:** - **Reasons:** Lack of equipment/staffing or bed capacity. - **Steps:** - Contact Gynaecology Service Manager. - Agree cancellation with the consultant in charge. - Inform the patient and reschedule surgery. - Notify theatres, ward manager, and clinical site manager. - Complete Datix reporting. - **Key Contacts:** - Chloe Rogers (Service Manager): 07825833737 - Nicky Van Eerde (PRH Manager): 07795416615 - Dawn Elson (RSCH Manager): 0779416591 - **Admissions:** Contact Gynae Admissions (ext 2863) or Clare Halton (out of hours). Compliance monitoring and appendix details are included\",\n      \"action\": \"added\"\n    }\n  ]\n}",
  "ai_provider": "DeepSeek",
  "ai_model": "deepseek-chat",
  "token_usage": null
}