{
  "prompt": {
    "guidelineId": "cg1118-neonatal-hypothermia-pdf",
    "fieldsProcessed": [
      "humanFriendlyName",
      "organisation",
      "yearProduced",
      "summary"
    ],
    "enhancedFields": 4,
    "contentLength": 1134
  },
  "response": "{\n  \"success\": true,\n  \"enhancedFields\": [\n    {\n      \"field\": \"humanFriendlyName\",\n      \"oldValue\": null,\n      \"newValue\": \"Neonatal Hypothermia Detection and Management Guide\",\n      \"action\": \"added\"\n    },\n    {\n      \"field\": \"organisation\",\n      \"oldValue\": null,\n      \"newValue\": \"The text provided does not explicitly mention a specific publishing organization or institution such as NHS, NICE, WHO, RCOG, etc. Therefore, I cannot identify the organization name from the given guideline text. If you have any additional context or a specific part of the text that might indicate the publishing organization, please provide that, and I’d be happy to assist further!\",\n      \"action\": \"added\"\n    },\n    {\n      \"field\": \"yearProduced\",\n      \"oldValue\": null,\n      \"newValue\": \"The text provided does not contain a publication year. If you have another guideline text that includes the year, please share it, and I can extract the 4-digit year for you\",\n      \"action\": \"added\"\n    },\n    {\n      \"field\": \"summary\",\n      \"oldValue\": null,\n      \"newValue\": \"**Summary of Neonatal Hypothermia Guideline:** This guideline provides staff with protocols for detecting and managing neonatal hypothermia. It applies to all caregivers of newborns, emphasizing prevention, monitoring, and timely intervention. **Key Recommendations:** - **Prevention:** Anticipate hypothermia in at-risk neonates; maintain a warm environment and encourage skin-to-skin contact. - **At Birth:** Dry the baby immediately, promote skin-to-skin contact, and initiate feeding. - **Low Temperature Management:** Use skin-to-skin contact, continuous monitoring, and a hot cot if needed. - **Hot Cot Use:** Keep it pre-warmed, monitor temperature closely, and gradually reduce heat once stabilized. - **Ongoing Care:** Discontinue monitoring if temperature stabilizes; prioritize feeding. - **Parental Communication:** Explain procedures and management to parents. - **Audit:** Follow outlined processes in the Maternity Audit Document for compliance. Staff must use professional judgment while adhering to these guidelines\",\n      \"action\": \"added\"\n    }\n  ]\n}",
  "endpoint": "enhanceGuidelineMetadata",
  "timestamp": "2025-06-18T21-44-26",
  "textContent": "AI: DeepSeek (deepseek-chat)\n\nQ: {\n  \"guidelineId\": \"cg1118-neonatal-hypothermia-pdf\",\n  \"fieldsProcessed\": [\n    \"humanFriendlyName\",\n    \"organisation\",\n    \"yearProduced\",\n    \"summary\"\n  ],\n  \"enhancedFields\": 4,\n  \"contentLength\": 1134\n}\n\nA: {\n  \"success\": true,\n  \"enhancedFields\": [\n    {\n      \"field\": \"humanFriendlyName\",\n      \"oldValue\": null,\n      \"newValue\": \"Neonatal Hypothermia Detection and Management Guide\",\n      \"action\": \"added\"\n    },\n    {\n      \"field\": \"organisation\",\n      \"oldValue\": null,\n      \"newValue\": \"The text provided does not explicitly mention a specific publishing organization or institution such as NHS, NICE, WHO, RCOG, etc. Therefore, I cannot identify the organization name from the given guideline text. If you have any additional context or a specific part of the text that might indicate the publishing organization, please provide that, and I’d be happy to assist further!\",\n      \"action\": \"added\"\n    },\n    {\n      \"field\": \"yearProduced\",\n      \"oldValue\": null,\n      \"newValue\": \"The text provided does not contain a publication year. If you have another guideline text that includes the year, please share it, and I can extract the 4-digit year for you\",\n      \"action\": \"added\"\n    },\n    {\n      \"field\": \"summary\",\n      \"oldValue\": null,\n      \"newValue\": \"**Summary of Neonatal Hypothermia Guideline:** This guideline provides staff with protocols for detecting and managing neonatal hypothermia. It applies to all caregivers of newborns, emphasizing prevention, monitoring, and timely intervention. **Key Recommendations:** - **Prevention:** Anticipate hypothermia in at-risk neonates; maintain a warm environment and encourage skin-to-skin contact. - **At Birth:** Dry the baby immediately, promote skin-to-skin contact, and initiate feeding. - **Low Temperature Management:** Use skin-to-skin contact, continuous monitoring, and a hot cot if needed. - **Hot Cot Use:** Keep it pre-warmed, monitor temperature closely, and gradually reduce heat once stabilized. - **Ongoing Care:** Discontinue monitoring if temperature stabilizes; prioritize feeding. - **Parental Communication:** Explain procedures and management to parents. - **Audit:** Follow outlined processes in the Maternity Audit Document for compliance. Staff must use professional judgment while adhering to these guidelines\",\n      \"action\": \"added\"\n    }\n  ]\n}",
  "ai_provider": "DeepSeek",
  "ai_model": "deepseek-chat",
  "token_usage": null
}