{
  "prompt": {
    "guidelineId": "cg1130-assisted-vaginal-birth-guideline-pdf",
    "fieldsProcessed": [
      "humanFriendlyName",
      "organisation",
      "yearProduced",
      "summary"
    ],
    "enhancedFields": 4,
    "contentLength": 2258
  },
  "response": "{\n  \"success\": true,\n  \"enhancedFields\": [\n    {\n      \"field\": \"humanFriendlyName\",\n      \"oldValue\": null,\n      \"newValue\": \"Assisted Vaginal Birth: Forceps and Vacuum Extraction Guidelines\",\n      \"action\": \"added\"\n    },\n    {\n      \"field\": \"organisation\",\n      \"oldValue\": null,\n      \"newValue\": \"RCOG\",\n      \"action\": \"added\"\n    },\n    {\n      \"field\": \"yearProduced\",\n      \"oldValue\": null,\n      \"newValue\": \"I don't see a publication year explicitly mentioned in the provided text. Could you check if the year is included in another part of the guideline?\",\n      \"action\": \"added\"\n    },\n    {\n      \"field\": \"summary\",\n      \"oldValue\": null,\n      \"newValue\": \"**Summary of Assisted Vaginal Birth Guideline:** - **Instrument choice:** Operators should select the most appropriate instrument (forceps or vacuum) for the first attempt. Vacuum extraction has a higher failure rate but less maternal trauma, while forceps are more effective but risk maternal injury. Vacuum does not increase cesarean rates or neonatal adverse outcomes. - **Risk factors for failure:** Mid-cavity/rotational birth, maternal obesity, fetal weight >4000g, occipito-posterior position, short maternal stature, and large fetal head circumference. - **Pre-procedure:** Ultrasound is recommended if fetal head position is uncertain. - **Post-birth care:** Administer antibiotics to reduce infection risk. Monitor for complications, ensure bladder care, thromboprophylaxis, and analgesia. Document and plan postnatal follow-up. - **Psychological support:** Offer referral to midwife counselors for traumatic births but avoid single-session, trauma-focused interventions. - **Safety & reporting:** Units must support patients and staff after adverse events. Adhere to duty of candour and complete incident reports. Monitor auditable standards per RCOG guidelines\",\n      \"action\": \"added\"\n    }\n  ]\n}",
  "endpoint": "enhanceGuidelineMetadata",
  "timestamp": "2025-06-18T21-50-05",
  "textContent": "AI: DeepSeek (deepseek-chat)\n\nQ: {\n  \"guidelineId\": \"cg1130-assisted-vaginal-birth-guideline-pdf\",\n  \"fieldsProcessed\": [\n    \"humanFriendlyName\",\n    \"organisation\",\n    \"yearProduced\",\n    \"summary\"\n  ],\n  \"enhancedFields\": 4,\n  \"contentLength\": 2258\n}\n\nA: {\n  \"success\": true,\n  \"enhancedFields\": [\n    {\n      \"field\": \"humanFriendlyName\",\n      \"oldValue\": null,\n      \"newValue\": \"Assisted Vaginal Birth: Forceps and Vacuum Extraction Guidelines\",\n      \"action\": \"added\"\n    },\n    {\n      \"field\": \"organisation\",\n      \"oldValue\": null,\n      \"newValue\": \"RCOG\",\n      \"action\": \"added\"\n    },\n    {\n      \"field\": \"yearProduced\",\n      \"oldValue\": null,\n      \"newValue\": \"I don't see a publication year explicitly mentioned in the provided text. Could you check if the year is included in another part of the guideline?\",\n      \"action\": \"added\"\n    },\n    {\n      \"field\": \"summary\",\n      \"oldValue\": null,\n      \"newValue\": \"**Summary of Assisted Vaginal Birth Guideline:** - **Instrument choice:** Operators should select the most appropriate instrument (forceps or vacuum) for the first attempt. Vacuum extraction has a higher failure rate but less maternal trauma, while forceps are more effective but risk maternal injury. Vacuum does not increase cesarean rates or neonatal adverse outcomes. - **Risk factors for failure:** Mid-cavity/rotational birth, maternal obesity, fetal weight >4000g, occipito-posterior position, short maternal stature, and large fetal head circumference. - **Pre-procedure:** Ultrasound is recommended if fetal head position is uncertain. - **Post-birth care:** Administer antibiotics to reduce infection risk. Monitor for complications, ensure bladder care, thromboprophylaxis, and analgesia. Document and plan postnatal follow-up. - **Psychological support:** Offer referral to midwife counselors for traumatic births but avoid single-session, trauma-focused interventions. - **Safety & reporting:** Units must support patients and staff after adverse events. Adhere to duty of candour and complete incident reports. Monitor auditable standards per RCOG guidelines\",\n      \"action\": \"added\"\n    }\n  ]\n}",
  "ai_provider": "DeepSeek",
  "ai_model": "deepseek-chat",
  "token_usage": null
}