{
  "prompt": {
    "guidelineId": "cg1126-multiple-pregnancy-and-birth-pdf",
    "fieldsProcessed": [
      "humanFriendlyName",
      "organisation",
      "yearProduced",
      "summary"
    ],
    "enhancedFields": 4,
    "contentLength": 6312
  },
  "response": "{\n  \"success\": true,\n  \"enhancedFields\": [\n    {\n      \"field\": \"humanFriendlyName\",\n      \"oldValue\": null,\n      \"newValue\": \"Guidelines for Managing Twin and Multiple Pregnancies\",\n      \"action\": \"added\"\n    },\n    {\n      \"field\": \"organisation\",\n      \"oldValue\": null,\n      \"newValue\": \"SRH&WH NHS Foundation Trust\",\n      \"action\": \"added\"\n    },\n    {\n      \"field\": \"yearProduced\",\n      \"oldValue\": null,\n      \"newValue\": \"The text does not contain a publication year. If you have the publication year or another part of the document that includes it, please provide that section\",\n      \"action\": \"added\"\n    },\n    {\n      \"field\": \"summary\",\n      \"oldValue\": null,\n      \"newValue\": \"**Summary of Twin and Higher Order Multiple Pregnancy Guidelines (University Hospitals Sussex):** - **Antenatal Care:** Offer consultant-led care, with discussions on birth planning by 24 weeks. Document birth plans (place, mode, analgesia) by 28 weeks. Monitor for complications (e.g., TTTS, growth restriction). - **TTTS Management:** Fetoscopic laser ablation is preferred before 26 weeks. Consider termination or selective termination in severe cases. - **Birth Planning:** Vaginal birth or caesarean section are safe for uncomplicated twins after 32 weeks. Caesarean recommended for monoamniotic twins/triplets. - **Intrapartum Care:** Continuous CTG monitoring for twins >26 weeks. Classify CTGs as \\\"abnormal\\\" or \\\"non-reassuring.\\\" Senior obstetrician involvement for pathological traces. Active management for second twin birth. - **Postpartum Care:** Monitor for hemorrhage, hypoglycemia. Follow bereavement pathway if fetal demise occurs. - **Preterm Birth:** Offer aspirin prophylaxis, screen for preterm labor, and plan birth at 35 weeks if uncomplicated. - **Documentation:** Label fetuses via ultrasound, document care plans, and ensure multidisciplinary team involvement. *(Word count: 200)*\",\n      \"action\": \"added\"\n    }\n  ]\n}",
  "endpoint": "enhanceGuidelineMetadata",
  "timestamp": "2025-06-18T21-47-54",
  "textContent": "AI: DeepSeek (deepseek-chat)\n\nQ: {\n  \"guidelineId\": \"cg1126-multiple-pregnancy-and-birth-pdf\",\n  \"fieldsProcessed\": [\n    \"humanFriendlyName\",\n    \"organisation\",\n    \"yearProduced\",\n    \"summary\"\n  ],\n  \"enhancedFields\": 4,\n  \"contentLength\": 6312\n}\n\nA: {\n  \"success\": true,\n  \"enhancedFields\": [\n    {\n      \"field\": \"humanFriendlyName\",\n      \"oldValue\": null,\n      \"newValue\": \"Guidelines for Managing Twin and Multiple Pregnancies\",\n      \"action\": \"added\"\n    },\n    {\n      \"field\": \"organisation\",\n      \"oldValue\": null,\n      \"newValue\": \"SRH&WH NHS Foundation Trust\",\n      \"action\": \"added\"\n    },\n    {\n      \"field\": \"yearProduced\",\n      \"oldValue\": null,\n      \"newValue\": \"The text does not contain a publication year. If you have the publication year or another part of the document that includes it, please provide that section\",\n      \"action\": \"added\"\n    },\n    {\n      \"field\": \"summary\",\n      \"oldValue\": null,\n      \"newValue\": \"**Summary of Twin and Higher Order Multiple Pregnancy Guidelines (University Hospitals Sussex):** - **Antenatal Care:** Offer consultant-led care, with discussions on birth planning by 24 weeks. Document birth plans (place, mode, analgesia) by 28 weeks. Monitor for complications (e.g., TTTS, growth restriction). - **TTTS Management:** Fetoscopic laser ablation is preferred before 26 weeks. Consider termination or selective termination in severe cases. - **Birth Planning:** Vaginal birth or caesarean section are safe for uncomplicated twins after 32 weeks. Caesarean recommended for monoamniotic twins/triplets. - **Intrapartum Care:** Continuous CTG monitoring for twins >26 weeks. Classify CTGs as \\\"abnormal\\\" or \\\"non-reassuring.\\\" Senior obstetrician involvement for pathological traces. Active management for second twin birth. - **Postpartum Care:** Monitor for hemorrhage, hypoglycemia. Follow bereavement pathway if fetal demise occurs. - **Preterm Birth:** Offer aspirin prophylaxis, screen for preterm labor, and plan birth at 35 weeks if uncomplicated. - **Documentation:** Label fetuses via ultrasound, document care plans, and ensure multidisciplinary team involvement. *(Word count: 200)*\",\n      \"action\": \"added\"\n    }\n  ]\n}",
  "ai_provider": "DeepSeek",
  "ai_model": "deepseek-chat",
  "token_usage": null
}