{
  "prompt": {
    "guidelineId": "cg1134-postnatal-care-pdf",
    "fieldsProcessed": [
      "humanFriendlyName",
      "organisation",
      "yearProduced",
      "summary"
    ],
    "enhancedFields": 4,
    "contentLength": 2306
  },
  "response": "{\n  \"success\": true,\n  \"enhancedFields\": [\n    {\n      \"field\": \"humanFriendlyName\",\n      \"oldValue\": null,\n      \"newValue\": \"Postnatal Care Guidelines for Mothers and Newborns\",\n      \"action\": \"added\"\n    },\n    {\n      \"field\": \"organisation\",\n      \"oldValue\": null,\n      \"newValue\": \"NICE\",\n      \"action\": \"added\"\n    },\n    {\n      \"field\": \"yearProduced\",\n      \"oldValue\": null,\n      \"newValue\": \"I cannot determine the publication year from the provided text. The guideline text does not contain any explicit mention of a publication year. If you have additional information or a different section of the guideline that includes the year, please share it\",\n      \"action\": \"added\"\n    },\n    {\n      \"field\": \"summary\",\n      \"oldValue\": null,\n      \"newValue\": \"**Summary:** The guideline outlines postnatal care for mothers/birthing parents and newborns, emphasizing assessments, monitoring, and support. Key recommendations include: - **Community visits:** Minimum visits post-discharge (next day, by day 5, and final review) with documentation. - **Baby care:** Educate parents on serious illness \\\"red flags,\\\" jaundice (refer if concerns), and use the Baby Check tool. Ensure feeding assessments and handover to health visitors. - **Inpatient care:** Complete assessments and Transfer of Care forms. - **Complex needs:** Assign a named health professional for coordinated care. - **Language support:** Provide interpreters as needed. - **Follow-up/readmissions:** Arrange appointments, review readmitted patients, and complete assessments. - **Discharge:** Ensure observations, documentation, and out-of-area transfer info if applicable. Audit processes and parental education are also highlighted\",\n      \"action\": \"added\"\n    }\n  ]\n}",
  "endpoint": "enhanceGuidelineMetadata",
  "timestamp": "2025-06-18T21-54-09",
  "textContent": "AI: DeepSeek (deepseek-chat)\n\nQ: {\n  \"guidelineId\": \"cg1134-postnatal-care-pdf\",\n  \"fieldsProcessed\": [\n    \"humanFriendlyName\",\n    \"organisation\",\n    \"yearProduced\",\n    \"summary\"\n  ],\n  \"enhancedFields\": 4,\n  \"contentLength\": 2306\n}\n\nA: {\n  \"success\": true,\n  \"enhancedFields\": [\n    {\n      \"field\": \"humanFriendlyName\",\n      \"oldValue\": null,\n      \"newValue\": \"Postnatal Care Guidelines for Mothers and Newborns\",\n      \"action\": \"added\"\n    },\n    {\n      \"field\": \"organisation\",\n      \"oldValue\": null,\n      \"newValue\": \"NICE\",\n      \"action\": \"added\"\n    },\n    {\n      \"field\": \"yearProduced\",\n      \"oldValue\": null,\n      \"newValue\": \"I cannot determine the publication year from the provided text. The guideline text does not contain any explicit mention of a publication year. If you have additional information or a different section of the guideline that includes the year, please share it\",\n      \"action\": \"added\"\n    },\n    {\n      \"field\": \"summary\",\n      \"oldValue\": null,\n      \"newValue\": \"**Summary:** The guideline outlines postnatal care for mothers/birthing parents and newborns, emphasizing assessments, monitoring, and support. Key recommendations include: - **Community visits:** Minimum visits post-discharge (next day, by day 5, and final review) with documentation. - **Baby care:** Educate parents on serious illness \\\"red flags,\\\" jaundice (refer if concerns), and use the Baby Check tool. Ensure feeding assessments and handover to health visitors. - **Inpatient care:** Complete assessments and Transfer of Care forms. - **Complex needs:** Assign a named health professional for coordinated care. - **Language support:** Provide interpreters as needed. - **Follow-up/readmissions:** Arrange appointments, review readmitted patients, and complete assessments. - **Discharge:** Ensure observations, documentation, and out-of-area transfer info if applicable. Audit processes and parental education are also highlighted\",\n      \"action\": \"added\"\n    }\n  ]\n}",
  "ai_provider": "DeepSeek",
  "ai_model": "deepseek-chat",
  "token_usage": null
}