{
  "prompt": {
    "guidelineId": "cg1192-large-for-gestational-age-pdf",
    "fieldsProcessed": [
      "humanFriendlyName",
      "organisation",
      "yearProduced",
      "summary"
    ],
    "enhancedFields": 4,
    "contentLength": 1166
  },
  "response": "{\n  \"success\": true,\n  \"enhancedFields\": [\n    {\n      \"field\": \"humanFriendlyName\",\n      \"oldValue\": null,\n      \"newValue\": \"Guidelines for Managing Large for Gestational Age (LGA) Pregnancies\",\n      \"action\": \"added\"\n    },\n    {\n      \"field\": \"organisation\",\n      \"oldValue\": null,\n      \"newValue\": \"RCOG\",\n      \"action\": \"added\"\n    },\n    {\n      \"field\": \"yearProduced\",\n      \"oldValue\": null,\n      \"newValue\": \"I cannot determine the publication year from the provided text, as it does not contain any explicit date information. The text describes the content and scope of the guideline but does not include a publication year. If you have access to the full document or its metadata, the year may be listed there. Let me know if you'd like me to check a different section of the guideline\",\n      \"action\": \"added\"\n    },\n    {\n      \"field\": \"summary\",\n      \"oldValue\": null,\n      \"newValue\": \"**Summary of Large for Gestational Age (LGA) Guideline:** - **Purpose:** Evidence-based management of suspected LGA fetuses, applicable to all medical/midwifery staff. - **Risks:** LGA/macrosomia linked to complications like shoulder dystocia, perinatal morbidity, and birth trauma. - **Antenatal Care:** Monitor fundal height; refer for ultrasound if LGA suspected. From 38 weeks, discuss risks/benefits of induction of labor (IOL) for macrosomia. - **Birth Options:** - **IOL:** Reduces shoulder dystocia risk but increases perineal tears. No significant difference in perinatal death, brachial plexus injury, or emergency caesarean vs. expectant management. - **Caesarean:** Consider for high-risk cases (e.g., suspected fetal weight ≥4.5kg). - **Shared Decision-Making:** Provide informed discussion on risks/benefits, respecting patient preferences for birth experience and outcomes. - **Key Emphasis:** Individualized care, balancing clinical risks with patient autonomy\",\n      \"action\": \"added\"\n    }\n  ]\n}",
  "endpoint": "enhanceGuidelineMetadata",
  "timestamp": "2025-06-18T22-01-57",
  "textContent": "AI: DeepSeek (deepseek-chat)\n\nQ: {\n  \"guidelineId\": \"cg1192-large-for-gestational-age-pdf\",\n  \"fieldsProcessed\": [\n    \"humanFriendlyName\",\n    \"organisation\",\n    \"yearProduced\",\n    \"summary\"\n  ],\n  \"enhancedFields\": 4,\n  \"contentLength\": 1166\n}\n\nA: {\n  \"success\": true,\n  \"enhancedFields\": [\n    {\n      \"field\": \"humanFriendlyName\",\n      \"oldValue\": null,\n      \"newValue\": \"Guidelines for Managing Large for Gestational Age (LGA) Pregnancies\",\n      \"action\": \"added\"\n    },\n    {\n      \"field\": \"organisation\",\n      \"oldValue\": null,\n      \"newValue\": \"RCOG\",\n      \"action\": \"added\"\n    },\n    {\n      \"field\": \"yearProduced\",\n      \"oldValue\": null,\n      \"newValue\": \"I cannot determine the publication year from the provided text, as it does not contain any explicit date information. The text describes the content and scope of the guideline but does not include a publication year. If you have access to the full document or its metadata, the year may be listed there. Let me know if you'd like me to check a different section of the guideline\",\n      \"action\": \"added\"\n    },\n    {\n      \"field\": \"summary\",\n      \"oldValue\": null,\n      \"newValue\": \"**Summary of Large for Gestational Age (LGA) Guideline:** - **Purpose:** Evidence-based management of suspected LGA fetuses, applicable to all medical/midwifery staff. - **Risks:** LGA/macrosomia linked to complications like shoulder dystocia, perinatal morbidity, and birth trauma. - **Antenatal Care:** Monitor fundal height; refer for ultrasound if LGA suspected. From 38 weeks, discuss risks/benefits of induction of labor (IOL) for macrosomia. - **Birth Options:** - **IOL:** Reduces shoulder dystocia risk but increases perineal tears. No significant difference in perinatal death, brachial plexus injury, or emergency caesarean vs. expectant management. - **Caesarean:** Consider for high-risk cases (e.g., suspected fetal weight ≥4.5kg). - **Shared Decision-Making:** Provide informed discussion on risks/benefits, respecting patient preferences for birth experience and outcomes. - **Key Emphasis:** Individualized care, balancing clinical risks with patient autonomy\",\n      \"action\": \"added\"\n    }\n  ]\n}",
  "ai_provider": "DeepSeek",
  "ai_model": "deepseek-chat",
  "token_usage": null
}