{
  "prompt": {
    "guidelineId": "cg1122-maternal-transfer-onsite-handover-of-care-pdf",
    "fieldsProcessed": [
      "humanFriendlyName",
      "organisation",
      "yearProduced",
      "summary"
    ],
    "enhancedFields": 4,
    "contentLength": 1792
  },
  "response": "{\n  \"success\": true,\n  \"enhancedFields\": [\n    {\n      \"field\": \"humanFriendlyName\",\n      \"oldValue\": null,\n      \"newValue\": \"Maternal Transfer and Onsite Handover of Care Guideline\",\n      \"action\": \"added\"\n    },\n    {\n      \"field\": \"organisation\",\n      \"oldValue\": null,\n      \"newValue\": \"NHS\",\n      \"action\": \"added\"\n    },\n    {\n      \"field\": \"yearProduced\",\n      \"oldValue\": null,\n      \"newValue\": \"The text provided does not contain a publication year. If you have another section of the guideline that includes the year, please share it, and I can extract it for you\",\n      \"action\": \"added\"\n    },\n    {\n      \"field\": \"summary\",\n      \"oldValue\": null,\n      \"newValue\": \"**Summary of Maternal Transfer and Onsite Handover of Care Guideline:** This guideline ensures safe maternal transfers during antenatal, intrapartum, and postnatal periods, covering intra-hospital, home-to-hospital, and inter-hospital transfers. Key recommendations include: - Use **SBAR** for structured documentation and verbal handovers. - Obtain **informed consent** and communicate with next of kin. - Conduct **multidisciplinary discussions** for timely transfers. - Assign clear roles for midwives, obstetricians, and management. - Follow specific protocols for **in utero, ITU/HDU, and postnatal transfers**, including neonatal readmissions. - Complete the **Maternity SBAR Transfer Form** during shift changes and ward transitions. - Ensure **health visitor handovers** post-booking and post-delivery, with updates on changes. - Implement **audit processes** for hospital, community, and ITU/HDU transfers. - Include discharge forms and postnatal concerns in health visitor handovers. **Contact details** provided for antenatal clinic, community midwives, labour ward, and safeguarding teams\",\n      \"action\": \"added\"\n    }\n  ]\n}",
  "endpoint": "enhanceGuidelineMetadata",
  "timestamp": "2025-06-18T21-47-27",
  "textContent": "AI: DeepSeek (deepseek-chat)\n\nQ: {\n  \"guidelineId\": \"cg1122-maternal-transfer-onsite-handover-of-care-pdf\",\n  \"fieldsProcessed\": [\n    \"humanFriendlyName\",\n    \"organisation\",\n    \"yearProduced\",\n    \"summary\"\n  ],\n  \"enhancedFields\": 4,\n  \"contentLength\": 1792\n}\n\nA: {\n  \"success\": true,\n  \"enhancedFields\": [\n    {\n      \"field\": \"humanFriendlyName\",\n      \"oldValue\": null,\n      \"newValue\": \"Maternal Transfer and Onsite Handover of Care Guideline\",\n      \"action\": \"added\"\n    },\n    {\n      \"field\": \"organisation\",\n      \"oldValue\": null,\n      \"newValue\": \"NHS\",\n      \"action\": \"added\"\n    },\n    {\n      \"field\": \"yearProduced\",\n      \"oldValue\": null,\n      \"newValue\": \"The text provided does not contain a publication year. If you have another section of the guideline that includes the year, please share it, and I can extract it for you\",\n      \"action\": \"added\"\n    },\n    {\n      \"field\": \"summary\",\n      \"oldValue\": null,\n      \"newValue\": \"**Summary of Maternal Transfer and Onsite Handover of Care Guideline:** This guideline ensures safe maternal transfers during antenatal, intrapartum, and postnatal periods, covering intra-hospital, home-to-hospital, and inter-hospital transfers. Key recommendations include: - Use **SBAR** for structured documentation and verbal handovers. - Obtain **informed consent** and communicate with next of kin. - Conduct **multidisciplinary discussions** for timely transfers. - Assign clear roles for midwives, obstetricians, and management. - Follow specific protocols for **in utero, ITU/HDU, and postnatal transfers**, including neonatal readmissions. - Complete the **Maternity SBAR Transfer Form** during shift changes and ward transitions. - Ensure **health visitor handovers** post-booking and post-delivery, with updates on changes. - Implement **audit processes** for hospital, community, and ITU/HDU transfers. - Include discharge forms and postnatal concerns in health visitor handovers. **Contact details** provided for antenatal clinic, community midwives, labour ward, and safeguarding teams\",\n      \"action\": \"added\"\n    }\n  ]\n}",
  "ai_provider": "DeepSeek",
  "ai_model": "deepseek-chat",
  "token_usage": null
}