{
  "prompt": {
    "guidelineId": "2020-10-secamb-suspected-preterm-labour-guidance-v001-pdf",
    "fieldsProcessed": [
      "humanFriendlyName",
      "organisation",
      "yearProduced",
      "summary"
    ],
    "enhancedFields": 4,
    "contentLength": 619
  },
  "response": "{\n  \"success\": true,\n  \"enhancedFields\": [\n    {\n      \"field\": \"humanFriendlyName\",\n      \"oldValue\": null,\n      \"newValue\": \"Suspected Preterm Labour: Guidance for Clinicians\",\n      \"action\": \"added\"\n    },\n    {\n      \"field\": \"organisation\",\n      \"oldValue\": null,\n      \"newValue\": \"RCOG\",\n      \"action\": \"added\"\n    },\n    {\n      \"field\": \"yearProduced\",\n      \"oldValue\": null,\n      \"newValue\": \"There is no publication year explicitly mentioned in the provided text\",\n      \"action\": \"added\"\n    },\n    {\n      \"field\": \"summary\",\n      \"oldValue\": null,\n      \"newValue\": \"**Summary:** For suspected preterm labour, prioritize delivering extremely preterm babies in specialized centers for optimal outcomes. In emergencies, proceed to the nearest hospital with a labour ward. Neonatal care varies by gestational age, so assess clinical status and transfer to the appropriate facility if preterm labour is suspected. Reorganized perinatal networks ensure expert care availability. Timely assessment and transfer are critical for improving neonatal survival and outcomes\",\n      \"action\": \"added\"\n    }\n  ]\n}",
  "endpoint": "enhanceGuidelineMetadata",
  "timestamp": "2025-06-18T18-38-34",
  "textContent": "AI: DeepSeek (deepseek-chat)\n\nQ: {\n  \"guidelineId\": \"2020-10-secamb-suspected-preterm-labour-guidance-v001-pdf\",\n  \"fieldsProcessed\": [\n    \"humanFriendlyName\",\n    \"organisation\",\n    \"yearProduced\",\n    \"summary\"\n  ],\n  \"enhancedFields\": 4,\n  \"contentLength\": 619\n}\n\nA: {\n  \"success\": true,\n  \"enhancedFields\": [\n    {\n      \"field\": \"humanFriendlyName\",\n      \"oldValue\": null,\n      \"newValue\": \"Suspected Preterm Labour: Guidance for Clinicians\",\n      \"action\": \"added\"\n    },\n    {\n      \"field\": \"organisation\",\n      \"oldValue\": null,\n      \"newValue\": \"RCOG\",\n      \"action\": \"added\"\n    },\n    {\n      \"field\": \"yearProduced\",\n      \"oldValue\": null,\n      \"newValue\": \"There is no publication year explicitly mentioned in the provided text\",\n      \"action\": \"added\"\n    },\n    {\n      \"field\": \"summary\",\n      \"oldValue\": null,\n      \"newValue\": \"**Summary:** For suspected preterm labour, prioritize delivering extremely preterm babies in specialized centers for optimal outcomes. In emergencies, proceed to the nearest hospital with a labour ward. Neonatal care varies by gestational age, so assess clinical status and transfer to the appropriate facility if preterm labour is suspected. Reorganized perinatal networks ensure expert care availability. Timely assessment and transfer are critical for improving neonatal survival and outcomes\",\n      \"action\": \"added\"\n    }\n  ]\n}",
  "ai_provider": "DeepSeek",
  "ai_model": "deepseek-chat",
  "token_usage": null
}