{
  "prompt": {
    "guidelineId": "mp026-bsots-pdf",
    "fieldsProcessed": [
      "humanFriendlyName",
      "organisation",
      "yearProduced",
      "summary"
    ],
    "enhancedFields": 4,
    "contentLength": 2811
  },
  "response": "{\n  \"success\": true,\n  \"enhancedFields\": [\n    {\n      \"field\": \"humanFriendlyName\",\n      \"oldValue\": null,\n      \"newValue\": \"Maternity Triage Protocol for Patient Admissions\",\n      \"action\": \"added\"\n    },\n    {\n      \"field\": \"organisation\",\n      \"oldValue\": null,\n      \"newValue\": \"UH Sussex\",\n      \"action\": \"added\"\n    },\n    {\n      \"field\": \"yearProduced\",\n      \"oldValue\": null,\n      \"newValue\": \"I cannot find a publication year in the provided text. The guideline does not explicitly state its publication date\",\n      \"action\": \"added\"\n    },\n    {\n      \"field\": \"summary\",\n      \"oldValue\": null,\n      \"newValue\": \"**Summary of Maternity Protocol MP026: Triage of Maternity Patients** This protocol standardizes non-elective maternity admissions, ensuring timely, prioritized care. Key points: - **Initial Assessment**: Midwives must assess patients within 15-30 minutes using the **Birmingham Symptom-specific Obstetric Triage System (BSOTS)** for prioritization. Obstetric staff should respond promptly. - **Referral Criteria**: Clear criteria for urgent obstetric assessment; non-obstetric issues are excluded. - **Patient Assessment**: Includes MEOWS, CTG, blood/urine tests, and holistic evaluation. - **Roles**: Midwives lead triage; Maternity Care Assistants (MCAs) support but do not perform initial observations. - **Ongoing Care**: Timely treatment based on BSOTS category, effective handover, and communication. - **Discharge/Follow-up**: Patients may be admitted, transferred, or discharged with follow-up as needed. - **Escalation**: Delays in assessment must be escalated and documented. - **Communication**: Clear explanations, reassurance, and translation services for non-English speakers. - **Staffing**: Local staffing varies, but initial triage must occur within 15-30 minutes. Aims to reduce unnecessary tests, standardize care, and ensure prompt treatment\",\n      \"action\": \"added\"\n    }\n  ]\n}",
  "endpoint": "enhanceGuidelineMetadata",
  "timestamp": "2025-06-18T22-39-45",
  "textContent": "AI: DeepSeek (deepseek-chat)\n\nQ: {\n  \"guidelineId\": \"mp026-bsots-pdf\",\n  \"fieldsProcessed\": [\n    \"humanFriendlyName\",\n    \"organisation\",\n    \"yearProduced\",\n    \"summary\"\n  ],\n  \"enhancedFields\": 4,\n  \"contentLength\": 2811\n}\n\nA: {\n  \"success\": true,\n  \"enhancedFields\": [\n    {\n      \"field\": \"humanFriendlyName\",\n      \"oldValue\": null,\n      \"newValue\": \"Maternity Triage Protocol for Patient Admissions\",\n      \"action\": \"added\"\n    },\n    {\n      \"field\": \"organisation\",\n      \"oldValue\": null,\n      \"newValue\": \"UH Sussex\",\n      \"action\": \"added\"\n    },\n    {\n      \"field\": \"yearProduced\",\n      \"oldValue\": null,\n      \"newValue\": \"I cannot find a publication year in the provided text. The guideline does not explicitly state its publication date\",\n      \"action\": \"added\"\n    },\n    {\n      \"field\": \"summary\",\n      \"oldValue\": null,\n      \"newValue\": \"**Summary of Maternity Protocol MP026: Triage of Maternity Patients** This protocol standardizes non-elective maternity admissions, ensuring timely, prioritized care. Key points: - **Initial Assessment**: Midwives must assess patients within 15-30 minutes using the **Birmingham Symptom-specific Obstetric Triage System (BSOTS)** for prioritization. Obstetric staff should respond promptly. - **Referral Criteria**: Clear criteria for urgent obstetric assessment; non-obstetric issues are excluded. - **Patient Assessment**: Includes MEOWS, CTG, blood/urine tests, and holistic evaluation. - **Roles**: Midwives lead triage; Maternity Care Assistants (MCAs) support but do not perform initial observations. - **Ongoing Care**: Timely treatment based on BSOTS category, effective handover, and communication. - **Discharge/Follow-up**: Patients may be admitted, transferred, or discharged with follow-up as needed. - **Escalation**: Delays in assessment must be escalated and documented. - **Communication**: Clear explanations, reassurance, and translation services for non-English speakers. - **Staffing**: Local staffing varies, but initial triage must occur within 15-30 minutes. Aims to reduce unnecessary tests, standardize care, and ensure prompt treatment\",\n      \"action\": \"added\"\n    }\n  ]\n}",
  "ai_provider": "DeepSeek",
  "ai_model": "deepseek-chat",
  "token_usage": null
}