{
  "prompt": {
    "guidelineId": "p19005-locsop-for-obstetric-procedural-counts-pdf",
    "fieldsProcessed": [
      "humanFriendlyName",
      "organisation",
      "yearProduced",
      "summary"
    ],
    "enhancedFields": 4,
    "contentLength": 2198
  },
  "response": "{\n  \"success\": true,\n  \"enhancedFields\": [\n    {\n      \"field\": \"humanFriendlyName\",\n      \"oldValue\": null,\n      \"newValue\": \"Swab and Instrument Counts for Obstetric Procedures\",\n      \"action\": \"added\"\n    },\n    {\n      \"field\": \"organisation\",\n      \"oldValue\": null,\n      \"newValue\": \"RCOG\",\n      \"action\": \"added\"\n    },\n    {\n      \"field\": \"yearProduced\",\n      \"oldValue\": null,\n      \"newValue\": \"I cannot find a publication year in the provided text. The guideline does not include a date or year of publication\",\n      \"action\": \"added\"\n    },\n    {\n      \"field\": \"summary\",\n      \"oldValue\": null,\n      \"newValue\": \"**Summary:** This SOP outlines safe practices for managing swabs, needles, and instruments during obstetric procedures outside the operating theatre. Key points include: - **Two staff members** must perform counts together before and after procedures, recording and signing all counts. Discrepancies require investigation. - **Sharps safety** must be followed, with audible counting and proper disposal. - **Post-procedure**, counts must be verified by two staff, with separate checks for all items. Missing items must be located; if unresolved, an urgent x-ray is required. - **Unreconciled counts** at homebirths require hospital transfer for x-ray if the item is not found. - **Transfer to theatre** requires completed counts; vaginal packing must be documented and communicated. - **Audit** includes checklists for pre-, intra-, and post-procedure counts, with actions for discrepancies. Non-reconciled counts before patient discharge are not typically classified as incidents if resolved. Missing items must be documented, with plans for removal or x-ray if unlocated\",\n      \"action\": \"added\"\n    }\n  ]\n}",
  "endpoint": "enhanceGuidelineMetadata",
  "timestamp": "2025-06-18T22-57-50",
  "textContent": "AI: DeepSeek (deepseek-chat)\n\nQ: {\n  \"guidelineId\": \"p19005-locsop-for-obstetric-procedural-counts-pdf\",\n  \"fieldsProcessed\": [\n    \"humanFriendlyName\",\n    \"organisation\",\n    \"yearProduced\",\n    \"summary\"\n  ],\n  \"enhancedFields\": 4,\n  \"contentLength\": 2198\n}\n\nA: {\n  \"success\": true,\n  \"enhancedFields\": [\n    {\n      \"field\": \"humanFriendlyName\",\n      \"oldValue\": null,\n      \"newValue\": \"Swab and Instrument Counts for Obstetric Procedures\",\n      \"action\": \"added\"\n    },\n    {\n      \"field\": \"organisation\",\n      \"oldValue\": null,\n      \"newValue\": \"RCOG\",\n      \"action\": \"added\"\n    },\n    {\n      \"field\": \"yearProduced\",\n      \"oldValue\": null,\n      \"newValue\": \"I cannot find a publication year in the provided text. The guideline does not include a date or year of publication\",\n      \"action\": \"added\"\n    },\n    {\n      \"field\": \"summary\",\n      \"oldValue\": null,\n      \"newValue\": \"**Summary:** This SOP outlines safe practices for managing swabs, needles, and instruments during obstetric procedures outside the operating theatre. Key points include: - **Two staff members** must perform counts together before and after procedures, recording and signing all counts. Discrepancies require investigation. - **Sharps safety** must be followed, with audible counting and proper disposal. - **Post-procedure**, counts must be verified by two staff, with separate checks for all items. Missing items must be located; if unresolved, an urgent x-ray is required. - **Unreconciled counts** at homebirths require hospital transfer for x-ray if the item is not found. - **Transfer to theatre** requires completed counts; vaginal packing must be documented and communicated. - **Audit** includes checklists for pre-, intra-, and post-procedure counts, with actions for discrepancies. Non-reconciled counts before patient discharge are not typically classified as incidents if resolved. Missing items must be documented, with plans for removal or x-ray if unlocated\",\n      \"action\": \"added\"\n    }\n  ]\n}",
  "ai_provider": "DeepSeek",
  "ai_model": "deepseek-chat",
  "token_usage": null
}