{
  "prompt": {
    "guidelineId": "cg1139-obesity-in-pregnancy-pdf",
    "fieldsProcessed": [
      "humanFriendlyName",
      "organisation",
      "yearProduced",
      "summary"
    ],
    "enhancedFields": 4,
    "contentLength": 1993
  },
  "response": "{\n  \"success\": true,\n  \"enhancedFields\": [\n    {\n      \"field\": \"humanFriendlyName\",\n      \"oldValue\": null,\n      \"newValue\": \"Obesity Management in Pregnancy: Guidelines for Care\",\n      \"action\": \"added\"\n    },\n    {\n      \"field\": \"organisation\",\n      \"oldValue\": null,\n      \"newValue\": \"RCOG\",\n      \"action\": \"added\"\n    },\n    {\n      \"field\": \"yearProduced\",\n      \"oldValue\": null,\n      \"newValue\": \"The text provided does not contain a publication year. If you have another section of the guideline that includes the year, please share it, and I can extract it for you\",\n      \"action\": \"added\"\n    },\n    {\n      \"field\": \"summary\",\n      \"oldValue\": null,\n      \"newValue\": \"**Summary of Obesity in Pregnancy Management Guidelines:** - **Monitoring & Risk Assessment:** Close monitoring for complications (e.g., gestational diabetes, pre-eclampsia) based on BMI. Thromboembolism risk assessment and thromboprophylaxis recommended. - **Labor & Delivery:** - Induction of labor for BMI ≥30; ultrasound considered for BMI >30. - Active management of third stage advised; avoid birthing pools for BMI ≥35. - Alert theatre staff if weight >120 kg; use Pat Slide™ for transfers. - Fetal scalp monitoring for accurate assessment. - **Cesarean Section (CS):** Suturing of subcutaneous tissue; PICO dressings for BMI ≥35. - **High-Risk Cases (BMI ≥40):** - Inform senior obstetrician, anesthetic registrar, and consultant. - Establish venous access and restrict oral intake. - **Postnatal Care:** Provide necessary equipment, encourage weight management programs (WBIP), and refer to Healthy Eating Services. - **Staff & Equipment:** Ensure training, manual handling assessments, and appropriate equipment (e.g., for patients up to 50 stone). *Key focus: individualized care, complication prevention, and multidisciplinary coordination.*\",\n      \"action\": \"added\"\n    }\n  ]\n}",
  "endpoint": "enhanceGuidelineMetadata",
  "timestamp": "2025-06-18T21-59-42",
  "textContent": "AI: DeepSeek (deepseek-chat)\n\nQ: {\n  \"guidelineId\": \"cg1139-obesity-in-pregnancy-pdf\",\n  \"fieldsProcessed\": [\n    \"humanFriendlyName\",\n    \"organisation\",\n    \"yearProduced\",\n    \"summary\"\n  ],\n  \"enhancedFields\": 4,\n  \"contentLength\": 1993\n}\n\nA: {\n  \"success\": true,\n  \"enhancedFields\": [\n    {\n      \"field\": \"humanFriendlyName\",\n      \"oldValue\": null,\n      \"newValue\": \"Obesity Management in Pregnancy: Guidelines for Care\",\n      \"action\": \"added\"\n    },\n    {\n      \"field\": \"organisation\",\n      \"oldValue\": null,\n      \"newValue\": \"RCOG\",\n      \"action\": \"added\"\n    },\n    {\n      \"field\": \"yearProduced\",\n      \"oldValue\": null,\n      \"newValue\": \"The text provided does not contain a publication year. If you have another section of the guideline that includes the year, please share it, and I can extract it for you\",\n      \"action\": \"added\"\n    },\n    {\n      \"field\": \"summary\",\n      \"oldValue\": null,\n      \"newValue\": \"**Summary of Obesity in Pregnancy Management Guidelines:** - **Monitoring & Risk Assessment:** Close monitoring for complications (e.g., gestational diabetes, pre-eclampsia) based on BMI. Thromboembolism risk assessment and thromboprophylaxis recommended. - **Labor & Delivery:** - Induction of labor for BMI ≥30; ultrasound considered for BMI >30. - Active management of third stage advised; avoid birthing pools for BMI ≥35. - Alert theatre staff if weight >120 kg; use Pat Slide™ for transfers. - Fetal scalp monitoring for accurate assessment. - **Cesarean Section (CS):** Suturing of subcutaneous tissue; PICO dressings for BMI ≥35. - **High-Risk Cases (BMI ≥40):** - Inform senior obstetrician, anesthetic registrar, and consultant. - Establish venous access and restrict oral intake. - **Postnatal Care:** Provide necessary equipment, encourage weight management programs (WBIP), and refer to Healthy Eating Services. - **Staff & Equipment:** Ensure training, manual handling assessments, and appropriate equipment (e.g., for patients up to 50 stone). *Key focus: individualized care, complication prevention, and multidisciplinary coordination.*\",\n      \"action\": \"added\"\n    }\n  ]\n}",
  "ai_provider": "DeepSeek",
  "ai_model": "deepseek-chat",
  "token_usage": null
}