{
  "prompt": {
    "guidelineId": "mp065-neonatal-bcg-immunisation-programme-pdf",
    "fieldsProcessed": [
      "humanFriendlyName",
      "organisation",
      "yearProduced",
      "summary"
    ],
    "enhancedFields": 4,
    "contentLength": 2569
  },
  "response": "{\n  \"success\": true,\n  \"enhancedFields\": [\n    {\n      \"field\": \"humanFriendlyName\",\n      \"oldValue\": null,\n      \"newValue\": \"Neonatal BCG Immunisation Programme for High-Risk Infants\",\n      \"action\": \"added\"\n    },\n    {\n      \"field\": \"organisation\",\n      \"oldValue\": null,\n      \"newValue\": \"RCOG\",\n      \"action\": \"added\"\n    },\n    {\n      \"field\": \"yearProduced\",\n      \"oldValue\": null,\n      \"newValue\": \"The text does not contain a publication year. If you have another guideline text with a visible publication date, please share it, and I can extract the year for you\",\n      \"action\": \"added\"\n    },\n    {\n      \"field\": \"summary\",\n      \"oldValue\": null,\n      \"newValue\": \"**Summary of Neonatal BCG Immunisation Programme (RSCH PRH only) MP065:** - **Purpose:** Protect newborns at high risk of TB exposure, preventing serious illness or death. - **Eligibility:** Infants (0–12 months) living in UK areas with TB incidence ≥40/100,000 **or** with a parent/grandparent born in a country with TB incidence ≥40/100,000 (listed countries included). - **Responsibilities:** Midwives, obstetricians, paediatricians, and neonatologists ensure protocol compliance. University Hospital Trust identifies eligible babies antenatally and refers them at birth. - **Vaccination Service:** Sussex Community Trust delivers timely BCG immunisation under specific arrangements. - **Pathways:** Antenatal and postnatal pathways for identification and referral. - **Failsafe:** Regular database checks and missed referral investigations. - **Reporting:** Local and national requirements ensure proper documentation. *(Word count: 100)*\",\n      \"action\": \"added\"\n    }\n  ]\n}",
  "endpoint": "enhanceGuidelineMetadata",
  "timestamp": "2025-06-18T22-52-43",
  "textContent": "AI: DeepSeek (deepseek-chat)\n\nQ: {\n  \"guidelineId\": \"mp065-neonatal-bcg-immunisation-programme-pdf\",\n  \"fieldsProcessed\": [\n    \"humanFriendlyName\",\n    \"organisation\",\n    \"yearProduced\",\n    \"summary\"\n  ],\n  \"enhancedFields\": 4,\n  \"contentLength\": 2569\n}\n\nA: {\n  \"success\": true,\n  \"enhancedFields\": [\n    {\n      \"field\": \"humanFriendlyName\",\n      \"oldValue\": null,\n      \"newValue\": \"Neonatal BCG Immunisation Programme for High-Risk Infants\",\n      \"action\": \"added\"\n    },\n    {\n      \"field\": \"organisation\",\n      \"oldValue\": null,\n      \"newValue\": \"RCOG\",\n      \"action\": \"added\"\n    },\n    {\n      \"field\": \"yearProduced\",\n      \"oldValue\": null,\n      \"newValue\": \"The text does not contain a publication year. If you have another guideline text with a visible publication date, please share it, and I can extract the year for you\",\n      \"action\": \"added\"\n    },\n    {\n      \"field\": \"summary\",\n      \"oldValue\": null,\n      \"newValue\": \"**Summary of Neonatal BCG Immunisation Programme (RSCH PRH only) MP065:** - **Purpose:** Protect newborns at high risk of TB exposure, preventing serious illness or death. - **Eligibility:** Infants (0–12 months) living in UK areas with TB incidence ≥40/100,000 **or** with a parent/grandparent born in a country with TB incidence ≥40/100,000 (listed countries included). - **Responsibilities:** Midwives, obstetricians, paediatricians, and neonatologists ensure protocol compliance. University Hospital Trust identifies eligible babies antenatally and refers them at birth. - **Vaccination Service:** Sussex Community Trust delivers timely BCG immunisation under specific arrangements. - **Pathways:** Antenatal and postnatal pathways for identification and referral. - **Failsafe:** Regular database checks and missed referral investigations. - **Reporting:** Local and national requirements ensure proper documentation. *(Word count: 100)*\",\n      \"action\": \"added\"\n    }\n  ]\n}",
  "ai_provider": "DeepSeek",
  "ai_model": "deepseek-chat",
  "token_usage": null
}