{
  "prompt": {
    "guidelineId": "cg1199-management-of-infectious-diseases-pdf",
    "fieldsProcessed": [
      "humanFriendlyName",
      "organisation",
      "yearProduced",
      "summary"
    ],
    "enhancedFields": 4,
    "contentLength": 4723
  },
  "response": "{\n  \"success\": true,\n  \"enhancedFields\": [\n    {\n      \"field\": \"humanFriendlyName\",\n      \"oldValue\": null,\n      \"newValue\": \"Pregnancy Guidelines for Managing HIV, Hepatitis, and STIs\",\n      \"action\": \"added\"\n    },\n    {\n      \"field\": \"organisation\",\n      \"oldValue\": null,\n      \"newValue\": \"BHIVA\",\n      \"action\": \"added\"\n    },\n    {\n      \"field\": \"yearProduced\",\n      \"oldValue\": null,\n      \"newValue\": \"The text does not explicitly mention a publication year. However, there is a reference to \\\"Hepatitis B guidance from Public Health England starting in April 2021,\\\" which suggests the guideline was published in or after 2021. Since the exact publication year is not provided in the text, I cannot extract it. If you have additional information or a different section of the guideline that includes the publication date, please share it\",\n      \"action\": \"added\"\n    },\n    {\n      \"field\": \"summary\",\n      \"oldValue\": null,\n      \"newValue\": \"**Summary of Management of Infectious Diseases during Pregnancy Guideline** **HIV:** - Universal screening offered; positive cases managed by a multidisciplinary team. - Care plans discussed at 12-16 and 34-36 weeks; encourage disclosure and monitor viral load. - Cesarean section (CS) recommended if viral load >400 copies/mL at 36 weeks. - IV AZT for viral load >1,000 copies/mL or untreated individuals in labor. - Postpartum: inform HIV consultant, discuss infant feeding, and provide neonatal prophylaxis. **Hepatitis B:** - Universal screening; monitor chronic cases and consider antivirals. - Neonates require vaccination and immunoglobulin if high risk. - Breastfeeding permitted unless contraindicated by treatment. **Hepatitis C & Syphilis:** - Screen high-risk women; syphilis requires early treatment to prevent congenital complications. - Re-test IV drug users or partners of positive individuals in the third trimester. **Chlamydia & Gonorrhoea:** - Test all pregnant women under 25; treat promptly to prevent neonatal infection. **General:** - Document care plans, ensure timely follow-up, and involve specialists as needed. - Mode of delivery and neonatal care depend on maternal infection status and viral load\",\n      \"action\": \"added\"\n    }\n  ]\n}",
  "endpoint": "enhanceGuidelineMetadata",
  "timestamp": "2025-06-18T22-03-52",
  "textContent": "AI: DeepSeek (deepseek-chat)\n\nQ: {\n  \"guidelineId\": \"cg1199-management-of-infectious-diseases-pdf\",\n  \"fieldsProcessed\": [\n    \"humanFriendlyName\",\n    \"organisation\",\n    \"yearProduced\",\n    \"summary\"\n  ],\n  \"enhancedFields\": 4,\n  \"contentLength\": 4723\n}\n\nA: {\n  \"success\": true,\n  \"enhancedFields\": [\n    {\n      \"field\": \"humanFriendlyName\",\n      \"oldValue\": null,\n      \"newValue\": \"Pregnancy Guidelines for Managing HIV, Hepatitis, and STIs\",\n      \"action\": \"added\"\n    },\n    {\n      \"field\": \"organisation\",\n      \"oldValue\": null,\n      \"newValue\": \"BHIVA\",\n      \"action\": \"added\"\n    },\n    {\n      \"field\": \"yearProduced\",\n      \"oldValue\": null,\n      \"newValue\": \"The text does not explicitly mention a publication year. However, there is a reference to \\\"Hepatitis B guidance from Public Health England starting in April 2021,\\\" which suggests the guideline was published in or after 2021. Since the exact publication year is not provided in the text, I cannot extract it. If you have additional information or a different section of the guideline that includes the publication date, please share it\",\n      \"action\": \"added\"\n    },\n    {\n      \"field\": \"summary\",\n      \"oldValue\": null,\n      \"newValue\": \"**Summary of Management of Infectious Diseases during Pregnancy Guideline** **HIV:** - Universal screening offered; positive cases managed by a multidisciplinary team. - Care plans discussed at 12-16 and 34-36 weeks; encourage disclosure and monitor viral load. - Cesarean section (CS) recommended if viral load >400 copies/mL at 36 weeks. - IV AZT for viral load >1,000 copies/mL or untreated individuals in labor. - Postpartum: inform HIV consultant, discuss infant feeding, and provide neonatal prophylaxis. **Hepatitis B:** - Universal screening; monitor chronic cases and consider antivirals. - Neonates require vaccination and immunoglobulin if high risk. - Breastfeeding permitted unless contraindicated by treatment. **Hepatitis C & Syphilis:** - Screen high-risk women; syphilis requires early treatment to prevent congenital complications. - Re-test IV drug users or partners of positive individuals in the third trimester. **Chlamydia & Gonorrhoea:** - Test all pregnant women under 25; treat promptly to prevent neonatal infection. **General:** - Document care plans, ensure timely follow-up, and involve specialists as needed. - Mode of delivery and neonatal care depend on maternal infection status and viral load\",\n      \"action\": \"added\"\n    }\n  ]\n}",
  "ai_provider": "DeepSeek",
  "ai_model": "deepseek-chat",
  "token_usage": null
}