{
  "prompt": {
    "guidelineId": "mp079-newborn-blood-spot-screening-pdf",
    "fieldsProcessed": [
      "humanFriendlyName",
      "organisation",
      "yearProduced",
      "summary"
    ],
    "enhancedFields": 4,
    "contentLength": 9066
  },
  "response": "{\n  \"success\": true,\n  \"enhancedFields\": [\n    {\n      \"field\": \"humanFriendlyName\",\n      \"oldValue\": null,\n      \"newValue\": \"Newborn Blood Spot Screening Guidelines for Babies Under One Year\",\n      \"action\": \"added\"\n    },\n    {\n      \"field\": \"organisation\",\n      \"oldValue\": null,\n      \"newValue\": \"BSUH NHS trust\",\n      \"action\": \"added\"\n    },\n    {\n      \"field\": \"yearProduced\",\n      \"oldValue\": null,\n      \"newValue\": \"The text provided does not contain a specific publication year. If you have a different section or part of the guideline that includes the publication date, please share it, and I can extract the year for you\",\n      \"action\": \"added\"\n    },\n    {\n      \"field\": \"summary\",\n      \"oldValue\": null,\n      \"newValue\": \"**Summary of Newborn Blood Spot Screening Protocol (BSUH NHS Trust):** - **Scope:** Applies to all babies born within BSUH NHS Trust or resident in the catchment area within their first year. - **Conditions Screened:** Phenylketonuria, congenital hypothyroidism, MCADD, sickle cell disease, cystic fibrosis (if under 8 weeks), MSUD, HCU, IVA, and GA1. - **Consent & Declination:** Parents must receive pre-screening information and can decline tests. Declination must be documented, with a blank sample card sent to the lab. - **Sample Collection:** - Taken on day 5 (day 0 = birth), using an automated incision device. - Heel cleaned with water; fill all four circles with single drops. - Transport to lab within 24 hours. - **Special Cases:** - Preterm babies (<32 weeks): Routine day 5 sample + repeat at 28 days/discharge. - Transfusions: For sickle cell, sample must be taken *before* transfusion. - **Follow-Up:** - Results communicated to parents within 6-8 weeks. - Health visitors ensure results are documented and followed up. - **Avoidable Repeats:** Midwifery/neonatal teams must arrange repeats within 72 hours if needed. - **Documentation:** Record all steps in maternity/paediatric notes and the Personal Child Health Record (PCHR). **Key Points:** Screening is strongly recommended; parents may decline. Timely sample collection and transport are critical. Special protocols apply for preterm/transfused infants. Health visitors oversee result delivery\",\n      \"action\": \"added\"\n    }\n  ]\n}",
  "endpoint": "enhanceGuidelineMetadata",
  "timestamp": "2025-06-18T22-56-57",
  "textContent": "AI: DeepSeek (deepseek-chat)\n\nQ: {\n  \"guidelineId\": \"mp079-newborn-blood-spot-screening-pdf\",\n  \"fieldsProcessed\": [\n    \"humanFriendlyName\",\n    \"organisation\",\n    \"yearProduced\",\n    \"summary\"\n  ],\n  \"enhancedFields\": 4,\n  \"contentLength\": 9066\n}\n\nA: {\n  \"success\": true,\n  \"enhancedFields\": [\n    {\n      \"field\": \"humanFriendlyName\",\n      \"oldValue\": null,\n      \"newValue\": \"Newborn Blood Spot Screening Guidelines for Babies Under One Year\",\n      \"action\": \"added\"\n    },\n    {\n      \"field\": \"organisation\",\n      \"oldValue\": null,\n      \"newValue\": \"BSUH NHS trust\",\n      \"action\": \"added\"\n    },\n    {\n      \"field\": \"yearProduced\",\n      \"oldValue\": null,\n      \"newValue\": \"The text provided does not contain a specific publication year. If you have a different section or part of the guideline that includes the publication date, please share it, and I can extract the year for you\",\n      \"action\": \"added\"\n    },\n    {\n      \"field\": \"summary\",\n      \"oldValue\": null,\n      \"newValue\": \"**Summary of Newborn Blood Spot Screening Protocol (BSUH NHS Trust):** - **Scope:** Applies to all babies born within BSUH NHS Trust or resident in the catchment area within their first year. - **Conditions Screened:** Phenylketonuria, congenital hypothyroidism, MCADD, sickle cell disease, cystic fibrosis (if under 8 weeks), MSUD, HCU, IVA, and GA1. - **Consent & Declination:** Parents must receive pre-screening information and can decline tests. Declination must be documented, with a blank sample card sent to the lab. - **Sample Collection:** - Taken on day 5 (day 0 = birth), using an automated incision device. - Heel cleaned with water; fill all four circles with single drops. - Transport to lab within 24 hours. - **Special Cases:** - Preterm babies (<32 weeks): Routine day 5 sample + repeat at 28 days/discharge. - Transfusions: For sickle cell, sample must be taken *before* transfusion. - **Follow-Up:** - Results communicated to parents within 6-8 weeks. - Health visitors ensure results are documented and followed up. - **Avoidable Repeats:** Midwifery/neonatal teams must arrange repeats within 72 hours if needed. - **Documentation:** Record all steps in maternity/paediatric notes and the Personal Child Health Record (PCHR). **Key Points:** Screening is strongly recommended; parents may decline. Timely sample collection and transport are critical. Special protocols apply for preterm/transfused infants. Health visitors oversee result delivery\",\n      \"action\": \"added\"\n    }\n  ]\n}",
  "ai_provider": "DeepSeek",
  "ai_model": "deepseek-chat",
  "token_usage": null
}