{
  "prompt": {
    "guidelineId": "cg1130-assisted-vaginal-birth-guideline-pdf",
    "fieldsProcessed": [
      "humanFriendlyName",
      "organisation",
      "yearProduced",
      "summary"
    ],
    "enhancedFields": 4,
    "contentLength": 2258
  },
  "response": "{\n  \"success\": true,\n  \"enhancedFields\": [\n    {\n      \"field\": \"humanFriendlyName\",\n      \"oldValue\": null,\n      \"newValue\": \"Assisted Vaginal Birth: Forceps and Vacuum Extraction Guidelines\",\n      \"action\": \"added\"\n    },\n    {\n      \"field\": \"organisation\",\n      \"oldValue\": null,\n      \"newValue\": \"RCOG\",\n      \"action\": \"added\"\n    },\n    {\n      \"field\": \"yearProduced\",\n      \"oldValue\": null,\n      \"newValue\": \"The text provided does not contain a publication year. If you have another guideline text that includes the year, please share it, and I can extract the 4-digit year for you\",\n      \"action\": \"added\"\n    },\n    {\n      \"field\": \"summary\",\n      \"oldValue\": null,\n      \"newValue\": \"**Summary of Assisted Vaginal Birth Guideline:** - **Instrument choice**: Select the most appropriate instrument (forceps or vacuum) for the first attempt. Vacuum extraction has higher failure rates but less maternal trauma, while forceps are more effective but risk maternal injury. Vacuum does not increase cesarean rates or neonatal complications like low Apgar scores. - **Risk factors for failure**: Mid-cavity/rotational births, maternal obesity, fetal weight >4000g, occipito-posterior position, short maternal stature, and large fetal head circumference. - **Pre-procedure**: Use ultrasound to confirm fetal head position if uncertain. Administer antibiotics to reduce infection risk. - **Post-birth care**: Monitor for complications, document details, provide thromboprophylaxis, analgesia, and bladder care. Offer postnatal counseling for traumatic births but avoid single-session, trauma-focused interventions. - **Adverse events**: Ensure duty of candour, clinical incident reporting, and supportive frameworks for families and staff. Audit compliance with RCOG standards\",\n      \"action\": \"added\"\n    }\n  ]\n}",
  "endpoint": "enhanceGuidelineMetadata",
  "timestamp": "2025-06-18T21-50-08",
  "textContent": "AI: DeepSeek (deepseek-chat)\n\nQ: {\n  \"guidelineId\": \"cg1130-assisted-vaginal-birth-guideline-pdf\",\n  \"fieldsProcessed\": [\n    \"humanFriendlyName\",\n    \"organisation\",\n    \"yearProduced\",\n    \"summary\"\n  ],\n  \"enhancedFields\": 4,\n  \"contentLength\": 2258\n}\n\nA: {\n  \"success\": true,\n  \"enhancedFields\": [\n    {\n      \"field\": \"humanFriendlyName\",\n      \"oldValue\": null,\n      \"newValue\": \"Assisted Vaginal Birth: Forceps and Vacuum Extraction Guidelines\",\n      \"action\": \"added\"\n    },\n    {\n      \"field\": \"organisation\",\n      \"oldValue\": null,\n      \"newValue\": \"RCOG\",\n      \"action\": \"added\"\n    },\n    {\n      \"field\": \"yearProduced\",\n      \"oldValue\": null,\n      \"newValue\": \"The text provided does not contain a publication year. If you have another guideline text that includes the year, please share it, and I can extract the 4-digit year for you\",\n      \"action\": \"added\"\n    },\n    {\n      \"field\": \"summary\",\n      \"oldValue\": null,\n      \"newValue\": \"**Summary of Assisted Vaginal Birth Guideline:** - **Instrument choice**: Select the most appropriate instrument (forceps or vacuum) for the first attempt. Vacuum extraction has higher failure rates but less maternal trauma, while forceps are more effective but risk maternal injury. Vacuum does not increase cesarean rates or neonatal complications like low Apgar scores. - **Risk factors for failure**: Mid-cavity/rotational births, maternal obesity, fetal weight >4000g, occipito-posterior position, short maternal stature, and large fetal head circumference. - **Pre-procedure**: Use ultrasound to confirm fetal head position if uncertain. Administer antibiotics to reduce infection risk. - **Post-birth care**: Monitor for complications, document details, provide thromboprophylaxis, analgesia, and bladder care. Offer postnatal counseling for traumatic births but avoid single-session, trauma-focused interventions. - **Adverse events**: Ensure duty of candour, clinical incident reporting, and supportive frameworks for families and staff. Audit compliance with RCOG standards\",\n      \"action\": \"added\"\n    }\n  ]\n}",
  "ai_provider": "DeepSeek",
  "ai_model": "deepseek-chat",
  "token_usage": null
}