{
  "prompt": {
    "guidelineId": "uhsx-local-requirements-pmrt-sop-pdf",
    "fieldsProcessed": [
      "humanFriendlyName",
      "organisation",
      "yearProduced",
      "summary"
    ],
    "enhancedFields": 4,
    "contentLength": 7116
  },
  "response": "{\n  \"success\": true,\n  \"enhancedFields\": [\n    {\n      \"field\": \"humanFriendlyName\",\n      \"oldValue\": null,\n      \"newValue\": \"Perinatal Mortality Review Process and Family Support Guidelines\",\n      \"action\": \"added\"\n    },\n    {\n      \"field\": \"organisation\",\n      \"oldValue\": null,\n      \"newValue\": \"MBRRACE-UK\",\n      \"action\": \"added\"\n    },\n    {\n      \"field\": \"yearProduced\",\n      \"oldValue\": null,\n      \"newValue\": \"The provided text does not contain a publication year. If you have another document or can provide the relevant section with the year, I'd be happy to extract it for you\",\n      \"action\": \"added\"\n    },\n    {\n      \"field\": \"summary\",\n      \"oldValue\": null,\n      \"newValue\": \"**Summary of PMRT Investigations SOP:** This SOP outlines the process for investigating stillbirths and neonatal deaths using the Perinatal Mortality Review Tool (PMRT). Key steps include: - **Eligibility:** Reviews apply to late fetal losses, stillbirths, neonatal deaths, and post-neonatal deaths. - **Multidisciplinary Review:** A systematic MDT review (including relevant professionals) must occur within 72 hours to determine causes and improve future care. - **Communication:** Ensure accessible support (BSL interpreters, text services, translation for non-English speakers) and maintain duty of candor with families. - **Documentation:** Medical records must be securely saved promptly; cases meeting PMRT criteria are classified as serious incidents. - **Family Involvement:** Provide feedback opportunities, share the PMRT report face-to-face, and offer ongoing support contacts. - **Reporting:** Notify MBRRACE-UK; external reviewers may be included. Staff involved should receive debriefs/support. - **Monitoring:** Quarterly audits ensure compliance with NHS Resolution Safety Action 10. - **Delays:** Families must be informed of any delays in review completion. Families are encouraged to share their care experiences, and findings are communicated via a consultant meeting or written/phone follow-up. Support resources are provided\",\n      \"action\": \"added\"\n    }\n  ]\n}",
  "endpoint": "enhanceGuidelineMetadata",
  "timestamp": "2025-06-18T23-09-38",
  "textContent": "AI: DeepSeek (deepseek-chat)\n\nQ: {\n  \"guidelineId\": \"uhsx-local-requirements-pmrt-sop-pdf\",\n  \"fieldsProcessed\": [\n    \"humanFriendlyName\",\n    \"organisation\",\n    \"yearProduced\",\n    \"summary\"\n  ],\n  \"enhancedFields\": 4,\n  \"contentLength\": 7116\n}\n\nA: {\n  \"success\": true,\n  \"enhancedFields\": [\n    {\n      \"field\": \"humanFriendlyName\",\n      \"oldValue\": null,\n      \"newValue\": \"Perinatal Mortality Review Process and Family Support Guidelines\",\n      \"action\": \"added\"\n    },\n    {\n      \"field\": \"organisation\",\n      \"oldValue\": null,\n      \"newValue\": \"MBRRACE-UK\",\n      \"action\": \"added\"\n    },\n    {\n      \"field\": \"yearProduced\",\n      \"oldValue\": null,\n      \"newValue\": \"The provided text does not contain a publication year. If you have another document or can provide the relevant section with the year, I'd be happy to extract it for you\",\n      \"action\": \"added\"\n    },\n    {\n      \"field\": \"summary\",\n      \"oldValue\": null,\n      \"newValue\": \"**Summary of PMRT Investigations SOP:** This SOP outlines the process for investigating stillbirths and neonatal deaths using the Perinatal Mortality Review Tool (PMRT). Key steps include: - **Eligibility:** Reviews apply to late fetal losses, stillbirths, neonatal deaths, and post-neonatal deaths. - **Multidisciplinary Review:** A systematic MDT review (including relevant professionals) must occur within 72 hours to determine causes and improve future care. - **Communication:** Ensure accessible support (BSL interpreters, text services, translation for non-English speakers) and maintain duty of candor with families. - **Documentation:** Medical records must be securely saved promptly; cases meeting PMRT criteria are classified as serious incidents. - **Family Involvement:** Provide feedback opportunities, share the PMRT report face-to-face, and offer ongoing support contacts. - **Reporting:** Notify MBRRACE-UK; external reviewers may be included. Staff involved should receive debriefs/support. - **Monitoring:** Quarterly audits ensure compliance with NHS Resolution Safety Action 10. - **Delays:** Families must be informed of any delays in review completion. Families are encouraged to share their care experiences, and findings are communicated via a consultant meeting or written/phone follow-up. Support resources are provided\",\n      \"action\": \"added\"\n    }\n  ]\n}",
  "ai_provider": "DeepSeek",
  "ai_model": "deepseek-chat",
  "token_usage": null
}