{
  "prompt": {
    "prompt": "Original Transcript:\n**Professional Medical Clerking – SBAR Format**  \n\n---  \n\n### **SITUATION:**  \n**Patient Demographics:**  \n- **Name:** Ms. X (DOB: 15/05/1985, 39yo)  \n- **Gestation:** N/A (G4P2, previous SVD x2, LSCS x1)  \n- **Presenting Complaint:** Abnormal uterine bleeding (AUB) – heavy menstrual bleeding (HMB) with intermenstrual bleeding (IMB) for 3/12, worsening over last 2/52.  \n- **Key Clinical Issue:** Persistent AUB with associated fatigue (likely secondary to iron deficiency anemia). No hemodynamic instability at present.  \n\n### **BACKGROUND:**  \n**Relevant PMHx:**  \n- **OBGYN Hx:**  \n  - G4P2 (2x SVD, 1x LSCS for FTP, 1x TOP)  \n  - Previous IUD (Mirena®) removed 6/12 ago due to expulsion  \n  - No known fibroids or endometriosis  \n- **Medical Hx:**  \n  - Hypothyroidism (on levothyroxine 75mcg OD)  \n  - Obesity (BMI 32)  \n  - No known coagulopathy  \n- **Surgical Hx:**  \n  - LSCS (2018)  \n  - Appendicectomy (2005)  \n- **Medications:**  \n  - Levothyroxine 75mcg OD  \n  - NSAIDs PRN for dysmenorrhea (no recent use)  \n- **Allergies:** NKDA  \n- **Social Hx:**  \n  - Non-smoker, occasional ETOH  \n  - Works as a teacher, moderately active  \n\n**Risk Factors for AUB:**  \n- Obesity (↑ endometrial hyperplasia risk)  \n- Hypothyroidism (may exacerbate HMB)  \n- Previous IUD expulsion (possible structural cause)  \n\n### **ASSESSMENT:**  \n**Clinical Findings (0800 hours):**  \n- **Vitals:**  \n  - BP: 128/78 mmHg  \n  - HR: 88 bpm (regular)  \n  - Temp: 36.7°C  \n  - SpO₂: 98% RA  \n  - RR: 14/min  \n- **General Exam:**  \n  - Pale conjunctivae (clinical anemia)  \n  - No signs of hemodynamic compromise  \n- **Abdo Exam:**  \n  - Soft, non-tender, no palpable masses  \n- **PV Exam (consented & chaperoned):**  \n  - No active bleeding at time of exam  \n  - Cervix appears normal, no cervical excitation  \n  - Uterus anteverted, non-tender, normal size  \n  - No adnexal masses  \n\n**Investigations:**  \n- **Bloods (FBC, LFTs, U&Es, CRP, TFTs, coagulation screen):**  \n  - Hb: 98 g/L (↓ from 112 g/L 6/12 ago)  \n  - MCV: 78 fL (microcytic)  \n  - Ferritin: 12 μg/L (↓)  \n  - TSH: 2.1 mIU/L (well-controlled)  \n  - Platelets: 220 x10⁹/L  \n  - INR/APTT: Normal  \n- **Imaging:**  \n  - **TV USS:**  \n    - Endometrial thickness: 12mm (heterogeneous)  \n    - No fibroids/polyps seen  \n    - Normal adnexa  \n  - **Pipelle biopsy (awaiting histology)**  \n\n**Differential Diagnosis (PALM-COEIN):**  \n1. **Polyp/Adenomyosis** (USS inconclusive, biopsy pending)  \n2. **Endometrial hyperplasia** (↑ risk due to obesity)  \n3. **Coagulopathy** (unlikely given normal coagulation)  \n4. **Ovulatory dysfunction** (secondary to hypothyroidism?)  \n5. **Iatrogenic** (none identified)  \n\n### **RECOMMENDATION:**  \n**Immediate Management:**  \n- **Iron supplementation:** Ferrous sulfate 200mg BD + vitamin C (monitor Hb in 4/52)  \n- **Hormonal therapy:**  \n  - Start norethisterone 5mg TDS for 21/7 (to regulate bleeding)  \n  - Consider Mirena® IUD reinsertion if biopsy normal  \n- **Analgesia:** Mefenamic acid 500mg TDS PRN (if dysmenorrhea)  \n\n**Monitoring & Follow-Up:**  \n- **Repeat Hb in 4/52** (target >110 g/L)  \n- **Await endometrial biopsy results** (exclude hyperplasia/malignancy)  \n- **GYN OPD follow-up in 6/52** (consider hysteroscopy if bleeding persists)  \n\n**Further Investigations if Needed:**  \n- **Hysteroscopy + biopsy** if USS/biopsy inconclusive  \n- **Thyroid antibody testing** if TFTs fluctuate  \n\n**Contingencies:**  \n- If hemodynamically unstable → admit for IV iron/transfusion  \n- If biopsy shows hyperplasia → consider progestogens/hysterectomy (if completed family)  \n\n---  \n**Documented by:** [Your Name] (FY2)  \n**Reviewed by:** [Consultant Name] (Obstetrics & Gynaecology)  \n**Time/Date:** 0800 hours, 05/06/2024  \n\n*(This is a fictional case for educational purposes only.)*\n\nGuideline Analysis:\nClinical transcript analysis for guideline compliance check against: Outpatient Hysteroscopy. This analysis focuses on identifying areas where the clinical documentation can be improved according to the specific guideline requirements.\n\nGuideline: Outpatient Hysteroscopy\n\n\nFull Guideline Content:\nKey recommendations:\n- All gynaecology departments should provide a dedicated outpatient hysteroscopy service for women and people with abnormal uterine bleeding, reproductive problems, and insertion/retrieval of intrauterine devices.\n- Written information should be provided to the woman prior to their appointment, including details about the procedure, benefits and risks, advice regarding pre-operative analgesia, and contact details for the hysteroscopy unit.\n- Women should be made aware of other settings and modes of anaesthesia for hysteroscopy.\n- Women should be advised to alert the clinical team if the procedure becomes too painful or distressing.\n- Vaginoscopy should be the standard technique for outpatient hysteroscopy unless a vaginal speculum is required.\n- Mechanical hysteroscopic tissue removal systems should be preferred over miniature bipolar electrodes.\n- Saline should be instilled at the lowest possible pressure to achieve a satisfactory view.\n- Conscious sedation should not be routinely used in outpatient hysteroscopic procedures.\n\nWomen should be given verbal and/or written informed consent prior to hysteroscopy, and should be informed of the potential pain and distress during the procedure. A safety checklist should be considered before hysteroscopy, including exclusion of pregnancy. Care after hysteroscopy should include discussing clinical findings, providing contact information, and offering a dedicated recovery area. Training in hysteroscopy should cover basic and advanced skills, and analgesia with NSAIDs or alternatives should be recommended.\n\nA statistically significant reduction in pain was demonstrated with NSAIDs, TENS, opioids, and antispasmodics given prior to hysteroscopy. NSAIDs and TENS showed no significant difference in side effects, while opioids and antispasmodics had a higher likelihood of side effects. Cervical preparation with vaginal prostaglandins can be considered in selected cases, but is associated with side effects and complications. Miniature hysteroscopes of 3.5mm or less in outer diameter should be used for diagnostic outpatient hysteroscopy to reduce pain. When performing operative hysteroscopy, smaller diameter hysteroscopes and mechanical tissue removal systems should be used for less pain. The choice of hysteroscope lens angle is at the discretion of the clinician.\n\nAdverse events were not meta-analysed. Image quality showed no significant difference between scope sizes, or found significantly better visualisation with a smaller-diameter hysteroscope. Studies reported a significant increase in success when using a smaller-diameter hysteroscope. Procedural duration was significantly shorter with a miniaturised hysteroscope in some studies. The incidence of vasovagal reactions was significantly lower with a smaller-diameter hysteroscope in one study. Flexible hysteroscopes are associated with less pain during diagnostic outpatient hysteroscopy. Mechanical hysteroscopic tissue removal systems are preferred over miniature bipolar electrodes for endometrial polyp removal. Inactivated mechanical mini-scissors should be preferred over miniature bipolar electrodes for uterine septa removal. Saline is recommended as the distension medium for outpatient hysteroscopy due to less pain, better image quality, and greater patient satisfaction. Saline should be instilled at the lowest possible pressure to achieve a satisfactory view. Warming saline to body temperature can be considered for outpatient hysteroscopy.\n\nRoutine cervical dilatation should be avoided prior to outpatient hysteroscopy. Blind dilatation of the cervix causes pain, discomfort, and uterine trauma in the outpatient setting. Local anaesthesia should not be routinely administered prior to outpatient hysteroscopy if a vaginoscopic approach is used, but should be considered if a vaginal speculum is planned. The choice of local anaesthetic agent and route of administration should be left to the discretion of the hysteroscopist. Conscious sedation should not be routinely used in outpatient hysteroscopic procedures. If conscious sedation is used, appropriate patient selection and monitoring are essential.\n\nConscious sedation is defined as a drug-induced depression of consciousness during which women respond purposefully to verbal commands. It is imperative to follow guidance on safe use to prevent life-threatening complications. Different sedation levels affect airway, ventilation, and cardiovascular function. Intravenous conscious sedation reduces pain during outpatient hysteroscopy compared to local anesthesia. Inhaled conscious sedation shows the greatest pain reduction but lacks recorded side effects. Close monitoring is necessary to identify and respond to over-sedation. Vaginoscopy is recommended for outpatient hysteroscopy due to reduced pain and quicker procedures. Routine antibiotic prophylaxis is not recommended, but antibiotics should be given if infection is suspected. Standardized documentation of hysteroscopic technique and findings is essential.\n\nEffect of cervical preparation with prostaglandins on pain relief and feasibility in outpatient hysteroscopy. Safety, acceptability and feasibility of hysteroscopy according to angle of distal optical lens. Effectiveness of the vaginoscopic approach to outpatient hysteroscopy in relieving pain compared with traditional approaches with local anaesthesia. Relative effectiveness of different types, routes, doses and timings of local anaesthesia on pain and incidence of vasovagal reactions. Effectiveness of warming fluid distension media on pain relief and satisfaction. Effectiveness of methoxyflurane (Penthrox®) on pain relief and satisfaction. Assessment of specific operative hysteroscopic technologies including endometrial ablative devices, regarding pain, acceptability, feasibility and effectiveness. Evaluation of technical, analgesic, anaesthetic and sedative interventions for specific operative outpatient hysteroscopic procedures. Qualitative research exploring patient experience and preferences. Qualitative research exploring patient recovery and return to daily activity following outpatient hysteroscopy. Units should consider collecting data for quality assurance purposes. Provision of pre-appointment written information on OPH ≥ 95%. Mean peak intra-procedural pain score (on an 11-point Visual Analogue Scale) for various procedures. Procedure acceptability for diagnostic hysteroscopy, hysteroscopic polypectomy, and endometrial ablation. Mean overall level of care for all hysteroscopies & endometrial ablation. Compliance with safety checklists for all hysteroscopies & endometrial ablation. Documentation completion rates for all hysteroscopies & endometrial ablation. Vasovagal reaction rates for diagnostic hysteroscopy, hysteroscopic polypectomy & endometrial ablation. Rates of uterine/cervical trauma, infection, hospital admission, and hospital readmission for all hysteroscopies & endometrial ablation. No reliable data for operative outpatient myomectomy or removal of retained products of conception. No data available for outpatient endometrial ablation. No data available for outpatient hysteroscopic polypectomy or outpatient endometrial ablation. No data available for outpatient hysteroscopic polypectomy or outpatient endometrial ablation. Recommended quality assurance tools for outpatient hysteroscopy include patient satisfaction surveys and the BSGE Surgical Information Collection System.\n\nHysteroscopy: Prospective randomized trials on pain management during outpatient hysteroscopy have been conducted, evaluating the use of various analgesic methods such as music, virtual reality, nitrous oxide, lidocaine, tramadol, misoprostol, diclofenac, and other medications. These studies have shown varying degrees of effectiveness in reducing pain associated with hysteroscopy. Additionally, studies have evaluated the optimal timing and methods of cervical preparation prior to hysteroscopy in different patient populations. Complications such as uterine perforation have also been reported in some cases.\n\nOUTPATIENT HYSTEROSCOPY\nSeveral clinical trials have been conducted to evaluate the use of different medications for cervical priming before hysteroscopy, including misoprostol, carboprost methylate suppository, and vaginal dinoprostone. These studies have shown varying levels of efficacy and pain relief in different patient populations. Additionally, studies comparing different types of hysteroscopes, such as flexible versus rigid endoscopes, have been conducted to determine the feasibility and patient discomfort associated with each type. Overall, the choice of medication and hysteroscope type can impact the success and patient experience of outpatient hysteroscopy.\n\nPain management in outpatient hysteroscopy is important for patient comfort and procedure completion rates. Various methods, such as warm saline distension media, topical anesthesia, and paracervical blocks, have been studied in randomized controlled trials to assess their efficacy in reducing pain during hysteroscopy. These studies have shown promising results in improving patient comfort and procedural outcomes.\n\nOutpatient hysteroscopy: traditional versus the “no-touch” technique. Randomized studies comparing different hysteroscopy techniques and antibiotic use. Fatal systemic infection following hysteroscopy. Meta-analysis on antibiotic prophylaxis for hysteroscopy. Comparison of outpatient vs inpatient polyp treatment. Local anesthesia during endometrial ablation: a systematic review. Patterns of benign gynecology care in English NHS hospitals.\n\nPlease extract actionable suggestions from this analysis and format them as specified. For each suggestion, include detailed context with relevant quoted text from the guideline to help the user understand the reasoning behind the recommendation.",
    "system_prompt": "You are a medical AI assistant that converts clinical guideline analysis into structured, actionable suggestions. \n\nYour task is to analyze the provided guideline analysis and extract specific, actionable suggestions that can be presented to the user for acceptance, rejection, or modification.\n\nCRITICAL CLINICAL REASONING REQUIREMENTS:\n- You must first understand the specific clinical scenario and current diagnosis from the transcript\n- Carefully assess whether each potential recommendation is APPROPRIATE and INDICATED for this specific case\n- Apply the fundamental principle: \"Will this investigation or intervention change management or improve patient care in this specific scenario?\"\n- Consider the clinical context: is this an acute emergency, established diagnosis, or uncertain diagnostic situation?\n- Distinguish between situations where additional testing is needed vs. where diagnosis is already established\n- Only recommend interventions that would genuinely improve patient care in THIS specific scenario\n\nGENERAL CLINICAL APPROPRIATENESS PRINCIPLES:\n- Do NOT suggest diagnostic investigations when the diagnosis is already established through adequate clinical and/or imaging findings\n- Do NOT recommend interventions that conflict with the current evidence-based management plan\n- Do NOT suggest serial monitoring of biomarkers when the clinical picture and imaging provide sufficient diagnostic certainty\n- Consider whether additional investigations would actually change the management approach\n- Evaluate the timing: is this the appropriate point in the clinical course for this intervention?\n- Apply cost-benefit analysis: does the potential benefit justify the intervention in this specific case?\n\nFor each suggestion you identify, return ONLY a valid JSON object with the following structure:\n{\n  \"suggestions\": [\n    {\n      \"id\": \"1\",\n      \"originalText\": \"text from transcript that needs changing OR description of missing element\",\n      \"suggestedText\": \"proposed replacement text\",\n      \"context\": \"detailed explanation of why this change is suggested, including relevant quoted text from the guideline in quotation marks, and confirmation that this recommendation is appropriate for the specific clinical scenario\",\n      \"category\": \"addition|modification|deletion|formatting\",\n      \"priority\": \"high|medium|low\",\n      \"guidelineReference\": \"specific guideline section or rule\"\n    }\n  ]\n}\n\nCRITICAL FORMATTING REQUIREMENTS:\n- Return ONLY the JSON object - no markdown code blocks, no explanatory text\n- Do not wrap the JSON in ```json or ``` blocks\n- Start your response directly with { and end with }\n- Use sequential numeric IDs starting from \"1\"\n- Ensure all JSON is properly formatted and valid\n\nImportant guidelines for originalText field:\n- For MODIFICATIONS: Use the exact text from the transcript that needs to be changed\n- For ADDITIONS (missing elements): Use descriptive text like \"Missing: cervical length screening documentation\" or \"Gap: no discussion of antenatal corticosteroids\"\n- DO NOT use phrases like \"no additional cervical length screening ordered\" unless those exact words appear in the transcript\n- For missing elements, be clear that you're identifying an absence, not quoting existing text\n\nImportant guidelines for context field:\n- Provide detailed explanations including WHY the change is needed AND why it's appropriate for this specific case\n- Include specific quoted text from the guideline using quotation marks (e.g., \"According to the guideline: 'All women should receive screening for...'\")\n- Reference specific guideline recommendations or requirements\n- Explain the clinical rationale behind the suggestion\n- EXPLICITLY state why this recommendation is indicated in this particular clinical scenario\n- Make the context informative and educational\n\nOther important guidelines:\n- Only suggest changes that are explicitly supported by the guideline analysis AND clinically appropriate for the specific scenario\n- Make suggestions specific and actionable\n- For modifications, ensure original text selections are precise and findable in the transcript\n- Prioritize suggestions based on clinical importance and appropriateness\n- If no clinically appropriate suggestions can be made, return {\"suggestions\": []}\n- When in doubt about appropriateness, err on the side of NOT making the suggestion",
    "transcript_length": 3778,
    "analysis_length": 235,
    "guideline_id": "bjog-2024-de-silva-outpatient-hysteroscopy-pdf",
    "guideline_title": "Outpatient Hysteroscopy"
  },
  "response": "{\n  \"suggestions\": [\n    {\n      \"id\": \"1\",\n      \"originalText\": \"Missing: pre-hysteroscopy patient information provision\",\n      \"suggestedText\": \"Provide written information prior to hysteroscopy appointment including: procedure details, benefits/risks, pre-op analgesia advice, and contact details\",\n      \"context\": \"According to the guideline: 'Written information should be provided to the woman prior to their appointment, including details about the procedure, benefits and risks, advice regarding pre-operative analgesia, and contact details for the hysteroscopy unit.' This is particularly important as the patient may require hysteroscopy if biopsy results are abnormal or bleeding persists, and proper preparation improves patient experience and procedure success.\",\n      \"category\": \"addition\",\n      \"priority\": \"high\",\n      \"guidelineReference\": \"Pre-procedure information requirements\"\n    },\n    {\n      \"id\": \"2\",\n      \"originalText\": \"Consider Mirena® IUD reinsertion if biopsy normal\",\n      \"suggestedText\": \"If proceeding with IUD reinsertion, consider performing under hysteroscopic guidance given previous expulsion history\",\n      \"context\": \"The guideline recommends hysteroscopy for IUD insertion/retrieval in complex cases. Given this patient's history of IUD expulsion, hysteroscopic guidance would improve placement accuracy and reduce re-expulsion risk. 'All gynaecology departments should provide a dedicated outpatient hysteroscopy service for...insertion/retrieval of intrauterine devices.'\",\n      \"category\": \"modification\",\n      \"priority\": \"medium\",\n      \"guidelineReference\": \"IUD insertion under hysteroscopic guidance\"\n    },\n    {\n      \"id\": \"3\",\n      \"originalText\": \"GYN OPD follow-up in 6/52 (consider hysteroscopy if bleeding persists)\",\n      \"suggestedText\": \"GYN OPD follow-up in 6/52 with hysteroscopy planning: document discussion of vaginoscopic approach, saline distension, and NSAID premedication\",\n      \"context\": \"The guideline strongly recommends: 'Vaginoscopy should be the standard technique' and 'Saline should be instilled at the lowest possible pressure'. Also: 'A statistically significant reduction in pain was demonstrated with NSAIDs'. As this patient may require hysteroscopy, these evidence-based techniques should be incorporated into the management plan to optimize outcomes.\",\n      \"category\": \"modification\",\n      \"priority\": \"high\",\n      \"guidelineReference\": \"Optimal hysteroscopy technique\"\n    },\n    {\n      \"id\": \"4\",\n      \"originalText\": \"Missing: hysteroscopy pain management discussion\",\n      \"suggestedText\": \"Document discussion of pain management options including: NSAIDs 1 hour pre-procedure, warm saline distension, and vaginoscopic approach\",\n      \"context\": \"Guideline states: 'A statistically significant reduction in pain was demonstrated with NSAIDs' and 'Warming saline to body temperature can be considered'. For this patient with obesity and possible endometrial pathology, optimal pain management is crucial for successful outpatient procedure completion.\",\n      \"category\": \"addition\",\n      \"priority\": \"medium\",\n      \"guidelineReference\": \"Pain management strategies\"\n    },\n    {\n      \"id\": \"5\",\n      \"originalText\": \"Hysteroscopy + biopsy if USS/biopsy inconclusive\",\n      \"suggestedText\": \"Hysteroscopy with mechanical tissue removal system if polyps found (preferred over bipolar electrodes)\",\n      \"context\": \"The guideline specifically recommends: 'Mechanical hysteroscopic tissue removal systems should be preferred over miniature bipolar electrodes' for polypectomy. As this patient has heterogeneous endometrium on USS, this technical detail should be specified in case operative hysteroscopy is needed.\",\n      \"category\": \"modification\",\n      \"priority\": \"medium\",\n      \"guidelineReference\": \"Operative hysteroscopy techniques\"\n    }\n  ]\n}",
  "endpoint": "dynamicAdvice",
  "timestamp": "2025-07-17T11-58-42",
  "textContent": "AI: DeepSeek (deepseek-chat)\n\nQ: {\n  \"prompt\": \"Original Transcript:\\n**Professional Medical Clerking – SBAR Format**  \\n\\n---  \\n\\n### **SITUATION:**  \\n**Patient Demographics:**  \\n- **Name:** Ms. X (DOB: 15/05/1985, 39yo)  \\n- **Gestation:** N/A (G4P2, previous SVD x2, LSCS x1)  \\n- **Presenting Complaint:** Abnormal uterine bleeding (AUB) – heavy menstrual bleeding (HMB) with intermenstrual bleeding (IMB) for 3/12, worsening over last 2/52.  \\n- **Key Clinical Issue:** Persistent AUB with associated fatigue (likely secondary to iron deficiency anemia). No hemodynamic instability at present.  \\n\\n### **BACKGROUND:**  \\n**Relevant PMHx:**  \\n- **OBGYN Hx:**  \\n  - G4P2 (2x SVD, 1x LSCS for FTP, 1x TOP)  \\n  - Previous IUD (Mirena®) removed 6/12 ago due to expulsion  \\n  - No known fibroids or endometriosis  \\n- **Medical Hx:**  \\n  - Hypothyroidism (on levothyroxine 75mcg OD)  \\n  - Obesity (BMI 32)  \\n  - No known coagulopathy  \\n- **Surgical Hx:**  \\n  - LSCS (2018)  \\n  - Appendicectomy (2005)  \\n- **Medications:**  \\n  - Levothyroxine 75mcg OD  \\n  - NSAIDs PRN for dysmenorrhea (no recent use)  \\n- **Allergies:** NKDA  \\n- **Social Hx:**  \\n  - Non-smoker, occasional ETOH  \\n  - Works as a teacher, moderately active  \\n\\n**Risk Factors for AUB:**  \\n- Obesity (↑ endometrial hyperplasia risk)  \\n- Hypothyroidism (may exacerbate HMB)  \\n- Previous IUD expulsion (possible structural cause)  \\n\\n### **ASSESSMENT:**  \\n**Clinical Findings (0800 hours):**  \\n- **Vitals:**  \\n  - BP: 128/78 mmHg  \\n  - HR: 88 bpm (regular)  \\n  - Temp: 36.7°C  \\n  - SpO₂: 98% RA  \\n  - RR: 14/min  \\n- **General Exam:**  \\n  - Pale conjunctivae (clinical anemia)  \\n  - No signs of hemodynamic compromise  \\n- **Abdo Exam:**  \\n  - Soft, non-tender, no palpable masses  \\n- **PV Exam (consented & chaperoned):**  \\n  - No active bleeding at time of exam  \\n  - Cervix appears normal, no cervical excitation  \\n  - Uterus anteverted, non-tender, normal size  \\n  - No adnexal masses  \\n\\n**Investigations:**  \\n- **Bloods (FBC, LFTs, U&Es, CRP, TFTs, coagulation screen):**  \\n  - Hb: 98 g/L (↓ from 112 g/L 6/12 ago)  \\n  - MCV: 78 fL (microcytic)  \\n  - Ferritin: 12 μg/L (↓)  \\n  - TSH: 2.1 mIU/L (well-controlled)  \\n  - Platelets: 220 x10⁹/L  \\n  - INR/APTT: Normal  \\n- **Imaging:**  \\n  - **TV USS:**  \\n    - Endometrial thickness: 12mm (heterogeneous)  \\n    - No fibroids/polyps seen  \\n    - Normal adnexa  \\n  - **Pipelle biopsy (awaiting histology)**  \\n\\n**Differential Diagnosis (PALM-COEIN):**  \\n1. **Polyp/Adenomyosis** (USS inconclusive, biopsy pending)  \\n2. **Endometrial hyperplasia** (↑ risk due to obesity)  \\n3. **Coagulopathy** (unlikely given normal coagulation)  \\n4. **Ovulatory dysfunction** (secondary to hypothyroidism?)  \\n5. **Iatrogenic** (none identified)  \\n\\n### **RECOMMENDATION:**  \\n**Immediate Management:**  \\n- **Iron supplementation:** Ferrous sulfate 200mg BD + vitamin C (monitor Hb in 4/52)  \\n- **Hormonal therapy:**  \\n  - Start norethisterone 5mg TDS for 21/7 (to regulate bleeding)  \\n  - Consider Mirena® IUD reinsertion if biopsy normal  \\n- **Analgesia:** Mefenamic acid 500mg TDS PRN (if dysmenorrhea)  \\n\\n**Monitoring & Follow-Up:**  \\n- **Repeat Hb in 4/52** (target >110 g/L)  \\n- **Await endometrial biopsy results** (exclude hyperplasia/malignancy)  \\n- **GYN OPD follow-up in 6/52** (consider hysteroscopy if bleeding persists)  \\n\\n**Further Investigations if Needed:**  \\n- **Hysteroscopy + biopsy** if USS/biopsy inconclusive  \\n- **Thyroid antibody testing** if TFTs fluctuate  \\n\\n**Contingencies:**  \\n- If hemodynamically unstable → admit for IV iron/transfusion  \\n- If biopsy shows hyperplasia → consider progestogens/hysterectomy (if completed family)  \\n\\n---  \\n**Documented by:** [Your Name] (FY2)  \\n**Reviewed by:** [Consultant Name] (Obstetrics & Gynaecology)  \\n**Time/Date:** 0800 hours, 05/06/2024  \\n\\n*(This is a fictional case for educational purposes only.)*\\n\\nGuideline Analysis:\\nClinical transcript analysis for guideline compliance check against: Outpatient Hysteroscopy. This analysis focuses on identifying areas where the clinical documentation can be improved according to the specific guideline requirements.\\n\\nGuideline: Outpatient Hysteroscopy\\n\\n\\nFull Guideline Content:\\nKey recommendations:\\n- All gynaecology departments should provide a dedicated outpatient hysteroscopy service for women and people with abnormal uterine bleeding, reproductive problems, and insertion/retrieval of intrauterine devices.\\n- Written information should be provided to the woman prior to their appointment, including details about the procedure, benefits and risks, advice regarding pre-operative analgesia, and contact details for the hysteroscopy unit.\\n- Women should be made aware of other settings and modes of anaesthesia for hysteroscopy.\\n- Women should be advised to alert the clinical team if the procedure becomes too painful or distressing.\\n- Vaginoscopy should be the standard technique for outpatient hysteroscopy unless a vaginal speculum is required.\\n- Mechanical hysteroscopic tissue removal systems should be preferred over miniature bipolar electrodes.\\n- Saline should be instilled at the lowest possible pressure to achieve a satisfactory view.\\n- Conscious sedation should not be routinely used in outpatient hysteroscopic procedures.\\n\\nWomen should be given verbal and/or written informed consent prior to hysteroscopy, and should be informed of the potential pain and distress during the procedure. A safety checklist should be considered before hysteroscopy, including exclusion of pregnancy. Care after hysteroscopy should include discussing clinical findings, providing contact information, and offering a dedicated recovery area. Training in hysteroscopy should cover basic and advanced skills, and analgesia with NSAIDs or alternatives should be recommended.\\n\\nA statistically significant reduction in pain was demonstrated with NSAIDs, TENS, opioids, and antispasmodics given prior to hysteroscopy. NSAIDs and TENS showed no significant difference in side effects, while opioids and antispasmodics had a higher likelihood of side effects. Cervical preparation with vaginal prostaglandins can be considered in selected cases, but is associated with side effects and complications. Miniature hysteroscopes of 3.5mm or less in outer diameter should be used for diagnostic outpatient hysteroscopy to reduce pain. When performing operative hysteroscopy, smaller diameter hysteroscopes and mechanical tissue removal systems should be used for less pain. The choice of hysteroscope lens angle is at the discretion of the clinician.\\n\\nAdverse events were not meta-analysed. Image quality showed no significant difference between scope sizes, or found significantly better visualisation with a smaller-diameter hysteroscope. Studies reported a significant increase in success when using a smaller-diameter hysteroscope. Procedural duration was significantly shorter with a miniaturised hysteroscope in some studies. The incidence of vasovagal reactions was significantly lower with a smaller-diameter hysteroscope in one study. Flexible hysteroscopes are associated with less pain during diagnostic outpatient hysteroscopy. Mechanical hysteroscopic tissue removal systems are preferred over miniature bipolar electrodes for endometrial polyp removal. Inactivated mechanical mini-scissors should be preferred over miniature bipolar electrodes for uterine septa removal. Saline is recommended as the distension medium for outpatient hysteroscopy due to less pain, better image quality, and greater patient satisfaction. Saline should be instilled at the lowest possible pressure to achieve a satisfactory view. Warming saline to body temperature can be considered for outpatient hysteroscopy.\\n\\nRoutine cervical dilatation should be avoided prior to outpatient hysteroscopy. Blind dilatation of the cervix causes pain, discomfort, and uterine trauma in the outpatient setting. Local anaesthesia should not be routinely administered prior to outpatient hysteroscopy if a vaginoscopic approach is used, but should be considered if a vaginal speculum is planned. The choice of local anaesthetic agent and route of administration should be left to the discretion of the hysteroscopist. Conscious sedation should not be routinely used in outpatient hysteroscopic procedures. If conscious sedation is used, appropriate patient selection and monitoring are essential.\\n\\nConscious sedation is defined as a drug-induced depression of consciousness during which women respond purposefully to verbal commands. It is imperative to follow guidance on safe use to prevent life-threatening complications. Different sedation levels affect airway, ventilation, and cardiovascular function. Intravenous conscious sedation reduces pain during outpatient hysteroscopy compared to local anesthesia. Inhaled conscious sedation shows the greatest pain reduction but lacks recorded side effects. Close monitoring is necessary to identify and respond to over-sedation. Vaginoscopy is recommended for outpatient hysteroscopy due to reduced pain and quicker procedures. Routine antibiotic prophylaxis is not recommended, but antibiotics should be given if infection is suspected. Standardized documentation of hysteroscopic technique and findings is essential.\\n\\nEffect of cervical preparation with prostaglandins on pain relief and feasibility in outpatient hysteroscopy. Safety, acceptability and feasibility of hysteroscopy according to angle of distal optical lens. Effectiveness of the vaginoscopic approach to outpatient hysteroscopy in relieving pain compared with traditional approaches with local anaesthesia. Relative effectiveness of different types, routes, doses and timings of local anaesthesia on pain and incidence of vasovagal reactions. Effectiveness of warming fluid distension media on pain relief and satisfaction. Effectiveness of methoxyflurane (Penthrox®) on pain relief and satisfaction. Assessment of specific operative hysteroscopic technologies including endometrial ablative devices, regarding pain, acceptability, feasibility and effectiveness. Evaluation of technical, analgesic, anaesthetic and sedative interventions for specific operative outpatient hysteroscopic procedures. Qualitative research exploring patient experience and preferences. Qualitative research exploring patient recovery and return to daily activity following outpatient hysteroscopy. Units should consider collecting data for quality assurance purposes. Provision of pre-appointment written information on OPH ≥ 95%. Mean peak intra-procedural pain score (on an 11-point Visual Analogue Scale) for various procedures. Procedure acceptability for diagnostic hysteroscopy, hysteroscopic polypectomy, and endometrial ablation. Mean overall level of care for all hysteroscopies & endometrial ablation. Compliance with safety checklists for all hysteroscopies & endometrial ablation. Documentation completion rates for all hysteroscopies & endometrial ablation. Vasovagal reaction rates for diagnostic hysteroscopy, hysteroscopic polypectomy & endometrial ablation. Rates of uterine/cervical trauma, infection, hospital admission, and hospital readmission for all hysteroscopies & endometrial ablation. No reliable data for operative outpatient myomectomy or removal of retained products of conception. No data available for outpatient endometrial ablation. No data available for outpatient hysteroscopic polypectomy or outpatient endometrial ablation. No data available for outpatient hysteroscopic polypectomy or outpatient endometrial ablation. Recommended quality assurance tools for outpatient hysteroscopy include patient satisfaction surveys and the BSGE Surgical Information Collection System.\\n\\nHysteroscopy: Prospective randomized trials on pain management during outpatient hysteroscopy have been conducted, evaluating the use of various analgesic methods such as music, virtual reality, nitrous oxide, lidocaine, tramadol, misoprostol, diclofenac, and other medications. These studies have shown varying degrees of effectiveness in reducing pain associated with hysteroscopy. Additionally, studies have evaluated the optimal timing and methods of cervical preparation prior to hysteroscopy in different patient populations. Complications such as uterine perforation have also been reported in some cases.\\n\\nOUTPATIENT HYSTEROSCOPY\\nSeveral clinical trials have been conducted to evaluate the use of different medications for cervical priming before hysteroscopy, including misoprostol, carboprost methylate suppository, and vaginal dinoprostone. These studies have shown varying levels of efficacy and pain relief in different patient populations. Additionally, studies comparing different types of hysteroscopes, such as flexible versus rigid endoscopes, have been conducted to determine the feasibility and patient discomfort associated with each type. Overall, the choice of medication and hysteroscope type can impact the success and patient experience of outpatient hysteroscopy.\\n\\nPain management in outpatient hysteroscopy is important for patient comfort and procedure completion rates. Various methods, such as warm saline distension media, topical anesthesia, and paracervical blocks, have been studied in randomized controlled trials to assess their efficacy in reducing pain during hysteroscopy. These studies have shown promising results in improving patient comfort and procedural outcomes.\\n\\nOutpatient hysteroscopy: traditional versus the “no-touch” technique. Randomized studies comparing different hysteroscopy techniques and antibiotic use. Fatal systemic infection following hysteroscopy. Meta-analysis on antibiotic prophylaxis for hysteroscopy. Comparison of outpatient vs inpatient polyp treatment. Local anesthesia during endometrial ablation: a systematic review. Patterns of benign gynecology care in English NHS hospitals.\\n\\nPlease extract actionable suggestions from this analysis and format them as specified. For each suggestion, include detailed context with relevant quoted text from the guideline to help the user understand the reasoning behind the recommendation.\",\n  \"system_prompt\": \"You are a medical AI assistant that converts clinical guideline analysis into structured, actionable suggestions. \\n\\nYour task is to analyze the provided guideline analysis and extract specific, actionable suggestions that can be presented to the user for acceptance, rejection, or modification.\\n\\nCRITICAL CLINICAL REASONING REQUIREMENTS:\\n- You must first understand the specific clinical scenario and current diagnosis from the transcript\\n- Carefully assess whether each potential recommendation is APPROPRIATE and INDICATED for this specific case\\n- Apply the fundamental principle: \\\"Will this investigation or intervention change management or improve patient care in this specific scenario?\\\"\\n- Consider the clinical context: is this an acute emergency, established diagnosis, or uncertain diagnostic situation?\\n- Distinguish between situations where additional testing is needed vs. where diagnosis is already established\\n- Only recommend interventions that would genuinely improve patient care in THIS specific scenario\\n\\nGENERAL CLINICAL APPROPRIATENESS PRINCIPLES:\\n- Do NOT suggest diagnostic investigations when the diagnosis is already established through adequate clinical and/or imaging findings\\n- Do NOT recommend interventions that conflict with the current evidence-based management plan\\n- Do NOT suggest serial monitoring of biomarkers when the clinical picture and imaging provide sufficient diagnostic certainty\\n- Consider whether additional investigations would actually change the management approach\\n- Evaluate the timing: is this the appropriate point in the clinical course for this intervention?\\n- Apply cost-benefit analysis: does the potential benefit justify the intervention in this specific case?\\n\\nFor each suggestion you identify, return ONLY a valid JSON object with the following structure:\\n{\\n  \\\"suggestions\\\": [\\n    {\\n      \\\"id\\\": \\\"1\\\",\\n      \\\"originalText\\\": \\\"text from transcript that needs changing OR description of missing element\\\",\\n      \\\"suggestedText\\\": \\\"proposed replacement text\\\",\\n      \\\"context\\\": \\\"detailed explanation of why this change is suggested, including relevant quoted text from the guideline in quotation marks, and confirmation that this recommendation is appropriate for the specific clinical scenario\\\",\\n      \\\"category\\\": \\\"addition|modification|deletion|formatting\\\",\\n      \\\"priority\\\": \\\"high|medium|low\\\",\\n      \\\"guidelineReference\\\": \\\"specific guideline section or rule\\\"\\n    }\\n  ]\\n}\\n\\nCRITICAL FORMATTING REQUIREMENTS:\\n- Return ONLY the JSON object - no markdown code blocks, no explanatory text\\n- Do not wrap the JSON in ```json or ``` blocks\\n- Start your response directly with { and end with }\\n- Use sequential numeric IDs starting from \\\"1\\\"\\n- Ensure all JSON is properly formatted and valid\\n\\nImportant guidelines for originalText field:\\n- For MODIFICATIONS: Use the exact text from the transcript that needs to be changed\\n- For ADDITIONS (missing elements): Use descriptive text like \\\"Missing: cervical length screening documentation\\\" or \\\"Gap: no discussion of antenatal corticosteroids\\\"\\n- DO NOT use phrases like \\\"no additional cervical length screening ordered\\\" unless those exact words appear in the transcript\\n- For missing elements, be clear that you're identifying an absence, not quoting existing text\\n\\nImportant guidelines for context field:\\n- Provide detailed explanations including WHY the change is needed AND why it's appropriate for this specific case\\n- Include specific quoted text from the guideline using quotation marks (e.g., \\\"According to the guideline: 'All women should receive screening for...'\\\")\\n- Reference specific guideline recommendations or requirements\\n- Explain the clinical rationale behind the suggestion\\n- EXPLICITLY state why this recommendation is indicated in this particular clinical scenario\\n- Make the context informative and educational\\n\\nOther important guidelines:\\n- Only suggest changes that are explicitly supported by the guideline analysis AND clinically appropriate for the specific scenario\\n- Make suggestions specific and actionable\\n- For modifications, ensure original text selections are precise and findable in the transcript\\n- Prioritize suggestions based on clinical importance and appropriateness\\n- If no clinically appropriate suggestions can be made, return {\\\"suggestions\\\": []}\\n- When in doubt about appropriateness, err on the side of NOT making the suggestion\",\n  \"transcript_length\": 3778,\n  \"analysis_length\": 235,\n  \"guideline_id\": \"bjog-2024-de-silva-outpatient-hysteroscopy-pdf\",\n  \"guideline_title\": \"Outpatient Hysteroscopy\"\n}\n\nA: {\n  \"suggestions\": [\n    {\n      \"id\": \"1\",\n      \"originalText\": \"Missing: pre-hysteroscopy patient information provision\",\n      \"suggestedText\": \"Provide written information prior to hysteroscopy appointment including: procedure details, benefits/risks, pre-op analgesia advice, and contact details\",\n      \"context\": \"According to the guideline: 'Written information should be provided to the woman prior to their appointment, including details about the procedure, benefits and risks, advice regarding pre-operative analgesia, and contact details for the hysteroscopy unit.' This is particularly important as the patient may require hysteroscopy if biopsy results are abnormal or bleeding persists, and proper preparation improves patient experience and procedure success.\",\n      \"category\": \"addition\",\n      \"priority\": \"high\",\n      \"guidelineReference\": \"Pre-procedure information requirements\"\n    },\n    {\n      \"id\": \"2\",\n      \"originalText\": \"Consider Mirena® IUD reinsertion if biopsy normal\",\n      \"suggestedText\": \"If proceeding with IUD reinsertion, consider performing under hysteroscopic guidance given previous expulsion history\",\n      \"context\": \"The guideline recommends hysteroscopy for IUD insertion/retrieval in complex cases. Given this patient's history of IUD expulsion, hysteroscopic guidance would improve placement accuracy and reduce re-expulsion risk. 'All gynaecology departments should provide a dedicated outpatient hysteroscopy service for...insertion/retrieval of intrauterine devices.'\",\n      \"category\": \"modification\",\n      \"priority\": \"medium\",\n      \"guidelineReference\": \"IUD insertion under hysteroscopic guidance\"\n    },\n    {\n      \"id\": \"3\",\n      \"originalText\": \"GYN OPD follow-up in 6/52 (consider hysteroscopy if bleeding persists)\",\n      \"suggestedText\": \"GYN OPD follow-up in 6/52 with hysteroscopy planning: document discussion of vaginoscopic approach, saline distension, and NSAID premedication\",\n      \"context\": \"The guideline strongly recommends: 'Vaginoscopy should be the standard technique' and 'Saline should be instilled at the lowest possible pressure'. Also: 'A statistically significant reduction in pain was demonstrated with NSAIDs'. As this patient may require hysteroscopy, these evidence-based techniques should be incorporated into the management plan to optimize outcomes.\",\n      \"category\": \"modification\",\n      \"priority\": \"high\",\n      \"guidelineReference\": \"Optimal hysteroscopy technique\"\n    },\n    {\n      \"id\": \"4\",\n      \"originalText\": \"Missing: hysteroscopy pain management discussion\",\n      \"suggestedText\": \"Document discussion of pain management options including: NSAIDs 1 hour pre-procedure, warm saline distension, and vaginoscopic approach\",\n      \"context\": \"Guideline states: 'A statistically significant reduction in pain was demonstrated with NSAIDs' and 'Warming saline to body temperature can be considered'. For this patient with obesity and possible endometrial pathology, optimal pain management is crucial for successful outpatient procedure completion.\",\n      \"category\": \"addition\",\n      \"priority\": \"medium\",\n      \"guidelineReference\": \"Pain management strategies\"\n    },\n    {\n      \"id\": \"5\",\n      \"originalText\": \"Hysteroscopy + biopsy if USS/biopsy inconclusive\",\n      \"suggestedText\": \"Hysteroscopy with mechanical tissue removal system if polyps found (preferred over bipolar electrodes)\",\n      \"context\": \"The guideline specifically recommends: 'Mechanical hysteroscopic tissue removal systems should be preferred over miniature bipolar electrodes' for polypectomy. As this patient has heterogeneous endometrium on USS, this technical detail should be specified in case operative hysteroscopy is needed.\",\n      \"category\": \"modification\",\n      \"priority\": \"medium\",\n      \"guidelineReference\": \"Operative hysteroscopy techniques\"\n    }\n  ]\n}\n\n--- Token Usage Report ---\nPrompt tokens: 3726\nCompletion tokens: 803\nTotal tokens: 4529\nEstimated cost: $0.002265",
  "ai_provider": "DeepSeek",
  "ai_model": "deepseek-chat",
  "token_usage": {
    "prompt_tokens": 3726,
    "completion_tokens": 803,
    "total_tokens": 4529,
    "estimated_cost_usd": 0.0022645
  }
}