{
  "prompt": {
    "guidelineId": "cg21010-care-of-the-late-preterm-newborn-guideline-pdf",
    "fieldsProcessed": [
      "humanFriendlyName",
      "organisation",
      "yearProduced",
      "summary"
    ],
    "enhancedFields": 4,
    "contentLength": 6351
  },
  "response": "{\n  \"success\": true,\n  \"enhancedFields\": [\n    {\n      \"field\": \"humanFriendlyName\",\n      \"oldValue\": null,\n      \"newValue\": \"Care Guidelines for Late Preterm Infants\",\n      \"action\": \"added\"\n    },\n    {\n      \"field\": \"organisation\",\n      \"oldValue\": null,\n      \"newValue\": \"RCOG\",\n      \"action\": \"added\"\n    },\n    {\n      \"field\": \"yearProduced\",\n      \"oldValue\": null,\n      \"newValue\": \"I cannot find a publication year in the provided text. The guideline text does not contain a specific 4-digit year indicating its publication date\",\n      \"action\": \"added\"\n    },\n    {\n      \"field\": \"summary\",\n      \"oldValue\": null,\n      \"newValue\": \"**Summary of Late Preterm Infant Care Guidelines** **Key Recommendations:** - **Immediate Post-Birth Care:** Skin-to-skin contact is vital for stabilization and breastfeeding initiation. Monitor blood glucose (BG) at 2 hours; if BG < 2.6 mmol/L, follow hypoglycemia pathway (3-hourly feeds for BG ≥ 2.6, 2-hourly for BG 1.4–2.6, urgent review if BG < 1.4). - **Feeding Support:** Breastfeed within the first hour; if not possible, hand express colostrum. Ensure 3-hourly feeds, monitor latch/suck/swallow, and supplement if inadequate intake (e.g., reduced nappies, weight loss ≥ 7%). Use paced bottle feeding if supplementing. - **Monitoring:** Track weight (at 72h, Day 5, discharge), jaundice, and BG. Observe for ineffective feeding (sleepiness, reluctance) and intervene with breast compressions, switch feeding, or supplementation. - **Discharge Criteria:** Stable temperature, successful feeding, weight gain, and parent education on preterm care, safer sleep, and illness signs. Avoid discharge before 72h to reduce readmission risk. - **Referral Pathways:** Admit to transitional care for feeding/weight issues or jaundice. Immediate NNU referral for jaundice <24h or instability (e.g., respiratory distress). **Parental Involvement:** Encourage active participation in care, provide education, and ensure community follow-up. **Appendices Highlight:** - Hypoglycemia management (Appendix 3). - Feeding plans (Appendices 2, 4, 5). - Discharge risk assessment (Appendix 6). - Red flag criteria for readmission (Appendix 1)\",\n      \"action\": \"added\"\n    }\n  ]\n}",
  "endpoint": "enhanceGuidelineMetadata",
  "timestamp": "2025-06-18T22-16-31",
  "textContent": "AI: DeepSeek (deepseek-chat)\n\nQ: {\n  \"guidelineId\": \"cg21010-care-of-the-late-preterm-newborn-guideline-pdf\",\n  \"fieldsProcessed\": [\n    \"humanFriendlyName\",\n    \"organisation\",\n    \"yearProduced\",\n    \"summary\"\n  ],\n  \"enhancedFields\": 4,\n  \"contentLength\": 6351\n}\n\nA: {\n  \"success\": true,\n  \"enhancedFields\": [\n    {\n      \"field\": \"humanFriendlyName\",\n      \"oldValue\": null,\n      \"newValue\": \"Care Guidelines for Late Preterm Infants\",\n      \"action\": \"added\"\n    },\n    {\n      \"field\": \"organisation\",\n      \"oldValue\": null,\n      \"newValue\": \"RCOG\",\n      \"action\": \"added\"\n    },\n    {\n      \"field\": \"yearProduced\",\n      \"oldValue\": null,\n      \"newValue\": \"I cannot find a publication year in the provided text. The guideline text does not contain a specific 4-digit year indicating its publication date\",\n      \"action\": \"added\"\n    },\n    {\n      \"field\": \"summary\",\n      \"oldValue\": null,\n      \"newValue\": \"**Summary of Late Preterm Infant Care Guidelines** **Key Recommendations:** - **Immediate Post-Birth Care:** Skin-to-skin contact is vital for stabilization and breastfeeding initiation. Monitor blood glucose (BG) at 2 hours; if BG < 2.6 mmol/L, follow hypoglycemia pathway (3-hourly feeds for BG ≥ 2.6, 2-hourly for BG 1.4–2.6, urgent review if BG < 1.4). - **Feeding Support:** Breastfeed within the first hour; if not possible, hand express colostrum. Ensure 3-hourly feeds, monitor latch/suck/swallow, and supplement if inadequate intake (e.g., reduced nappies, weight loss ≥ 7%). Use paced bottle feeding if supplementing. - **Monitoring:** Track weight (at 72h, Day 5, discharge), jaundice, and BG. Observe for ineffective feeding (sleepiness, reluctance) and intervene with breast compressions, switch feeding, or supplementation. - **Discharge Criteria:** Stable temperature, successful feeding, weight gain, and parent education on preterm care, safer sleep, and illness signs. Avoid discharge before 72h to reduce readmission risk. - **Referral Pathways:** Admit to transitional care for feeding/weight issues or jaundice. Immediate NNU referral for jaundice <24h or instability (e.g., respiratory distress). **Parental Involvement:** Encourage active participation in care, provide education, and ensure community follow-up. **Appendices Highlight:** - Hypoglycemia management (Appendix 3). - Feeding plans (Appendices 2, 4, 5). - Discharge risk assessment (Appendix 6). - Red flag criteria for readmission (Appendix 1)\",\n      \"action\": \"added\"\n    }\n  ]\n}",
  "ai_provider": "DeepSeek",
  "ai_model": "deepseek-chat",
  "token_usage": null
}