{
  "prompt": {
    "guidelineId": "gp007-ovarian-hyperstimulation-syndrome-ohss-v2-pdf",
    "fieldsProcessed": [
      "humanFriendlyName",
      "organisation",
      "yearProduced",
      "summary"
    ],
    "enhancedFields": 4,
    "contentLength": 2904
  },
  "response": "{\n  \"success\": true,\n  \"enhancedFields\": [\n    {\n      \"field\": \"humanFriendlyName\",\n      \"oldValue\": null,\n      \"newValue\": \"OHSS Management in Maternity Care\",\n      \"action\": \"added\"\n    },\n    {\n      \"field\": \"organisation\",\n      \"oldValue\": null,\n      \"newValue\": \"Brighton & Sussex University Hospitals NHS Trust\",\n      \"action\": \"added\"\n    },\n    {\n      \"field\": \"yearProduced\",\n      \"oldValue\": null,\n      \"newValue\": \"2006\",\n      \"action\": \"added\"\n    },\n    {\n      \"field\": \"summary\",\n      \"oldValue\": null,\n      \"newValue\": \"**Summary of Brighton & Sussex University Hospitals NHS Trust Maternity Protocol: Ovarian Hyperstimulation Syndrome (OHSS)** - **Definition**: OHSS is an iatrogenic condition caused by ovarian stimulation for fertility treatment, leading to systemic effects from vasoactive ovarian products. - **Diagnosis**: Based on ovarian stimulation history and symptoms (abdominal distension, pain, nausea, vomiting). Rule out differentials (e.g., ectopic pregnancy, appendicitis). - **Severity Classification**: Mild, moderate, severe, or critical; assess and document severity. Report OHSS-related deaths to maternal death enquiries. - **Management**: - **Outpatient**: Mild/moderate cases with monitoring and symptom control (pain relief, antiemetics). - **Inpatient**: Severe/critical cases or uncontrolled moderate cases require hospitalization (IV rehydration, fluid balance monitoring, paracentesis if needed). - **Key Actions**: Early consultant involvement, IV therapy, pain/nausea management, emotional support, and clear discharge advice with follow-up. - **Discharge**: Provide patient information, contact details, and ensure primary clinician notification. *(Based on RCOG Green-top guideline, 2006.)*\",\n      \"action\": \"added\"\n    }\n  ]\n}",
  "endpoint": "enhanceGuidelineMetadata",
  "timestamp": "2025-06-18T22-22-11",
  "textContent": "AI: DeepSeek (deepseek-chat)\n\nQ: {\n  \"guidelineId\": \"gp007-ovarian-hyperstimulation-syndrome-ohss-v2-pdf\",\n  \"fieldsProcessed\": [\n    \"humanFriendlyName\",\n    \"organisation\",\n    \"yearProduced\",\n    \"summary\"\n  ],\n  \"enhancedFields\": 4,\n  \"contentLength\": 2904\n}\n\nA: {\n  \"success\": true,\n  \"enhancedFields\": [\n    {\n      \"field\": \"humanFriendlyName\",\n      \"oldValue\": null,\n      \"newValue\": \"OHSS Management in Maternity Care\",\n      \"action\": \"added\"\n    },\n    {\n      \"field\": \"organisation\",\n      \"oldValue\": null,\n      \"newValue\": \"Brighton & Sussex University Hospitals NHS Trust\",\n      \"action\": \"added\"\n    },\n    {\n      \"field\": \"yearProduced\",\n      \"oldValue\": null,\n      \"newValue\": \"2006\",\n      \"action\": \"added\"\n    },\n    {\n      \"field\": \"summary\",\n      \"oldValue\": null,\n      \"newValue\": \"**Summary of Brighton & Sussex University Hospitals NHS Trust Maternity Protocol: Ovarian Hyperstimulation Syndrome (OHSS)** - **Definition**: OHSS is an iatrogenic condition caused by ovarian stimulation for fertility treatment, leading to systemic effects from vasoactive ovarian products. - **Diagnosis**: Based on ovarian stimulation history and symptoms (abdominal distension, pain, nausea, vomiting). Rule out differentials (e.g., ectopic pregnancy, appendicitis). - **Severity Classification**: Mild, moderate, severe, or critical; assess and document severity. Report OHSS-related deaths to maternal death enquiries. - **Management**: - **Outpatient**: Mild/moderate cases with monitoring and symptom control (pain relief, antiemetics). - **Inpatient**: Severe/critical cases or uncontrolled moderate cases require hospitalization (IV rehydration, fluid balance monitoring, paracentesis if needed). - **Key Actions**: Early consultant involvement, IV therapy, pain/nausea management, emotional support, and clear discharge advice with follow-up. - **Discharge**: Provide patient information, contact details, and ensure primary clinician notification. *(Based on RCOG Green-top guideline, 2006.)*\",\n      \"action\": \"added\"\n    }\n  ]\n}",
  "ai_provider": "DeepSeek",
  "ai_model": "deepseek-chat",
  "token_usage": null
}