{
  "prompt": {
    "guidelineId": "mp070-examination-of-the-newborn-pdf",
    "fieldsProcessed": [
      "humanFriendlyName",
      "organisation",
      "yearProduced",
      "summary"
    ],
    "enhancedFields": 4,
    "contentLength": 1598
  },
  "response": "{\n  \"success\": true,\n  \"enhancedFields\": [\n    {\n      \"field\": \"humanFriendlyName\",\n      \"oldValue\": null,\n      \"newValue\": \"Newborn Examination Guidelines for Early Detection of Abnormalities\",\n      \"action\": \"added\"\n    },\n    {\n      \"field\": \"organisation\",\n      \"oldValue\": null,\n      \"newValue\": \"RSCH PRH\",\n      \"action\": \"added\"\n    },\n    {\n      \"field\": \"yearProduced\",\n      \"oldValue\": null,\n      \"newValue\": \"I don't see a publication year in the provided text. Could you check if it's included in another part of the document?\",\n      \"action\": \"added\"\n    },\n    {\n      \"field\": \"summary\",\n      \"oldValue\": null,\n      \"newValue\": \"**Summary:** The newborn examination aims to detect congenital abnormalities within 72 hours of birth, provide health advice, and ensure timely referrals. **Key Points:** - **Timing:** Conduct within 72 hours, unless early discharge occurs. - **Examination Components:** Clinical history, observation, and full physical exam. - **Qualified Staff:** Neonatologists, neonatal medical staff, and trained midwives. - **Midwives’ Scope:** Can examine term (≥37 weeks), low-risk newborns (uncomplicated delivery, no maternal medical concerns). Must refer preterm (<37 weeks), complicated/traumatic deliveries, or antenatal abnormalities. - **Documentation:** Record consent, findings, and deviations from normal. - **Communication:** Obtain consent, explain procedures, and discuss results clearly. - **Referrals:** Promptly refer abnormal findings for further investigation. Document referrals in postnatal notes\",\n      \"action\": \"added\"\n    }\n  ]\n}",
  "endpoint": "enhanceGuidelineMetadata",
  "timestamp": "2025-06-18T22-54-05",
  "textContent": "AI: DeepSeek (deepseek-chat)\n\nQ: {\n  \"guidelineId\": \"mp070-examination-of-the-newborn-pdf\",\n  \"fieldsProcessed\": [\n    \"humanFriendlyName\",\n    \"organisation\",\n    \"yearProduced\",\n    \"summary\"\n  ],\n  \"enhancedFields\": 4,\n  \"contentLength\": 1598\n}\n\nA: {\n  \"success\": true,\n  \"enhancedFields\": [\n    {\n      \"field\": \"humanFriendlyName\",\n      \"oldValue\": null,\n      \"newValue\": \"Newborn Examination Guidelines for Early Detection of Abnormalities\",\n      \"action\": \"added\"\n    },\n    {\n      \"field\": \"organisation\",\n      \"oldValue\": null,\n      \"newValue\": \"RSCH PRH\",\n      \"action\": \"added\"\n    },\n    {\n      \"field\": \"yearProduced\",\n      \"oldValue\": null,\n      \"newValue\": \"I don't see a publication year in the provided text. Could you check if it's included in another part of the document?\",\n      \"action\": \"added\"\n    },\n    {\n      \"field\": \"summary\",\n      \"oldValue\": null,\n      \"newValue\": \"**Summary:** The newborn examination aims to detect congenital abnormalities within 72 hours of birth, provide health advice, and ensure timely referrals. **Key Points:** - **Timing:** Conduct within 72 hours, unless early discharge occurs. - **Examination Components:** Clinical history, observation, and full physical exam. - **Qualified Staff:** Neonatologists, neonatal medical staff, and trained midwives. - **Midwives’ Scope:** Can examine term (≥37 weeks), low-risk newborns (uncomplicated delivery, no maternal medical concerns). Must refer preterm (<37 weeks), complicated/traumatic deliveries, or antenatal abnormalities. - **Documentation:** Record consent, findings, and deviations from normal. - **Communication:** Obtain consent, explain procedures, and discuss results clearly. - **Referrals:** Promptly refer abnormal findings for further investigation. Document referrals in postnatal notes\",\n      \"action\": \"added\"\n    }\n  ]\n}",
  "ai_provider": "DeepSeek",
  "ai_model": "deepseek-chat",
  "token_usage": null
}