{
  "prompt": {
    "guidelineId": "shoulder-dystocia-prompt-card-ed-rsch-prh-pdf",
    "fieldsProcessed": [
      "humanFriendlyName",
      "organisation",
      "yearProduced",
      "summary"
    ],
    "enhancedFields": 4,
    "contentLength": 1237
  },
  "response": "{\n  \"success\": true,\n  \"enhancedFields\": [\n    {\n      \"field\": \"humanFriendlyName\",\n      \"oldValue\": null,\n      \"newValue\": \"Shoulder Dystocia Management Prompt Card\",\n      \"action\": \"added\"\n    },\n    {\n      \"field\": \"organisation\",\n      \"oldValue\": null,\n      \"newValue\": \"RCOG\",\n      \"action\": \"added\"\n    },\n    {\n      \"field\": \"yearProduced\",\n      \"oldValue\": null,\n      \"newValue\": \"I cannot find a publication year in the provided text. The text appears to be a clinical prompt card or guideline excerpt, but it does not contain a visible publication date\",\n      \"action\": \"added\"\n    },\n    {\n      \"field\": \"summary\",\n      \"oldValue\": null,\n      \"newValue\": \"**Summary of Shoulder Dystocia Guidelines:** - **Identify shoulder dystocia** and immediately **call for help** (senior midwife, registrar, paediatrician). Prepare for neonatal resuscitation and reassure parents. - **First-line maneuvers**: - **McRoberts position**: Lie flat, elevate legs. - **Suprapubic pressure**: Apply 30 sec continuous or rocking pressure. - **Next steps if unsuccessful**: - **Posterior shoulder pressure**: Apply pressure to anterior/posterior shoulder or rotate baby 180° (repeat if needed). - **Deliver posterior arm** or change maternal position (e.g., all fours). - **If still unresolved**: Repeat maneuvers or consider **cleidotomy, Zavanelli maneuver, or symphysiotomy** (consultant obstetrician must be contacted). - **Avoid excessive traction or flexion** of the fetal head. - **Clinical judgment** determines the order of maneuvers, but McRoberts and suprapubic pressure are first-line. Episiotomy may be evaluated if needed\",\n      \"action\": \"added\"\n    }\n  ]\n}",
  "endpoint": "enhanceGuidelineMetadata",
  "timestamp": "2025-06-18T23-02-31",
  "textContent": "AI: DeepSeek (deepseek-chat)\n\nQ: {\n  \"guidelineId\": \"shoulder-dystocia-prompt-card-ed-rsch-prh-pdf\",\n  \"fieldsProcessed\": [\n    \"humanFriendlyName\",\n    \"organisation\",\n    \"yearProduced\",\n    \"summary\"\n  ],\n  \"enhancedFields\": 4,\n  \"contentLength\": 1237\n}\n\nA: {\n  \"success\": true,\n  \"enhancedFields\": [\n    {\n      \"field\": \"humanFriendlyName\",\n      \"oldValue\": null,\n      \"newValue\": \"Shoulder Dystocia Management Prompt Card\",\n      \"action\": \"added\"\n    },\n    {\n      \"field\": \"organisation\",\n      \"oldValue\": null,\n      \"newValue\": \"RCOG\",\n      \"action\": \"added\"\n    },\n    {\n      \"field\": \"yearProduced\",\n      \"oldValue\": null,\n      \"newValue\": \"I cannot find a publication year in the provided text. The text appears to be a clinical prompt card or guideline excerpt, but it does not contain a visible publication date\",\n      \"action\": \"added\"\n    },\n    {\n      \"field\": \"summary\",\n      \"oldValue\": null,\n      \"newValue\": \"**Summary of Shoulder Dystocia Guidelines:** - **Identify shoulder dystocia** and immediately **call for help** (senior midwife, registrar, paediatrician). Prepare for neonatal resuscitation and reassure parents. - **First-line maneuvers**: - **McRoberts position**: Lie flat, elevate legs. - **Suprapubic pressure**: Apply 30 sec continuous or rocking pressure. - **Next steps if unsuccessful**: - **Posterior shoulder pressure**: Apply pressure to anterior/posterior shoulder or rotate baby 180° (repeat if needed). - **Deliver posterior arm** or change maternal position (e.g., all fours). - **If still unresolved**: Repeat maneuvers or consider **cleidotomy, Zavanelli maneuver, or symphysiotomy** (consultant obstetrician must be contacted). - **Avoid excessive traction or flexion** of the fetal head. - **Clinical judgment** determines the order of maneuvers, but McRoberts and suprapubic pressure are first-line. Episiotomy may be evaluated if needed\",\n      \"action\": \"added\"\n    }\n  ]\n}",
  "ai_provider": "DeepSeek",
  "ai_model": "deepseek-chat",
  "token_usage": null
}