{
  "prompt": {
    "guidelineId": "cg1128-neonatal-resuscitation-pdf",
    "fieldsProcessed": [
      "humanFriendlyName",
      "organisation",
      "yearProduced",
      "summary"
    ],
    "enhancedFields": 4,
    "contentLength": 3034
  },
  "response": "{\n  \"success\": true,\n  \"enhancedFields\": [\n    {\n      \"field\": \"humanFriendlyName\",\n      \"oldValue\": null,\n      \"newValue\": \"Neonatal Resuscitation Guidelines and Equipment Standards\",\n      \"action\": \"added\"\n    },\n    {\n      \"field\": \"organisation\",\n      \"oldValue\": null,\n      \"newValue\": \"RCOG\",\n      \"action\": \"added\"\n    },\n    {\n      \"field\": \"yearProduced\",\n      \"oldValue\": null,\n      \"newValue\": \"2023\",\n      \"action\": \"added\"\n    },\n    {\n      \"field\": \"summary\",\n      \"oldValue\": null,\n      \"newValue\": \"**Summary of Neonatal Resuscitation Guideline (CG1128 V6, Jan 2023):** - **Equipment & Personnel**: Ensure trained staff and resuscitation equipment (e.g., Resuscitaire, laryngoscopes, endotracheal tubes) are immediately available. Regular checks of equipment functionality (e.g., oxygen supply, suction) are mandatory. - **Drug Dosing**: Weight-based dosing for adrenaline (0.2 ml/kg IV/IO), bicarbonate (2–4 ml/kg of 4.2%), glucose 10% (2.5 ml/kg), and 0.9% sodium chloride (10 ml/kg). ETT sizes and lengths are specified by weight/gestation. - **Preterm Infants (<26 weeks)**: Individualized decision-making with parental involvement; options include resuscitation, comfort care, or survival-focused care based on gestational age and viability. - **Resuscitation Protocol**: Follow Resuscitation Council UK’s Newborn Life Support (NLS) flowchart. Initial steps include warmth, airway clearance, and ventilation with 21–30% oxygen (adjusted for preterm infants). - **Documentation**: Checklists for Resuscitaire contents (e.g., masks, suction catheters, ETTs) and pre-use verification are provided. - **Training**: Staff must undergo regular neonatal life support training and competency assessments. *(Focused on clinical recommendations; excludes governance/background details.)*\",\n      \"action\": \"added\"\n    }\n  ]\n}",
  "endpoint": "enhanceGuidelineMetadata",
  "timestamp": "2025-06-18T21-48-59",
  "textContent": "AI: DeepSeek (deepseek-chat)\n\nQ: {\n  \"guidelineId\": \"cg1128-neonatal-resuscitation-pdf\",\n  \"fieldsProcessed\": [\n    \"humanFriendlyName\",\n    \"organisation\",\n    \"yearProduced\",\n    \"summary\"\n  ],\n  \"enhancedFields\": 4,\n  \"contentLength\": 3034\n}\n\nA: {\n  \"success\": true,\n  \"enhancedFields\": [\n    {\n      \"field\": \"humanFriendlyName\",\n      \"oldValue\": null,\n      \"newValue\": \"Neonatal Resuscitation Guidelines and Equipment Standards\",\n      \"action\": \"added\"\n    },\n    {\n      \"field\": \"organisation\",\n      \"oldValue\": null,\n      \"newValue\": \"RCOG\",\n      \"action\": \"added\"\n    },\n    {\n      \"field\": \"yearProduced\",\n      \"oldValue\": null,\n      \"newValue\": \"2023\",\n      \"action\": \"added\"\n    },\n    {\n      \"field\": \"summary\",\n      \"oldValue\": null,\n      \"newValue\": \"**Summary of Neonatal Resuscitation Guideline (CG1128 V6, Jan 2023):** - **Equipment & Personnel**: Ensure trained staff and resuscitation equipment (e.g., Resuscitaire, laryngoscopes, endotracheal tubes) are immediately available. Regular checks of equipment functionality (e.g., oxygen supply, suction) are mandatory. - **Drug Dosing**: Weight-based dosing for adrenaline (0.2 ml/kg IV/IO), bicarbonate (2–4 ml/kg of 4.2%), glucose 10% (2.5 ml/kg), and 0.9% sodium chloride (10 ml/kg). ETT sizes and lengths are specified by weight/gestation. - **Preterm Infants (<26 weeks)**: Individualized decision-making with parental involvement; options include resuscitation, comfort care, or survival-focused care based on gestational age and viability. - **Resuscitation Protocol**: Follow Resuscitation Council UK’s Newborn Life Support (NLS) flowchart. Initial steps include warmth, airway clearance, and ventilation with 21–30% oxygen (adjusted for preterm infants). - **Documentation**: Checklists for Resuscitaire contents (e.g., masks, suction catheters, ETTs) and pre-use verification are provided. - **Training**: Staff must undergo regular neonatal life support training and competency assessments. *(Focused on clinical recommendations; excludes governance/background details.)*\",\n      \"action\": \"added\"\n    }\n  ]\n}",
  "ai_provider": "DeepSeek",
  "ai_model": "deepseek-chat",
  "token_usage": null
}