{
  "prompt": {
    "guidelineId": "uhsx-maternity-smoking-smoke-free-pregnancy-guideline-pdf",
    "fieldsProcessed": [
      "humanFriendlyName",
      "organisation",
      "yearProduced",
      "summary"
    ],
    "enhancedFields": 4,
    "contentLength": 2819
  },
  "response": "{\n  \"success\": true,\n  \"enhancedFields\": [\n    {\n      \"field\": \"humanFriendlyName\",\n      \"oldValue\": null,\n      \"newValue\": \"Smoking Cessation Guidelines for a Healthy Pregnancy\",\n      \"action\": \"added\"\n    },\n    {\n      \"field\": \"organisation\",\n      \"oldValue\": null,\n      \"newValue\": \"RCOG\",\n      \"action\": \"added\"\n    },\n    {\n      \"field\": \"yearProduced\",\n      \"oldValue\": null,\n      \"newValue\": \"I cannot find a publication year in the provided text. The guideline does not explicitly state its publication date\",\n      \"action\": \"added\"\n    },\n    {\n      \"field\": \"summary\",\n      \"oldValue\": null,\n      \"newValue\": \"**Summary of Maternity Smoking & Smoke-Free Pregnancy Guideline:** Smoking in pregnancy increases risks like stillbirth, miscarriage, and sudden infant death. Quitting improves outcomes. Key recommendations: - **Treatment:** Combine behavioral support and nicotine replacement therapy (NRT). - **Messaging:** Advise complete cessation; cutting down still poses risks. - **Referrals:** Use an \\\"opt-out\\\" approach for current smokers, high CO levels, or recent quitters. - **CO Monitoring:** Offer at every antenatal visit; explain results and refer smokers to cessation services. - **Household Smoking:** Encourage partners/household members to quit. - **NRT & E-Cigarettes:** NRT is safe; e-cigarettes are a safer alternative (long-term effects unknown). - **Inpatient Care:** Provide NRT and cessation support during hospital stays. - **Staff Training:** Annual training on CO screening, smoking cessation, and local guidelines. **Key Actions:** Document smoking status, refer promptly, and ensure continuous monitoring for high-risk cases\",\n      \"action\": \"added\"\n    }\n  ]\n}",
  "endpoint": "enhanceGuidelineMetadata",
  "timestamp": "2025-06-18T23-11-25",
  "textContent": "AI: DeepSeek (deepseek-chat)\n\nQ: {\n  \"guidelineId\": \"uhsx-maternity-smoking-smoke-free-pregnancy-guideline-pdf\",\n  \"fieldsProcessed\": [\n    \"humanFriendlyName\",\n    \"organisation\",\n    \"yearProduced\",\n    \"summary\"\n  ],\n  \"enhancedFields\": 4,\n  \"contentLength\": 2819\n}\n\nA: {\n  \"success\": true,\n  \"enhancedFields\": [\n    {\n      \"field\": \"humanFriendlyName\",\n      \"oldValue\": null,\n      \"newValue\": \"Smoking Cessation Guidelines for a Healthy Pregnancy\",\n      \"action\": \"added\"\n    },\n    {\n      \"field\": \"organisation\",\n      \"oldValue\": null,\n      \"newValue\": \"RCOG\",\n      \"action\": \"added\"\n    },\n    {\n      \"field\": \"yearProduced\",\n      \"oldValue\": null,\n      \"newValue\": \"I cannot find a publication year in the provided text. The guideline does not explicitly state its publication date\",\n      \"action\": \"added\"\n    },\n    {\n      \"field\": \"summary\",\n      \"oldValue\": null,\n      \"newValue\": \"**Summary of Maternity Smoking & Smoke-Free Pregnancy Guideline:** Smoking in pregnancy increases risks like stillbirth, miscarriage, and sudden infant death. Quitting improves outcomes. Key recommendations: - **Treatment:** Combine behavioral support and nicotine replacement therapy (NRT). - **Messaging:** Advise complete cessation; cutting down still poses risks. - **Referrals:** Use an \\\"opt-out\\\" approach for current smokers, high CO levels, or recent quitters. - **CO Monitoring:** Offer at every antenatal visit; explain results and refer smokers to cessation services. - **Household Smoking:** Encourage partners/household members to quit. - **NRT & E-Cigarettes:** NRT is safe; e-cigarettes are a safer alternative (long-term effects unknown). - **Inpatient Care:** Provide NRT and cessation support during hospital stays. - **Staff Training:** Annual training on CO screening, smoking cessation, and local guidelines. **Key Actions:** Document smoking status, refer promptly, and ensure continuous monitoring for high-risk cases\",\n      \"action\": \"added\"\n    }\n  ]\n}",
  "ai_provider": "DeepSeek",
  "ai_model": "deepseek-chat",
  "token_usage": null
}