{
  "prompt": {
    "guidelineId": "cg1109-diabetes-in-pregnancy-guideline-pdf",
    "fieldsProcessed": [
      "humanFriendlyName",
      "organisation",
      "yearProduced",
      "summary"
    ],
    "enhancedFields": 4,
    "contentLength": 3289
  },
  "response": "{\n  \"success\": true,\n  \"enhancedFields\": [\n    {\n      \"field\": \"humanFriendlyName\",\n      \"oldValue\": null,\n      \"newValue\": \"Diabetes in Pregnancy Care Guidelines\",\n      \"action\": \"added\"\n    },\n    {\n      \"field\": \"organisation\",\n      \"oldValue\": null,\n      \"newValue\": \"RCOG\",\n      \"action\": \"added\"\n    },\n    {\n      \"field\": \"yearProduced\",\n      \"oldValue\": null,\n      \"newValue\": \"The text provided does not contain a publication year. If you have another guideline text that includes the year, please share it, and I can extract the 4-digit year for you\",\n      \"action\": \"added\"\n    },\n    {\n      \"field\": \"summary\",\n      \"oldValue\": null,\n      \"newValue\": \"**Summary of Diabetes in Pregnancy Guideline:** - **Pre-pregnancy counseling**: Discuss risks, optimize glucose monitoring, review medications, and screen for complications in women with pre-existing diabetes. - **Screening for GDM**: Follow diagnostic criteria; refer to the Diabetes Pregnancy Team if diagnosed. After 34 weeks, GTT is rarely useful unless new concerns arise (random glucose ≥7mmol/L requires discussion). - **Diagnosis without GTT**: Urgent referral if glucose >11.0mmol/L or fasting ≥5.6mmol/L. For fasting <7mmol/L, trial diet/exercise changes first. - **Corticosteroid use**: Monitor glucose closely; may require hospitalization for insulin adjustment and IV fluids. - **Labor/delivery**: Continue insulin; consider VRIII. Postpartum, adjust insulin doses and monitor glucose. - **Breastfeeding**: Frequent glucose monitoring advised. - **Diabetic emergencies**: Require immediate intervention. - **Monitoring**: 20-week ultrasound/fetal heart exam; self-monitor glucose. - **Vaccination**: Offer COVID-19 vaccination per JCVI guidance, prioritizing GDM patients. - **Audit**: Regular audits to ensure adherence to care standards\",\n      \"action\": \"added\"\n    }\n  ]\n}",
  "endpoint": "enhanceGuidelineMetadata",
  "timestamp": "2025-06-18T18-41-40",
  "textContent": "AI: DeepSeek (deepseek-chat)\n\nQ: {\n  \"guidelineId\": \"cg1109-diabetes-in-pregnancy-guideline-pdf\",\n  \"fieldsProcessed\": [\n    \"humanFriendlyName\",\n    \"organisation\",\n    \"yearProduced\",\n    \"summary\"\n  ],\n  \"enhancedFields\": 4,\n  \"contentLength\": 3289\n}\n\nA: {\n  \"success\": true,\n  \"enhancedFields\": [\n    {\n      \"field\": \"humanFriendlyName\",\n      \"oldValue\": null,\n      \"newValue\": \"Diabetes in Pregnancy Care Guidelines\",\n      \"action\": \"added\"\n    },\n    {\n      \"field\": \"organisation\",\n      \"oldValue\": null,\n      \"newValue\": \"RCOG\",\n      \"action\": \"added\"\n    },\n    {\n      \"field\": \"yearProduced\",\n      \"oldValue\": null,\n      \"newValue\": \"The text provided does not contain a publication year. If you have another guideline text that includes the year, please share it, and I can extract the 4-digit year for you\",\n      \"action\": \"added\"\n    },\n    {\n      \"field\": \"summary\",\n      \"oldValue\": null,\n      \"newValue\": \"**Summary of Diabetes in Pregnancy Guideline:** - **Pre-pregnancy counseling**: Discuss risks, optimize glucose monitoring, review medications, and screen for complications in women with pre-existing diabetes. - **Screening for GDM**: Follow diagnostic criteria; refer to the Diabetes Pregnancy Team if diagnosed. After 34 weeks, GTT is rarely useful unless new concerns arise (random glucose ≥7mmol/L requires discussion). - **Diagnosis without GTT**: Urgent referral if glucose >11.0mmol/L or fasting ≥5.6mmol/L. For fasting <7mmol/L, trial diet/exercise changes first. - **Corticosteroid use**: Monitor glucose closely; may require hospitalization for insulin adjustment and IV fluids. - **Labor/delivery**: Continue insulin; consider VRIII. Postpartum, adjust insulin doses and monitor glucose. - **Breastfeeding**: Frequent glucose monitoring advised. - **Diabetic emergencies**: Require immediate intervention. - **Monitoring**: 20-week ultrasound/fetal heart exam; self-monitor glucose. - **Vaccination**: Offer COVID-19 vaccination per JCVI guidance, prioritizing GDM patients. - **Audit**: Regular audits to ensure adherence to care standards\",\n      \"action\": \"added\"\n    }\n  ]\n}",
  "ai_provider": "DeepSeek",
  "ai_model": "deepseek-chat",
  "token_usage": null
}