{
  "prompt": {
    "guidelineId": "cg21009-maternity-fluid-management-as-an-in-patient-or-in-labour-pdf",
    "fieldsProcessed": [
      "humanFriendlyName",
      "organisation",
      "yearProduced",
      "summary"
    ],
    "enhancedFields": 4,
    "contentLength": 3972
  },
  "response": "{\n  \"success\": true,\n  \"enhancedFields\": [\n    {\n      \"field\": \"humanFriendlyName\",\n      \"oldValue\": null,\n      \"newValue\": \"Guideline for Preventing Hyponatraemia During Labour\",\n      \"action\": \"added\"\n    },\n    {\n      \"field\": \"organisation\",\n      \"oldValue\": null,\n      \"newValue\": \"RCOG\",\n      \"action\": \"added\"\n    },\n    {\n      \"field\": \"yearProduced\",\n      \"oldValue\": null,\n      \"newValue\": \"There is no publication year mentioned in the provided text. If you have the full guideline document, please check the title page, footer, or references section for the publication year\",\n      \"action\": \"added\"\n    },\n    {\n      \"field\": \"summary\",\n      \"oldValue\": null,\n      \"newValue\": \"**Summary:** This guideline focuses on preventing and managing hyponatraemia during labour by monitoring fluid balance and sodium levels. Key recommendations include: - **Fluid Balance:** Limit IV fluids to 1L in 12 hours (max 2.5L/24h). Monitor intake/output hourly if IV fluids are given. - **Sodium Monitoring:** Check sodium levels if fluid balance exceeds 1500ml positive, or if IV insulin/dextrose is used (6-8 hourly). Avoid sampling from limbs with IV infusions. - **Oxytocin:** Stop if sodium <125mmol/L and consult senior obstetrician. - **Postpartum:** Notify paediatric team if maternal hyponatraemia; discharge if sodium ≥130mmol/L. - **Symptomatic Hyponatraemia:** Emergency management includes fluid restriction, 2.7% saline (if severe), and ICU transfer if needed. - **Ketonuria:** Encourage oral intake (carbohydrates) for mild/moderate cases; IV fluids not routinely needed. - **Audit:** Document fluid balance (oral/IV intake, urine output) and adhere to sodium monitoring pathways for high-risk cases. Severe hyponatraemia (<125mmol/L with symptoms) requires urgent intervention with senior team involvement\",\n      \"action\": \"added\"\n    }\n  ]\n}",
  "endpoint": "enhanceGuidelineMetadata",
  "timestamp": "2025-06-18T22-16-00",
  "textContent": "AI: DeepSeek (deepseek-chat)\n\nQ: {\n  \"guidelineId\": \"cg21009-maternity-fluid-management-as-an-in-patient-or-in-labour-pdf\",\n  \"fieldsProcessed\": [\n    \"humanFriendlyName\",\n    \"organisation\",\n    \"yearProduced\",\n    \"summary\"\n  ],\n  \"enhancedFields\": 4,\n  \"contentLength\": 3972\n}\n\nA: {\n  \"success\": true,\n  \"enhancedFields\": [\n    {\n      \"field\": \"humanFriendlyName\",\n      \"oldValue\": null,\n      \"newValue\": \"Guideline for Preventing Hyponatraemia During Labour\",\n      \"action\": \"added\"\n    },\n    {\n      \"field\": \"organisation\",\n      \"oldValue\": null,\n      \"newValue\": \"RCOG\",\n      \"action\": \"added\"\n    },\n    {\n      \"field\": \"yearProduced\",\n      \"oldValue\": null,\n      \"newValue\": \"There is no publication year mentioned in the provided text. If you have the full guideline document, please check the title page, footer, or references section for the publication year\",\n      \"action\": \"added\"\n    },\n    {\n      \"field\": \"summary\",\n      \"oldValue\": null,\n      \"newValue\": \"**Summary:** This guideline focuses on preventing and managing hyponatraemia during labour by monitoring fluid balance and sodium levels. Key recommendations include: - **Fluid Balance:** Limit IV fluids to 1L in 12 hours (max 2.5L/24h). Monitor intake/output hourly if IV fluids are given. - **Sodium Monitoring:** Check sodium levels if fluid balance exceeds 1500ml positive, or if IV insulin/dextrose is used (6-8 hourly). Avoid sampling from limbs with IV infusions. - **Oxytocin:** Stop if sodium <125mmol/L and consult senior obstetrician. - **Postpartum:** Notify paediatric team if maternal hyponatraemia; discharge if sodium ≥130mmol/L. - **Symptomatic Hyponatraemia:** Emergency management includes fluid restriction, 2.7% saline (if severe), and ICU transfer if needed. - **Ketonuria:** Encourage oral intake (carbohydrates) for mild/moderate cases; IV fluids not routinely needed. - **Audit:** Document fluid balance (oral/IV intake, urine output) and adhere to sodium monitoring pathways for high-risk cases. Severe hyponatraemia (<125mmol/L with symptoms) requires urgent intervention with senior team involvement\",\n      \"action\": \"added\"\n    }\n  ]\n}",
  "ai_provider": "DeepSeek",
  "ai_model": "deepseek-chat",
  "token_usage": null
}