{
  "prompt": {
    "guidelineId": "gp006-management-of-bartholins-cyst-abscess-n-pdf",
    "fieldsProcessed": [
      "humanFriendlyName",
      "organisation",
      "yearProduced",
      "summary"
    ],
    "enhancedFields": 4,
    "contentLength": 2398
  },
  "response": "{\n  \"success\": true,\n  \"enhancedFields\": [\n    {\n      \"field\": \"humanFriendlyName\",\n      \"oldValue\": null,\n      \"newValue\": \"Bartholin’s Cyst and Abscess Management\",\n      \"action\": \"added\"\n    },\n    {\n      \"field\": \"organisation\",\n      \"oldValue\": null,\n      \"newValue\": \"RCOG\",\n      \"action\": \"added\"\n    },\n    {\n      \"field\": \"yearProduced\",\n      \"oldValue\": null,\n      \"newValue\": \"The text provided does not contain a publication year. If you have another guideline text that includes a publication date, please share it, and I can extract the year for you\",\n      \"action\": \"added\"\n    },\n    {\n      \"field\": \"summary\",\n      \"oldValue\": null,\n      \"newValue\": \"**Summary of Management of Bartholin’s Cyst/Abscess:** - **Bartholin’s cyst** (painless, fluctuant mass) may not require treatment unless at risk of abscess. - **Bartholin’s abscess** (painful, inflamed) requires surgical intervention: - **Under 40**: Outpatient Word catheter (97% success at 6 months). - **Over 40**: Marsupialisation with biopsy under GA (5–15% recurrence). - **Cellulitis**: Admit for IV antibiotics. - **Conservative management** (analgesia, warm compress) for small vulval abscesses; **incision and drainage** for larger abscesses. - **Antibiotics** only if cellulitis, PID, or STI suspected. - **Recurrent abscesses**: Screen for diabetes, consult senior clinician. - **Gland excision** should be performed only by a consultant. **Word Catheter vs. Marsupialisation:** - **Word Catheter**: Outpatient, no fasting, less post-procedure pain, but may dislodge. - **Marsupialisation**: GA required, longer recovery, higher post-op pain, but long-term data available\",\n      \"action\": \"added\"\n    }\n  ]\n}",
  "endpoint": "enhanceGuidelineMetadata",
  "timestamp": "2025-06-18T22-21-44",
  "textContent": "AI: DeepSeek (deepseek-chat)\n\nQ: {\n  \"guidelineId\": \"gp006-management-of-bartholins-cyst-abscess-n-pdf\",\n  \"fieldsProcessed\": [\n    \"humanFriendlyName\",\n    \"organisation\",\n    \"yearProduced\",\n    \"summary\"\n  ],\n  \"enhancedFields\": 4,\n  \"contentLength\": 2398\n}\n\nA: {\n  \"success\": true,\n  \"enhancedFields\": [\n    {\n      \"field\": \"humanFriendlyName\",\n      \"oldValue\": null,\n      \"newValue\": \"Bartholin’s Cyst and Abscess Management\",\n      \"action\": \"added\"\n    },\n    {\n      \"field\": \"organisation\",\n      \"oldValue\": null,\n      \"newValue\": \"RCOG\",\n      \"action\": \"added\"\n    },\n    {\n      \"field\": \"yearProduced\",\n      \"oldValue\": null,\n      \"newValue\": \"The text provided does not contain a publication year. If you have another guideline text that includes a publication date, please share it, and I can extract the year for you\",\n      \"action\": \"added\"\n    },\n    {\n      \"field\": \"summary\",\n      \"oldValue\": null,\n      \"newValue\": \"**Summary of Management of Bartholin’s Cyst/Abscess:** - **Bartholin’s cyst** (painless, fluctuant mass) may not require treatment unless at risk of abscess. - **Bartholin’s abscess** (painful, inflamed) requires surgical intervention: - **Under 40**: Outpatient Word catheter (97% success at 6 months). - **Over 40**: Marsupialisation with biopsy under GA (5–15% recurrence). - **Cellulitis**: Admit for IV antibiotics. - **Conservative management** (analgesia, warm compress) for small vulval abscesses; **incision and drainage** for larger abscesses. - **Antibiotics** only if cellulitis, PID, or STI suspected. - **Recurrent abscesses**: Screen for diabetes, consult senior clinician. - **Gland excision** should be performed only by a consultant. **Word Catheter vs. Marsupialisation:** - **Word Catheter**: Outpatient, no fasting, less post-procedure pain, but may dislodge. - **Marsupialisation**: GA required, longer recovery, higher post-op pain, but long-term data available\",\n      \"action\": \"added\"\n    }\n  ]\n}",
  "ai_provider": "DeepSeek",
  "ai_model": "deepseek-chat",
  "token_usage": null
}