{
  "prompt": {
    "guidelineId": "cg1134-postnatal-care-pdf",
    "fieldsProcessed": [
      "humanFriendlyName",
      "organisation",
      "yearProduced",
      "summary"
    ],
    "enhancedFields": 4,
    "contentLength": 2306
  },
  "response": "{\n  \"success\": true,\n  \"enhancedFields\": [\n    {\n      \"field\": \"humanFriendlyName\",\n      \"oldValue\": null,\n      \"newValue\": \"Postnatal Care Guidelines for Mothers and Newborns\",\n      \"action\": \"added\"\n    },\n    {\n      \"field\": \"organisation\",\n      \"oldValue\": null,\n      \"newValue\": \"NICE\",\n      \"action\": \"added\"\n    },\n    {\n      \"field\": \"yearProduced\",\n      \"oldValue\": null,\n      \"newValue\": \"The provided text does not contain a publication year. If you have another guideline text that includes the year, please share it, and I'll extract the 4-digit year for you\",\n      \"action\": \"added\"\n    },\n    {\n      \"field\": \"summary\",\n      \"oldValue\": null,\n      \"newValue\": \"**Summary of Postnatal Care Guideline:** - **Community Visiting Pattern:** Minimum visits include a midwife visit the day after discharge, screenings by day 5, and a final discharge review with baby weight check. - **Baby Care:** Parents should be directed to Lullaby Trust for guidance. Recognize 'red flags' for serious illness. Refer to jaundice guidelines if concerns arise. - **Inpatient Care:** Complete assessments and Transfer of Care form. - **Community Care:** Reinforce signs of serious illness, discuss Baby Check tool, and assess/document newborn feeding. - **Discharge to Health Visitor:** Conduct observations and ensure handover documentation. - **Continued Visits:** Extend visits if clinically indicated. - **Complex Needs:** Assign a named coordinating health professional. - **Language Support:** Provide interpreting services. - **Follow-Up & Readmissions:** Schedule follow-ups and review readmitted patients with necessary assessments. - **Audit & Documentation:** Ensure patient information and professional discussions are recorded. - **Appendices:** Include checklists and out-of-area discharge information\",\n      \"action\": \"added\"\n    }\n  ]\n}",
  "endpoint": "enhanceGuidelineMetadata",
  "timestamp": "2025-06-18T21-53-54",
  "textContent": "AI: DeepSeek (deepseek-chat)\n\nQ: {\n  \"guidelineId\": \"cg1134-postnatal-care-pdf\",\n  \"fieldsProcessed\": [\n    \"humanFriendlyName\",\n    \"organisation\",\n    \"yearProduced\",\n    \"summary\"\n  ],\n  \"enhancedFields\": 4,\n  \"contentLength\": 2306\n}\n\nA: {\n  \"success\": true,\n  \"enhancedFields\": [\n    {\n      \"field\": \"humanFriendlyName\",\n      \"oldValue\": null,\n      \"newValue\": \"Postnatal Care Guidelines for Mothers and Newborns\",\n      \"action\": \"added\"\n    },\n    {\n      \"field\": \"organisation\",\n      \"oldValue\": null,\n      \"newValue\": \"NICE\",\n      \"action\": \"added\"\n    },\n    {\n      \"field\": \"yearProduced\",\n      \"oldValue\": null,\n      \"newValue\": \"The provided text does not contain a publication year. If you have another guideline text that includes the year, please share it, and I'll extract the 4-digit year for you\",\n      \"action\": \"added\"\n    },\n    {\n      \"field\": \"summary\",\n      \"oldValue\": null,\n      \"newValue\": \"**Summary of Postnatal Care Guideline:** - **Community Visiting Pattern:** Minimum visits include a midwife visit the day after discharge, screenings by day 5, and a final discharge review with baby weight check. - **Baby Care:** Parents should be directed to Lullaby Trust for guidance. Recognize 'red flags' for serious illness. Refer to jaundice guidelines if concerns arise. - **Inpatient Care:** Complete assessments and Transfer of Care form. - **Community Care:** Reinforce signs of serious illness, discuss Baby Check tool, and assess/document newborn feeding. - **Discharge to Health Visitor:** Conduct observations and ensure handover documentation. - **Continued Visits:** Extend visits if clinically indicated. - **Complex Needs:** Assign a named coordinating health professional. - **Language Support:** Provide interpreting services. - **Follow-Up & Readmissions:** Schedule follow-ups and review readmitted patients with necessary assessments. - **Audit & Documentation:** Ensure patient information and professional discussions are recorded. - **Appendices:** Include checklists and out-of-area discharge information\",\n      \"action\": \"added\"\n    }\n  ]\n}",
  "ai_provider": "DeepSeek",
  "ai_model": "deepseek-chat",
  "token_usage": null
}