{
  "prompt": {
    "guidelineId": "cg20005-second-trimester-anomaly-screening-180-206-weeks-pdf",
    "fieldsProcessed": [
      "humanFriendlyName",
      "organisation",
      "yearProduced",
      "summary"
    ],
    "enhancedFields": 4,
    "contentLength": 4102
  },
  "response": "{\n  \"success\": true,\n  \"enhancedFields\": [\n    {\n      \"field\": \"humanFriendlyName\",\n      \"oldValue\": null,\n      \"newValue\": \"20-Week Anomaly Scan Protocol for Sonographers\",\n      \"action\": \"added\"\n    },\n    {\n      \"field\": \"organisation\",\n      \"oldValue\": null,\n      \"newValue\": \"NHS\",\n      \"action\": \"added\"\n    },\n    {\n      \"field\": \"yearProduced\",\n      \"oldValue\": null,\n      \"newValue\": \"2027\",\n      \"action\": \"added\"\n    },\n    {\n      \"field\": \"summary\",\n      \"oldValue\": null,\n      \"newValue\": \"**Summary of 20-Week Anomaly Scan Protocol** The 20-week anomaly scan screens for major fetal anomalies, including anencephaly, spina bifida, cardiac defects, and trisomies 18/13. Key anatomical structures (head, spine, heart, abdomen, limbs) must be examined and documented. **Key Recommendations:** - **Fibroids:** Seek second opinion if concerning; no routine rescans or growth scans unless clinically indicated. - **Placenta:** Assess location; follow up for low-lying placenta/praevia. Suspect placenta accreta if placental lakes >50%, bridging vessels, or abnormal Doppler signals. - **Vasa Praevia:** Use Doppler to identify fetal vessels near cervix; refer to ANST if suspected. - **Referrals:** Promptly communicate suspected abnormalities. Normal variants need no referral. Refer placental masses, large lakes, or succenturiate lobes to fetal medicine. - **Pathways:** Follow specific protocols for echogenic bowel, renal pylectasia, ventriculomegaly, talipes, adnexal masses, and amniotic bands. - **Documentation:** Archive required images; update maternity records and notify relevant teams (midwife, consultant, pediatrician). **High-Risk Pregnancies:** Include uterine artery Dopplers. Postnatal counseling and neonatal monitoring may be needed for certain findings. *Review Date: February 2027*\",\n      \"action\": \"added\"\n    }\n  ]\n}",
  "endpoint": "enhanceGuidelineMetadata",
  "timestamp": "2025-06-18T22-14-12",
  "textContent": "AI: DeepSeek (deepseek-chat)\n\nQ: {\n  \"guidelineId\": \"cg20005-second-trimester-anomaly-screening-180-206-weeks-pdf\",\n  \"fieldsProcessed\": [\n    \"humanFriendlyName\",\n    \"organisation\",\n    \"yearProduced\",\n    \"summary\"\n  ],\n  \"enhancedFields\": 4,\n  \"contentLength\": 4102\n}\n\nA: {\n  \"success\": true,\n  \"enhancedFields\": [\n    {\n      \"field\": \"humanFriendlyName\",\n      \"oldValue\": null,\n      \"newValue\": \"20-Week Anomaly Scan Protocol for Sonographers\",\n      \"action\": \"added\"\n    },\n    {\n      \"field\": \"organisation\",\n      \"oldValue\": null,\n      \"newValue\": \"NHS\",\n      \"action\": \"added\"\n    },\n    {\n      \"field\": \"yearProduced\",\n      \"oldValue\": null,\n      \"newValue\": \"2027\",\n      \"action\": \"added\"\n    },\n    {\n      \"field\": \"summary\",\n      \"oldValue\": null,\n      \"newValue\": \"**Summary of 20-Week Anomaly Scan Protocol** The 20-week anomaly scan screens for major fetal anomalies, including anencephaly, spina bifida, cardiac defects, and trisomies 18/13. Key anatomical structures (head, spine, heart, abdomen, limbs) must be examined and documented. **Key Recommendations:** - **Fibroids:** Seek second opinion if concerning; no routine rescans or growth scans unless clinically indicated. - **Placenta:** Assess location; follow up for low-lying placenta/praevia. Suspect placenta accreta if placental lakes >50%, bridging vessels, or abnormal Doppler signals. - **Vasa Praevia:** Use Doppler to identify fetal vessels near cervix; refer to ANST if suspected. - **Referrals:** Promptly communicate suspected abnormalities. Normal variants need no referral. Refer placental masses, large lakes, or succenturiate lobes to fetal medicine. - **Pathways:** Follow specific protocols for echogenic bowel, renal pylectasia, ventriculomegaly, talipes, adnexal masses, and amniotic bands. - **Documentation:** Archive required images; update maternity records and notify relevant teams (midwife, consultant, pediatrician). **High-Risk Pregnancies:** Include uterine artery Dopplers. Postnatal counseling and neonatal monitoring may be needed for certain findings. *Review Date: February 2027*\",\n      \"action\": \"added\"\n    }\n  ]\n}",
  "ai_provider": "DeepSeek",
  "ai_model": "deepseek-chat",
  "token_usage": null
}