{
  "prompt": {
    "guidelineId": "cg1139-obesity-in-pregnancy-pdf",
    "fieldsProcessed": [
      "humanFriendlyName",
      "organisation",
      "yearProduced",
      "summary"
    ],
    "enhancedFields": 4,
    "contentLength": 1993
  },
  "response": "{\n  \"success\": true,\n  \"enhancedFields\": [\n    {\n      \"field\": \"humanFriendlyName\",\n      \"oldValue\": null,\n      \"newValue\": \"Obesity Management in Pregnancy: Guidelines for Care\",\n      \"action\": \"added\"\n    },\n    {\n      \"field\": \"organisation\",\n      \"oldValue\": null,\n      \"newValue\": \"RCOG\",\n      \"action\": \"added\"\n    },\n    {\n      \"field\": \"yearProduced\",\n      \"oldValue\": null,\n      \"newValue\": \"The text provided does not contain a publication year. If you have another section or part of the guideline that includes the year, please share it, and I can extract it for you\",\n      \"action\": \"added\"\n    },\n    {\n      \"field\": \"summary\",\n      \"oldValue\": null,\n      \"newValue\": \"**Summary of Obesity in Pregnancy Management Guidelines** This guideline outlines care for pregnant individuals with obesity to reduce complications like gestational diabetes, pre-eclampsia, and thromboembolism. Key recommendations: - **Monitoring & Risk Assessment**: Close monitoring for BMI ≥30, thromboembolism risk assessment, and thromboprophylaxis. - **Labor & Delivery**: - Induction for BMI ≥30; ultrasound recommended for BMI >30. - Active third-stage management; avoid birthing pools for BMI ≥35. - Alert theatre staff if weight >120 kg; use Pat Slide™ for transfers. - Fetal scalp monitoring for accurate assessment. - **Cesarean Section (CS)**: Suturing subcutaneous tissue; PICO dressings for BMI ≥35. - **High-Risk BMI (≥40)**: Inform senior obstetrician and anesthetist; establish venous access, restrict oral intake. - **Postnatal Care**: Provide necessary equipment, encourage weight management programs (WBIP), and refer to Healthy Eating Services. - **Staff Training**: Ensure proper training and manual handling equipment (e.g., for patients up to 50 stone). Complications should be managed proactively with multidisciplinary involvement\",\n      \"action\": \"added\"\n    }\n  ]\n}",
  "endpoint": "enhanceGuidelineMetadata",
  "timestamp": "2025-06-18T21-59-32",
  "textContent": "AI: DeepSeek (deepseek-chat)\n\nQ: {\n  \"guidelineId\": \"cg1139-obesity-in-pregnancy-pdf\",\n  \"fieldsProcessed\": [\n    \"humanFriendlyName\",\n    \"organisation\",\n    \"yearProduced\",\n    \"summary\"\n  ],\n  \"enhancedFields\": 4,\n  \"contentLength\": 1993\n}\n\nA: {\n  \"success\": true,\n  \"enhancedFields\": [\n    {\n      \"field\": \"humanFriendlyName\",\n      \"oldValue\": null,\n      \"newValue\": \"Obesity Management in Pregnancy: Guidelines for Care\",\n      \"action\": \"added\"\n    },\n    {\n      \"field\": \"organisation\",\n      \"oldValue\": null,\n      \"newValue\": \"RCOG\",\n      \"action\": \"added\"\n    },\n    {\n      \"field\": \"yearProduced\",\n      \"oldValue\": null,\n      \"newValue\": \"The text provided does not contain a publication year. If you have another section or part of the guideline that includes the year, please share it, and I can extract it for you\",\n      \"action\": \"added\"\n    },\n    {\n      \"field\": \"summary\",\n      \"oldValue\": null,\n      \"newValue\": \"**Summary of Obesity in Pregnancy Management Guidelines** This guideline outlines care for pregnant individuals with obesity to reduce complications like gestational diabetes, pre-eclampsia, and thromboembolism. Key recommendations: - **Monitoring & Risk Assessment**: Close monitoring for BMI ≥30, thromboembolism risk assessment, and thromboprophylaxis. - **Labor & Delivery**: - Induction for BMI ≥30; ultrasound recommended for BMI >30. - Active third-stage management; avoid birthing pools for BMI ≥35. - Alert theatre staff if weight >120 kg; use Pat Slide™ for transfers. - Fetal scalp monitoring for accurate assessment. - **Cesarean Section (CS)**: Suturing subcutaneous tissue; PICO dressings for BMI ≥35. - **High-Risk BMI (≥40)**: Inform senior obstetrician and anesthetist; establish venous access, restrict oral intake. - **Postnatal Care**: Provide necessary equipment, encourage weight management programs (WBIP), and refer to Healthy Eating Services. - **Staff Training**: Ensure proper training and manual handling equipment (e.g., for patients up to 50 stone). Complications should be managed proactively with multidisciplinary involvement\",\n      \"action\": \"added\"\n    }\n  ]\n}",
  "ai_provider": "DeepSeek",
  "ai_model": "deepseek-chat",
  "token_usage": null
}