{
  "prompt": {
    "guidelineId": "shoulder-dystocia-guideline-uhsx-pdf",
    "fieldsProcessed": [
      "humanFriendlyName",
      "organisation",
      "yearProduced",
      "summary"
    ],
    "enhancedFields": 4,
    "contentLength": 1732
  },
  "response": "{\n  \"success\": true,\n  \"enhancedFields\": [\n    {\n      \"field\": \"humanFriendlyName\",\n      \"oldValue\": null,\n      \"newValue\": \"Shoulder Dystocia Management Guidelines\",\n      \"action\": \"added\"\n    },\n    {\n      \"field\": \"organisation\",\n      \"oldValue\": null,\n      \"newValue\": \"RCOG\",\n      \"action\": \"added\"\n    },\n    {\n      \"field\": \"yearProduced\",\n      \"oldValue\": null,\n      \"newValue\": \"I cannot find a publication year in the provided text. The guideline text does not contain a visible 4-digit year\",\n      \"action\": \"added\"\n    },\n    {\n      \"field\": \"summary\",\n      \"oldValue\": null,\n      \"newValue\": \"**Summary of Shoulder Dystocia Guidelines** Shoulder dystocia (SD) is a vaginal birth complication requiring additional maneuvers after failed gentle traction, occurring in ~0.6% of births. It carries high risks of perinatal mortality/morbidity (e.g., brachial plexus injury) and maternal complications (e.g., hemorrhage, trauma). Key risk factors include fetal macrosomia, maternal diabetes, and obesity. **Management:** - **Antenatal:** Assess recurrence risk in subsequent pregnancies after prior SD. - **Intrapartum:** Prompt recognition and systematic maneuvers (e.g., McRoberts, suprapubic pressure) to reduce hypoxia and trauma. Involve experienced obstetricians. - **Post-birth:** Monitor for maternal hemorrhage/perineal tears and neonatal injuries. Pediatric review if brachial plexus injury suspected. **Follow-up:** Offer counseling and document incidents for audit. Training in SD management is recommended for all birth attendants. *(Appendices include PROMPT algorithm, proforma, and implementation tools.)*\",\n      \"action\": \"added\"\n    }\n  ]\n}",
  "endpoint": "enhanceGuidelineMetadata",
  "timestamp": "2025-06-18T23-02-05",
  "textContent": "AI: DeepSeek (deepseek-chat)\n\nQ: {\n  \"guidelineId\": \"shoulder-dystocia-guideline-uhsx-pdf\",\n  \"fieldsProcessed\": [\n    \"humanFriendlyName\",\n    \"organisation\",\n    \"yearProduced\",\n    \"summary\"\n  ],\n  \"enhancedFields\": 4,\n  \"contentLength\": 1732\n}\n\nA: {\n  \"success\": true,\n  \"enhancedFields\": [\n    {\n      \"field\": \"humanFriendlyName\",\n      \"oldValue\": null,\n      \"newValue\": \"Shoulder Dystocia Management Guidelines\",\n      \"action\": \"added\"\n    },\n    {\n      \"field\": \"organisation\",\n      \"oldValue\": null,\n      \"newValue\": \"RCOG\",\n      \"action\": \"added\"\n    },\n    {\n      \"field\": \"yearProduced\",\n      \"oldValue\": null,\n      \"newValue\": \"I cannot find a publication year in the provided text. The guideline text does not contain a visible 4-digit year\",\n      \"action\": \"added\"\n    },\n    {\n      \"field\": \"summary\",\n      \"oldValue\": null,\n      \"newValue\": \"**Summary of Shoulder Dystocia Guidelines** Shoulder dystocia (SD) is a vaginal birth complication requiring additional maneuvers after failed gentle traction, occurring in ~0.6% of births. It carries high risks of perinatal mortality/morbidity (e.g., brachial plexus injury) and maternal complications (e.g., hemorrhage, trauma). Key risk factors include fetal macrosomia, maternal diabetes, and obesity. **Management:** - **Antenatal:** Assess recurrence risk in subsequent pregnancies after prior SD. - **Intrapartum:** Prompt recognition and systematic maneuvers (e.g., McRoberts, suprapubic pressure) to reduce hypoxia and trauma. Involve experienced obstetricians. - **Post-birth:** Monitor for maternal hemorrhage/perineal tears and neonatal injuries. Pediatric review if brachial plexus injury suspected. **Follow-up:** Offer counseling and document incidents for audit. Training in SD management is recommended for all birth attendants. *(Appendices include PROMPT algorithm, proforma, and implementation tools.)*\",\n      \"action\": \"added\"\n    }\n  ]\n}",
  "ai_provider": "DeepSeek",
  "ai_model": "deepseek-chat",
  "token_usage": null
}