{
  "prompt": {
    "guidelineId": "cg1134-postnatal-care-pdf",
    "fieldsProcessed": [
      "humanFriendlyName",
      "organisation",
      "yearProduced",
      "summary"
    ],
    "enhancedFields": 4,
    "contentLength": 2306
  },
  "response": "{\n  \"success\": true,\n  \"enhancedFields\": [\n    {\n      \"field\": \"humanFriendlyName\",\n      \"oldValue\": null,\n      \"newValue\": \"Postnatal Care Guidelines for Mothers and Newborns\",\n      \"action\": \"added\"\n    },\n    {\n      \"field\": \"organisation\",\n      \"oldValue\": null,\n      \"newValue\": \"NICE\",\n      \"action\": \"added\"\n    },\n    {\n      \"field\": \"yearProduced\",\n      \"oldValue\": null,\n      \"newValue\": \"I cannot determine the publication year from the provided text, as it does not contain any explicit date or year information. The text describes the content and recommendations of a medical guideline but does not include its publication year. If you have access to the full document or its metadata, the year may be listed there\",\n      \"action\": \"added\"\n    },\n    {\n      \"field\": \"summary\",\n      \"oldValue\": null,\n      \"newValue\": \"**Summary:** The guideline outlines postnatal care for mothers/birthing parents and newborns, emphasizing assessments, monitoring, and education. Key recommendations include: - **Community Visits:** Minimum visits post-discharge: midwife visit the next day, screenings by day 5, and final discharge review. - **Baby Care:** Recognize 'red flags' for serious illness; refer to jaundice guidelines if needed. Ensure feeding assessments and educate parents on illness signs. - **Inpatient/Discharge:** Complete assessments, document care transfers, and provide handover to health visitors. - **Complex Needs:** Assign a named coordinator for women with complex needs. - **Language/Follow-up:** Use interpreter services; arrange follow-ups as needed. - **Readmissions:** Review and assess readmitted patients. - **Audit/Checklists:** Ensure proper documentation and patient information sharing. Appendices cover out-of-area transfers and discharge checklists\",\n      \"action\": \"added\"\n    }\n  ]\n}",
  "endpoint": "enhanceGuidelineMetadata",
  "timestamp": "2025-06-18T21-53-55",
  "textContent": "AI: DeepSeek (deepseek-chat)\n\nQ: {\n  \"guidelineId\": \"cg1134-postnatal-care-pdf\",\n  \"fieldsProcessed\": [\n    \"humanFriendlyName\",\n    \"organisation\",\n    \"yearProduced\",\n    \"summary\"\n  ],\n  \"enhancedFields\": 4,\n  \"contentLength\": 2306\n}\n\nA: {\n  \"success\": true,\n  \"enhancedFields\": [\n    {\n      \"field\": \"humanFriendlyName\",\n      \"oldValue\": null,\n      \"newValue\": \"Postnatal Care Guidelines for Mothers and Newborns\",\n      \"action\": \"added\"\n    },\n    {\n      \"field\": \"organisation\",\n      \"oldValue\": null,\n      \"newValue\": \"NICE\",\n      \"action\": \"added\"\n    },\n    {\n      \"field\": \"yearProduced\",\n      \"oldValue\": null,\n      \"newValue\": \"I cannot determine the publication year from the provided text, as it does not contain any explicit date or year information. The text describes the content and recommendations of a medical guideline but does not include its publication year. If you have access to the full document or its metadata, the year may be listed there\",\n      \"action\": \"added\"\n    },\n    {\n      \"field\": \"summary\",\n      \"oldValue\": null,\n      \"newValue\": \"**Summary:** The guideline outlines postnatal care for mothers/birthing parents and newborns, emphasizing assessments, monitoring, and education. Key recommendations include: - **Community Visits:** Minimum visits post-discharge: midwife visit the next day, screenings by day 5, and final discharge review. - **Baby Care:** Recognize 'red flags' for serious illness; refer to jaundice guidelines if needed. Ensure feeding assessments and educate parents on illness signs. - **Inpatient/Discharge:** Complete assessments, document care transfers, and provide handover to health visitors. - **Complex Needs:** Assign a named coordinator for women with complex needs. - **Language/Follow-up:** Use interpreter services; arrange follow-ups as needed. - **Readmissions:** Review and assess readmitted patients. - **Audit/Checklists:** Ensure proper documentation and patient information sharing. Appendices cover out-of-area transfers and discharge checklists\",\n      \"action\": \"added\"\n    }\n  ]\n}",
  "ai_provider": "DeepSeek",
  "ai_model": "deepseek-chat",
  "token_usage": null
}