{
  "prompt": {
    "guidelineId": "cg1109-diabetes-in-pregnancy-guideline-pdf",
    "fieldsProcessed": [
      "humanFriendlyName",
      "organisation",
      "yearProduced",
      "summary"
    ],
    "enhancedFields": 4,
    "contentLength": 3289
  },
  "response": "{\n  \"success\": true,\n  \"enhancedFields\": [\n    {\n      \"field\": \"humanFriendlyName\",\n      \"oldValue\": null,\n      \"newValue\": \"Diabetes in Pregnancy Care Guidelines\",\n      \"action\": \"added\"\n    },\n    {\n      \"field\": \"organisation\",\n      \"oldValue\": null,\n      \"newValue\": \"RCOG\",\n      \"action\": \"added\"\n    },\n    {\n      \"field\": \"yearProduced\",\n      \"oldValue\": null,\n      \"newValue\": \"The text provided does not contain a publication year. If you have another guideline text that includes the year, please share it, and I can extract the 4-digit year for you\",\n      \"action\": \"added\"\n    },\n    {\n      \"field\": \"summary\",\n      \"oldValue\": null,\n      \"newValue\": \"**Summary of Diabetes in Pregnancy Guideline:** - **Pre-pregnancy counseling** for those with pre-existing diabetes: discuss risks, optimize glucose monitoring, review medications, and screen for complications. - **Screening for GDM**: Follow diagnostic criteria; refer to Diabetes Pregnancy Team if diagnosed. - **After 34 weeks**, GTT or glucose monitoring is rarely useful unless new concerns arise. Random glucose ≥7mmol/L warrants discussion. - **Diagnosis without GTT**: Glucose >11.0mmol/L or fasting ≥5.6mmol/L requires urgent referral. - **Management**: For GDM with fasting glucose <7mmol/L, trial diet/exercise first. Insulin adjustments may be needed for those on corticosteroids or during labor. - **Monitoring**: Regular blood glucose checks, especially postpartum and while breastfeeding. Hospital admission may be needed for hyperemesis or unstable glucose. - **Fetal care**: Include 20-week ultrasound and fetal heart exam. - **Vaccination**: Offer COVID-19 vaccination per JCVI guidelines; prioritize those with GDM. - **Audit**: Regular audits to ensure guideline adherence and optimal care\",\n      \"action\": \"added\"\n    }\n  ]\n}",
  "endpoint": "enhanceGuidelineMetadata",
  "timestamp": "2025-06-18T18-41-33",
  "textContent": "AI: DeepSeek (deepseek-chat)\n\nQ: {\n  \"guidelineId\": \"cg1109-diabetes-in-pregnancy-guideline-pdf\",\n  \"fieldsProcessed\": [\n    \"humanFriendlyName\",\n    \"organisation\",\n    \"yearProduced\",\n    \"summary\"\n  ],\n  \"enhancedFields\": 4,\n  \"contentLength\": 3289\n}\n\nA: {\n  \"success\": true,\n  \"enhancedFields\": [\n    {\n      \"field\": \"humanFriendlyName\",\n      \"oldValue\": null,\n      \"newValue\": \"Diabetes in Pregnancy Care Guidelines\",\n      \"action\": \"added\"\n    },\n    {\n      \"field\": \"organisation\",\n      \"oldValue\": null,\n      \"newValue\": \"RCOG\",\n      \"action\": \"added\"\n    },\n    {\n      \"field\": \"yearProduced\",\n      \"oldValue\": null,\n      \"newValue\": \"The text provided does not contain a publication year. If you have another guideline text that includes the year, please share it, and I can extract the 4-digit year for you\",\n      \"action\": \"added\"\n    },\n    {\n      \"field\": \"summary\",\n      \"oldValue\": null,\n      \"newValue\": \"**Summary of Diabetes in Pregnancy Guideline:** - **Pre-pregnancy counseling** for those with pre-existing diabetes: discuss risks, optimize glucose monitoring, review medications, and screen for complications. - **Screening for GDM**: Follow diagnostic criteria; refer to Diabetes Pregnancy Team if diagnosed. - **After 34 weeks**, GTT or glucose monitoring is rarely useful unless new concerns arise. Random glucose ≥7mmol/L warrants discussion. - **Diagnosis without GTT**: Glucose >11.0mmol/L or fasting ≥5.6mmol/L requires urgent referral. - **Management**: For GDM with fasting glucose <7mmol/L, trial diet/exercise first. Insulin adjustments may be needed for those on corticosteroids or during labor. - **Monitoring**: Regular blood glucose checks, especially postpartum and while breastfeeding. Hospital admission may be needed for hyperemesis or unstable glucose. - **Fetal care**: Include 20-week ultrasound and fetal heart exam. - **Vaccination**: Offer COVID-19 vaccination per JCVI guidelines; prioritize those with GDM. - **Audit**: Regular audits to ensure guideline adherence and optimal care\",\n      \"action\": \"added\"\n    }\n  ]\n}",
  "ai_provider": "DeepSeek",
  "ai_model": "deepseek-chat",
  "token_usage": null
}