{
  "prompt": {
    "guidelineId": "mp008-infections-in-pregnancy-pdf",
    "fieldsProcessed": [
      "humanFriendlyName",
      "organisation",
      "yearProduced",
      "summary"
    ],
    "enhancedFields": 4,
    "contentLength": 2581
  },
  "response": "{\n  \"success\": true,\n  \"enhancedFields\": [\n    {\n      \"field\": \"humanFriendlyName\",\n      \"oldValue\": null,\n      \"newValue\": \"Managing Infections in Pregnancy: GBS and Herpes Guidelines\",\n      \"action\": \"added\"\n    },\n    {\n      \"field\": \"organisation\",\n      \"oldValue\": null,\n      \"newValue\": \"RCOG\",\n      \"action\": \"added\"\n    },\n    {\n      \"field\": \"yearProduced\",\n      \"oldValue\": null,\n      \"newValue\": \"The text provided does not contain a publication year. If you have another guideline text that includes the publication year, please share it, and I can extract the 4-digit year for you\",\n      \"action\": \"added\"\n    },\n    {\n      \"field\": \"summary\",\n      \"oldValue\": null,\n      \"newValue\": \"**Summary of MP008: Infections in Pregnancy** **Group B Streptococcus (GBS):** - Routine screening not recommended; provide information. - Offer IV antibiotic prophylaxis in labour for at-risk women (e.g., GBS in previous pregnancy, GBS bacteriuria). - Intrapartum antibiotics not indicated for planned cesarean without labour. - If antibiotics declined, monitor neonate for sepsis. **Herpes Simplex Virus (HSV):** - **Primary infection within 6 weeks of delivery:** Recommend cesarean; avoid invasive procedures. Give IV acyclovir in labour; inform neonatology. - **Recurrent herpes at delivery:** Vaginal delivery permitted if no lesions; avoid invasive procedures. - **PPROM with primary HSV:** Cesarean advised; IV acyclovir during conservative management. - **Postnatal care:** Hand hygiene critical; avoid kissing with cold sores. Breastfeeding safe unless nipple lesions present. - **Suppressive therapy:** Consider aciclovir from 36 weeks for recurrent HSV. **General:** Professional judgement applies; ensure protocol accessibility\",\n      \"action\": \"added\"\n    }\n  ]\n}",
  "endpoint": "enhanceGuidelineMetadata",
  "timestamp": "2025-06-18T22-34-00",
  "textContent": "AI: DeepSeek (deepseek-chat)\n\nQ: {\n  \"guidelineId\": \"mp008-infections-in-pregnancy-pdf\",\n  \"fieldsProcessed\": [\n    \"humanFriendlyName\",\n    \"organisation\",\n    \"yearProduced\",\n    \"summary\"\n  ],\n  \"enhancedFields\": 4,\n  \"contentLength\": 2581\n}\n\nA: {\n  \"success\": true,\n  \"enhancedFields\": [\n    {\n      \"field\": \"humanFriendlyName\",\n      \"oldValue\": null,\n      \"newValue\": \"Managing Infections in Pregnancy: GBS and Herpes Guidelines\",\n      \"action\": \"added\"\n    },\n    {\n      \"field\": \"organisation\",\n      \"oldValue\": null,\n      \"newValue\": \"RCOG\",\n      \"action\": \"added\"\n    },\n    {\n      \"field\": \"yearProduced\",\n      \"oldValue\": null,\n      \"newValue\": \"The text provided does not contain a publication year. If you have another guideline text that includes the publication year, please share it, and I can extract the 4-digit year for you\",\n      \"action\": \"added\"\n    },\n    {\n      \"field\": \"summary\",\n      \"oldValue\": null,\n      \"newValue\": \"**Summary of MP008: Infections in Pregnancy** **Group B Streptococcus (GBS):** - Routine screening not recommended; provide information. - Offer IV antibiotic prophylaxis in labour for at-risk women (e.g., GBS in previous pregnancy, GBS bacteriuria). - Intrapartum antibiotics not indicated for planned cesarean without labour. - If antibiotics declined, monitor neonate for sepsis. **Herpes Simplex Virus (HSV):** - **Primary infection within 6 weeks of delivery:** Recommend cesarean; avoid invasive procedures. Give IV acyclovir in labour; inform neonatology. - **Recurrent herpes at delivery:** Vaginal delivery permitted if no lesions; avoid invasive procedures. - **PPROM with primary HSV:** Cesarean advised; IV acyclovir during conservative management. - **Postnatal care:** Hand hygiene critical; avoid kissing with cold sores. Breastfeeding safe unless nipple lesions present. - **Suppressive therapy:** Consider aciclovir from 36 weeks for recurrent HSV. **General:** Professional judgement applies; ensure protocol accessibility\",\n      \"action\": \"added\"\n    }\n  ]\n}",
  "ai_provider": "DeepSeek",
  "ai_model": "deepseek-chat",
  "token_usage": null
}