{
  "prompt": {
    "guidelineId": "cg1128-neonatal-resuscitation-pdf",
    "fieldsProcessed": [
      "humanFriendlyName",
      "organisation",
      "yearProduced",
      "summary"
    ],
    "enhancedFields": 4,
    "contentLength": 3034
  },
  "response": "{\n  \"success\": true,\n  \"enhancedFields\": [\n    {\n      \"field\": \"humanFriendlyName\",\n      \"oldValue\": null,\n      \"newValue\": \"Neonatal Resuscitation Guidelines and Equipment Checklist\",\n      \"action\": \"added\"\n    },\n    {\n      \"field\": \"organisation\",\n      \"oldValue\": null,\n      \"newValue\": \"RCOG\",\n      \"action\": \"added\"\n    },\n    {\n      \"field\": \"yearProduced\",\n      \"oldValue\": null,\n      \"newValue\": \"2023\",\n      \"action\": \"added\"\n    },\n    {\n      \"field\": \"summary\",\n      \"oldValue\": null,\n      \"newValue\": \"**Summary of Neonatal Resuscitation Guideline (CG1128 V6, Jan 2023):** - **Preparation**: Ensure trained personnel, functional equipment, and emergency communication protocols are in place. - **Equipment**: Resuscitaire must include working heater, oxygen/air supply (≥4000 kPa), suction, masks (sizes 0-1), laryngoscopes (blades 0-1), ETTs (2.5–4.0), and drugs (adrenaline, bicarbonate, glucose, NaCl). - **Drug Dosing**: Weight-based guidelines for adrenaline (0.2 ml/kg IV/IO), bicarbonate (2–4 ml/kg of 4.2%), glucose 10% (2.5 ml/kg), and 0.9% NaCl (10 ml/kg). - **Preterm Infants (<26 weeks)**: Individualized decisions (resuscitation/comfort care) based on gestational age, survival likelihood, and parental discussion. - **ETT Sizes/Lengths**: Vary by weight (e.g., 2.5/5.5 cm for 0.5–0.75 kg; 3.5/9 cm for 3 kg). - **Flowchart**: Follow Resuscitation Council UK’s Newborn Life Support (NLS 2021) algorithm. - **Checks**: Verify oxygen supply, suction pressure (10 kPa), and equipment pre-delivery. *Appendixes detail outcomes for 22–26 weeks, resuscitation steps, and equipment lists.*\",\n      \"action\": \"added\"\n    }\n  ]\n}",
  "endpoint": "enhanceGuidelineMetadata",
  "timestamp": "2025-06-18T21-48-56",
  "textContent": "AI: DeepSeek (deepseek-chat)\n\nQ: {\n  \"guidelineId\": \"cg1128-neonatal-resuscitation-pdf\",\n  \"fieldsProcessed\": [\n    \"humanFriendlyName\",\n    \"organisation\",\n    \"yearProduced\",\n    \"summary\"\n  ],\n  \"enhancedFields\": 4,\n  \"contentLength\": 3034\n}\n\nA: {\n  \"success\": true,\n  \"enhancedFields\": [\n    {\n      \"field\": \"humanFriendlyName\",\n      \"oldValue\": null,\n      \"newValue\": \"Neonatal Resuscitation Guidelines and Equipment Checklist\",\n      \"action\": \"added\"\n    },\n    {\n      \"field\": \"organisation\",\n      \"oldValue\": null,\n      \"newValue\": \"RCOG\",\n      \"action\": \"added\"\n    },\n    {\n      \"field\": \"yearProduced\",\n      \"oldValue\": null,\n      \"newValue\": \"2023\",\n      \"action\": \"added\"\n    },\n    {\n      \"field\": \"summary\",\n      \"oldValue\": null,\n      \"newValue\": \"**Summary of Neonatal Resuscitation Guideline (CG1128 V6, Jan 2023):** - **Preparation**: Ensure trained personnel, functional equipment, and emergency communication protocols are in place. - **Equipment**: Resuscitaire must include working heater, oxygen/air supply (≥4000 kPa), suction, masks (sizes 0-1), laryngoscopes (blades 0-1), ETTs (2.5–4.0), and drugs (adrenaline, bicarbonate, glucose, NaCl). - **Drug Dosing**: Weight-based guidelines for adrenaline (0.2 ml/kg IV/IO), bicarbonate (2–4 ml/kg of 4.2%), glucose 10% (2.5 ml/kg), and 0.9% NaCl (10 ml/kg). - **Preterm Infants (<26 weeks)**: Individualized decisions (resuscitation/comfort care) based on gestational age, survival likelihood, and parental discussion. - **ETT Sizes/Lengths**: Vary by weight (e.g., 2.5/5.5 cm for 0.5–0.75 kg; 3.5/9 cm for 3 kg). - **Flowchart**: Follow Resuscitation Council UK’s Newborn Life Support (NLS 2021) algorithm. - **Checks**: Verify oxygen supply, suction pressure (10 kPa), and equipment pre-delivery. *Appendixes detail outcomes for 22–26 weeks, resuscitation steps, and equipment lists.*\",\n      \"action\": \"added\"\n    }\n  ]\n}",
  "ai_provider": "DeepSeek",
  "ai_model": "deepseek-chat",
  "token_usage": null
}