{
  "prompt": {
    "guidelineId": "cg1111-screening-for-downs-edwards-and-pataus-syndrome-pdf",
    "fieldsProcessed": [
      "humanFriendlyName",
      "organisation",
      "yearProduced",
      "summary"
    ],
    "enhancedFields": 4,
    "contentLength": 1330
  },
  "response": "{\n  \"success\": true,\n  \"enhancedFields\": [\n    {\n      \"field\": \"humanFriendlyName\",\n      \"oldValue\": null,\n      \"newValue\": \"Screening for Down’s, Edward’s, and Patau’s Syndromes\",\n      \"action\": \"added\"\n    },\n    {\n      \"field\": \"organisation\",\n      \"oldValue\": null,\n      \"newValue\": \"NICE\",\n      \"action\": \"added\"\n    },\n    {\n      \"field\": \"yearProduced\",\n      \"oldValue\": null,\n      \"newValue\": \"I cannot find a publication year in the provided text. The guideline text does not explicitly mention a 4-digit year\",\n      \"action\": \"added\"\n    },\n    {\n      \"field\": \"summary\",\n      \"oldValue\": null,\n      \"newValue\": \"**Summary:** This guideline outlines screening for Down’s (T21), Edward’s (T18), and Patau’s (T13) syndromes. Key recommendations: - **Screening Offer:** NIPT (non-invasive prenatal testing) is offered after a higher-chance result from combined/quadruple tests. Options include no further testing, NIPT, or prenatal diagnosis. - **Timing:** Testing available up to 21+6 weeks, with results expected within 2 weeks. - **Results:** Reported as lower or higher chance. Samples may be retained for quality assurance. - **Eligibility:** Includes IVF and donor egg pregnancies. - **Follow-Up:** Clear referral pathways for abnormal results. - **Staff Requirements:** Midwives must undergo specific education/training. - **Consent & Care:** Emphasizes informed decision-making, timely results, and optimal management for confirmed diagnoses. - **Audit:** Monitoring processes ensure guideline adherence. Targets all involved staff, ensuring standardized screening and care\",\n      \"action\": \"added\"\n    }\n  ]\n}",
  "endpoint": "enhanceGuidelineMetadata",
  "timestamp": "2025-06-18T21-39-42",
  "textContent": "AI: DeepSeek (deepseek-chat)\n\nQ: {\n  \"guidelineId\": \"cg1111-screening-for-downs-edwards-and-pataus-syndrome-pdf\",\n  \"fieldsProcessed\": [\n    \"humanFriendlyName\",\n    \"organisation\",\n    \"yearProduced\",\n    \"summary\"\n  ],\n  \"enhancedFields\": 4,\n  \"contentLength\": 1330\n}\n\nA: {\n  \"success\": true,\n  \"enhancedFields\": [\n    {\n      \"field\": \"humanFriendlyName\",\n      \"oldValue\": null,\n      \"newValue\": \"Screening for Down’s, Edward’s, and Patau’s Syndromes\",\n      \"action\": \"added\"\n    },\n    {\n      \"field\": \"organisation\",\n      \"oldValue\": null,\n      \"newValue\": \"NICE\",\n      \"action\": \"added\"\n    },\n    {\n      \"field\": \"yearProduced\",\n      \"oldValue\": null,\n      \"newValue\": \"I cannot find a publication year in the provided text. The guideline text does not explicitly mention a 4-digit year\",\n      \"action\": \"added\"\n    },\n    {\n      \"field\": \"summary\",\n      \"oldValue\": null,\n      \"newValue\": \"**Summary:** This guideline outlines screening for Down’s (T21), Edward’s (T18), and Patau’s (T13) syndromes. Key recommendations: - **Screening Offer:** NIPT (non-invasive prenatal testing) is offered after a higher-chance result from combined/quadruple tests. Options include no further testing, NIPT, or prenatal diagnosis. - **Timing:** Testing available up to 21+6 weeks, with results expected within 2 weeks. - **Results:** Reported as lower or higher chance. Samples may be retained for quality assurance. - **Eligibility:** Includes IVF and donor egg pregnancies. - **Follow-Up:** Clear referral pathways for abnormal results. - **Staff Requirements:** Midwives must undergo specific education/training. - **Consent & Care:** Emphasizes informed decision-making, timely results, and optimal management for confirmed diagnoses. - **Audit:** Monitoring processes ensure guideline adherence. Targets all involved staff, ensuring standardized screening and care\",\n      \"action\": \"added\"\n    }\n  ]\n}",
  "ai_provider": "DeepSeek",
  "ai_model": "deepseek-chat",
  "token_usage": null
}