{
  "prompt": {
    "guidelineId": "cg11103-recovery-post-regional-and-ga-anaesthesia-pdf",
    "fieldsProcessed": [
      "humanFriendlyName",
      "organisation",
      "yearProduced",
      "summary"
    ],
    "enhancedFields": 4,
    "contentLength": 2204
  },
  "response": "{\n  \"success\": true,\n  \"enhancedFields\": [\n    {\n      \"field\": \"humanFriendlyName\",\n      \"oldValue\": null,\n      \"newValue\": \"Post-Anaesthesia Recovery Guidelines for Maternity Care\",\n      \"action\": \"added\"\n    },\n    {\n      \"field\": \"organisation\",\n      \"oldValue\": null,\n      \"newValue\": \"The text does not explicitly mention a specific publishing organization or institution such as NHS, NICE, WHO, RCOG, etc. Therefore, I cannot identify the organization name from the provided guideline text\",\n      \"action\": \"added\"\n    },\n    {\n      \"field\": \"yearProduced\",\n      \"oldValue\": null,\n      \"newValue\": \"The text you provided does not contain a publication year. If you have another part of the guideline that includes the year, please share it, and I can extract it for you\",\n      \"action\": \"added\"\n    },\n    {\n      \"field\": \"summary\",\n      \"oldValue\": null,\n      \"newValue\": \"**Summary of Recovery Following Regional and General Anaesthesia Guideline (Maternity):** This guideline provides evidence-based recommendations for post-anaesthetic care after caesarean sections and obstetric procedures. It applies to midwives, obstetricians, anaesthetists, and recovery staff. **Key Recommendations:** - **Equipment:** Ensure availability of BP monitor, SpO₂ monitor, thermometer, oxygen, suction, and infusion devices. - **Monitoring:** Continuous vital sign monitoring until stable, with specific protocols for general/regional anaesthesia. - **Ongoing Care:** Maintain IV patency, administer prescribed medications, and avoid leaving women unattended. - **Discharge Criteria:** Consciousness, clear airway, stable cardiovascular status, adequate analgesia, and pressure dressing removal. - **Postnatal Care:** Monitor temperature, pulse, BP; support breastfeeding and baby care. Refer anaesthetic complications to an obstetric anaesthetist. - **Training/Audit:** Ensure staff training per Maternity Training Needs Analysis. Audit vital signs and MEOWS chart documentation. Care continues until handover to the midwife is complete\",\n      \"action\": \"added\"\n    }\n  ]\n}",
  "endpoint": "enhanceGuidelineMetadata",
  "timestamp": "2025-06-18T18-41-56",
  "textContent": "AI: DeepSeek (deepseek-chat)\n\nQ: {\n  \"guidelineId\": \"cg11103-recovery-post-regional-and-ga-anaesthesia-pdf\",\n  \"fieldsProcessed\": [\n    \"humanFriendlyName\",\n    \"organisation\",\n    \"yearProduced\",\n    \"summary\"\n  ],\n  \"enhancedFields\": 4,\n  \"contentLength\": 2204\n}\n\nA: {\n  \"success\": true,\n  \"enhancedFields\": [\n    {\n      \"field\": \"humanFriendlyName\",\n      \"oldValue\": null,\n      \"newValue\": \"Post-Anaesthesia Recovery Guidelines for Maternity Care\",\n      \"action\": \"added\"\n    },\n    {\n      \"field\": \"organisation\",\n      \"oldValue\": null,\n      \"newValue\": \"The text does not explicitly mention a specific publishing organization or institution such as NHS, NICE, WHO, RCOG, etc. Therefore, I cannot identify the organization name from the provided guideline text\",\n      \"action\": \"added\"\n    },\n    {\n      \"field\": \"yearProduced\",\n      \"oldValue\": null,\n      \"newValue\": \"The text you provided does not contain a publication year. If you have another part of the guideline that includes the year, please share it, and I can extract it for you\",\n      \"action\": \"added\"\n    },\n    {\n      \"field\": \"summary\",\n      \"oldValue\": null,\n      \"newValue\": \"**Summary of Recovery Following Regional and General Anaesthesia Guideline (Maternity):** This guideline provides evidence-based recommendations for post-anaesthetic care after caesarean sections and obstetric procedures. It applies to midwives, obstetricians, anaesthetists, and recovery staff. **Key Recommendations:** - **Equipment:** Ensure availability of BP monitor, SpO₂ monitor, thermometer, oxygen, suction, and infusion devices. - **Monitoring:** Continuous vital sign monitoring until stable, with specific protocols for general/regional anaesthesia. - **Ongoing Care:** Maintain IV patency, administer prescribed medications, and avoid leaving women unattended. - **Discharge Criteria:** Consciousness, clear airway, stable cardiovascular status, adequate analgesia, and pressure dressing removal. - **Postnatal Care:** Monitor temperature, pulse, BP; support breastfeeding and baby care. Refer anaesthetic complications to an obstetric anaesthetist. - **Training/Audit:** Ensure staff training per Maternity Training Needs Analysis. Audit vital signs and MEOWS chart documentation. Care continues until handover to the midwife is complete\",\n      \"action\": \"added\"\n    }\n  ]\n}",
  "ai_provider": "DeepSeek",
  "ai_model": "deepseek-chat",
  "token_usage": null
}