{
  "prompt": {
    "guidelineId": "mp018-diabetes-in-pregnancy-sr-pdf",
    "fieldsProcessed": [
      "humanFriendlyName",
      "organisation",
      "yearProduced",
      "summary"
    ],
    "enhancedFields": 4,
    "contentLength": 3087
  },
  "response": "{\n  \"success\": true,\n  \"enhancedFields\": [\n    {\n      \"field\": \"humanFriendlyName\",\n      \"oldValue\": null,\n      \"newValue\": \"Diabetes Care During Pregnancy: Guidelines and Management\",\n      \"action\": \"added\"\n    },\n    {\n      \"field\": \"organisation\",\n      \"oldValue\": null,\n      \"newValue\": \"RCOG\",\n      \"action\": \"added\"\n    },\n    {\n      \"field\": \"yearProduced\",\n      \"oldValue\": null,\n      \"newValue\": \"The text provided does not contain a publication year. If you have another guideline text that includes the publication year, please share it, and I can extract the 4-digit year for you\",\n      \"action\": \"added\"\n    },\n    {\n      \"field\": \"summary\",\n      \"oldValue\": null,\n      \"newValue\": \"**Summary of Diabetes in Pregnancy Maternity Protocol (MP018):** - Applies to pre-existing or gestational diabetes, requiring individualized, multidisciplinary care. - **Pre-pregnancy planning** and routine monitoring are vital for optimal outcomes. - **Glycaemic targets**: Aim for fasting glucose ≤6.0 mmol/L and post-meal ≤7.8 mmol/L. - **Insulin users**: Offer glucagon, pump therapy, and hypoglycemia education. - **Diabetic ketoacidosis (DKA)**: Treat as an emergency with senior input. - **MODY**: Genetic testing required; manage similarly to pre-existing diabetes. - **Delivery**: Continuous glucose monitoring; neonatal hypoglycemia screening post-birth. - **Postpartum**: Insulin reverts to pre-pregnancy levels; monitor glucose and adjust doses. - **Gestational diabetes**: Offer metformin/insulin if diet/exercise fail; monitor during labor. - **Postnatal care**: HbA1c at 6–13 weeks; advise on future diabetes risks and lifestyle. - **Documentation**: Include multidisciplinary plans, antenatal ultrasounds, and management timelines. - **Lifestyle**: Encourage healthy diet, weight management, and annual HbA1c for gestational diabetes\",\n      \"action\": \"added\"\n    }\n  ]\n}",
  "endpoint": "enhanceGuidelineMetadata",
  "timestamp": "2025-06-18T22-36-42",
  "textContent": "AI: DeepSeek (deepseek-chat)\n\nQ: {\n  \"guidelineId\": \"mp018-diabetes-in-pregnancy-sr-pdf\",\n  \"fieldsProcessed\": [\n    \"humanFriendlyName\",\n    \"organisation\",\n    \"yearProduced\",\n    \"summary\"\n  ],\n  \"enhancedFields\": 4,\n  \"contentLength\": 3087\n}\n\nA: {\n  \"success\": true,\n  \"enhancedFields\": [\n    {\n      \"field\": \"humanFriendlyName\",\n      \"oldValue\": null,\n      \"newValue\": \"Diabetes Care During Pregnancy: Guidelines and Management\",\n      \"action\": \"added\"\n    },\n    {\n      \"field\": \"organisation\",\n      \"oldValue\": null,\n      \"newValue\": \"RCOG\",\n      \"action\": \"added\"\n    },\n    {\n      \"field\": \"yearProduced\",\n      \"oldValue\": null,\n      \"newValue\": \"The text provided does not contain a publication year. If you have another guideline text that includes the publication year, please share it, and I can extract the 4-digit year for you\",\n      \"action\": \"added\"\n    },\n    {\n      \"field\": \"summary\",\n      \"oldValue\": null,\n      \"newValue\": \"**Summary of Diabetes in Pregnancy Maternity Protocol (MP018):** - Applies to pre-existing or gestational diabetes, requiring individualized, multidisciplinary care. - **Pre-pregnancy planning** and routine monitoring are vital for optimal outcomes. - **Glycaemic targets**: Aim for fasting glucose ≤6.0 mmol/L and post-meal ≤7.8 mmol/L. - **Insulin users**: Offer glucagon, pump therapy, and hypoglycemia education. - **Diabetic ketoacidosis (DKA)**: Treat as an emergency with senior input. - **MODY**: Genetic testing required; manage similarly to pre-existing diabetes. - **Delivery**: Continuous glucose monitoring; neonatal hypoglycemia screening post-birth. - **Postpartum**: Insulin reverts to pre-pregnancy levels; monitor glucose and adjust doses. - **Gestational diabetes**: Offer metformin/insulin if diet/exercise fail; monitor during labor. - **Postnatal care**: HbA1c at 6–13 weeks; advise on future diabetes risks and lifestyle. - **Documentation**: Include multidisciplinary plans, antenatal ultrasounds, and management timelines. - **Lifestyle**: Encourage healthy diet, weight management, and annual HbA1c for gestational diabetes\",\n      \"action\": \"added\"\n    }\n  ]\n}",
  "ai_provider": "DeepSeek",
  "ai_model": "deepseek-chat",
  "token_usage": null
}