{
  "prompt": {
    "prompt": "Original Transcript:\nSITUATION: 29-year-old G2P1 at 11+3 weeks gestation presenting with vaginal bleeding and cramping consistent with inevitable miscarriage\n\nBACKGROUND: Mrs Peterson has experienced light vaginal bleeding for the past 3 days, initially spotting that she hoped was implantation bleeding. However, bleeding has increased to moderate flow with dark red blood and small clots. She developed cramping lower abdominal pain yesterday, described as severe period-like pain occurring in waves every 10-15 minutes. She passed some tissue this morning which she brought in a container. No fever, no offensive discharge, no urinary symptoms. This pregnancy was planned and much wanted after 8 months of trying. Her first pregnancy 4 years ago was uncomplicated with normal vaginal delivery at term. Last menstrual period was 12 weeks ago, pregnancy confirmed by home test and GP at 6+ weeks. Dating scan was booked for next week. She has been feeling less nauseous over the past week, which concerned her. No significant medical history, taking folic acid and pregnancy vitamins.\n\nASSESSMENT: Patient appears upset but hemodynamically stable. Vital signs: BP 118/76 mmHg, HR 88 bpm, temp 36.8°C. Abdominal examination reveals mild suprapubic tenderness, no guarding, no masses palpable. Speculum examination shows moderate dark red bleeding from cervical os with tissue visible in posterior fornix. Cervical os appears open approximately 1cm. Bimanual examination confirms open cervix, uterus smaller than expected for dates (approximately 8-week size), no adnexal masses or tenderness. Pregnancy test (urine) still positive but weaker than previous tests. Transvaginal ultrasound shows irregular gestational sac measuring 6+2 weeks equivalent, no fetal pole visible, no fetal heart activity detected. Some retained products of conception visible.\n\nRECOMMENDATION: Diagnosis of inevitable miscarriage with incomplete evacuation. Options discussed including expectant management, medical management (misoprostol), or surgical management (ERPC). Given patient preference and retained products visible on scan, surgical management recommended. ERPC scheduled for tomorrow morning after overnight fasting. Pre-operative bloods including FBC, cross-match. Rhesus status checked - patient is Rhesus negative so anti-D immunoglobulin required. Antibiotics (doxycycline) prescribed prophylactically. Pain relief with codeine and ibuprofen. Emotional support provided, bereavement counseling referral offered. Follow-up in 2 weeks to ensure complete evacuation and provide ongoing support. Advised to avoid intercourse and tampons for 2 weeks post-procedure.\n\nGuideline Analysis:\n### Ectopic Pregnancy and Miscarriage: Diagnosis and Initial Management Guideline\n\n### Very Important Recommendations  \n1. **Additional information needed** - Document serum hCG levels (current and trends if available) to guide management decisions.  \n   **Reason:** The guideline (1.4.29–1.4.31) emphasizes the importance of serial hCG measurements in diagnosing and managing pregnancies of unknown location or non-viable pregnancies. The current note lacks hCG values, which are critical for confirming the diagnosis and guiding follow-up.  \n\n2. **Different management plan** - Offer methotrexate as an alternative if the patient meets criteria (no significant pain, adnexal mass <35mm, hCG <1,500 IU/L, no heartbeat).  \n   **Reason:** The guideline recommends methotrexate for unruptured ectopic pregnancies or non-viable intrauterine pregnancies meeting specific criteria (1.4.32). While the note assumes inevitable miscarriage, ectopic pregnancy must be definitively excluded, and methotrexate could be an option if criteria align.  \n\n3. **Improved patient advice** - Provide written information on symptoms requiring urgent review (e.g., worsening pain, fever, heavy bleeding) and emergency contact details.  \n   **Reason:** The guideline stresses written information for women with pregnancy complications (1.4.30) to ensure timely access to care and reduce risks associated with delayed presentation.  \n\n### Somewhat Important Recommendations  \n1. **Additional information needed** - Clarify if a senior gynaecologist reviewed the case pre-operatively, as recommended for uncertain diagnoses (e.g., no fetal pole on scan).  \n   **Reason:** The guideline (1.4.31) advises senior review for pregnancies with inconclusive ultrasound findings or ambiguous hCG trends.  \n\n2. **Improved patient advice** - Discuss psychological support options in more detail (e.g., specific counseling services, peer support groups).  \n   **Reason:** The guideline highlights the emotional impact of miscarriage and recommends proactive support (see \"Psychological and emotional impact\" section).  \n\n### Less Important Recommendations  \n1. **Additional information needed** - Document whether serum progesterone was measured (though the guideline advises against its use).  \n   **Reason:** The guideline explicitly discourages progesterone for diagnosing pregnancy location (1.4.32), but noting its absence aligns with best practices.  \n\n2. **Improved patient advice** - Include statistics on success rates of surgical vs. medical management to aid decision-making.  \n   **Reason:** While not explicitly required, the guideline’s emphasis on informed choice (e.g., methotrexate vs. surgery) supports transparent risk/benefit discussions.  \n\n### Unimportant Recommendations  \n1. **Additional information needed** - Record the exact time of the last menstrual period (LMP) to the day, rather than \"12 weeks ago.\"  \n   **Reason:** The current documentation suffices for clinical decision-making, and the ultrasound findings override LMP discrepancies.  \n\n---  \n**Key Omissions in the Note:**  \n- No mention of ectopic pregnancy exclusion despite guideline emphasis on this as a critical differential.  \n- Lack of hCG trends to confirm non-viability (though ultrasound findings are likely sufficient here).  \n- Anti-D prophylaxis is correctly planned, but the rationale (Rhesus-negative status) could be stated more explicitly.  \n\n**Overall Alignment:** The note largely follows the guideline but could better address ectopic pregnancy exclusion, hCG monitoring, and patient information. The surgical plan is appropriate given retained products and patient preference, but alternatives (e.g., methotrexate) should be ruled out or offered if applicable.\n\n\n## Summary\n\nAnalyzed against the most relevant guideline successfully.\n\n*Note: Found 54 relevant guidelines total, analyzed against the most relevant one.*\n\n\nGuideline: Ectopic Pregnancy and Miscarriage: Diagnosis and Initial Management Guideline\n\n\nFull Guideline Content:\nEctopic pregnancy and miscarriage: diagnosis and initial management guideline covers diagnosing and managing ectopic pregnancy and miscarriage in women with complications in early pregnancy. It aims to improve early pregnancy loss diagnosis and support for women. Healthcare professionals, commissioners, and women with complications in early pregnancy are the target audience. Recommendations include providing support and information with dignity and respect, early pregnancy assessment services available 7 days a week, and recognizing the symptoms and signs of ectopic pregnancy for prompt referral.\n\nIn women of reproductive age, consider offering a pregnancy test even with non-specific symptoms. Healthcare professionals should have access to pregnancy tests. Refer women with positive pregnancy tests and specific symptoms for further assessment. Exclude the possibility of ectopic pregnancy even without known risk factors. Refer women with early pregnancy complications for assessment based on clinical situation. Use ultrasound scans to diagnose viable intrauterine and tubal ectopic pregnancies. Consider signs indicating tubal ectopic pregnancy during ultrasound scans. Use serum hCG measurements cautiously in women with pregnancies of unknown location. Provide written information to women with pregnancies of unknown location for monitoring symptoms and accessing emergency care.\n\n1.4.29 For a woman with an increase in serum hCG levels greater than 63% after Ectopic pregnancy and miscarriage: diagnosis and initial management:\n- Inform her that she is likely to have a developing intrauterine pregnancy.\n- Offer her a transvaginal ultrasound scan to determine the location of the pregnancy between 7 and 14 days later. Consider an earlier scan for women with a serum hCG level greater than or equal to 1,500 IU/litre.\n- If a viable intrauterine pregnancy is confirmed, offer her routine antenatal care. \n- If a viable intrauterine pregnancy is not confirmed, refer her for immediate clinical review by a senior gynaecologist.\n\n1.4.30 For a woman with a decrease in serum hCG levels greater than 50% after 48 hours:\n- Inform her that the pregnancy is unlikely to continue but this is not confirmed.\n- Provide her with oral and written information about where she can access support and counselling services.\n- Ask her to take a urine pregnancy test 14 days after the second serum hCG test.\n\n1.4.31 For a woman with a decrease in serum hCG levels less than 50%, or an increase less than 63%, refer her for clinical review in the early pregnancy assessment service within 24 hours.\n\n1.4.32 For women with a pregnancy of unknown location, when using serial serum hCG measurements, do not use serum progesterone measurements as an adjunct to diagnose either viable intrauterine pregnancy or ectopic pregnancy.\n\nOffer systemic methotrexate to women with an unruptured tubal ectopic pregnancy who have no significant pain, an adnexal mass smaller than 35mm, a serum hCG level less than 1,500 IU/litre, and no visible heartbeat. Surgery should be offered if methotrexate is not acceptable or if the woman has significant pain, a larger adnexal mass, a visible heartbeat, or a serum hCG level of 5,000 IU/litre or more. Women with an ectopic pregnancy and a serum hCG level between 1,500 and 5,000 IU/litre can choose between methotrexate and surgical management if they meet certain criteria. Laparoscopic surgery should be performed when surgical treatment is needed, and competent surgeons should be available. Salpingectomy should be offered unless there are other risk factors for infertility, and salpingotomy can be considered for women with infertility risk factors. Anti-D immunoglobulin prophylaxis should be offered to all Rh-negative women undergoing surgery for an ectopic pregnancy or miscarriage. Do not offer it to women receiving solely medical management or with certain pregnancy conditions.\n\nOver the past 2 decades, there have been significant changes in the management of ectopic pregnancy and miscarriage, with a shift towards outpatient or day case care and the introduction of medical and expectant management as alternatives to surgery. However, there is a lack of research into the effects of these different approaches from the woman's perspective, particularly their psychological and emotional impact. Miscarriage is distressing for most women, and the type of management itself might affect women's need for counseling, resulting in a cost to the NHS. Therefore, further research in this area is important.\n\nA comparative study should be conducted to assess how the type of intervention impacts women's experience, including psychological and emotional outcomes. Currently, there is no evidence exploring the psychological impact of different treatments for ectopic pregnancy. A qualitative comparative study is needed to reduce the emotional impact of the condition and maximize women's emotional recovery in the short and long term.\n\nAdditionally, recommendations have been made regarding the use of ultrasound for diagnosing tubal ectopic pregnancy and the use of progestogens for preventing miscarriage. Standardizing practices across the NHS based on evidence will improve the diagnosis of ectopic pregnancy and reduce risks to women. The use of progestogens to prevent miscarriage is cost-effective and will standardize the preparation of progesterone used in such cases.\n\nFurthermore, recommendations have been made for the medical management of miscarriage, including the use of a combination of medications to reduce the need for surgical intervention. These recommendations aim to improve the management of miscarriage and reduce costs for the NHS.\n\nLastly, recommendations have been made for the expectant management of tubal ectopic pregnancy, offering clinically stable women an alternative to medical management. These recommendations aim to standardize the management of ectopic pregnancy and make expectant management available when clinically appropriate, potentially resulting in cost savings through a reduction in drug use.\n\nEctopic pregnancy and miscarriage have an adverse effect on the quality of life of many women. Approximately 20% of pregnancies miscarry, and miscarriages can cause considerable distress. Early pregnancy loss accounts for over 50,000 admissions in the UK annually. The rate of ectopic pregnancy is 11 per 1,000 pregnancies, with a maternal mortality of 0.2 per 1,000 estimated ectopic pregnancies. About two-thirds of these deaths are associated with substandard care. Women who do not access medical help readily are particularly vulnerable. Improvement in the diagnosis and management of early pregnancy loss is therefore of vital importance, in order to reduce the incidence of the associated psychological morbidity and avoid the unnecessary deaths of women with ectopic pregnancies.\n\nPlease extract actionable suggestions from this analysis and format them as specified. For each suggestion, include detailed context with relevant quoted text from the guideline to help the user understand the reasoning behind the recommendation.",
    "system_prompt": "You are a medical AI assistant that converts clinical guideline analysis into structured, actionable suggestions. \n\nYour task is to analyze the provided guideline analysis and extract specific, actionable suggestions that can be presented to the user for acceptance, rejection, or modification.\n\nFor each suggestion you identify, return ONLY a valid JSON object with the following structure:\n{\n  \"suggestions\": [\n    {\n      \"id\": \"1\",\n      \"originalText\": \"text from transcript that needs changing OR description of missing element\",\n      \"suggestedText\": \"proposed replacement text\",\n      \"context\": \"detailed explanation of why this change is suggested, including relevant quoted text from the guideline in quotation marks\",\n      \"category\": \"addition|modification|deletion|formatting\",\n      \"priority\": \"high|medium|low\",\n      \"guidelineReference\": \"specific guideline section or rule\"\n    }\n  ]\n}\n\nCRITICAL FORMATTING REQUIREMENTS:\n- Return ONLY the JSON object - no markdown code blocks, no explanatory text\n- Do not wrap the JSON in ```json or ``` blocks\n- Start your response directly with { and end with }\n- Use sequential numeric IDs starting from \"1\"\n- Ensure all JSON is properly formatted and valid\n\nImportant guidelines for originalText field:\n- For MODIFICATIONS: Use the exact text from the transcript that needs to be changed\n- For ADDITIONS (missing elements): Use descriptive text like \"Missing: cervical length screening documentation\" or \"Gap: no discussion of antenatal corticosteroids\"\n- DO NOT use phrases like \"no additional cervical length screening ordered\" unless those exact words appear in the transcript\n- For missing elements, be clear that you're identifying an absence, not quoting existing text\n\nImportant guidelines for context field:\n- Provide detailed explanations including WHY the change is needed\n- Include specific quoted text from the guideline using quotation marks (e.g., \"According to the guideline: 'All women should receive screening for...'\")\n- Reference specific guideline recommendations or requirements\n- Explain the clinical rationale behind the suggestion\n- Make the context informative and educational\n\nOther important guidelines:\n- Only suggest changes that are explicitly supported by the guideline analysis\n- Make suggestions specific and actionable\n- For modifications, ensure original text selections are precise and findable in the transcript\n- Prioritize suggestions based on clinical importance\n- If no specific suggestions can be made, return {\"suggestions\": []}",
    "transcript_length": 2634,
    "analysis_length": 3893,
    "guideline_id": "nice-guidance-2023-ectopic-pdf",
    "guideline_title": "Ectopic Pregnancy and Miscarriage: Diagnosis and Initial Management Guideline"
  },
  "response": "{\n  \"suggestions\": [\n    {\n      \"id\": \"1\",\n      \"originalText\": \"Missing: serum hCG levels documentation\",\n      \"suggestedText\": \"Document current serum hCG levels and trends if available\",\n      \"context\": \"The guideline (1.4.29–1.4.31) emphasizes the importance of serial hCG measurements in diagnosing and managing pregnancies of unknown location or non-viable pregnancies. 'Use serum hCG measurements cautiously in women with pregnancies of unknown location.' Current documentation lacks hCG values which are critical for confirming diagnosis and guiding follow-up.\",\n      \"category\": \"addition\",\n      \"priority\": \"high\",\n      \"guidelineReference\": \"1.4.29-1.4.31\"\n    },\n    {\n      \"id\": \"2\",\n      \"originalText\": \"Gap: no discussion of methotrexate as alternative\",\n      \"suggestedText\": \"Consider and document whether methotrexate could be offered as an alternative (if no significant pain, adnexal mass <35mm, hCG <1,500 IU/L, no heartbeat)\",\n      \"context\": \"The guideline recommends (1.4.32): 'Offer systemic methotrexate to women with an unruptured tubal ectopic pregnancy who have no significant pain, an adnexal mass smaller than 35mm, a serum hCG level less than 1,500 IU/litre, and no visible heartbeat.' While surgical management is appropriate here, the rationale for not offering methotrexate should be documented.\",\n      \"category\": \"addition\",\n      \"priority\": \"high\",\n      \"guidelineReference\": \"1.4.32\"\n    },\n    {\n      \"id\": \"3\",\n      \"originalText\": \"Gap: no written information provided to patient\",\n      \"suggestedText\": \"Provide written information on symptoms requiring urgent review (worsening pain, fever, heavy bleeding) and emergency contact details\",\n      \"context\": \"The guideline stresses (1.4.30): 'Provide her with oral and written information about where she can access support and counselling services.' Also states generally: 'Provide written information to women with pregnancies of unknown location for monitoring symptoms and accessing emergency care.'\",\n      \"category\": \"addition\",\n      \"priority\": \"high\",\n      \"guidelineReference\": \"1.4.30\"\n    },\n    {\n      \"id\": \"4\",\n      \"originalText\": \"Gap: no documentation of senior gynaecologist review\",\n      \"suggestedText\": \"Document whether case was reviewed by senior gynaecologist given inconclusive ultrasound findings\",\n      \"context\": \"The guideline recommends (1.4.31): 'refer her for immediate clinical review by a senior gynaecologist' for inconclusive findings. With no fetal pole visible on scan, senior review would be appropriate though not strictly required given other findings.\",\n      \"category\": \"addition\",\n      \"priority\": \"medium\",\n      \"guidelineReference\": \"1.4.31\"\n    },\n    {\n      \"id\": \"5\",\n      \"originalText\": \"Emotional support provided, bereavement counseling referral offered\",\n      \"suggestedText\": \"Emotional support provided with details of specific counseling services and peer support groups; bereavement counseling referral offered\",\n      \"context\": \"The guideline highlights the emotional impact of miscarriage and recommends proactive support: 'Provide her with oral and written information about where she can access support and counselling services.' More specific resources should be documented.\",\n      \"category\": \"modification\",\n      \"priority\": \"medium\",\n      \"guidelineReference\": \"Psychological and emotional impact section\"\n    },\n    {\n      \"id\": \"6\",\n      \"originalText\": \"Gap: no explicit exclusion of ectopic pregnancy documented\",\n      \"suggestedText\": \"Document explicit consideration and exclusion of ectopic pregnancy in differential diagnosis\",\n      \"context\": \"The guideline emphasizes: 'Exclude the possibility of ectopic pregnancy even without known risk factors.' While ultrasound findings suggest intrauterine pregnancy, ectopic pregnancy should be formally considered and excluded in documentation.\",\n      \"category\": \"addition\",\n      \"priority\": \"high\",\n      \"guidelineReference\": \"General principles\"\n    },\n    {\n      \"id\": \"7\",\n      \"originalText\": \"Rhesus status checked - patient is Rhesus negative so anti-D immunoglobulin required\",\n      \"suggestedText\": \"Rhesus status confirmed negative - anti-D immunoglobulin administered/provided per guideline recommendation for surgical management\",\n      \"context\": \"The guideline states: 'Anti-D immunoglobulin prophylaxis should be offered to all Rh-negative women undergoing surgery for an ectopic pregnancy or miscarriage.' Current documentation is correct but could be more explicit about guideline compliance.\",\n      \"category\": \"modification\",\n      \"priority\": \"low\",\n      \"guidelineReference\": \"Anti-D prophylaxis section\"\n    }\n  ]\n}",
  "endpoint": "dynamicAdvice",
  "timestamp": "2025-06-16T04-00-11",
  "textContent": "AI: DeepSeek (deepseek-chat)\n\nQ: {\n  \"prompt\": \"Original Transcript:\\nSITUATION: 29-year-old G2P1 at 11+3 weeks gestation presenting with vaginal bleeding and cramping consistent with inevitable miscarriage\\n\\nBACKGROUND: Mrs Peterson has experienced light vaginal bleeding for the past 3 days, initially spotting that she hoped was implantation bleeding. However, bleeding has increased to moderate flow with dark red blood and small clots. She developed cramping lower abdominal pain yesterday, described as severe period-like pain occurring in waves every 10-15 minutes. She passed some tissue this morning which she brought in a container. No fever, no offensive discharge, no urinary symptoms. This pregnancy was planned and much wanted after 8 months of trying. Her first pregnancy 4 years ago was uncomplicated with normal vaginal delivery at term. Last menstrual period was 12 weeks ago, pregnancy confirmed by home test and GP at 6+ weeks. Dating scan was booked for next week. She has been feeling less nauseous over the past week, which concerned her. No significant medical history, taking folic acid and pregnancy vitamins.\\n\\nASSESSMENT: Patient appears upset but hemodynamically stable. Vital signs: BP 118/76 mmHg, HR 88 bpm, temp 36.8°C. Abdominal examination reveals mild suprapubic tenderness, no guarding, no masses palpable. Speculum examination shows moderate dark red bleeding from cervical os with tissue visible in posterior fornix. Cervical os appears open approximately 1cm. Bimanual examination confirms open cervix, uterus smaller than expected for dates (approximately 8-week size), no adnexal masses or tenderness. Pregnancy test (urine) still positive but weaker than previous tests. Transvaginal ultrasound shows irregular gestational sac measuring 6+2 weeks equivalent, no fetal pole visible, no fetal heart activity detected. Some retained products of conception visible.\\n\\nRECOMMENDATION: Diagnosis of inevitable miscarriage with incomplete evacuation. Options discussed including expectant management, medical management (misoprostol), or surgical management (ERPC). Given patient preference and retained products visible on scan, surgical management recommended. ERPC scheduled for tomorrow morning after overnight fasting. Pre-operative bloods including FBC, cross-match. Rhesus status checked - patient is Rhesus negative so anti-D immunoglobulin required. Antibiotics (doxycycline) prescribed prophylactically. Pain relief with codeine and ibuprofen. Emotional support provided, bereavement counseling referral offered. Follow-up in 2 weeks to ensure complete evacuation and provide ongoing support. Advised to avoid intercourse and tampons for 2 weeks post-procedure.\\n\\nGuideline Analysis:\\n### Ectopic Pregnancy and Miscarriage: Diagnosis and Initial Management Guideline\\n\\n### Very Important Recommendations  \\n1. **Additional information needed** - Document serum hCG levels (current and trends if available) to guide management decisions.  \\n   **Reason:** The guideline (1.4.29–1.4.31) emphasizes the importance of serial hCG measurements in diagnosing and managing pregnancies of unknown location or non-viable pregnancies. The current note lacks hCG values, which are critical for confirming the diagnosis and guiding follow-up.  \\n\\n2. **Different management plan** - Offer methotrexate as an alternative if the patient meets criteria (no significant pain, adnexal mass <35mm, hCG <1,500 IU/L, no heartbeat).  \\n   **Reason:** The guideline recommends methotrexate for unruptured ectopic pregnancies or non-viable intrauterine pregnancies meeting specific criteria (1.4.32). While the note assumes inevitable miscarriage, ectopic pregnancy must be definitively excluded, and methotrexate could be an option if criteria align.  \\n\\n3. **Improved patient advice** - Provide written information on symptoms requiring urgent review (e.g., worsening pain, fever, heavy bleeding) and emergency contact details.  \\n   **Reason:** The guideline stresses written information for women with pregnancy complications (1.4.30) to ensure timely access to care and reduce risks associated with delayed presentation.  \\n\\n### Somewhat Important Recommendations  \\n1. **Additional information needed** - Clarify if a senior gynaecologist reviewed the case pre-operatively, as recommended for uncertain diagnoses (e.g., no fetal pole on scan).  \\n   **Reason:** The guideline (1.4.31) advises senior review for pregnancies with inconclusive ultrasound findings or ambiguous hCG trends.  \\n\\n2. **Improved patient advice** - Discuss psychological support options in more detail (e.g., specific counseling services, peer support groups).  \\n   **Reason:** The guideline highlights the emotional impact of miscarriage and recommends proactive support (see \\\"Psychological and emotional impact\\\" section).  \\n\\n### Less Important Recommendations  \\n1. **Additional information needed** - Document whether serum progesterone was measured (though the guideline advises against its use).  \\n   **Reason:** The guideline explicitly discourages progesterone for diagnosing pregnancy location (1.4.32), but noting its absence aligns with best practices.  \\n\\n2. **Improved patient advice** - Include statistics on success rates of surgical vs. medical management to aid decision-making.  \\n   **Reason:** While not explicitly required, the guideline’s emphasis on informed choice (e.g., methotrexate vs. surgery) supports transparent risk/benefit discussions.  \\n\\n### Unimportant Recommendations  \\n1. **Additional information needed** - Record the exact time of the last menstrual period (LMP) to the day, rather than \\\"12 weeks ago.\\\"  \\n   **Reason:** The current documentation suffices for clinical decision-making, and the ultrasound findings override LMP discrepancies.  \\n\\n---  \\n**Key Omissions in the Note:**  \\n- No mention of ectopic pregnancy exclusion despite guideline emphasis on this as a critical differential.  \\n- Lack of hCG trends to confirm non-viability (though ultrasound findings are likely sufficient here).  \\n- Anti-D prophylaxis is correctly planned, but the rationale (Rhesus-negative status) could be stated more explicitly.  \\n\\n**Overall Alignment:** The note largely follows the guideline but could better address ectopic pregnancy exclusion, hCG monitoring, and patient information. The surgical plan is appropriate given retained products and patient preference, but alternatives (e.g., methotrexate) should be ruled out or offered if applicable.\\n\\n\\n## Summary\\n\\nAnalyzed against the most relevant guideline successfully.\\n\\n*Note: Found 54 relevant guidelines total, analyzed against the most relevant one.*\\n\\n\\nGuideline: Ectopic Pregnancy and Miscarriage: Diagnosis and Initial Management Guideline\\n\\n\\nFull Guideline Content:\\nEctopic pregnancy and miscarriage: diagnosis and initial management guideline covers diagnosing and managing ectopic pregnancy and miscarriage in women with complications in early pregnancy. It aims to improve early pregnancy loss diagnosis and support for women. Healthcare professionals, commissioners, and women with complications in early pregnancy are the target audience. Recommendations include providing support and information with dignity and respect, early pregnancy assessment services available 7 days a week, and recognizing the symptoms and signs of ectopic pregnancy for prompt referral.\\n\\nIn women of reproductive age, consider offering a pregnancy test even with non-specific symptoms. Healthcare professionals should have access to pregnancy tests. Refer women with positive pregnancy tests and specific symptoms for further assessment. Exclude the possibility of ectopic pregnancy even without known risk factors. Refer women with early pregnancy complications for assessment based on clinical situation. Use ultrasound scans to diagnose viable intrauterine and tubal ectopic pregnancies. Consider signs indicating tubal ectopic pregnancy during ultrasound scans. Use serum hCG measurements cautiously in women with pregnancies of unknown location. Provide written information to women with pregnancies of unknown location for monitoring symptoms and accessing emergency care.\\n\\n1.4.29 For a woman with an increase in serum hCG levels greater than 63% after Ectopic pregnancy and miscarriage: diagnosis and initial management:\\n- Inform her that she is likely to have a developing intrauterine pregnancy.\\n- Offer her a transvaginal ultrasound scan to determine the location of the pregnancy between 7 and 14 days later. Consider an earlier scan for women with a serum hCG level greater than or equal to 1,500 IU/litre.\\n- If a viable intrauterine pregnancy is confirmed, offer her routine antenatal care. \\n- If a viable intrauterine pregnancy is not confirmed, refer her for immediate clinical review by a senior gynaecologist.\\n\\n1.4.30 For a woman with a decrease in serum hCG levels greater than 50% after 48 hours:\\n- Inform her that the pregnancy is unlikely to continue but this is not confirmed.\\n- Provide her with oral and written information about where she can access support and counselling services.\\n- Ask her to take a urine pregnancy test 14 days after the second serum hCG test.\\n\\n1.4.31 For a woman with a decrease in serum hCG levels less than 50%, or an increase less than 63%, refer her for clinical review in the early pregnancy assessment service within 24 hours.\\n\\n1.4.32 For women with a pregnancy of unknown location, when using serial serum hCG measurements, do not use serum progesterone measurements as an adjunct to diagnose either viable intrauterine pregnancy or ectopic pregnancy.\\n\\nOffer systemic methotrexate to women with an unruptured tubal ectopic pregnancy who have no significant pain, an adnexal mass smaller than 35mm, a serum hCG level less than 1,500 IU/litre, and no visible heartbeat. Surgery should be offered if methotrexate is not acceptable or if the woman has significant pain, a larger adnexal mass, a visible heartbeat, or a serum hCG level of 5,000 IU/litre or more. Women with an ectopic pregnancy and a serum hCG level between 1,500 and 5,000 IU/litre can choose between methotrexate and surgical management if they meet certain criteria. Laparoscopic surgery should be performed when surgical treatment is needed, and competent surgeons should be available. Salpingectomy should be offered unless there are other risk factors for infertility, and salpingotomy can be considered for women with infertility risk factors. Anti-D immunoglobulin prophylaxis should be offered to all Rh-negative women undergoing surgery for an ectopic pregnancy or miscarriage. Do not offer it to women receiving solely medical management or with certain pregnancy conditions.\\n\\nOver the past 2 decades, there have been significant changes in the management of ectopic pregnancy and miscarriage, with a shift towards outpatient or day case care and the introduction of medical and expectant management as alternatives to surgery. However, there is a lack of research into the effects of these different approaches from the woman's perspective, particularly their psychological and emotional impact. Miscarriage is distressing for most women, and the type of management itself might affect women's need for counseling, resulting in a cost to the NHS. Therefore, further research in this area is important.\\n\\nA comparative study should be conducted to assess how the type of intervention impacts women's experience, including psychological and emotional outcomes. Currently, there is no evidence exploring the psychological impact of different treatments for ectopic pregnancy. A qualitative comparative study is needed to reduce the emotional impact of the condition and maximize women's emotional recovery in the short and long term.\\n\\nAdditionally, recommendations have been made regarding the use of ultrasound for diagnosing tubal ectopic pregnancy and the use of progestogens for preventing miscarriage. Standardizing practices across the NHS based on evidence will improve the diagnosis of ectopic pregnancy and reduce risks to women. The use of progestogens to prevent miscarriage is cost-effective and will standardize the preparation of progesterone used in such cases.\\n\\nFurthermore, recommendations have been made for the medical management of miscarriage, including the use of a combination of medications to reduce the need for surgical intervention. These recommendations aim to improve the management of miscarriage and reduce costs for the NHS.\\n\\nLastly, recommendations have been made for the expectant management of tubal ectopic pregnancy, offering clinically stable women an alternative to medical management. These recommendations aim to standardize the management of ectopic pregnancy and make expectant management available when clinically appropriate, potentially resulting in cost savings through a reduction in drug use.\\n\\nEctopic pregnancy and miscarriage have an adverse effect on the quality of life of many women. Approximately 20% of pregnancies miscarry, and miscarriages can cause considerable distress. Early pregnancy loss accounts for over 50,000 admissions in the UK annually. The rate of ectopic pregnancy is 11 per 1,000 pregnancies, with a maternal mortality of 0.2 per 1,000 estimated ectopic pregnancies. About two-thirds of these deaths are associated with substandard care. Women who do not access medical help readily are particularly vulnerable. Improvement in the diagnosis and management of early pregnancy loss is therefore of vital importance, in order to reduce the incidence of the associated psychological morbidity and avoid the unnecessary deaths of women with ectopic pregnancies.\\n\\nPlease extract actionable suggestions from this analysis and format them as specified. For each suggestion, include detailed context with relevant quoted text from the guideline to help the user understand the reasoning behind the recommendation.\",\n  \"system_prompt\": \"You are a medical AI assistant that converts clinical guideline analysis into structured, actionable suggestions. \\n\\nYour task is to analyze the provided guideline analysis and extract specific, actionable suggestions that can be presented to the user for acceptance, rejection, or modification.\\n\\nFor each suggestion you identify, return ONLY a valid JSON object with the following structure:\\n{\\n  \\\"suggestions\\\": [\\n    {\\n      \\\"id\\\": \\\"1\\\",\\n      \\\"originalText\\\": \\\"text from transcript that needs changing OR description of missing element\\\",\\n      \\\"suggestedText\\\": \\\"proposed replacement text\\\",\\n      \\\"context\\\": \\\"detailed explanation of why this change is suggested, including relevant quoted text from the guideline in quotation marks\\\",\\n      \\\"category\\\": \\\"addition|modification|deletion|formatting\\\",\\n      \\\"priority\\\": \\\"high|medium|low\\\",\\n      \\\"guidelineReference\\\": \\\"specific guideline section or rule\\\"\\n    }\\n  ]\\n}\\n\\nCRITICAL FORMATTING REQUIREMENTS:\\n- Return ONLY the JSON object - no markdown code blocks, no explanatory text\\n- Do not wrap the JSON in ```json or ``` blocks\\n- Start your response directly with { and end with }\\n- Use sequential numeric IDs starting from \\\"1\\\"\\n- Ensure all JSON is properly formatted and valid\\n\\nImportant guidelines for originalText field:\\n- For MODIFICATIONS: Use the exact text from the transcript that needs to be changed\\n- For ADDITIONS (missing elements): Use descriptive text like \\\"Missing: cervical length screening documentation\\\" or \\\"Gap: no discussion of antenatal corticosteroids\\\"\\n- DO NOT use phrases like \\\"no additional cervical length screening ordered\\\" unless those exact words appear in the transcript\\n- For missing elements, be clear that you're identifying an absence, not quoting existing text\\n\\nImportant guidelines for context field:\\n- Provide detailed explanations including WHY the change is needed\\n- Include specific quoted text from the guideline using quotation marks (e.g., \\\"According to the guideline: 'All women should receive screening for...'\\\")\\n- Reference specific guideline recommendations or requirements\\n- Explain the clinical rationale behind the suggestion\\n- Make the context informative and educational\\n\\nOther important guidelines:\\n- Only suggest changes that are explicitly supported by the guideline analysis\\n- Make suggestions specific and actionable\\n- For modifications, ensure original text selections are precise and findable in the transcript\\n- Prioritize suggestions based on clinical importance\\n- If no specific suggestions can be made, return {\\\"suggestions\\\": []}\",\n  \"transcript_length\": 2634,\n  \"analysis_length\": 3893,\n  \"guideline_id\": \"nice-guidance-2023-ectopic-pdf\",\n  \"guideline_title\": \"Ectopic Pregnancy and Miscarriage: Diagnosis and Initial Management Guideline\"\n}\n\nA: {\n  \"suggestions\": [\n    {\n      \"id\": \"1\",\n      \"originalText\": \"Missing: serum hCG levels documentation\",\n      \"suggestedText\": \"Document current serum hCG levels and trends if available\",\n      \"context\": \"The guideline (1.4.29–1.4.31) emphasizes the importance of serial hCG measurements in diagnosing and managing pregnancies of unknown location or non-viable pregnancies. 'Use serum hCG measurements cautiously in women with pregnancies of unknown location.' Current documentation lacks hCG values which are critical for confirming diagnosis and guiding follow-up.\",\n      \"category\": \"addition\",\n      \"priority\": \"high\",\n      \"guidelineReference\": \"1.4.29-1.4.31\"\n    },\n    {\n      \"id\": \"2\",\n      \"originalText\": \"Gap: no discussion of methotrexate as alternative\",\n      \"suggestedText\": \"Consider and document whether methotrexate could be offered as an alternative (if no significant pain, adnexal mass <35mm, hCG <1,500 IU/L, no heartbeat)\",\n      \"context\": \"The guideline recommends (1.4.32): 'Offer systemic methotrexate to women with an unruptured tubal ectopic pregnancy who have no significant pain, an adnexal mass smaller than 35mm, a serum hCG level less than 1,500 IU/litre, and no visible heartbeat.' While surgical management is appropriate here, the rationale for not offering methotrexate should be documented.\",\n      \"category\": \"addition\",\n      \"priority\": \"high\",\n      \"guidelineReference\": \"1.4.32\"\n    },\n    {\n      \"id\": \"3\",\n      \"originalText\": \"Gap: no written information provided to patient\",\n      \"suggestedText\": \"Provide written information on symptoms requiring urgent review (worsening pain, fever, heavy bleeding) and emergency contact details\",\n      \"context\": \"The guideline stresses (1.4.30): 'Provide her with oral and written information about where she can access support and counselling services.' Also states generally: 'Provide written information to women with pregnancies of unknown location for monitoring symptoms and accessing emergency care.'\",\n      \"category\": \"addition\",\n      \"priority\": \"high\",\n      \"guidelineReference\": \"1.4.30\"\n    },\n    {\n      \"id\": \"4\",\n      \"originalText\": \"Gap: no documentation of senior gynaecologist review\",\n      \"suggestedText\": \"Document whether case was reviewed by senior gynaecologist given inconclusive ultrasound findings\",\n      \"context\": \"The guideline recommends (1.4.31): 'refer her for immediate clinical review by a senior gynaecologist' for inconclusive findings. With no fetal pole visible on scan, senior review would be appropriate though not strictly required given other findings.\",\n      \"category\": \"addition\",\n      \"priority\": \"medium\",\n      \"guidelineReference\": \"1.4.31\"\n    },\n    {\n      \"id\": \"5\",\n      \"originalText\": \"Emotional support provided, bereavement counseling referral offered\",\n      \"suggestedText\": \"Emotional support provided with details of specific counseling services and peer support groups; bereavement counseling referral offered\",\n      \"context\": \"The guideline highlights the emotional impact of miscarriage and recommends proactive support: 'Provide her with oral and written information about where she can access support and counselling services.' More specific resources should be documented.\",\n      \"category\": \"modification\",\n      \"priority\": \"medium\",\n      \"guidelineReference\": \"Psychological and emotional impact section\"\n    },\n    {\n      \"id\": \"6\",\n      \"originalText\": \"Gap: no explicit exclusion of ectopic pregnancy documented\",\n      \"suggestedText\": \"Document explicit consideration and exclusion of ectopic pregnancy in differential diagnosis\",\n      \"context\": \"The guideline emphasizes: 'Exclude the possibility of ectopic pregnancy even without known risk factors.' While ultrasound findings suggest intrauterine pregnancy, ectopic pregnancy should be formally considered and excluded in documentation.\",\n      \"category\": \"addition\",\n      \"priority\": \"high\",\n      \"guidelineReference\": \"General principles\"\n    },\n    {\n      \"id\": \"7\",\n      \"originalText\": \"Rhesus status checked - patient is Rhesus negative so anti-D immunoglobulin required\",\n      \"suggestedText\": \"Rhesus status confirmed negative - anti-D immunoglobulin administered/provided per guideline recommendation for surgical management\",\n      \"context\": \"The guideline states: 'Anti-D immunoglobulin prophylaxis should be offered to all Rh-negative women undergoing surgery for an ectopic pregnancy or miscarriage.' Current documentation is correct but could be more explicit about guideline compliance.\",\n      \"category\": \"modification\",\n      \"priority\": \"low\",\n      \"guidelineReference\": \"Anti-D prophylaxis section\"\n    }\n  ]\n}\n\n--- Token Usage Report ---\nPrompt tokens: 3144\nCompletion tokens: 1029\nTotal tokens: 4173\nEstimated cost: $0.002086",
  "ai_provider": "DeepSeek",
  "ai_model": "deepseek-chat",
  "token_usage": {
    "prompt_tokens": 3144,
    "completion_tokens": 1029,
    "total_tokens": 4173,
    "estimated_cost_usd": 0.0020865
  }
}