{
  "prompt": {
    "guidelineId": "uhsx-bladder-care-guideline-pdf",
    "fieldsProcessed": [
      "humanFriendlyName",
      "organisation",
      "yearProduced",
      "summary"
    ],
    "enhancedFields": 4,
    "contentLength": 2715
  },
  "response": "{\n  \"success\": true,\n  \"enhancedFields\": [\n    {\n      \"field\": \"humanFriendlyName\",\n      \"oldValue\": null,\n      \"newValue\": \"Bladder Care Guidelines for Women During and After Birth\",\n      \"action\": \"added\"\n    },\n    {\n      \"field\": \"organisation\",\n      \"oldValue\": null,\n      \"newValue\": \"RCOG\",\n      \"action\": \"added\"\n    },\n    {\n      \"field\": \"yearProduced\",\n      \"oldValue\": null,\n      \"newValue\": \"I cannot find a publication year in the provided text. Please provide the text that includes the publication year\",\n      \"action\": \"added\"\n    },\n    {\n      \"field\": \"summary\",\n      \"oldValue\": null,\n      \"newValue\": \"**Summary of Bladder Care Guideline for Labour and Postnatal Period** This guideline promotes bladder health by preventing overdistension, infection, and damage. Key recommendations: - **Monitoring & Voiding:** Encourage regular voiding, monitor fluid intake, and catheterize when necessary. Postnatally, document voiding volumes and consider bladder scans or physiotherapy referrals if needed. - **Catheter Care:** Remove catheters when clinically indicated; provide care instructions to reduce infection risk. Monitor trials without catheter (TWOC) closely. **Bladder Scan Management:** - **<200 mL:** Hydrate and continue TWOC. - **200-500 mL:** In-out catheter, restart TWOC. - **500-1000 mL:** Indwelling catheter (IDC) for 24h, urine tests, then repeat TWOC. - **>1000 mL/failed TWOC:** IDC for 7 days, urine tests, obstetric review, and continence nurse referral. **Second Failed TWOC:** - Check voided volumes and post-void residuals (<150 mL is acceptable). If dysfunction persists, insert IDC for 7 days. **Indwelling Catheter Use Indications:** - Post-Caesarean/operative birth, spinal/epidural analgesia. - Bladder distension in labour, retention issues, retained placenta, PPH, severe perineal trauma (3rd/4th-degree tears, hematoma)\",\n      \"action\": \"added\"\n    }\n  ]\n}",
  "endpoint": "enhanceGuidelineMetadata",
  "timestamp": "2025-06-18T23-07-56",
  "textContent": "AI: DeepSeek (deepseek-chat)\n\nQ: {\n  \"guidelineId\": \"uhsx-bladder-care-guideline-pdf\",\n  \"fieldsProcessed\": [\n    \"humanFriendlyName\",\n    \"organisation\",\n    \"yearProduced\",\n    \"summary\"\n  ],\n  \"enhancedFields\": 4,\n  \"contentLength\": 2715\n}\n\nA: {\n  \"success\": true,\n  \"enhancedFields\": [\n    {\n      \"field\": \"humanFriendlyName\",\n      \"oldValue\": null,\n      \"newValue\": \"Bladder Care Guidelines for Women During and After Birth\",\n      \"action\": \"added\"\n    },\n    {\n      \"field\": \"organisation\",\n      \"oldValue\": null,\n      \"newValue\": \"RCOG\",\n      \"action\": \"added\"\n    },\n    {\n      \"field\": \"yearProduced\",\n      \"oldValue\": null,\n      \"newValue\": \"I cannot find a publication year in the provided text. Please provide the text that includes the publication year\",\n      \"action\": \"added\"\n    },\n    {\n      \"field\": \"summary\",\n      \"oldValue\": null,\n      \"newValue\": \"**Summary of Bladder Care Guideline for Labour and Postnatal Period** This guideline promotes bladder health by preventing overdistension, infection, and damage. Key recommendations: - **Monitoring & Voiding:** Encourage regular voiding, monitor fluid intake, and catheterize when necessary. Postnatally, document voiding volumes and consider bladder scans or physiotherapy referrals if needed. - **Catheter Care:** Remove catheters when clinically indicated; provide care instructions to reduce infection risk. Monitor trials without catheter (TWOC) closely. **Bladder Scan Management:** - **<200 mL:** Hydrate and continue TWOC. - **200-500 mL:** In-out catheter, restart TWOC. - **500-1000 mL:** Indwelling catheter (IDC) for 24h, urine tests, then repeat TWOC. - **>1000 mL/failed TWOC:** IDC for 7 days, urine tests, obstetric review, and continence nurse referral. **Second Failed TWOC:** - Check voided volumes and post-void residuals (<150 mL is acceptable). If dysfunction persists, insert IDC for 7 days. **Indwelling Catheter Use Indications:** - Post-Caesarean/operative birth, spinal/epidural analgesia. - Bladder distension in labour, retention issues, retained placenta, PPH, severe perineal trauma (3rd/4th-degree tears, hematoma)\",\n      \"action\": \"added\"\n    }\n  ]\n}",
  "ai_provider": "DeepSeek",
  "ai_model": "deepseek-chat",
  "token_usage": null
}