{
  "prompt": {
    "guidelineId": "cg12030-caesarean-birth-guideline-pdf",
    "fieldsProcessed": [
      "humanFriendlyName",
      "organisation",
      "yearProduced",
      "summary"
    ],
    "enhancedFields": 4,
    "contentLength": 7252
  },
  "response": "{\n  \"success\": true,\n  \"enhancedFields\": [\n    {\n      \"field\": \"humanFriendlyName\",\n      \"oldValue\": null,\n      \"newValue\": \"Caesarean Section Birth Guideline\",\n      \"action\": \"added\"\n    },\n    {\n      \"field\": \"organisation\",\n      \"oldValue\": null,\n      \"newValue\": \"RCOG\",\n      \"action\": \"added\"\n    },\n    {\n      \"field\": \"yearProduced\",\n      \"oldValue\": null,\n      \"newValue\": \"2016\",\n      \"action\": \"added\"\n    },\n    {\n      \"field\": \"summary\",\n      \"oldValue\": null,\n      \"newValue\": \"**Summary of Caesarean Section (CS) Birth Guideline** This guideline provides evidence-based recommendations for safe, high-quality CS care. It applies to maternity staff, including midwives, obstetricians, and anaesthetists. **Key Recommendations:** - **Categories of Urgency:** - **Category 1 (immediate threat to life):** Perform within 30 minutes. - **Category 2 (maternal/fetal compromise, not life-threatening):** Within 75 minutes. - **Category 3 (early birth needed, no compromise):** Timely scheduling. - **Category 4 (elective):** Only if clinically beneficial. - **Preoperative Care:** - Antenatal assessment for planned CS. - Regional anesthesia preferred; general anesthesia with rapid sequence induction if needed. - Prophylactic antibiotics, vasopressors, and fluid warming recommended. - **Intraoperative Care:** - Carbetocin for hemorrhage prevention. - Allow a birth companion; encourage skin-to-skin contact. - Use WHO surgical safety checklist. - **Postoperative Care:** - Regular pain relief (paracetamol, NSAIDs, morphine as needed). - Monitor for complications; encourage breastfeeding. - Thromboembolism prophylaxis and early mobilization. - **Risks & Outcomes:** - Higher risks: hysterectomy, neonatal mortality, future placenta accreta. - Lower risks: urinary incontinence, perineal trauma. - **Emergency CS Outside Theatre:** - Mobilize necessary equipment/personnel promptly. - **Monitoring:** - Frequent postoperative observations (vitals, pain, bleeding). Planned CS should be at ≥39 weeks unless medically indicated. Maternal request CS requires consultant approval. Enhanced recovery programs are encouraged for elective cases\",\n      \"action\": \"added\"\n    }\n  ]\n}",
  "endpoint": "enhanceGuidelineMetadata",
  "timestamp": "2025-06-18T22-06-18",
  "textContent": "AI: DeepSeek (deepseek-chat)\n\nQ: {\n  \"guidelineId\": \"cg12030-caesarean-birth-guideline-pdf\",\n  \"fieldsProcessed\": [\n    \"humanFriendlyName\",\n    \"organisation\",\n    \"yearProduced\",\n    \"summary\"\n  ],\n  \"enhancedFields\": 4,\n  \"contentLength\": 7252\n}\n\nA: {\n  \"success\": true,\n  \"enhancedFields\": [\n    {\n      \"field\": \"humanFriendlyName\",\n      \"oldValue\": null,\n      \"newValue\": \"Caesarean Section Birth Guideline\",\n      \"action\": \"added\"\n    },\n    {\n      \"field\": \"organisation\",\n      \"oldValue\": null,\n      \"newValue\": \"RCOG\",\n      \"action\": \"added\"\n    },\n    {\n      \"field\": \"yearProduced\",\n      \"oldValue\": null,\n      \"newValue\": \"2016\",\n      \"action\": \"added\"\n    },\n    {\n      \"field\": \"summary\",\n      \"oldValue\": null,\n      \"newValue\": \"**Summary of Caesarean Section (CS) Birth Guideline** This guideline provides evidence-based recommendations for safe, high-quality CS care. It applies to maternity staff, including midwives, obstetricians, and anaesthetists. **Key Recommendations:** - **Categories of Urgency:** - **Category 1 (immediate threat to life):** Perform within 30 minutes. - **Category 2 (maternal/fetal compromise, not life-threatening):** Within 75 minutes. - **Category 3 (early birth needed, no compromise):** Timely scheduling. - **Category 4 (elective):** Only if clinically beneficial. - **Preoperative Care:** - Antenatal assessment for planned CS. - Regional anesthesia preferred; general anesthesia with rapid sequence induction if needed. - Prophylactic antibiotics, vasopressors, and fluid warming recommended. - **Intraoperative Care:** - Carbetocin for hemorrhage prevention. - Allow a birth companion; encourage skin-to-skin contact. - Use WHO surgical safety checklist. - **Postoperative Care:** - Regular pain relief (paracetamol, NSAIDs, morphine as needed). - Monitor for complications; encourage breastfeeding. - Thromboembolism prophylaxis and early mobilization. - **Risks & Outcomes:** - Higher risks: hysterectomy, neonatal mortality, future placenta accreta. - Lower risks: urinary incontinence, perineal trauma. - **Emergency CS Outside Theatre:** - Mobilize necessary equipment/personnel promptly. - **Monitoring:** - Frequent postoperative observations (vitals, pain, bleeding). Planned CS should be at ≥39 weeks unless medically indicated. Maternal request CS requires consultant approval. Enhanced recovery programs are encouraged for elective cases\",\n      \"action\": \"added\"\n    }\n  ]\n}",
  "ai_provider": "DeepSeek",
  "ai_model": "deepseek-chat",
  "token_usage": null
}