{
  "prompt": {
    "guidelineId": "cg1109-diabetes-in-pregnancy-guideline-pdf",
    "fieldsProcessed": [
      "humanFriendlyName",
      "organisation",
      "yearProduced",
      "summary"
    ],
    "enhancedFields": 4,
    "contentLength": 3289
  },
  "response": "{\n  \"success\": true,\n  \"enhancedFields\": [\n    {\n      \"field\": \"humanFriendlyName\",\n      \"oldValue\": null,\n      \"newValue\": \"Diabetes in Pregnancy Care Guidelines\",\n      \"action\": \"added\"\n    },\n    {\n      \"field\": \"organisation\",\n      \"oldValue\": null,\n      \"newValue\": \"RCOG\",\n      \"action\": \"added\"\n    },\n    {\n      \"field\": \"yearProduced\",\n      \"oldValue\": null,\n      \"newValue\": \"I cannot find a publication year in the provided text. The guideline does not explicitly mention a publication or revision year\",\n      \"action\": \"added\"\n    },\n    {\n      \"field\": \"summary\",\n      \"oldValue\": null,\n      \"newValue\": \"**Summary of Diabetes in Pregnancy Guideline:** - **Pre-pregnancy counseling:** Discuss risks, optimize glucose monitoring, review medications, and screen for complications in women with pre-existing diabetes. - **Screening for GDM:** Follow diagnostic criteria; refer to Diabetes Pregnancy Team if diagnosed. After 34 weeks, GTT is rarely useful unless new concerns arise (random glucose ≥7mmol/L warrants discussion). - **Diagnosis without GTT:** Urgent referral if glucose >11.0mmol/L (any time) or fasting ≥5.6mmol/L. - **Management:** For GDM with fasting glucose <7mmol/L, trial diet/exercise first. Insulin adjustment and close monitoring are required for those on corticosteroids or during labor (VRIII may be needed). - **Postpartum care:** Adjust insulin doses post-birth; monitor glucose closely, especially when breastfeeding. - **Monitoring & emergencies:** Regular ultrasounds, fetal heart exams, and self-monitoring of blood glucose. Diabetic emergencies require immediate attention. - **Vaccination:** Offer COVID-19 vaccination per JCVI guidelines; prioritize GDM patients. - **Audit:** Ensure regular audits to maintain care standards\",\n      \"action\": \"added\"\n    }\n  ]\n}",
  "endpoint": "enhanceGuidelineMetadata",
  "timestamp": "2025-06-18T18-41-42",
  "textContent": "AI: DeepSeek (deepseek-chat)\n\nQ: {\n  \"guidelineId\": \"cg1109-diabetes-in-pregnancy-guideline-pdf\",\n  \"fieldsProcessed\": [\n    \"humanFriendlyName\",\n    \"organisation\",\n    \"yearProduced\",\n    \"summary\"\n  ],\n  \"enhancedFields\": 4,\n  \"contentLength\": 3289\n}\n\nA: {\n  \"success\": true,\n  \"enhancedFields\": [\n    {\n      \"field\": \"humanFriendlyName\",\n      \"oldValue\": null,\n      \"newValue\": \"Diabetes in Pregnancy Care Guidelines\",\n      \"action\": \"added\"\n    },\n    {\n      \"field\": \"organisation\",\n      \"oldValue\": null,\n      \"newValue\": \"RCOG\",\n      \"action\": \"added\"\n    },\n    {\n      \"field\": \"yearProduced\",\n      \"oldValue\": null,\n      \"newValue\": \"I cannot find a publication year in the provided text. The guideline does not explicitly mention a publication or revision year\",\n      \"action\": \"added\"\n    },\n    {\n      \"field\": \"summary\",\n      \"oldValue\": null,\n      \"newValue\": \"**Summary of Diabetes in Pregnancy Guideline:** - **Pre-pregnancy counseling:** Discuss risks, optimize glucose monitoring, review medications, and screen for complications in women with pre-existing diabetes. - **Screening for GDM:** Follow diagnostic criteria; refer to Diabetes Pregnancy Team if diagnosed. After 34 weeks, GTT is rarely useful unless new concerns arise (random glucose ≥7mmol/L warrants discussion). - **Diagnosis without GTT:** Urgent referral if glucose >11.0mmol/L (any time) or fasting ≥5.6mmol/L. - **Management:** For GDM with fasting glucose <7mmol/L, trial diet/exercise first. Insulin adjustment and close monitoring are required for those on corticosteroids or during labor (VRIII may be needed). - **Postpartum care:** Adjust insulin doses post-birth; monitor glucose closely, especially when breastfeeding. - **Monitoring & emergencies:** Regular ultrasounds, fetal heart exams, and self-monitoring of blood glucose. Diabetic emergencies require immediate attention. - **Vaccination:** Offer COVID-19 vaccination per JCVI guidelines; prioritize GDM patients. - **Audit:** Ensure regular audits to maintain care standards\",\n      \"action\": \"added\"\n    }\n  ]\n}",
  "ai_provider": "DeepSeek",
  "ai_model": "deepseek-chat",
  "token_usage": null
}