{
  "prompt": {
    "guidelineId": "mp053-obstetric-haemorrhage-pdf",
    "fieldsProcessed": [
      "humanFriendlyName",
      "organisation",
      "yearProduced",
      "summary"
    ],
    "enhancedFields": 4,
    "contentLength": 4510
  },
  "response": "{\n  \"success\": true,\n  \"enhancedFields\": [\n    {\n      \"field\": \"humanFriendlyName\",\n      \"oldValue\": null,\n      \"newValue\": \"Obstetric Hemorrhage Management Protocol\",\n      \"action\": \"added\"\n    },\n    {\n      \"field\": \"organisation\",\n      \"oldValue\": null,\n      \"newValue\": \"NHS\",\n      \"action\": \"added\"\n    },\n    {\n      \"field\": \"yearProduced\",\n      \"oldValue\": null,\n      \"newValue\": \"2023\",\n      \"action\": \"added\"\n    },\n    {\n      \"field\": \"summary\",\n      \"oldValue\": null,\n      \"newValue\": \"**Summary of Obstetric Haemorrhage Protocol (MP053, v3.1):** This protocol covers **antepartum hemorrhage (APH), placental abruption, placenta praevia, postpartum hemorrhage (PPH), and women declining blood products**. ### **Key Definitions:** - **APH:** Minor (<50ml) or major (>50ml/concealed bleeding). - **PPH:** Minor (500-1000ml), major (>1000ml), or massive (≥2L). ### **Management Principles:** - **APH:** Assess cause (e.g., abruption, praevia), monitor maternal/fetal status, and escalate if major. - **Placenta Praevia:** Consultant-led care, elective C-section for asymptomatic cases, and emergency delivery with oxytocin/neonatology support. - **PPH:** Risk assessment, individualized care plans, and immediate resuscitation for massive hemorrhage (monitor Hb/coagulation, transfuse urgently). - **Blood Product Decliners:** Consultant/anaesthetist review, antenatal planning, and adherence to Jehovah’s Witness protocols. ### **General Actions:** - Oxytocin at delivery, thromboprophylaxis post-bleeding, FBC pre-discharge. - Debrief by senior staff and Datix reporting for losses >1500ml. **Responsibilities:** Staff must follow protocol, apply professional judgment, and ensure clear communication during emergencies. Management ensures protocol accessibility and regular updates\",\n      \"action\": \"added\"\n    }\n  ]\n}",
  "endpoint": "enhanceGuidelineMetadata",
  "timestamp": "2025-06-18T22-50-24",
  "textContent": "AI: DeepSeek (deepseek-chat)\n\nQ: {\n  \"guidelineId\": \"mp053-obstetric-haemorrhage-pdf\",\n  \"fieldsProcessed\": [\n    \"humanFriendlyName\",\n    \"organisation\",\n    \"yearProduced\",\n    \"summary\"\n  ],\n  \"enhancedFields\": 4,\n  \"contentLength\": 4510\n}\n\nA: {\n  \"success\": true,\n  \"enhancedFields\": [\n    {\n      \"field\": \"humanFriendlyName\",\n      \"oldValue\": null,\n      \"newValue\": \"Obstetric Hemorrhage Management Protocol\",\n      \"action\": \"added\"\n    },\n    {\n      \"field\": \"organisation\",\n      \"oldValue\": null,\n      \"newValue\": \"NHS\",\n      \"action\": \"added\"\n    },\n    {\n      \"field\": \"yearProduced\",\n      \"oldValue\": null,\n      \"newValue\": \"2023\",\n      \"action\": \"added\"\n    },\n    {\n      \"field\": \"summary\",\n      \"oldValue\": null,\n      \"newValue\": \"**Summary of Obstetric Haemorrhage Protocol (MP053, v3.1):** This protocol covers **antepartum hemorrhage (APH), placental abruption, placenta praevia, postpartum hemorrhage (PPH), and women declining blood products**. ### **Key Definitions:** - **APH:** Minor (<50ml) or major (>50ml/concealed bleeding). - **PPH:** Minor (500-1000ml), major (>1000ml), or massive (≥2L). ### **Management Principles:** - **APH:** Assess cause (e.g., abruption, praevia), monitor maternal/fetal status, and escalate if major. - **Placenta Praevia:** Consultant-led care, elective C-section for asymptomatic cases, and emergency delivery with oxytocin/neonatology support. - **PPH:** Risk assessment, individualized care plans, and immediate resuscitation for massive hemorrhage (monitor Hb/coagulation, transfuse urgently). - **Blood Product Decliners:** Consultant/anaesthetist review, antenatal planning, and adherence to Jehovah’s Witness protocols. ### **General Actions:** - Oxytocin at delivery, thromboprophylaxis post-bleeding, FBC pre-discharge. - Debrief by senior staff and Datix reporting for losses >1500ml. **Responsibilities:** Staff must follow protocol, apply professional judgment, and ensure clear communication during emergencies. Management ensures protocol accessibility and regular updates\",\n      \"action\": \"added\"\n    }\n  ]\n}",
  "ai_provider": "DeepSeek",
  "ai_model": "deepseek-chat",
  "token_usage": null
}