{
  "prompt": {
    "guidelineId": "cg17004-newborn-hearing-screening-programme-sop-pdf",
    "fieldsProcessed": [
      "humanFriendlyName",
      "organisation",
      "yearProduced",
      "summary"
    ],
    "enhancedFields": 4,
    "contentLength": 5927
  },
  "response": "{\n  \"success\": true,\n  \"enhancedFields\": [\n    {\n      \"field\": \"humanFriendlyName\",\n      \"oldValue\": null,\n      \"newValue\": \"Newborn Hearing Screening Procedure for NHS Staff\",\n      \"action\": \"added\"\n    },\n    {\n      \"field\": \"organisation\",\n      \"oldValue\": null,\n      \"newValue\": \"NHS\",\n      \"action\": \"added\"\n    },\n    {\n      \"field\": \"yearProduced\",\n      \"oldValue\": null,\n      \"newValue\": \"I cannot find a publication year in the provided text. The document does not explicitly mention a 4-digit year\",\n      \"action\": \"added\"\n    },\n    {\n      \"field\": \"summary\",\n      \"oldValue\": null,\n      \"newValue\": \"**Summary of Newborn Hearing Screening Standard Operating Procedure:** - **Eligibility & Pathways**: Screens well babies and NICU babies to identify permanent hearing loss early, improving developmental outcomes. - **Screening Tests**: Initial automated otoacoustic emission (AOAE) test; automated auditory brainstem response (AABR) if needed. Consent is required. - **Referrals**: Made to audiology based on results/risk factors. Twins/multiples require verified IDs. Referrals tracked via S4H. - **Governance**: Monthly/quarterly KPI reports; incidents reported internally and escalated. - **Training**: Staff complete national ECA and Level 3 Diploma (exempt if registered). Annual competency reassessment via e-learning/observation. - **Equipment & QA**: Daily QA checks; failed tests trigger investigation/re-training. Missed screens prompt follow-up. - **Special Cases**: Foster care, out-of-area births, child deaths, and declines require specific protocols (e.g., safeguarding checks, decline forms, audiology notifications). - **Failsafes**: Regular audits (S4H/SEMA) to ensure no missed screens; NICU babies require AOAE/AABR. - **Outcome Codes**: Track incomplete, referred, or declined screens. Key focus: Early detection, standardized pathways, and robust governance to ensure timely intervention\",\n      \"action\": \"added\"\n    }\n  ]\n}",
  "endpoint": "enhanceGuidelineMetadata",
  "timestamp": "2025-06-18T22-11-12",
  "textContent": "AI: DeepSeek (deepseek-chat)\n\nQ: {\n  \"guidelineId\": \"cg17004-newborn-hearing-screening-programme-sop-pdf\",\n  \"fieldsProcessed\": [\n    \"humanFriendlyName\",\n    \"organisation\",\n    \"yearProduced\",\n    \"summary\"\n  ],\n  \"enhancedFields\": 4,\n  \"contentLength\": 5927\n}\n\nA: {\n  \"success\": true,\n  \"enhancedFields\": [\n    {\n      \"field\": \"humanFriendlyName\",\n      \"oldValue\": null,\n      \"newValue\": \"Newborn Hearing Screening Procedure for NHS Staff\",\n      \"action\": \"added\"\n    },\n    {\n      \"field\": \"organisation\",\n      \"oldValue\": null,\n      \"newValue\": \"NHS\",\n      \"action\": \"added\"\n    },\n    {\n      \"field\": \"yearProduced\",\n      \"oldValue\": null,\n      \"newValue\": \"I cannot find a publication year in the provided text. The document does not explicitly mention a 4-digit year\",\n      \"action\": \"added\"\n    },\n    {\n      \"field\": \"summary\",\n      \"oldValue\": null,\n      \"newValue\": \"**Summary of Newborn Hearing Screening Standard Operating Procedure:** - **Eligibility & Pathways**: Screens well babies and NICU babies to identify permanent hearing loss early, improving developmental outcomes. - **Screening Tests**: Initial automated otoacoustic emission (AOAE) test; automated auditory brainstem response (AABR) if needed. Consent is required. - **Referrals**: Made to audiology based on results/risk factors. Twins/multiples require verified IDs. Referrals tracked via S4H. - **Governance**: Monthly/quarterly KPI reports; incidents reported internally and escalated. - **Training**: Staff complete national ECA and Level 3 Diploma (exempt if registered). Annual competency reassessment via e-learning/observation. - **Equipment & QA**: Daily QA checks; failed tests trigger investigation/re-training. Missed screens prompt follow-up. - **Special Cases**: Foster care, out-of-area births, child deaths, and declines require specific protocols (e.g., safeguarding checks, decline forms, audiology notifications). - **Failsafes**: Regular audits (S4H/SEMA) to ensure no missed screens; NICU babies require AOAE/AABR. - **Outcome Codes**: Track incomplete, referred, or declined screens. Key focus: Early detection, standardized pathways, and robust governance to ensure timely intervention\",\n      \"action\": \"added\"\n    }\n  ]\n}",
  "ai_provider": "DeepSeek",
  "ai_model": "deepseek-chat",
  "token_usage": null
}