{
  "prompt": {
    "guidelineId": "cg14020-female-genital-mutilation-fgm-pdf",
    "fieldsProcessed": [
      "humanFriendlyName",
      "organisation",
      "yearProduced",
      "summary"
    ],
    "enhancedFields": 4,
    "contentLength": 2965
  },
  "response": "{\n  \"success\": true,\n  \"enhancedFields\": [\n    {\n      \"field\": \"humanFriendlyName\",\n      \"oldValue\": null,\n      \"newValue\": \"FGM Recognition, Reporting, and Management Guidelines\",\n      \"action\": \"added\"\n    },\n    {\n      \"field\": \"organisation\",\n      \"oldValue\": null,\n      \"newValue\": \"RCOG\",\n      \"action\": \"added\"\n    },\n    {\n      \"field\": \"yearProduced\",\n      \"oldValue\": null,\n      \"newValue\": \"The provided text does not contain a publication year. If you have another guideline text that includes the year, please share it, and I can extract the 4-digit year for you\",\n      \"action\": \"added\"\n    },\n    {\n      \"field\": \"summary\",\n      \"oldValue\": null,\n      \"newValue\": \"**Summary of FGM Guideline:** FGM involves partial or total removal of external female genitalia for non-medical reasons, causing significant harm. Types include clitoridectomy, excision, infibulation, and other harmful procedures. UK healthcare professionals must report FGM cases in girls under 18 to police and safeguard at-risk individuals. **Key Recommendations:** - **Mandatory Reporting:** Immediate reporting required for under-18 cases. - **Documentation:** Record assessments, risks, and actions in patient records. - **Risk Assessment:** Use indicators to evaluate risk; refer to safeguarding leads if uncertain. - **Immediate Risk:** Refer to Social Services/Police if harm is imminent. - **Information Sharing:** Notify GP, provide FGM leaflets, and discuss health/legal implications. - **Prevalence & Risk Factors:** Higher in certain regions; assess family risks. - **Support & Referrals:** Offer defibrillation at 20 and 30 weeks (if declined); involve safeguarding teams as needed. - **Data Collection:** Mandatory recording in FGM datasets; respect patient objections. - **Maternity Care:** Follow specific guidance for identifying and managing FGM cases. Professionals should consult safeguarding leads and use available resources for support\",\n      \"action\": \"added\"\n    }\n  ]\n}",
  "endpoint": "enhanceGuidelineMetadata",
  "timestamp": "2025-06-18T22-09-04",
  "textContent": "AI: DeepSeek (deepseek-chat)\n\nQ: {\n  \"guidelineId\": \"cg14020-female-genital-mutilation-fgm-pdf\",\n  \"fieldsProcessed\": [\n    \"humanFriendlyName\",\n    \"organisation\",\n    \"yearProduced\",\n    \"summary\"\n  ],\n  \"enhancedFields\": 4,\n  \"contentLength\": 2965\n}\n\nA: {\n  \"success\": true,\n  \"enhancedFields\": [\n    {\n      \"field\": \"humanFriendlyName\",\n      \"oldValue\": null,\n      \"newValue\": \"FGM Recognition, Reporting, and Management Guidelines\",\n      \"action\": \"added\"\n    },\n    {\n      \"field\": \"organisation\",\n      \"oldValue\": null,\n      \"newValue\": \"RCOG\",\n      \"action\": \"added\"\n    },\n    {\n      \"field\": \"yearProduced\",\n      \"oldValue\": null,\n      \"newValue\": \"The provided text does not contain a publication year. If you have another guideline text that includes the year, please share it, and I can extract the 4-digit year for you\",\n      \"action\": \"added\"\n    },\n    {\n      \"field\": \"summary\",\n      \"oldValue\": null,\n      \"newValue\": \"**Summary of FGM Guideline:** FGM involves partial or total removal of external female genitalia for non-medical reasons, causing significant harm. Types include clitoridectomy, excision, infibulation, and other harmful procedures. UK healthcare professionals must report FGM cases in girls under 18 to police and safeguard at-risk individuals. **Key Recommendations:** - **Mandatory Reporting:** Immediate reporting required for under-18 cases. - **Documentation:** Record assessments, risks, and actions in patient records. - **Risk Assessment:** Use indicators to evaluate risk; refer to safeguarding leads if uncertain. - **Immediate Risk:** Refer to Social Services/Police if harm is imminent. - **Information Sharing:** Notify GP, provide FGM leaflets, and discuss health/legal implications. - **Prevalence & Risk Factors:** Higher in certain regions; assess family risks. - **Support & Referrals:** Offer defibrillation at 20 and 30 weeks (if declined); involve safeguarding teams as needed. - **Data Collection:** Mandatory recording in FGM datasets; respect patient objections. - **Maternity Care:** Follow specific guidance for identifying and managing FGM cases. Professionals should consult safeguarding leads and use available resources for support\",\n      \"action\": \"added\"\n    }\n  ]\n}",
  "ai_provider": "DeepSeek",
  "ai_model": "deepseek-chat",
  "token_usage": null
}