{
  "prompt": {
    "guidelineId": "gp001-management-of-confirmed-ectopic-pregnancy-pdf",
    "fieldsProcessed": [
      "humanFriendlyName",
      "organisation",
      "yearProduced",
      "summary"
    ],
    "enhancedFields": 4,
    "contentLength": 2045
  },
  "response": "{\n  \"success\": true,\n  \"enhancedFields\": [\n    {\n      \"field\": \"humanFriendlyName\",\n      \"oldValue\": null,\n      \"newValue\": \"Ectopic Pregnancy Management Guidelines\",\n      \"action\": \"added\"\n    },\n    {\n      \"field\": \"organisation\",\n      \"oldValue\": null,\n      \"newValue\": \"NICE and RCOG\",\n      \"action\": \"added\"\n    },\n    {\n      \"field\": \"yearProduced\",\n      \"oldValue\": null,\n      \"newValue\": \"I cannot find a publication year in the provided text. The guideline references NICE and RCOG guidelines but does not specify its own publication year\",\n      \"action\": \"added\"\n    },\n    {\n      \"field\": \"summary\",\n      \"oldValue\": null,\n      \"newValue\": \"**Summary of Management of Confirmed Ectopic Pregnancy Guideline** **Key Principles:** Follow NICE/RCOG guidelines with senior input. **Management Options:** - **Expectant:** For stable women with declining hCG; monitor with scans/hCG. - **Medical:** Methotrexate for eligible stable women; strict monitoring required. - **Surgical:** Laparoscopy preferred (salpingectomy/salpingotomy). **Anti-D Prophylaxis:** - Give to rhesus-negative women post-surgery (not for medical management). - Avoid Kleihauer test. **Follow-Up & Counseling:** - Weekly hCG until negative; safety net for emergencies. - Persistent trophoblast: outpatient medical/surgical treatment. - Debrief patient/family; provide emergency contacts. - Document follow-up; advise self-referral for future pregnancies. **General:** Prioritize clinical condition over hCG levels\",\n      \"action\": \"added\"\n    }\n  ]\n}",
  "endpoint": "enhanceGuidelineMetadata",
  "timestamp": "2025-06-18T22-19-04",
  "textContent": "AI: DeepSeek (deepseek-chat)\n\nQ: {\n  \"guidelineId\": \"gp001-management-of-confirmed-ectopic-pregnancy-pdf\",\n  \"fieldsProcessed\": [\n    \"humanFriendlyName\",\n    \"organisation\",\n    \"yearProduced\",\n    \"summary\"\n  ],\n  \"enhancedFields\": 4,\n  \"contentLength\": 2045\n}\n\nA: {\n  \"success\": true,\n  \"enhancedFields\": [\n    {\n      \"field\": \"humanFriendlyName\",\n      \"oldValue\": null,\n      \"newValue\": \"Ectopic Pregnancy Management Guidelines\",\n      \"action\": \"added\"\n    },\n    {\n      \"field\": \"organisation\",\n      \"oldValue\": null,\n      \"newValue\": \"NICE and RCOG\",\n      \"action\": \"added\"\n    },\n    {\n      \"field\": \"yearProduced\",\n      \"oldValue\": null,\n      \"newValue\": \"I cannot find a publication year in the provided text. The guideline references NICE and RCOG guidelines but does not specify its own publication year\",\n      \"action\": \"added\"\n    },\n    {\n      \"field\": \"summary\",\n      \"oldValue\": null,\n      \"newValue\": \"**Summary of Management of Confirmed Ectopic Pregnancy Guideline** **Key Principles:** Follow NICE/RCOG guidelines with senior input. **Management Options:** - **Expectant:** For stable women with declining hCG; monitor with scans/hCG. - **Medical:** Methotrexate for eligible stable women; strict monitoring required. - **Surgical:** Laparoscopy preferred (salpingectomy/salpingotomy). **Anti-D Prophylaxis:** - Give to rhesus-negative women post-surgery (not for medical management). - Avoid Kleihauer test. **Follow-Up & Counseling:** - Weekly hCG until negative; safety net for emergencies. - Persistent trophoblast: outpatient medical/surgical treatment. - Debrief patient/family; provide emergency contacts. - Document follow-up; advise self-referral for future pregnancies. **General:** Prioritize clinical condition over hCG levels\",\n      \"action\": \"added\"\n    }\n  ]\n}",
  "ai_provider": "DeepSeek",
  "ai_model": "deepseek-chat",
  "token_usage": null
}