{
  "prompt": {
    "guidelineId": "cg1127-neonatal-abstinence-scoring-pdf",
    "fieldsProcessed": [
      "humanFriendlyName",
      "organisation",
      "yearProduced",
      "summary"
    ],
    "enhancedFields": 4,
    "contentLength": 6543
  },
  "response": "{\n  \"success\": true,\n  \"enhancedFields\": [\n    {\n      \"field\": \"humanFriendlyName\",\n      \"oldValue\": null,\n      \"newValue\": \"Neonatal Abstinence Syndrome Assessment and Management Guideline\",\n      \"action\": \"added\"\n    },\n    {\n      \"field\": \"organisation\",\n      \"oldValue\": null,\n      \"newValue\": \"The text does not explicitly mention a specific publishing organization or institution like NHS, NICE, WHO, RCOG, etc. Therefore, I cannot identify the organization from the provided guideline text\",\n      \"action\": \"added\"\n    },\n    {\n      \"field\": \"yearProduced\",\n      \"oldValue\": null,\n      \"newValue\": \"The text provided does not contain a publication year. If you have another guideline text that includes the year, please share it, and I can extract the 4-digit year for you\",\n      \"action\": \"added\"\n    },\n    {\n      \"field\": \"summary\",\n      \"oldValue\": null,\n      \"newValue\": \"**Summary of Neonatal Abstinence Syndrome (NAS) Guideline** **Scope**: Applies to pediatric, neonatal, and midwifery staff caring for newborns at risk of NAS due to maternal substance use. **Key Recommendations**: - **Assessment**: Use standardized scoring tools to monitor withdrawal symptoms (e.g., jitteriness, poor feeding, irritability). - **Management**: - **Opiate withdrawal**: Start morphine (125 mcg/kg/day, 4x daily) and wean gradually based on NAS scores. - **Non-opiate withdrawal**: - Alcohol: Phenobarbitone 20mg/kg once. - Benzodiazepines: Chlorpromazine 2 mg/kg/day if symptoms arise (10 days–6 weeks). - Barbiturates: Follow specific weaning protocol. - Avoid pethidine/diamorphine in labor for opiate-dependent mothers; do not give naloxone. - **Postnatal Care**: - Keep mother and baby together where possible. - Administer Hepatitis B vaccine (and immunoglobulin if high-risk). - Encourage breastfeeding unless contraindicated. - **Discharge Criteria**: Stable NAS scores, normal feeding/sleeping, no morphine dose changes for 36 hours. - **Follow-up**: Ensure social services involvement, discharge planning, and parental education. **Monitoring**: Audit antenatal care, NAS scoring, and discharge processes\",\n      \"action\": \"added\"\n    }\n  ]\n}",
  "endpoint": "enhanceGuidelineMetadata",
  "timestamp": "2025-06-18T21-48-25",
  "textContent": "AI: DeepSeek (deepseek-chat)\n\nQ: {\n  \"guidelineId\": \"cg1127-neonatal-abstinence-scoring-pdf\",\n  \"fieldsProcessed\": [\n    \"humanFriendlyName\",\n    \"organisation\",\n    \"yearProduced\",\n    \"summary\"\n  ],\n  \"enhancedFields\": 4,\n  \"contentLength\": 6543\n}\n\nA: {\n  \"success\": true,\n  \"enhancedFields\": [\n    {\n      \"field\": \"humanFriendlyName\",\n      \"oldValue\": null,\n      \"newValue\": \"Neonatal Abstinence Syndrome Assessment and Management Guideline\",\n      \"action\": \"added\"\n    },\n    {\n      \"field\": \"organisation\",\n      \"oldValue\": null,\n      \"newValue\": \"The text does not explicitly mention a specific publishing organization or institution like NHS, NICE, WHO, RCOG, etc. Therefore, I cannot identify the organization from the provided guideline text\",\n      \"action\": \"added\"\n    },\n    {\n      \"field\": \"yearProduced\",\n      \"oldValue\": null,\n      \"newValue\": \"The text provided does not contain a publication year. If you have another guideline text that includes the year, please share it, and I can extract the 4-digit year for you\",\n      \"action\": \"added\"\n    },\n    {\n      \"field\": \"summary\",\n      \"oldValue\": null,\n      \"newValue\": \"**Summary of Neonatal Abstinence Syndrome (NAS) Guideline** **Scope**: Applies to pediatric, neonatal, and midwifery staff caring for newborns at risk of NAS due to maternal substance use. **Key Recommendations**: - **Assessment**: Use standardized scoring tools to monitor withdrawal symptoms (e.g., jitteriness, poor feeding, irritability). - **Management**: - **Opiate withdrawal**: Start morphine (125 mcg/kg/day, 4x daily) and wean gradually based on NAS scores. - **Non-opiate withdrawal**: - Alcohol: Phenobarbitone 20mg/kg once. - Benzodiazepines: Chlorpromazine 2 mg/kg/day if symptoms arise (10 days–6 weeks). - Barbiturates: Follow specific weaning protocol. - Avoid pethidine/diamorphine in labor for opiate-dependent mothers; do not give naloxone. - **Postnatal Care**: - Keep mother and baby together where possible. - Administer Hepatitis B vaccine (and immunoglobulin if high-risk). - Encourage breastfeeding unless contraindicated. - **Discharge Criteria**: Stable NAS scores, normal feeding/sleeping, no morphine dose changes for 36 hours. - **Follow-up**: Ensure social services involvement, discharge planning, and parental education. **Monitoring**: Audit antenatal care, NAS scoring, and discharge processes\",\n      \"action\": \"added\"\n    }\n  ]\n}",
  "ai_provider": "DeepSeek",
  "ai_model": "deepseek-chat",
  "token_usage": null
}