{
  "prompt": {
    "guidelineId": "uhsx-perineal-trauma-repair-guideline-pdf",
    "fieldsProcessed": [
      "humanFriendlyName",
      "organisation",
      "yearProduced",
      "summary"
    ],
    "enhancedFields": 4,
    "contentLength": 6005
  },
  "response": "{\n  \"success\": true,\n  \"enhancedFields\": [\n    {\n      \"field\": \"humanFriendlyName\",\n      \"oldValue\": null,\n      \"newValue\": \"Perineal Trauma and Repair Guidelines\",\n      \"action\": \"added\"\n    },\n    {\n      \"field\": \"organisation\",\n      \"oldValue\": null,\n      \"newValue\": \"RCOG\",\n      \"action\": \"added\"\n    },\n    {\n      \"field\": \"yearProduced\",\n      \"oldValue\": null,\n      \"newValue\": \"2027\",\n      \"action\": \"added\"\n    },\n    {\n      \"field\": \"summary\",\n      \"oldValue\": null,\n      \"newValue\": \"**Summary of Perineal Trauma & Repair Guideline** **Key Recommendations:** - **Risk Factors for OASI:** Asian ethnicity, nulliparity, birth weight >4kg, shoulder dystocia, prolonged second stage. - **OASI Care Bundle:** Inform pregnant women, perform episiotomy when indicated (mediolateral, 60° angle at crowning), manual perineal protection, and perineal warming. - **Birth Technique:** Avoid undue traction during shoulder delivery; support perineum and follow curve of Carus. - **Examination & Classification:** Perineal and rectal exams post-birth; classify tears per RCOG guidelines. - **Repair:** - Qualified staff should repair tears; 3rd/4th-degree tears require theatre under regional/general anesthesia. - Actively bleeding tears in water births need immediate suturing; only superficial skin tears may be left unsutured. - Labial/clitoral tears require analgesia and aesthetic consideration. - **Post-Repair Care:** - Rectal/vaginal exams to ensure integrity. - Antibiotics, regular analgesia, high-fiber diet, pelvic floor exercises. - Document repair details and complete incident reporting. - **Follow-Up:** Referral pathways, monitoring, and future birth support for women with prior OASI. **Additional:** Laxatives, analgesia options, and strict record-keeping are emphasized. Audit and equality assessments confirm non-discriminatory impact. *(Guideline due for review: March 2027)*\",\n      \"action\": \"added\"\n    }\n  ]\n}",
  "endpoint": "enhanceGuidelineMetadata",
  "timestamp": "2025-06-18T23-14-13",
  "textContent": "AI: DeepSeek (deepseek-chat)\n\nQ: {\n  \"guidelineId\": \"uhsx-perineal-trauma-repair-guideline-pdf\",\n  \"fieldsProcessed\": [\n    \"humanFriendlyName\",\n    \"organisation\",\n    \"yearProduced\",\n    \"summary\"\n  ],\n  \"enhancedFields\": 4,\n  \"contentLength\": 6005\n}\n\nA: {\n  \"success\": true,\n  \"enhancedFields\": [\n    {\n      \"field\": \"humanFriendlyName\",\n      \"oldValue\": null,\n      \"newValue\": \"Perineal Trauma and Repair Guidelines\",\n      \"action\": \"added\"\n    },\n    {\n      \"field\": \"organisation\",\n      \"oldValue\": null,\n      \"newValue\": \"RCOG\",\n      \"action\": \"added\"\n    },\n    {\n      \"field\": \"yearProduced\",\n      \"oldValue\": null,\n      \"newValue\": \"2027\",\n      \"action\": \"added\"\n    },\n    {\n      \"field\": \"summary\",\n      \"oldValue\": null,\n      \"newValue\": \"**Summary of Perineal Trauma & Repair Guideline** **Key Recommendations:** - **Risk Factors for OASI:** Asian ethnicity, nulliparity, birth weight >4kg, shoulder dystocia, prolonged second stage. - **OASI Care Bundle:** Inform pregnant women, perform episiotomy when indicated (mediolateral, 60° angle at crowning), manual perineal protection, and perineal warming. - **Birth Technique:** Avoid undue traction during shoulder delivery; support perineum and follow curve of Carus. - **Examination & Classification:** Perineal and rectal exams post-birth; classify tears per RCOG guidelines. - **Repair:** - Qualified staff should repair tears; 3rd/4th-degree tears require theatre under regional/general anesthesia. - Actively bleeding tears in water births need immediate suturing; only superficial skin tears may be left unsutured. - Labial/clitoral tears require analgesia and aesthetic consideration. - **Post-Repair Care:** - Rectal/vaginal exams to ensure integrity. - Antibiotics, regular analgesia, high-fiber diet, pelvic floor exercises. - Document repair details and complete incident reporting. - **Follow-Up:** Referral pathways, monitoring, and future birth support for women with prior OASI. **Additional:** Laxatives, analgesia options, and strict record-keeping are emphasized. Audit and equality assessments confirm non-discriminatory impact. *(Guideline due for review: March 2027)*\",\n      \"action\": \"added\"\n    }\n  ]\n}",
  "ai_provider": "DeepSeek",
  "ai_model": "deepseek-chat",
  "token_usage": null
}